Organization Name,Organization Name URL,Full Description,Industries,Website,Headquarters Location,Description,CB Rank (Company),SEMrush - Monthly Visits,SEMrush - Average Visits (6 months),SEMrush - Monthly Visits Growth,SEMrush - Visit Duration Growth,SEMrush - Visit Duration,SEMrush - Page Views / Visit,SEMrush - Page Views / Visit Growth,SEMrush - Bounce Rate,SEMrush - Bounce Rate Growth,SEMrush - Global Traffic Rank,SEMrush - Monthly Rank Change (#),SEMrush - Monthly Rank Growth,Headquarters Regions,Operating Status,Founded Date,Founded Date Precision,Number of Founders,Number of Employees,Founders,Apptopia - Number of Apps,Apptopia - Downloads Last 30 Days,Aberdeen - IT Spend,Aberdeen - IT Spend Currency,Aberdeen - IT Spend Currency (in USD)
CashControl,https://www.crunchbase.com/organization/cashcontrol-2216,,"Cloud Data Services, Information Technology, Point of Sale, SaaS, Software",https://www.cashcontrol.com,"Bad Honnef Am Rhein, Nordrhein-Westfalen, Germany",CashControl is a SaaS provider that offers cashless billing and cash register software for restaurants and catering industries.,"1,434,055","4,180",,"1,051.52%",350%,72,2.5,25%,0%,-49.05%,"3,704,166","-5,146,465",-58.15%,European Union (EU),Active,1991-01-01,year,,1-10,,,,,,
Datasource,https://www.crunchbase.com/organization/datasource-f756,,"Cloud Data Services, Consulting, IT Management, Recruiting",https://www.datasourcerecruitment.co.uk/,"Cheltenham, Gloucestershire, United Kingdom","Datasource is a recruitment agency that specializes in IT, engineering, management, and technical consultancy services.","1,308,645","4,159",,,,151,1.52,,58.49%,,"3,684,979",,,,Active,1981-01-01,year,,11-50,,,,,,
AGS IT Partner,https://www.crunchbase.com/organization/agsitpartner,,"Cloud Data Services, Consulting, Digital Marketing",https://www.ags.no/,"Horten, Vestfold, Norway","AGS IT Partner is an IT consulting services firm that offers solutions in the cloud, ERP, digital marketing and security.","462,538","3,671","4,989.83",-46.42%,"27,500%",276,2.41,121.04%,59.93%,-34.08%,"3,867,919","1,302,706",50.78%,"Nordic Countries, Scandinavia",Active,1983-01-01,day,,11-50,,,,,,
Microminder,https://www.crunchbase.com/organization/microminder,,"Cloud Data Services, Consulting, Dental, Health Care, Information Technology, Technical Support",https://www.microminder.com/,"Perivale, Ealing, United Kingdom",Microminder is an IT support company that offers consultancy and communication services to the dental healthcare sector.,"1,197,476","3,582","2,033.5",283.92%,,80,1.5,50%,75%,-25%,"3,898,889","-2,706,580",-40.97%,,Active,1984-01-01,year,,101-250,,,,3415604,USD,3415604
Vector,https://www.crunchbase.com/organization/vector-a6ec,,"Cloud Data Services, Information Technology, Software",https://www.vector.hu,"Kecskemét, Bacs-Kiskun, Hungary",VECTOR specializes in providing vectorial development and distribution management system.,"794,679","3,399",,-7.18%,"1,546.36%","1,811",5.22,176.83%,33.33%,134.72%,"3,992,022","262,893",7.05%,European Union (EU),Active,1991-06-01,day,,11-50,,,,4475457,USD,4475457
IPS,https://www.crunchbase.com/organization/ips-6065,,"Cloud Data Services, Information Technology, Internet of Things, Software",https://www.ips-ag.com/,"Czechowice-dziedzice, Slaskie, Poland",IPS provides a wide range of highly tailored solutions to help customers around the world automate and digitalize their operations.,"1,324,125","2,761",,-60.88%,180%,14,1.95,30.27%,4.6%,-90.8%,"4,481,603","1,829,463",68.98%,European Union (EU),Active,1992-01-01,year,,51-100,,,,,,
Megabyte Computers,https://www.crunchbase.com/organization/megabyte-computers,,"Cloud Data Services, IT Infrastructure, Web Development",http://www.megabyte.be,"Auderghem, Brussels Hoofdstedelijk Gewest, Belgium","Megabyte offers quality IT services such as IT infrastructure, IT audit, network management, IT outsourcing, & cloud solutions, etc.","1,649,029","2,404","2,551.83",57.12%,324.72%,0,1,0%,100%,0%,"4,664,759","-879,783",-15.87%,European Union (EU),Active,1986-04-17,day,,11-50,,,,,,
Kefron,https://www.crunchbase.com/organization/kefron,"From their humble beginnings in Dublin, Kefron has grown from a small document storage company in 1989 to a document and information management business, operating across seven locations in the UK and Ireland. Digital and physical document management, this is what they do. Managing their customer’s information, keeping it safe and secure, has always been core to Kefron. They have continuously evolved their service offering through the latest document management technology, whilst still focusing on their physical document storage services. They are a solutions provider. They strive to forge strong relationships with their customers based on a deep knowledge of their business and the challenges they face. To achieve this we leverage Kefron group expertise, knowledge and services.","Cloud Data Services, Information Technology",https://www.kefron.com/,"Woodley, Wokingham, United Kingdom","Kefron is a Smart, Secure and Scalable Document Management Solutions","171,850","2,364","1,773.83",108.65%,"27,925%","1,121",1.83,-0.23%,79.23%,380.18%,"4,708,570","-1,618,317",-25.58%,,Active,1989-01-01,year,,101-250,,,,,,
Asset Control,https://www.crunchbase.com/organization/asset-control,"Asset Control is the market leader in data quality software solutions for financial data. Focused on business user enablement, we help clients simplify complexity and ensure users across buy and sell side make the most of their data assets by providing easy data integration, data cleansing, distribution and data discovery solutions. We service a blue-chip client base globally and our award-winning solutions provide rigorous processes to secure high-quality data, easy integration into business user workflows and a trusted environment for advanced analytics. Delivered through managed services, cloud or on-premise deployment, our highly scalable products help the world’s most successful financial institutions meet their risk management, valuation, security master and operational needs with mission critical reliability.","Analytics, Big Data, Cloud Data Services, Consulting, Data Integration, Document Management, Financial Services, Information Technology, Risk Management, Software",https://www.alveotech.com,"London, England, United Kingdom","Asset Control provides financial data management solutions to banks, insurers, investment managers and market infrastructure firms","155,150","2,219",,51.36%,-97.57%,62,2.04,-77.33%,65.32%,"3,348.28%","4,810,580","-904,960",-15.83%,,Active,1991-01-11,day,1,101-250,Tim Knigge,,,,,
Olidata,https://www.crunchbase.com/organization/olidata,,"Cloud Data Services, Cyber Security, Internet of Things",https://www.olidata.com,"Cesena, Emilia-Romagna, Italy","Olidata offers IoT, cloud services, IT consulting, SAP ERP, cyber security and a range of similar services.","1,101,118","2,145","2,252.17",-38.78%,-98.93%,2,1.24,-73.53%,76.46%,129.4%,"4,854,171","1,043,261",27.38%,European Union (EU),Active,1982-01-01,year,,11-50,,,,24048467,USD,24048467
swcomms,https://www.crunchbase.com/organization/swcomms,"swcomms provides cloud telephone systems, data networks, cloud solutions, data centers, internet connectivity, and security solutions. Their focussed approach has not only seen our turnover increase year on year but has also led to a high level of repeat business and customer recommendations from companies impressed by our ability to provide high-quality solutions, delivered on time and within budget while always remaining at the forefront of technological innovation.","Cloud Data Services, Cloud Security, Network Security, Telecommunications",https://www.swcomms.co.uk/,"Exeter, Devon, United Kingdom","swcomms provides cloud telephone systems, data networks, cloud solutions, data centre, internet connectivity and security solutions.","456,966","2,018","1,661.5",78.27%,150%,59,1.93,92.91%,69.03%,-30.97%,"5,060,598","-1,641,056",-24.49%,,Active,1983-01-01,year,,51-100,,,,4828879,USD,4828879
Euro One Számítástechnikai Zrt,https://www.crunchbase.com/organization/euro-one-számítástechnikai-zrt,,"Cloud Data Services, Information Technology, Productivity Tools",https://www.euroone.hu,"Budapest, Budapest, Hungary",EURO ONE develops and provides complex sustainable IT solutions.,"651,450","1,985",,-11.86%,,0,1,-50%,100%,200.03%,"5,085,887","294,740",6.15%,European Union (EU),Active,1991-11-01,day,,51-100,,,,,,
BDR Group,https://www.crunchbase.com/organization/bdr-group,"BDR Group is uniquely positioned to support businesses of any size in these difficult times, with a range of technology solutions that enable flexible working patterns or make existing processes more efficient. They provide services like IT, Wifi, Energy, Cloud, Unified Communications, Structured Cabling, Network Equipment, Access Control, CCTV and many more.","Cloud Data Services, Electrical Distribution, Information Technology",https://bdrgroup.co.uk/,"Stratford-upon-avon, Warwickshire, United Kingdom","BDR Group offers simplified business transformation solutions for SMEs, Enterprises, and, public sector.","261,251","1,971",,,,0,1,,100%,,"5,097,285",,,,Active,1991-01-01,year,1,51-100,Bahman Rahimi,,,,,
Open Answers,https://www.crunchbase.com/organization/open-answers,"Open Answers founded in 1988,  is a provider of premium quality digital technology services to blue-chip customers and the public sector, specialising in cloud systems integration, also has a track record of 25+ years delivering specialist open systems and open source services, from support and education to systems engineering and integration, to the world’s leading technology vendors.","Business Information Systems, Cloud Data Services, Consulting, Information Technology",https://www.openanswers.co.uk/,"Harrow, Harrow, United Kingdom","Open Answers is a provider of digital technology services to blue chip customers and the public, specializing in cloud systems integration.","888,854","1,322","2,189",31.67%,52.72%,"1,363",1.73,4.98%,26.85%,-23.42%,"6,366,215","-78,569",-1.22%,,Active,1988-01-01,year,,11-50,,,,,,
Id Grup,https://www.crunchbase.com/organization/id-grup,"ID Grup is a provider of Cloud and Managed IT infrastructure services in the region of Barcelona. With more than 300 technical certifications and a long experience as an integrator, ID Grup offers end-to-end solutions in Managed Cloud Services, Managed On-premise Services, Workplace, Mobility, Network, IT Security, and IT Supply.","Cloud Data Services, IT Management",http://www.idgrup.com,"L'hospitalet De Llobregat, Catalonia, Spain",Id Grup is a provider of Cloud and Managed IT infrastructure services in the region of Barcelona.,"508,484","1,307","2,162.5",17.54%,,0,1,0%,100%,0%,"6,406,039","63,725",1%,European Union (EU),Active,1990-01-01,day,,51-100,,,,,,
Care Computers,https://www.crunchbase.com/organization/care-computers,,"Cloud Data Services, Consulting, Hardware, Professional Networking, Project Management, Software",https://carecomputers.co.uk/,"Windsor, Windsor and Maidenhead, United Kingdom","Care Computers offers network support, cloud deployment, migration, telephony, software acquisitions, and hardware repair services.","833,525","1,191",,,,0,1,,100%,,"6,629,230",,,,Active,1993-01-01,year,,11-50,,,,3393009,USD,3393009
Tectrade,https://www.crunchbase.com/organization/tectrade,"Tectrade knows how to protect and recover data, and we help businesses ensure their data is safe, secure and recoverable.  Zero Day Recovery for ransomware recovery.","Cloud Data Services, Cyber Security, Data Storage",http://www.tectrade.com,"Godalming, Surrey, United Kingdom",Data Protection & Recovery - Ransomware Recovery,"334,719","1,167",,213.71%,,0,1,0%,100%,0%,"6,848,131","-1,923,726",-21.93%,,Active,1991-01-01,year,,101-250,,,,,USD,
Alfa Solutions,https://www.crunchbase.com/organization/alfa-solutions,,"Cloud Data Services, Information Technology, Virtualization",http://www.alfasolutions.be,"Waregem, West-Vlaanderen, Belgium",Alfa Solutions delivers products and services to solve complex problems in IT projects and tailored to clients as per their requirements.,"349,600","1,122",,-39.61%,-74.92%,0,1,-44.44%,100%,66.67%,"6,918,840","1,823,785",35.8%,European Union (EU),Active,1990-11-20,day,1,11-50,Danny Wullaert,,,3657030,USD,3657030
AS-SYSTEME,https://www.crunchbase.com/organization/as-systeme,,"Cloud Data Services, Consulting, IT Management",https://www.as-systeme.eu/,"Stuttgart, Baden-Wurttemberg, Germany",AS-SYSTEME is an IT consulting and service company that fixates on serving various sectors for the optimization of business processes.,"1,634,468","1,103",,,,0,1,,100%,,"6,934,694",,,European Union (EU),Active,1989-01-01,day,,11-50,,,,,,
Sediin,https://www.crunchbase.com/organization/sediin,,"Cloud Data Services, Enterprise Resource Planning (ERP), Information Technology, Software",http://www.sediin.it,"Roma, Lazio, Italy","Sediin offers IT consultancy, integrated solutions, software, and app development, ERP, data access, cloud services, security, and GDPR.","1,430,801","1,080",,,,1,2,,0%,,"4,102,067",,,European Union (EU),Active,1993-12-17,day,,51-100,,,,3861585,USD,3861585
Baggenstos,https://www.crunchbase.com/organization/baggenstos,,"Cloud Data Services, Outsourcing",http://www.baggenstos.ch,"Wallisellen, Zurich, Switzerland",Baggenstos provides cloud and managed services for flexible outsourcing.,"1,419,860",945,,-71.64%,,2,2,100%,0%,,"7,114,079","3,094,353",76.98%,,Active,1925-01-01,day,,51-100,,,,3670582,USD,3670582
Datenerfassung Kruse,https://www.crunchbase.com/organization/datenerfassung-kruse,,"Cloud Data Services, Data Integration, Employee Benefits",http://www.krusescan.de,"Witten, Nordrhein-Westfalen, Germany","Datenerfassung Kruse is a data acquisition firm that offers data capture, document scan, barcode stamp, and folder archive solutions.","1,902,582",812,,,,0,1,,100%,,"7,296,991",,,European Union (EU),Active,1969-01-01,day,,11-50,,,,4047564,USD,4047564
ACMI,https://www.crunchbase.com/organization/acmi-c607,"ACMI provides designing, supplying, installing, securing, hosting, and managing the Information System. They provide cloud4i, cloud power managed services, professional services, and concierge. Their customers contact through email and phone number.","Cloud Data Services, Cloud Management, Cyber Security, IT Infrastructure",https://www.acmi.fr,"Paris, Ile-de-France, France",ACMI provides managed services to IBM cloud.,"1,048,850",622,,431.62%,,635,3.5,250%,50%,-50%,"7,900,962","-2,130,710",-21.24%,European Union (EU),Active,1986-01-01,year,1,11-50,Alain Beck,,,,,
Advania,https://www.crunchbase.com/organization/advania-57dc,"Advania is a Nordic information technology service corporation headquartered in Stockholm, Sweden. Advania has corporate clients in the public and private sectors. It provides a range of IT services, platforms, cloud services, and support to multinational enterprises, governments, and businesses. Advania has roots in three Nordic countries, Iceland, Norway, and Sweden. Over a long period of time, each country generated a component of what eventually was braided into one company, Advania AB, in 2012.","Cloud Data Services, Consulting, Information Technology, Outsourcing",https://www.advania.com/advania/,"Stockholm, Stockholms Lan, Sweden",Advania offering its customers integrated IT services and solutions.,"270,761",615,777.33,-66.52%,-21.83%,0,1,-42.25%,100%,62.13%,"7,915,323","2,800,112",54.74%,"European Union (EU), Nordic Countries, Scandinavia",Active,1939-01-01,year,1,1001-5000,Einar J. Skúlason,,,,,
Needocs,https://www.crunchbase.com/organization/needocs,"Needocs is a marketplace of professional documents & ebooks. Needocs offers a wide range of documents, templates, presentations, studies to professionals, individuals and students. Needocs allows individuals to publish and sell their value added content and to benefit from an attractive remuneration. The website's social media options allow publishers to communicate efficiently on their activities.","Cloud Data Services, Marketplace, Presentations, Web Design",http://www.needocs.com,"Paris, Ile-de-France, France",Needocs provides platform for publishing documenting both academic and business needs.,"1,754,837",581,"3,930.83",94.97%,-98.01%,0,1,0%,100%,0%,"7,951,657","-584,305",-6.85%,European Union (EU),Active,1983-01-01,day,,1-10,,,,,,
e vendo,https://www.crunchbase.com/organization/e-vendo,,"Cloud Data Services, E-Commerce, Software, Wholesale",https://www.e-vendo.de/,"Berlin, Berlin, Germany",e-vendo offers a 360° omnichannel cloud solution.,"919,075",536,,-91.09%,-95%,0,1,-21.89%,100%,38.93%,"8,069,928","5,346,727",196.34%,European Union (EU),Active,1990-01-01,day,,1-10,,,,4936458,USD,4936458
Zerouno Informatica Spa,https://www.crunchbase.com/organization/zerouno-informatica-spa,"Zerouno Informatica Spa is a customer in the digital innovation path, providing Industrial cybersecurity, cloud and smart working solutions. they simplify your business management with the solutions they design with power, processing the most crucial data and delivering an easy-to-read outcome. With their expertise in the microsoft sector and the quality of the product, our analysts can analyze and integrate data from a wide range of different sources.","Cloud Data Services, Consulting, IT Management",https://www.zerogroup.it,"Brescia, Lombardia, Italy",Zerouno Informatica Spa is a IT sector and technological solutions provider.,"883,058",510,,,,65,3.5,,50%,,"8,160,315",,,European Union (EU),Active,1990-01-01,year,,101-250,,,,,,
Greensys IT Technological Innovation,https://www.crunchbase.com/organization/greensys-it-technological-innovation,,"Cloud Data Services, Consulting, Information Services, Software",http://www.greensys.es/,"Madrid, Madrid, Spain",Greensys IT Technology Innovation has developed software solutions and business management services for small and medium-sized enterprises.,"1,491,793",499,,38.23%,,0,1,0%,100%,0%,"8,201,970","75,069",0.92%,European Union (EU),Active,1990-01-01,day,,,,,,5052680,USD,5052680
Z-Lab,https://www.crunchbase.com/organization/z-lab-4818,,"Business Development, Business Intelligence, Cloud Data Services, E-Commerce, Software",http://www.z-lab.it,"Trescore Balneario, Lombardia, Italy","Z lab provides solutions in areas like business intelligence, CRM, E-commerce, sales, marketing, app and mobile as well as cloud solutions.","598,779",484,,,,0,1,,100%,,"8,347,695",,,European Union (EU),Active,1986-01-29,day,,11-50,,,,4969990,USD,4969990
KUPPER IT GmbH,https://www.crunchbase.com/organization/kupper-it-gmbh,"KUPPER IT provides cloud servers, storage, databases, and software available to our customers via the Internet, so to speak from the cloud. From end devices to networks, servers, and storage to high-availability data centers, they develop, implement and maintain infrastructure solutions that we supplement with intelligent collaboration and database platforms.","Cloud Data Services, Information Technology, IT Infrastructure, IT Management",http://www.kupper-it.com,"Leipzig, Sachsen, Germany",KUPPER IT is an information technology consulting and cloud data management company.,"1,756,019",481,,,,0,1,,100%,,"8,371,032",,,European Union (EU),Active,1993-01-01,year,,11-50,,,,,,
Ata It,https://www.crunchbase.com/organization/ata-it,,"Cloud Data Services, Information and Communications Technology (ICT), Information Services, Software",http://www.atait.com,"Onze-lieve-vrouw-waver, Antwerpen, Belgium","ATA IT provides cloud solutions, IT security, disaster recovery, ICT architecture, and design services.","1,012,251",470,,"1,520.69%",,5,1.5,50%,50%,-50%,"8,438,282","-1,923,093",-18.56%,European Union (EU),Active,1983-12-26,day,,11-50,,,,,,
COMPUTERLAND Belgium,https://www.crunchbase.com/organization/computerland-belgium,,"Cloud Data Services, Consulting, Information and Communications Technology (ICT)",http://www.computerland.be,"Alleur, Liege, Belgium",COMPUTERLAND provides solutions and services in domains of applications and infrastructure.,"308,709",469,,35.16%,,0,1,0%,100%,0%,"8,425,411","193,595",2.35%,European Union (EU),Active,1972-01-03,day,,101-250,,,,,,
Knipp,https://www.crunchbase.com/organization/knipp,,"Cloud Data Services, Domain Registrar, IT Management, Software",http://www.knipp.de,"Dortmund, Nordrhein-Westfalen, Germany","Knipp specializes in services like domain registration, software development, data services, and printing.","1,541,078",457,,-82.7%,,0,1,-65.76%,100%,146.12%,"8,480,503","3,998,427",89.21%,European Union (EU),Active,1988-01-01,day,,11-50,,,,4115144,USD,4115144
MB Solutions,https://www.crunchbase.com/organization/mb-solutions,,"Cloud Data Services, Consulting, Information Technology",https://mb-solutions.dk,"Vejle, Syddanmark, Denmark","MB Solutions is an IT service providing firm that deals in cloud services & security, consulting and IT support services.","275,291",454,,64.49%,,0,1,0%,100%,0%,"8,462,788","-170,862",-1.98%,"European Union (EU), Nordic Countries, Scandinavia",Active,1994-01-01,year,,11-50,,,,,,
Everex Communications,https://www.crunchbase.com/organization/everex-communications,,"Cloud Data Services, Information Technology",http://www.everex.es,"Madrid, Madrid, Spain","Everex Communications is an information technology firm offering cloud, datacentre, IP and data.","1,327,869",441,,7.56%,-65.67%,46,5,25%,0%,,"8,515,305","603,010",7.62%,European Union (EU),Active,1993-01-01,day,,1-10,,,,12497537,USD,12497537
Horn & Cosifan,https://www.crunchbase.com/organization/horn-cosifan,"Horn & Cosifan focuses on virtualization, high availability, managed and cloud services, and especially IT security.","Cloud Data Services, Information Services, Information Technology",https://www.horn-cosifan.de/,"Frankfurt, Hessen, Germany","Horn & Cosifan provides cloud services, and especially IT security.","699,416",405,,,,7,2,,0%,,"8,703,267",,,European Union (EU),Active,1993-01-01,year,,101-250,,,,,,
3T Technology Transfer and Training,https://www.crunchbase.com/organization/3t-technology-transfer-and-training,,"Cloud Data Services, Information Services, Information Technology",http://ttt.ch/,"Gland, Geneve, Switzerland","3T TT&T provides I.T. services and solutions to SME's with their digital transformation process, particularly in cloud based services.","687,613",399,,,,0,1,,100%,,"8,686,792",,,,Active,1982-01-01,day,,11-50,,,,24620,USD,24620
Solviteers Cloud & Infradiensten,https://www.crunchbase.com/organization/solviteers-cloud-infradiensten,,"Cloud Data Services, IT Infrastructure, Software, Software Engineering",https://www.solviteerscloudeninfra.nl/,"Houten, Utrecht, The Netherlands","Solviteers is an IT company that offers IT services and solutions like software development, cloud & infrastructure services to enterprises.","1,187,742",385,,,,2,2,,0%,,"6,393,967",,,European Union (EU),Active,1993-01-01,day,,1-10,,,,,,
Bridgeworks Ltd,https://www.crunchbase.com/organization/bridgeworks,"We accelerate the major Storage Area Network protocols such as iSCSI Fibre Channel and SAS across WAN  without loss of performance. We also provide TCP/IP stream acceleration across WANs such as S3 REST, FTP, GridFTP, Vertias, Commvault, NedApp Snap Mirror, IBM Spectrum Protect, Carigo, Caligo, HTPP, and many more..","Cloud Data Services, Cloud Infrastructure, Cloud Storage, Data Storage",http://www.4bridgeworks.com,"Lymington, Hampshire, United Kingdom",Bridgeworks' Accelerates datay even encrtpted/compressed flow up to 40Gb/s across WAN without changing or modifing the data.,"480,819",372,,-85.34%,,0,1,-60%,100%,100%,"8,772,062","4,372,063",99.37%,,Active,1982-01-01,year,,11-50,,2,,32743764,USD,32743764
DSM Group,https://www.crunchbase.com/organization/dsm-group,"IT infrastructure should be as important to your business as the health of your staff. Keeping your IT systems running at their optimum level is not something that should be overlooked, for like one's health, poor maintenance can lead to drastic failures. An IT support agreement is an easy way of minimising IT system disruption and in many cases preventing it at all. Support agreements can be tailored to fit exact requirements and unlike many other IT support companies we do not insist on fixed contract terms. DSM can provide complete solutions from IT support, through backup solutions and Cloud Computing to Disaster Recovery.","Cloud Computing, Cloud Data Services, Cloud Infrastructure, Cloud Management, Data Center, Information Services, Information Technology, IT Management, Web Hosting",http://dsm-gb.co.uk,"Peterborough, Peterborough, United Kingdom","IT Solutions providor based in Peterborough. Services include Disaster Recovery, Cloud Solutions and Data Centre","404,473",321,,,,77,1.5,,50%,,"9,062,802",,,,Active,1987-01-01,year,1,11-50,Mike Richardson,,,,,
Layer2,https://www.crunchbase.com/organization/layer2,"Layer2 is the provider of data integration by developing the software products. They help in business process, knowledge management and document solutions.","Cloud Data Services, Data Integration, Knowledge Management, Software",https://www.layer2.de/,"Hamburg, Hamburg, Germany",Layer2 is the IT service provider that offers mutifunction tools to create workplaces for everyday work.,"709,225",319,,-62.78%,,25,5,400%,0%,0%,"9,068,406","1,879,279",26.14%,European Union (EU),Active,1991-01-01,year,,11-50,,,,4182389,USD,4182389
Sinfic,https://www.crunchbase.com/organization/sinfic,,"Cloud Data Services, SaaS, Software",http://www.sinfic.pt,"Amadora, Lisboa, Portugal","Sinfic offers a range of services related to software, SaaS, Cloud, IT infrastructure, human resources, and more.","766,576",303,"8,449.5",-99.34%,-99.39%,0,1,-4.08%,100%,0.86%,"9,033,483","8,195,367",977.83%,European Union (EU),Active,1990-01-01,day,,101-250,,,,,,
