Organization Name,Organization Name URL,Full Description,Industries,Website,Headquarters Location,Description,CB Rank (Company),SEMrush - Monthly Visits,SEMrush - Average Visits (6 months),SEMrush - Monthly Visits Growth,SEMrush - Visit Duration Growth,SEMrush - Visit Duration,SEMrush - Page Views / Visit,SEMrush - Page Views / Visit Growth,SEMrush - Bounce Rate,SEMrush - Bounce Rate Growth,SEMrush - Global Traffic Rank,SEMrush - Monthly Rank Change (#),SEMrush - Monthly Rank Growth,Headquarters Regions,Operating Status,Founded Date,Founded Date Precision,Number of Founders,Number of Employees,Founders,Apptopia - Number of Apps,Apptopia - Downloads Last 30 Days,Aberdeen - IT Spend,Aberdeen - IT Spend Currency,Aberdeen - IT Spend Currency (in USD)
Control Group,https://www.crunchbase.com/organization/control-group-5504,"Control Group offers services to companies, offices, and public administrations. They provides solutions for software services, managed printing services, document management and processes, managed job services and cloud services. Their customer can contact them through social media, phone, mail, and fax.","Cloud Data Services, Cyber Security, Hardware, Software",https://www.controlgroup.es,"Barcelona, Catalonia, Spain","Control Group provides software, document management, and printing solutions.","566,190",288,"1,263.83",-50.43%,"2,650%",605,2.62,56.65%,0%,-42.38%,"9,204,212","2,031,601",28.32%,European Union (EU),Active,1979-01-01,year,,1-10,,,,6222235,USD,6222235
Canon Business Center,https://www.crunchbase.com/organization/canon-business-center,Canon Business Center provides customers will find products and solutions for business complete with advice and help with implementation. Is a printing solutions provider. Customers must create a user account in order to access our online store.,"Cloud Data Services, Customer Service, Financial Services, Printing",https://www.canonbusinesscenter.se,"Solna, Stockholms Lan, Sweden",Canon Business Center offers a variety of financing options.,"1,693,521",285,,-96.91%,,0,1,0%,100%,0%,"9,204,996","6,927,162",304.11%,"European Union (EU), Nordic Countries, Scandinavia",Active,1992-01-01,year,,,,,,4314702,USD,4314702
KARADI,https://www.crunchbase.com/organization/karadi,"KARADI provides functional IT solutions. They provide corporate workflow and document management, introduction of company management systems, system operation services, sharepoint development, microsoft office 365, and business intelligence solutions. They offer support and consulting services.","Cloud Data Services, Consulting, IT Management, Management Consulting",https://karadi.hu,"Nyíregyháza, Szabolcs-Szatmar-Bereg, Hungary",KARADI provides cloud-based solutions for SMEs and large companies.,"998,644",279,,,,0,1,,100%,,"9,219,469",,,European Union (EU),Active,1992-01-01,year,,1-10,,,,,,
Qual,https://www.crunchbase.com/organization/qual,,"Cloud Data Services, Information Technology, Security, Telecommunications",https://www.qual.co.uk/,"Harley, Surrey, United Kingdom","Qual offers IT storage, Cloud and professional services, IT security, software, and IT solutions.","378,039",260,,29.35%,,160,3,200%,0%,,"9,347,062","171,363",1.87%,,Active,1994-01-01,year,,11-50,,,,,,
Hypersoft Information Systems,https://www.crunchbase.com/organization/hypersoft-information-systems,"Hypersoft Information Systems is a leading global provider of software for productivity analytics and technology operations. Omnicontext, the company's main product, delivers the most comprehensive information on working time efficiency, productive habits, and collaboration patterns in today's digitized businesses. Omnicontext also measures and monitors how information technology changes work culture and productivity, how technology services are adopted and used, and how well these services perform for their customers. Hypersoft collects the broadest range of data sources to leverage in its analytics platform, including application and device utilization data, communication details, and a wide range of information technology metrics from data centers and cloud platforms such as Microsoft Office 365 and G Suite. Hypersoft solutions are available to both individual professionals and enterprise customers, and can be used as cloud software operated by Hypersoft or as traditional on-premises products. The company's mobile applications can be acquired directly through Microsoft and Google stores. Hypersoft is headquartered in Munich, Germany, with customers, partners, and operations throughout Europe, North and South America, and Asia-Pacific.","Analytics, Cloud Data Services, Mobile Apps, Personal Development, Productivity Tools, Software",https://hypersoft.com,"Munich, Bayern, Germany",Hypersoft produces software for productivity analytics and technology operations for organizations of any size.,"194,878",246,,-82.7%,,47,5,400%,0%,,"9,444,422","3,357,349",55.16%,European Union (EU),Active,1993-01-01,year,1,11-50,Serguei Dobrinevski,,,,,
Orbit Consulting Group,https://www.crunchbase.com/organization/orbit-consulting-group,,"Cloud Data Services, Enterprise Resource Planning (ERP), Infrastructure",http://www.orbit.es,"Madrid, Madrid, Spain","Orbit Consulting Group is an integration of business management solutions (ERP / CRM / BPM), (SAGE CRM, SAGE 200cloud) and development.","691,461",243,,,,0,1,,100%,,"9,419,125",,,European Union (EU),Active,1994-01-01,day,,11-50,,,,4268914,USD,4268914
AMAGOO,https://www.crunchbase.com/organization/amagoo,,"3D Technology, Cloud Data Services, Information and Communications Technology (ICT)",http://www.amagoo.com,"Arbon, Sankt Gallen, Switzerland","Amagoo offers services that include media and packaging, 3D visualization, brands, ICT, cloud solutions, automation of business processes.","1,287,609",224,,,,0,1,,100%,,"9,536,120",,,,Active,1978-01-01,day,,11-50,,,,,,
Digimark,https://www.crunchbase.com/organization/digimark-681e,,"Cloud Data Services, Information Technology, Security, Software",http://www.digimark.gr,"Néa Filadélfeia, Thessaloniki, Greece","Digimark provides IT integrated solutions for printing, security, infrastructure, cloud services, telecommunication, and business software.","1,174,268",198,,,,0,1,,100%,,"9,645,219",,,European Union (EU),Active,1987-01-01,day,,11-50,,,,,,
Microland Keyworks,https://www.crunchbase.com/organization/microland-keyworks,"Microland keyworks is a computer solutions company that develops and markets ERP software and management and billing programs for small and medium-sized companies. They develop custom software tailored to the business needs, as well as specialized modules dependent on the ERP platform. Communications and services in the cloud,  their programs can be deployed for remote use, as well as on servers hosted in the cloud.","Business Development, Cloud Data Services, Customer Service, Enterprise Resource Planning (ERP), Software",https://www.microland.es,"Barcelona, Catalonia, Spain","Microland Keyworks provides management, business advice and support.","1,343,935",190,,,,0,1,,100%,,"9,674,659",,,European Union (EU),Active,1993-01-01,year,,11-50,,,,,,
Vitec HK Data,https://www.crunchbase.com/organization/hk-data,,"Cloud Data Services, Cloud Infrastructure, Professional Services",https://www.hk-data.no/,"Moelv, Hedmark, Norway",HK Data ensures privacy of data by providing cloud-based professional solutions to its clients.,"978,494",138,,,,0,1,,100%,,"9,948,984",,,"Nordic Countries, Scandinavia",Active,1989-01-01,year,,11-50,,,,,,
ST.AG,https://www.crunchbase.com/organization/st-ag,,"Cloud Data Services, Information Technology, Service Industry, Telecommunications",https://www.st-ag.de,"Berlin, Berlin, Germany","ST.AG offers data center, electrical engineering, infrastructure, media technology, network, and IT services.","731,893",119,,-33.15%,,0,1,-75%,100%,,"10,005,898","698,209",7.5%,European Union (EU),Active,1984-01-01,year,,11-50,,,,1010,USD,1010
Computers and Communications,https://www.crunchbase.com/organization/computers-and-communications,,"Cloud Data Services, Information Technology, IT Infrastructure, Software",http://www.cac.be,"Oudenaarde, Oost-Vlaanderen, Belgium","Computers and Communications offer cloud solutions, IT infrastructure, hardware and software solutions for all IT requirements.","1,788,202",90,,-43.04%,"10,184.62%","1,337",3,0%,0%,,"10,429,664","620,229",6.32%,European Union (EU),Active,1987-08-20,day,,11-50,,,,,,
Telia Cygate,https://www.crunchbase.com/organization/telia-cygate,,"Cloud Data Services, Cyber Security, Information Technology",https://teliacygate.fi,"Helsinki, Southern Finland, Finland","Telia Cygate offers cybersecurity, data center & cloud, monitoring & management, and consulting services.","331,907",65,,,,650,5,,0%,,"10,223,495",,,"European Union (EU), Nordic Countries, Scandinavia",Active,1989-01-01,year,,251-500,,,,,,
Daenet,https://www.crunchbase.com/organization/daenet,,"Artificial Intelligence, Cloud Data Services, Internet of Things, Software",https://daenet.de,"Frankfurt An Der Oder, Brandenburg, Germany","Daenet is a software development company that focuses on Cloud, IoT, and artificial intelligence.","992,957",59,,,,0,1,,100%,,"10,587,398",,,European Union (EU),Active,1989-01-01,year,,11-50,,,,4053896,USD,4053896
Tricostar,https://www.crunchbase.com/organization/tricostar,"Tricostar was established in 1988 and is now a major developer and supplier of IT solutions for the public and corporate sectors. Privately owned, the organisation was originally established to develop and market Timebase, time recording software initially targeted at Local Authority legal departments.","Cloud Data Services, Project Management, Software, Training",http://www.tricostar.com/,"Enfield, Enfield, United Kingdom","Innovative technology solutions to reduce costs, increase revenue and make more efficient use of resources.","465,082",34,,,,0,1,,100%,,"10,720,682",,,,Active,1988-01-01,day,,1-10,,,,,,
Statpro,https://www.crunchbase.com/organization/statpro,"StatPro is a global provider of award winning portfolio analytics solutions for the investment community. The Group’s cloud-based platform provides vital analysis of portfolio performance, attribution, risk and compliance. This multi asset-class analytics platform helps StatPro’s clients increase assets under management, improve client service, meet tough regulations and reduce costs. The Group’s integrated and global data coverage includes over 3.2 million securities such as equities, bonds, mutual funds, FX rates, futures, options, OTCs, sector classifications and much else besides. StatPro also covers most families of benchmarks including MSCI, FTSE, Russell, NASDAQ and the open source Freedom Index.","Analytics, Apps, Cloud Data Services, Financial Services, Online Portals, Software",http://www.statpro.com,"London, England, United Kingdom",StatPro is a business that helps investors combine data on performance and risk analytics together to streamline asset management.,"150,471",,,,,,,,,,,,,,Closed,1994-01-01,year,1,251-500,Justin Wheatley,,,,,
Overline,https://www.crunchbase.com/organization/overline,,"Cloud Data Services, Internet, IT Infrastructure, Unified Communications",https://www.overline.com/,"Worthing, West Sussex, United Kingdom","Overline offers remote working, hosted communication, IT support, Microsoft 365 business, desk phones, billing, internet and cloud services.","276,662",,,,,,,,,,,,,,Active,1994-01-01,year,,11-50,,,,,,
NFS Technology Group,https://www.crunchbase.com/organization/nfs-technology-group,"NFS Technology Group is a respected international providers of market-leading hospitality technology and services for corporates, hotels, restaurants, golf and private clubs, conference and event venues. ","Cloud Data Services, Hospitality",https://www.nfs-hospitality.com,"Hertford, Hertford, United Kingdom",NFS Technology Group is a respected international providers of market-leading hospitality technology and services.,"283,098",,,,,,,,,,,,,,Active,1989-02-18,day,1,11-50,Luis DeSouza,,,,,
Nviron,https://www.crunchbase.com/organization/nviron,"Nviron is an established provider of advanced IT infrastructure and services. VMware Enterprise, Microsoft Gold & Dell Platinum partner.Nviron Endpoint-Security-as-a-Service (ESaaS) provides powerful security features with maximum flexibility and minimum effort.  Underpinned by award-winning Antivirus, web filtering and antimalware technology, Nviron ESaaS is the ideal service to help you combat today’s cyber threats.","Cloud Data Services, Information Technology, IT Infrastructure, Service Industry, Small and Medium Businesses",https://www.nviron.co.uk,"Runcorn, Cheshire, United Kingdom","Nviron provides IT infrastructure, networking and security solutions.","285,994",,,,,,,,,,,,,,Active,1989-01-01,year,,11-50,,,,,,
CCE,https://www.crunchbase.com/organization/cce,"CCE is one of the UK’s leading independent IT companies providing IT Infrastructure, Cloud and Managed Print Solutions to improve your productivity. We deliver: IT Design & Consultancy IT Infrastructure installation Private Cloud, ISP & Data Centres Flexible support packages 24/7/365 UK based service desk UK & European Coverage Cost saving Managed Print Services CCE has the resources & expertise to manage all your IT needs, or simply boost your in-house team when required. Our IT solutions & flexible support packages enable better workflow for your organisation.","Cloud Computing, Cloud Data Services, Cloud Infrastructure, Information Technology, IT Infrastructure, IT Management",https://cce.co.uk,"London, England, United Kingdom","Managed Service Provider based in the UK.  Cloud, ISP, Managed Print Services, Service Desk, Hardware Support & Networking & IT consultancy.","288,734",,,,,,,,,,,,,,Active,1979-02-01,month,,101-250,,,,,,
Access Alto,https://www.crunchbase.com/organization/access-alto,"Access Alto is a leading Cloud Hosting provider offering Public, Private and Hybrid Cloud solutions on VMware and Openstack. We have award winning cloud infrastructure in the UK, US and APAC.","Business Development, Cloud Computing, Cloud Data Services, Enterprise Software, Finance, Private Cloud, Software",http://www.theaccessgroup.com/solutions/hosting/,"Brighton, East Sussex, United Kingdom","Leading cloud hosting provider offering Public, Private and Hybrid Cloud solutions on VMware and Openstack.","327,659",,,,,,,,,,,,,,Active,1989-01-01,year,,11-50,,,,,,
Nexis,https://www.crunchbase.com/organization/nexis,,"Cloud Data Services, Software, Virtualization",http://www.nexis.be,"Incourt, Brabant Wallon, Belgium","Nexis specializes in IT solutions, assisting customers in data analysis, design, virtualization, and cloud storage.","343,700",,,,,,,,,,,,,European Union (EU),Active,1992-10-21,day,,11-50,,,,,,
SB Telecom,https://www.crunchbase.com/organization/sb-telecom,"SB Telecom is a leading provider of business communication solutions. From mobile telephony to fixed telephony, cloud and IT services to internet connections: their experts will assist you.","Cloud Data Services, Information Technology, Internet, Telecommunications",https://sbtelecom.nl/,"Veenendaal, Utrecht, The Netherlands",SB Telecom is the leading provider of integrated fixed and mobile telephony and data solutions for the business market.,"433,148",,,,,,,,,,,,,European Union (EU),Active,1994-01-01,year,,11-50,,,,,,
Pavilion,https://www.crunchbase.com/organization/pav-i-t-services,"Delivering IT certainty, boosting your organisational productivity and improving your IT security","Cloud Data Services, Cloud Infrastructure, Cloud Security, Cloud Storage, Information Technology, Network Hardware, Network Security, Software, Technical Support",https://www.pav.co.uk/,"Sheffield, Sheffield, United Kingdom","PAVilion is an IT solutions provider with expertise in the design, implementation and support of complex IT infrastructures.","447,106",,,,,,,,,,,,,,Active,1988-01-01,day,,11-50,,,,,,
NTT DATA,https://www.crunchbase.com/organization/ntt-data-ff07,,"Cloud Data Services, Consulting, Information Technology, Software",https://de.nttdata.com,"München, Bayern, Germany","NTT DATA is an IT firm that offers data & cloud infrastructure, consulting, cybersecurity & application services.","453,105",,,,,,,,,,,,,European Union (EU),Active,1971-01-01,year,,1001-5000,,,,,,
SOU,https://www.crunchbase.com/organization/sou-a029,,"Cloud Data Services, Enterprise Resource Planning (ERP), Software",http://www.sou.de,"Schwetzingen, Baden-Wurttemberg, Germany",SOU is a provider of standard business software for medium-sized companies.,"465,084",,,,,,,,,,,,,European Union (EU),Active,1990-01-01,day,,11-50,,,,8655361,USD,8655361
Asdon Group,https://www.crunchbase.com/organization/asdon-group,"Asdon Group supports clients throughout the UK and Ireland with strategic and value-added services for over 100 years. Their comprehensive and diverse portfolio allows them to offer their customers truly unique solutions for businesses of all sizes by leveraging their experience and expertise across a range of disciplines. The company offers Digital Dictation, IT Services, Copier Technology, Office Products, Telecoms, Cyber Security, CRM, GDPR, Unified Communications, Speech Recognition, Business Improvement, HR & Recruitment, Hosting, Process Automation, Mobile & Landline, IT Infrastructure, Managed Print Services, Cloud Services, Office 365, Connectivity, and Internet Services.","Cloud Data Services, CRM, Cyber Security, Information Services, Information Technology, Internet, IT Infrastructure, Software",https://www.asdongroup.com/,"Lisburn, Lisburn, United Kingdom","Asdon Group is a software company that offers business technology, compliance services, and office products.","466,144",,,,,,,,,,,,,,Active,1918-01-01,year,,11-50,,,,,,
Telia Carrier,https://www.crunchbase.com/organization/telia-carrier-uk,"Telia Carrier is a provider of network infrastructure and services for individuals and businesses to execute their most critical activities. With its IP services, the company provides unlimited access to the Internet, and its suite of enterprise, networking, and mobile data solutions connect business-critical content and applications to media-hungry audiences everywhere. Telia Carrier is a fully-owned subsidiary of Telia Company and was founded in 1993.","Cloud Data Services, Information Technology, Telecommunications",http://www.teliacarrier.com,"Stockholm, Stockholms Lan, Sweden",Telia Carrier is a provider of network infrastructure and services for individuals and businesses.,"472,922",,,,,,,,,,,,,"European Union (EU), Nordic Countries, Scandinavia",Active,1993-01-01,year,,501-1000,,,,4328156,USD,4328156
EPM Data,https://www.crunchbase.com/organization/epm-data,,"Cloud Data Services, Information Technology, Outsourcing, Software",https://www.epm.se/,"Stockholm, Stockholms Lan, Sweden",EPM Data is an IT company that offers outsourcing solutions and cloud services.,"508,926",,,,,,,,,,,,,"European Union (EU), Nordic Countries, Scandinavia",Active,1994-01-01,day,,11-50,,,,4333970,USD,4333970
Bristol IT Company,https://www.crunchbase.com/organization/bristol-it-company,,"Cloud Data Services, Information Technology, Software",https://bristolitcompany.com/,"Bristol, Bristol, City of, United Kingdom","Bristol IT Company offers cloud, security, software development, connectivity, web, and managed IT services.","531,091",,,,,,,,,,,,,,Active,1990-01-01,year,,11-50,,,,,,
IntraConnect,https://www.crunchbase.com/organization/intraconnect,,"Cloud Data Services, IT Management, Software",http://www.intraconnect.de,"Dresden, Sachsen, Germany","IntraConnect is a computer consultant company specializes in cloud & services, IT automation and business processes.","534,167",,,,,,,,,,,,,European Union (EU),Active,1990-01-01,day,,11-50,,,,4066987,USD,4066987
iSmart,https://www.crunchbase.com/organization/ismart-1a24,,"Apps, Cloud Data Services, Consulting, Software, UX Design, Web Development",https://www.ismart.be,"Kasterlee, Antwerpen, Belgium",iSmart works with you to determine which technology helps your company and your people tailor-made digital thinking.,"563,984",,,,,,,,,,,,,European Union (EU),Active,1987-01-01,year,,11-50,,,,,,
Arvato Systems,https://www.crunchbase.com/organization/arvato-systems-fdaf,"Arvato Systems assists companies in digital transformation. The company offers digital strategy consulting, technology consulting, process consulting, cloud and data center services, security services, managed services, and application management.","Cloud Data Services, Consulting, Cyber Security, Information Technology",https://www.arvato-systems.com ,"Gütersloh, Nordrhein-Westfalen, Germany",Arvato Systems provides IT solutions and cloud services.,"589,471",,,,,,,,,,,,,European Union (EU),Active,1990-01-01,year,,1001-5000,,,,,,
Tech Data,https://www.crunchbase.com/organization/tech-data-de8b,,"Analytics, Cloud Data Services, Data Center, Information Technology",http://www.techdata.nu,"Spånga, Skane Lan, Sweden","Tech Data offers IT solutions with core competencies in the cloud, network, data center, IoT, security, and analytics.","589,499",,,,,,,,,,,,,"European Union (EU), Nordic Countries, Scandinavia",Active,1982-12-20,day,,101-250,,,,,,
Meta-Inform,https://www.crunchbase.com/organization/meta-inform,,"Cloud Data Services, Legal, Training",http://www.meta-inform.com,"Odesa, Odes'ka Oblast', Ukraine","Meta-inform provides consulting, legal services, cloud services, short-term business education, seminars for accountants and lawyers.","609,558",,,,,,,,,,,,,,Active,1991-01-01,day,,11-50,,,,,,
binary GmbH,https://www.crunchbase.com/organization/binary-gmbh,"binary is a private cloud specialist for medium-sized customers. The company operates its own state-of-the-art, certified data center in Germany as well as partner locations for the purpose of geo-redundancy. Binary is thus able to provide complete operating models in the private cloud sector with a focus on scalable and tailor-made solutions. binary operates its own 24/7 service desks that offer support and advice right down to the end user.","Cloud Computing, Cloud Data Services, Cloud Management",https://www.binary.de/,"Essen, Nordrhein-Westfalen, Germany",binary GmbH is a private cloud specialist for medium-sized customers.,"611,798",,,,,,,,,,,,,European Union (EU),Active,1992-01-01,year,,,,,,,,
Eurofiber,https://www.crunchbase.com/organization/eurofiber-3ed4,,"Cloud Data Services, Cloud Security, Internet, Online Portals",http://www.eurofiber.be,"Zaventem, Vlaams-Brabant, Belgium","Eurofiber is an IT infrastructure firm that offers services for fiber optic network, cloud services, ethernet VPN, and business internet.","646,957",,,,,,,,,,,,,European Union (EU),Active,1988-08-31,day,,501-1000,,,,,,
PC AddOn,https://www.crunchbase.com/organization/pc-addon,"PC AddOn operates to find flexible and reliable IT solutions with functionality and user-friendliness in focus. They focus on operation, support, and more from IT environments with single computers to several hundred. They help their customers have access to hardware or cloud solutions. They also offer printing solutions. Their services include It operations, digital workplace, backup, and more.","Cloud Data Services, Consulting, Information Technology, Printing, Software",https://www.pcaddon.se,"Upplands-väsby, Stockholms Lan, Sweden",PC AddOn provides information technology consulting services.,"649,141",,,,,,,,,,,,,"European Union (EU), Nordic Countries, Scandinavia",Active,1992-01-01,year,,1-10,,,,13522583,USD,13522583
NCS IT,https://www.crunchbase.com/organization/ncs-it,,"Cloud Computing, Cloud Data Services, Consulting, Cyber Security, Information Technology, IT Infrastructure",https://www.ncs.cloud/,"Rawtenstall, Lancashire, United Kingdom","NCS IT is an IT company that provides cyber security, internet security, and network cabling services.","656,072",,,,,,,,,,,,,,Active,1994-01-01,year,1,11-50,Carl Nelson,,,,,
Groupe Stordata,https://www.crunchbase.com/organization/groupe-stordata,Stordata is a provider of computer data storage services. The company accompanies its clients in the process of transforming their Information Systems up to the implementation of their infrastructures.,"Architecture, Cloud Data Services, Consulting, Data Storage, IT Infrastructure, Security",http://www.stordata.fr,"Versailles, Ile-de-France, France","Groupe Stordata specializes in consulting, architecture, implementation and MCO of storage infrastructures.","657,642",,,,,,,,,,,,,European Union (EU),Active,1988-10-01,day,,101-250,,,,,,
Dacoll,https://www.crunchbase.com/organization/dacoll,,"Cloud Data Services, Consulting, Information and Communications Technology (ICT), Information Technology",https://dacoll.co.uk,"Bathgate, West Lothian, United Kingdom","Dacoll is an IT solution firm that offers ICT, consulting, and cloud data services.","668,793",,,,,,,,,,,,,,Active,1969-01-01,year,,51-100,,,,,,
Astria,https://www.crunchbase.com/organization/astria-be48,,"Cloud Data Services, CRM, Information Technology",https://www.astria.co.uk/,"Reading, Reading, United Kingdom","Astria offers IT services such as cyber security, data analytics, UI/UX design, CRM, SASS and cloud-based solutions.","672,377",,,,,,,,,,,,,,Active,1994-01-01,year,,1-10,,,,,,
