Organization Name,Organization Name URL,Full Description,Industries,Website,Headquarters Location,Description,CB Rank (Company),SEMrush - Monthly Visits,SEMrush - Average Visits (6 months),SEMrush - Monthly Visits Growth,SEMrush - Visit Duration Growth,SEMrush - Visit Duration,SEMrush - Page Views / Visit,SEMrush - Page Views / Visit Growth,SEMrush - Bounce Rate,SEMrush - Bounce Rate Growth,SEMrush - Global Traffic Rank,SEMrush - Monthly Rank Change (#),SEMrush - Monthly Rank Growth,Headquarters Regions,Operating Status,Founded Date,Founded Date Precision,Number of Founders,Number of Employees,Founders,Apptopia - Number of Apps,Apptopia - Downloads Last 30 Days,Aberdeen - IT Spend,Aberdeen - IT Spend Currency,Aberdeen - IT Spend Currency (in USD)
Axcelinno,https://www.crunchbase.com/organization/axcelinno,,"Cloud Data Services, Cloud Infrastructure, Information Technology",https://www.axcelinno.io/,"Frisco, Texas, United States","Axcelinno is an information technology firm that offers digital innovation, cloud management and cloud security services.","322,564","13,824",,,,353,1.25,,75%,,"1,812,132",,,"Dallas/Fort Worth Metroplex, Southern US",Active,2017-01-01,year,1,11-50,Farhan Hussain,,,,,
Turbonomic,https://www.crunchbase.com/organization/turbonomic,"Turbonomic is an Application Resource Management (ARM) and Network Performance Management (NPM) software provider based in Boston, MA. Turbonomic provides businesses with ARM software that simultaneously optimizes the performance, compliance, and cost of applications in real-time. Turbonomic identifies and executes the right actions at the right time at every layer of the application stack. Applications get the exact resources they need, continuously and in real-time.","Application Performance Management, Cloud Infrastructure, Enterprise Software, Information Technology, Productivity Tools, Software",http://www.turbonomic.com,"Boston, Massachusetts, United States","Turbonomic develops tools that optimize application performance, compliance, and cost in real-time.","56,576","13,699","23,747.83",-53.05%,-72.04%,548,1.43,-26.03%,66.31%,-4.89%,"1,875,934","698,491",59.32%,"Greater Boston Area, East Coast, New England",Active,2008-01-01,year,5,251-500,"Danillo Florissi, Shai Benjamin, Shmuel Kliger, Yechiam Yemini, Yuri Rabover",,,22121708,USD,22121708
Kaa IoT,https://www.crunchbase.com/organization/kaa-iot,"Kaa is an enterprise-grade IoT platform that enables a broad range of cloud capabilities for your connected devices. It brings together everything from tiny sensors to sophisticated industrial machinery and makes them connect in a meaningful and effective way, thus making every aspect of your business smarter and more attractive to your customers. Built on the modern cloud-native technology stack, Kaa provides elastic scalability and mission-critical resilience for your IoT device ecosystems. Kaa puts you in charge of your IoT innovations by holding out extensive freedom of technology, deployment models, and customization. It is built on industry-proven open components and supports popular IoT protocols so that your team can quickly get the knack of the platform’s mechanics. It also takes care of an end-to-end IoT data flow and allows you to set up business-specific analytics pipelines and visualization dashboards. It gives you clear visibility into your key performance indicators and greatly speeds up the decision making process through consistent automation.","Cloud Infrastructure, Computer, Internet, Internet of Things, Smart Home, Software, Wearables",https://www.kaaiot.com,"Miami Beach, Florida, United States",Kaa is an enterprise-grade IoT platform that enables a broad range of cloud capabilities for your connected devices.,"206,710","13,469","107,163.5",106.39%,"1,425.93%",412,1.57,10.73%,57.7%,-10.92%,"1,892,849","-847,054",-30.92%,"Greater Miami Area, East Coast, Southern US",Active,2017-01-01,year,,101-250,,,,,,
Thundra,https://www.crunchbase.com/organization/thundra,"Thundra is a software company for developers and quality engineers who develop, debug, test, and deliver modern microservices on the cloud. By offering everything from test optimization to remote debugging, Thundra provides a shift-left observability approach for development teams by eliminating the need for multiple tools in pre-production environments. By providing observability into the CI process, Thundra Foresight helps optimize build duration, enabling more frequent deployments, higher development productivity, and lower CI costs.","Cloud Infrastructure, SaaS, Software",https://www.thundra.io,"Boston, Massachusetts, United States",Thundra is a private company providing modern observability solutions on cloud area,"33,601","13,361","86,123.33",-30.24%,-44.31%,93,1.18,-18.51%,92.84%,19.1%,"1,844,182","396,626",27.4%,"Greater Boston Area, East Coast, New England",Active,2017-01-01,year,1,11-50,Serkan Özal,,,,,
Inflect,https://www.crunchbase.com/organization/inflect,"Inflect's mission is to make the buying and selling of internet infrastructure frictionless. Inflect has two primary products. Routefinder, enabling the research and quoting of connectivity options between cloud regions, data centers and enterprise locations like an online flight search. And the Inflect Global Marketplace, enabling search for the most relevant data center location based on powerful filters.","Cloud Infrastructure, E-Commerce, Internet, Open Source, Software",http://www.Inflect.com,"San Francisco, California, United States","Indexing the world’s data center, cloud and network data into a neutral, online marketplace and software research tools.","43,782","13,140","9,529.33",16.56%,262.67%,272,1.1,-21.37%,95.24%,10.02%,"1,863,358","-62,318",-3.24%,"San Francisco Bay Area, West Coast, Western US",Active,2016-06-01,month,2,1-10,"Charles Stewart, Mike Nguyen",,,,,
Spin Servers,https://www.crunchbase.com/organization/majestic-hosting-solutions-llc,"Spin Servers is a US-based provider of Infrastructure as a Service (IaaS). We specialize in dedicated servers and custom-built private cloud solutions built on high-performance bare metal servers.  Get high performance dedicated servers built on bare metal Dell PowerEdge servers with Intel Xeon processors and highly scalable bandwidth options. We offer multiple POP's with a focus on strong connectivity through North America, Latin America, and Asia Pacific - with a special emphasis on China and India.  With tens of thousands of servers in stock, we can help you spin up all of your server requirements seamlessly & affordably - no matter the scale. The best part is that there is no long-term commitment required.","Cloud Computing, Cloud Infrastructure, Data Center, Private Cloud, Web Hosting",https://www.spinservers.com,"Carrollton, Texas, United States","Dedicated Servers, Server Hosting, Private Cloud, Edge Computing, Bare Metal, Hybrid Cloud, IPv4, IP Transit, Network Connectivity","54,347","13,130","54,461.17",-85.24%,-75.78%,31,2.51,-55.1%,59.62%,134.82%,"1,864,237","1,324,933",245.67%,"Dallas/Fort Worth Metroplex, Southern US",Active,2018-05-01,month,1,1-10,Arnav Kejriwal,,,,,
Ridge,https://www.crunchbase.com/organization/tectonic-c189,"Ridge goes beyond the public cloud with a flexible cloud that’s anywhere you need to be. Ridge Cloud integrates into multiple locations and technology stacks to offer a full cloud experience on top of any underlying infrastructure — public or private. Businesses get a cloud customized for their specific throughput, locality, and commercial requirements. Without any installation or CAPEX, Ridge leverages existing servers and runs application workloads on any IaaS, virtualization, or bare-metal machines. Whether you need to deploy in a private data center, on-prem, edge micro-center, or even in a multi-facility hybrid environment, Ridge expands your footprint without limits.","Cloud Computing, Cloud Data Services, Cloud Infrastructure, Cloud Storage",https://ridge.co,"Boston, Massachusetts, United States",Get a cloud that works best for you! Ridge boosts cloud-native apps with a flexible cloud that sits on any infrastructure & in any location.,"16,383","13,033","5,938.67",258.34%,-91.68%,0,1,-6.09%,100%,6.94%,"1,931,125","-1,948,102",-50.22%,"Greater Boston Area, East Coast, New England",Active,2018-01-01,year,3,51-100,"Jonathan Seelig, Mati Lerner, Nir Sheffi",,,,,
Altostra,https://www.crunchbase.com/organization/altostra,Altostra is a no-code infrastructure platform for developers built to accelerate and simplify cloud adoption. Altostra eliminates the need to write code that defines infrastructure (aka IaC) and by that can speed up the development lifecycle up to 4x.,"Cloud Computing, Cloud Infrastructure, Cloud Management, Developer Platform, Developer Tools, Software",https://www.altostra.com,"Palo Alto, California, United States",No-Code infrastructure platform for developers,"539,238","12,392","7,964.17",68.58%,-97.69%,144,1.04,4.1%,95.87%,-4.12%,"1,998,820","-569,537",-22.18%,"San Francisco Bay Area, Silicon Valley, West Coast",Active,2018-09-06,day,2,11-50,"Gal Zabib, Yevgeni Krupetsky",,,,,
CoreStack Inc,https://www.crunchbase.com/organization/cd-cloudenablers-pvt-limited,"CoreStack empowers enterprises to achieve continuous and autonomous cloud governance so they can accelerate innovation and deliver predictable outcomes. The company ensures cloud compliance and automating cloud operations. CoreStack's cloud-native, multi-cloud compliance platform is used today by many global enterprises. It is used today by many leading global enterprises across multiple industries. CoreStack was founded in 2016 and is headquartered in Bellevue, Washington.","Cloud Computing, Cloud Infrastructure, Cloud Management, Cloud Security, SaaS, Software",https://www.corestack.io,"Bellevue, Washington, United States",CoreStack delivers continuous and autonomous cloud governance for enterprises.,"12,510","12,382","16,874",-80.98%,-93.3%,351,1.94,-70%,53.28%,27.83%,"1,999,630","1,293,955",183.36%,"Greater Seattle Area, West Coast, Western US",Active,2016-11-04,day,5,101-250,"Ezhilarasan Natarajan, Krishnakumar Narayanan, Rathinasabapathy Arumugam, Thiruvalluvar NB, Venkatesh Perumal",,,,,
Megarender,https://www.crunchbase.com/organization/megarender,,"3D Technology, Cloud Infrastructure, Software",https://megarender.com/,"Austin, Texas, United States","Online cloud rendering services for designers, architects and animation studios.","87,910","12,225","6,393.67","1,807.18%","3,092.31%","2,138",9.38,837.52%,21.91%,-78.09%,"1,939,046","-5,071,814",-72.34%,Southern US,Active,2014-01-01,year,1,11-50,Victor Yurkov,,,,,
Virsec,https://www.crunchbase.com/organization/virsec-systems-3,"Virsec has pioneered technology to protect critical application workloads from the inside, protecting processes in memory and pinpointing attacks in real-time, within any application, in any environment. Through its patented AppMap technology, Virsec maps acceptable application execution and instantly detects deviations caused by attacks. This deterministic process takes the guesswork out of cybersecurity, detecting and blocking application attacks within milliseconds, with precise forensics at every step.","Cloud Infrastructure, Cloud Security, Cyber Security, IT Infrastructure, Network Security, Software",http://virsec.com/,"San Jose, California, United States","Virsec is a cybersecurity company offering continuous self-protection to enterprise workloads, stopping known & unknown attacks","45,235","12,199","11,914.83",-5.96%,655.88%,257,2.98,74.32%,44.5%,-41.7%,"2,017,018","139,209",7.41%,"San Francisco Bay Area, Silicon Valley, West Coast",Active,2013-06-15,day,4,101-250,"Atiq Raza, Dave Furneaux, Ray DeMeo, Satya Gupta",,,157860,USD,157860
ObjectiveFS,https://www.crunchbase.com/organization/objectivefs,Distributed cloud filesystem that provides persistent storage for containers and cloud instances.  ObjectiveFS makes scaling reliable storage infrastructure easy by eliminating cluster management overhead. 3 reasons why businesses use our native cloud filesystem: 1. Scaling up storage and machines is easy.   2. No storage cluster management overhead.   3. Existing applications runs out of the box in the cloud.,"Cloud Computing, Cloud Infrastructure, Enterprise Software, Software",https://objectivefs.com,"Raleigh, North Carolina, United States",ObjectiveFS offers a filesystem that makes scaling storage infrastructure easy on the public and private cloud.,"666,064","11,787","8,480.83",54.44%,"9,900%","1,100",1.25,9.8%,79.22%,-7.78%,"2,053,207","-455,565",-18.16%,"Research Triangle, East Coast, Southern US",Active,,,2,1-10,"Grace Nordin, Thomas Nordin",,,,,
Heavybit,https://www.crunchbase.com/organization/heavybit-industries,"Heavybit is the leading investor in developer-first startups that turn visions into movements, products into platforms, and contributors into communities. Our partnership, team, and community of technical founders and 600+ domain experts have an unequaled track record of nurturing developer-first startups.","Cloud Infrastructure, Developer APIs, Developer Platform, Developer Tools, Enterprise Software, Information Technology, Infrastructure, Software, Venture Capital",https://www.heavybit.com,"San Francisco, California, United States",Heavybit is the leading investor in dev-first companies with an unrivaled track record helping technical founders achieve breakout success.,"27,869","11,716","6,985.17",56.21%,"1,845.83%",467,1.22,7.99%,77.67%,-16.81%,"2,059,127","-471,334",-18.63%,"San Francisco Bay Area, West Coast, Western US",Active,2013-01-01,year,2,11-50,"James Lindenbaum, Tom Drummond",,,,,
Nimbus Data,https://www.crunchbase.com/organization/nimbus-data,"Nimbus Data helps hundreds of world-leading companies accelerate data storage, simplify data management, and improve data protection for cloud infrastructure, analytics, AI, rich content, scientific computing, and much more. Its solutions include ExaFlash®, All-Flash Arrays and ExaDrive®, and Solid State Drives.","Cloud Infrastructure, Enterprise Software, Flash Storage, IT Infrastructure, Software",http://www.nimbusdata.com,"Irvine, California, United States",Nimbus Data develops advanced flash memory solutions that power data-driven innovation.,"50,151","11,709","12,696.83",26.39%,-98.48%,24,3.22,-1.22%,25.7%,-65.89%,"1,991,769","-166,481",-7.71%,"Greater Los Angeles Area, West Coast, Western US",Active,2003-09-01,month,1,11-50,Thomas Isakovich,1,,757199,USD,757199
Nordic Backup,https://www.crunchbase.com/organization/nordic-backup-d1e7,"Nordic Backup offers dependable cloud-based backup and restore solutions. Nordic Backup has never lost a single byte of data from a customer. They have restored thousands of PCs and millions of records, restoring businesses and lives to normalcy. Nordic Backup created backup solutions for IT professionals in the field that required complete safety for their customers. Banks, municipalities, law firms, and other organizations rely on Nordic Backup to restore their data in an emergency.","Cloud Data Services, Cloud Infrastructure, Software",https://nordic-backup.com,"Lake Mary, Florida, United States",Nordic Backup is a cloud-based dependable backup and restore services.,"1,051,529","11,387","7,800.5",46.16%,,20,1.16,15.52%,84.08%,-15.62%,"2,088,661","-396,569",-15.96%,"East Coast, Southern US",Active,2003-01-01,year,,11-50,,,,,,
Connectria Hosting,https://www.crunchbase.com/organization/connectria,"Connectria provides award-winning cloud hosting, cloud managed services, cloud security, and cloud management software.","Cloud Computing, Cloud Data Services, Cloud Infrastructure, Cloud Management, Web Hosting",http://www.connectria.com,"Saint Louis, Missouri, United States","Connectria is a provider of cloud computing, web hosting, custom hosting, cloud migration and management solutions.","143,347","11,361","8,648.33",20.87%,118.44%,"1,249",1.6,59.96%,74.3%,-25.7%,"2,029,461","-111,983",-5.23%,Midwestern US,Active,1998-01-01,year,1,101-250,Rich Waidmann,,,4765040,USD,4765040
Cloudastructure,https://www.crunchbase.com/organization/cloudastructure-inc,"Cloud-controlled physical infrastructure providing enterprise solutions for Video Surveillance as a Service (VSaaS), Door Access Control as a Service (ACaaS), as well as integration with other sensors to support Internet of Things (IoT) applications. The Cloudastructure hardware utilizes state of art technology, delivered at a competitive price that beats industry standards and comes with zero maintenance or replacement costs with a life-time warranty. The Cloudastructure solution centralizes the management of access control with video monitoring and allows customers to scale geographically across multiple locations. The Cloudastructure platform delivers intelligence online and keeps critical data safely offsite.","Cloud Infrastructure, Internet of Things, SaaS",http://www.cloudastructure.com,"Palo Alto, California, United States","Cloudastructure provides cloud based infrastructure for building automation - providing VSaaS, ACaaS, and Custom IoT integration solutions","60,386","11,350",,,,13,1.3,,83.85%,,"2,030,553",,,"San Francisco Bay Area, Silicon Valley, West Coast",Active,2013-09-01,day,2,11-50,"Glenn Forrester, Rick Bentley",,,,,
ClearDATA,https://www.crunchbase.com/organization/cleardata,"Healthcare professionals across the globe trust the ClearDATA HITRUST-certified cloud to safeguard their sensitive data and power their critical applications available across the major public cloud platforms. For healthcare organizations, customers receive one of the most comprehensive Business Associate Agreements (BAA) in the industry, combined with market-leading healthcare-exclusive security and compliance solutions, and multi-cloud expertise. ClearDATA’s innovative platform of solutions and services protects customers from data privacy risks, improves their data management, and scales their healthcare IT infrastructure, enabling the industry to focus on making healthcare better by improving healthcare delivery, every single day.","Cloud Data Services, Cloud Infrastructure, Compliance, Cyber Security, Health Care, Information Technology, Security, Software",https://www.cleardata.com/,"Austin, Texas, United States",Building the world's most innovative company designed to modernize and protect your healthcare data.,"8,964","11,322","15,607.67",89.62%,450%,33,1.44,9.15%,82.6%,20.51%,"2,094,181","-832,918",-28.46%,Southern US,Active,2011-01-01,year,4,101-250,"Chris Bowen, Darin Brannan, David G. Jemmett, Matt Ferrari",,,,,
Goldsky,https://www.crunchbase.com/organization/goldsky,Goldsky empowers developers to quickly spin up realtime APIs using data stored on Ethereum and other networks.,"Blockchain, Cloud Infrastructure, Developer Platform",https://goldsky.com,"San Francisco, California, United States",Goldsky is the leading platform for building web3 APIs.,"1,574","11,223",,,,29,1.53,,73.37%,,"2,104,994",,,"San Francisco Bay Area, West Coast, Western US",Active,2021-01-01,year,2,1-10,"Jeffrey Ling, Kevin Li",,,,,
The KR Group,https://www.crunchbase.com/organization/the-kr-group,"The KR Group is an IT company that offers comprehensive IT solutions and products like cyber-security, data, and cloud services.","Cloud Infrastructure, Consulting, Cyber Security, Information Technology",http://www.krgroup.com,"Grand Rapids, Michigan, United States","The KR Group is an IT company that offers comprehensive IT solutions and products like cyber-security, data, and cloud services.","391,953","11,160","11,052.17",-37.63%,-82.66%,133,1.69,-66.87%,54.29%,197.81%,"2,049,633","549,694",36.65%,"Great Lakes, Midwestern US",Active,2008-01-01,year,,11-50,,,,168412,USD,168412
Saturn Cloud,https://www.crunchbase.com/organization/saturn-cloud,"Saturn Cloud is the go-to workspace for data scientists. Have your team collaborate with powerful resources, jobs, deployments, and more.","Cloud Data Services, Cloud Infrastructure, Machine Learning, SaaS, Software",https://www.saturncloud.io/,"New York, New York, United States","A cloud workspace for the whole data science team, supporting Python & R. Collaborate with powerful resources, jobs, deployments, and more","21,778","11,033","11,964",7.53%,-29.54%,167,1.59,18.64%,64.1%,-5.35%,"2,123,853","-31,131",-1.44%,"Greater New York Area, East Coast, Northeastern US",Active,2019-08-27,day,2,11-50,"Hugo Shi, M. Sebastian Metti",,,,,
Datica,https://www.crunchbase.com/organization/datica,"Datica helps highly regulated industries manage sensitive information in the cloud. Datica's customers ranges from mid-to-late-stage startups to Fortune 100 companies.  The company was founded in 2013 and is based in Minneapolis, Minnesota.","Cloud Computing, Cloud Infrastructure, Compliance, Health Care, Information Technology, Open Source, SaaS",https://datica.com/,"Minneapolis, Minnesota, United States",Datica brings the cloud to healthcare and helps highly regulated industries.,"28,927","10,924","12,125.83",54.03%,22.25%,"1,687",5.79,22.64%,24.72%,-0.08%,"2,073,147","-414,259",-16.65%,"Greater Minneapolis-Saint Paul Area, Great Lakes, Midwestern US",Active,2013-04-13,day,5,51-100,"Jeremy Pierotti, Josh Elson, Mike Pietig, Mohan Balachandran, Travis Good",,,,,
CloudForecast,https://www.crunchbase.com/organization/cloudforecast,We're building the best cloud budget management software on the market at a 1/10th of the price. You work hard for your margins. There's no reason that you should give up 1-3% of your server costs to a company to provide budget planning and forecasting.,"Cloud Computing, Cloud Infrastructure, Cloud Management, Enterprise Software, SaaS",http://cloudforecast.io,"San Francisco, California, United States",AWS Billing analytics for the rest of us,"230,981","10,880","9,601.17",1.6%,-98.66%,569,1.15,14.51%,85.49%,-14.51%,"2,081,495","89,998",4.52%,"San Francisco Bay Area, West Coast, Western US",Active,2017-03-01,month,3,1-10,"Francois Lagier, Kacy Fortner, Tony Chan",,,,,
mLab,https://www.crunchbase.com/organization/objectlabs,"mLab is a fully managed cloud database service featuring automated provisioning and scaling of MongoDB databases, backup and recovery, 24/7 monitoring and alerting, web-based management tools, and expert support. mLab’s Database-as-a-Service platform powers over 900,000 database deployments across AWS, Azure, and Google and allows developers to focus their attention on product development instead of operations.","Cloud Computing, Cloud Infrastructure, Software",https://mlab.com/,"San Francisco, California, United States",mLab is a cloud-based infrastructure company that builds software for developers and IT professionals.,"198,543","10,575","13,469.5",28.04%,-11.84%,67,1.57,-3.12%,75.93%,19.5%,"2,170,466","-248,153",-10.26%,"San Francisco Bay Area, West Coast, Western US",Active,2011-01-01,year,2,11-50,"Angela Kung Shulman, Will Shulman",,,,,
2nd Watch,https://www.crunchbase.com/organization/2nd-watch,"2nd Watch is an AWS Premier Partner and a Microsoft Azure Gold Partner, providing consulting and managed cloud services to enterprises. Its patent-pending, proprietary tools automate everyday workload management processes for big data analytics, digital marketing, line-of-business, and cloud-native workloads.  It was founded in 2010 and headquartered in Seattle, Washington.","Cloud Infrastructure, Enterprise Software, IaaS, Information Technology, Internet, Software, Telecommunications",http://2ndwatch.com,"Seattle, Washington, United States",2nd Watch is an AWS Premier Partner and a Microsoft Azure Gold Partner that provides consulting and managed cloud services to enterprises.,"6,753","10,313","13,161.67",-30.93%,93.02%,83,1.43,-12.68%,82.24%,-0.34%,"2,149,049","492,328",29.72%,"Greater Seattle Area, West Coast, Western US",Active,2010-01-01,year,3,251-500,"Brett Turner, Jeff Aden, Kris Bliesner",,,1784943,USD,1784943
IT Convergence,https://www.crunchbase.com/organization/it-convergence,"IT Convergence is a global enterprise application services provider that specializes in Oracle solutions. The company offers spans the entire technology stack and includes Consulting, Development, Testing, Education, Oracle UPK, and Cloud & Managed Services.","Cloud Infrastructure, Enterprise Software, Software Engineering",http://www.itconvergence.com/,"Reno, Nevada, United States",IT Convergence is a global enterprise application services provider that specializes in Oracle solutions.,"159,817","10,022","11,912",-25.23%,320%,84,1.08,-14.79%,96.74%,15.75%,"2,179,416","427,419",24.4%,Western US,Active,1998-01-01,year,1,501-1000,Patrick Krause,,,,,
Golioth,https://www.crunchbase.com/organization/golioth,"Golioth provides turnkey IoT cloud services with unmatched levels of choice in what matters most to hardware developers: flexibility in hardware, embedded software, messaging protocols, and connectivity. Golioth supports a range of open IoT protocols and connectivity for communication, providing security by default.","Cloud Infrastructure, Developer Tools, Enterprise Software, Internet of Things",https://golioth.io,"San Francisco, California, United States",The IoT cloud platform built for hardware.,"39,521","9,891","4,388.17",71.33%,-39.73%,484,3.45,193.91%,23.92%,-71.1%,"2,243,880","-770,331",-25.56%,"San Francisco Bay Area, West Coast, Western US",Active,2020-03-01,day,1,11-50,Jonathan Beri,,,,,
