Organization Name,Organization Name URL,Full Description,Industries,Website,Headquarters Location,Description,CB Rank (Company),SEMrush - Monthly Visits,SEMrush - Average Visits (6 months),SEMrush - Monthly Visits Growth,SEMrush - Visit Duration Growth,SEMrush - Visit Duration,SEMrush - Page Views / Visit,SEMrush - Page Views / Visit Growth,SEMrush - Bounce Rate,SEMrush - Bounce Rate Growth,SEMrush - Global Traffic Rank,SEMrush - Monthly Rank Change (#),SEMrush - Monthly Rank Growth,Headquarters Regions,Operating Status,Founded Date,Founded Date Precision,Number of Founders,Number of Employees,Founders,Apptopia - Number of Apps,Apptopia - Downloads Last 30 Days,Aberdeen - IT Spend,Aberdeen - IT Spend Currency,Aberdeen - IT Spend Currency (in USD)
"ATRIUS Industries, Inc.",https://www.crunchbase.com/organization/atrius-industries-inc,"Autonomy will drive the next Trillion-Dollar Industry, multiple of them. Autonomous Infrastructure enabling the Robotic Edge. Autonomous Robotics will enable incredibly disruptive benefits for transportation, smart city, energy, rail, oil/gas, construction, public safety, disaster response, and dozens of other commercial applications. Advancing Intelligent Infrastructure to support Industry 4.0 Currently, the infrastructure to support ground and air vehicle autonomy at scale is non-existent in our society where we live and work. Infrastructure is required to see full adopted autonomous trucks, cars, shuttles, industrial robotics, drones, and urban air. ATRIUS and our partners have engineered a unified architecture that aligns the billions that are being spent on 5G, Edge Computing, and Intelligent Transportation Systems. This will be the largest infrastructure buildout the nation has seen and will create the largest productivity gain in history. Autonomous systems will drive exponential impacts across multiple trillion-dollar industries. Just as we saw the impact of autonomous robotics in our manufacturing industry, we will now see it across just about every other. We are establishing multiple P3/P4 programs to create the Autonomous Mobility Corridors and accelerate the installation of the critical infrastructure required for autonomous systems.","Aerospace, Artificial Intelligence, Cloud Infrastructure, Information Services, Information Technology, Internet, IT Infrastructure, Robotics",https://atrius.world,"Austin, Texas, United States",Intelligent & Autonomous Infrastructure Enabling the Robotic Edge - 5G and Edge Compute  - Autonomous Mobility Corridors,"418,140",,,,,,,,,,,,,Southern US,Active,2018-10-26,day,7,11-50,"Ethan Alexander, Grant Anthony, Jeffrey DeCoux, Kennedy Paige, Lloyd Walker, Paul Workman, Richard Primeaux",,,,,
Calview,https://www.crunchbase.com/organization/calview,"Calview brings global data center locations, bare-metal servers, application hosting, colo, bandwidth, cloud, VoIP, network, security, and call centers.","Call Center, Cloud Infrastructure, Data Center, Information Technology, ISP, Network Security, Web Hosting",https://www.calview.com,"San Jose, California, United States","Calview is a ISP, cloud, datacenter, network & security company.","425,449",,,,,,,,,,,,,"San Francisco Bay Area, Silicon Valley, West Coast",Active,1995-02-01,month,,51-100,,,,20252,USD,20252
Loki Labs,https://www.crunchbase.com/organization/loki-labs,"Loki Labs provides managed cybersecurity services that make organizations of all sizes more secure. Founded by cyber specialists from the U.S. National Security Agency and Department of Defense, Loki provides best-of-breed security monitoring and response solutions protecting SMBs without the cost or complexity of internal security personnel and monitoring solutions.   Loki’s 24x7x365 Security Operations Center (SOC) identifies attacks and vulnerabilities on networks and devices in real-time and alerts Loki’s in-house analysts who expertly respond to contain and mitigate the threat. Loki also provides cyber risk assessments and post-attack investigation and reporting as well as other compliance services that keep stakeholders informed and enables firms to improve their security posture.  Loki also provides a full suite of cybersecurity services including security assessments, emergency incident response and Range-as-a Service solutions. ","Cloud Infrastructure, Cyber Security, Network Security, Risk Management, Security",https://lokilabs.io/,"Orlando, Florida, United States",Loki Labs provides managed cybersecurity services that make organizations of all sizes more secure.,"428,214",,,,,,,,,,,,,"East Coast, Southern US",Active,2015-01-01,year,,11-50,,,,,,
LogicsOne,https://www.crunchbase.com/organization/logicsone,"LogicsOne is the largest and fastest-growing services team in the US Southeast focused on virtualization, storage, and cloud technologies. Their portfolio includes LogicsCare™ support and remote management, technology solutions, along with a full range of consulting services. LogicsOne is different from a traditional services company, due to their dedicated focus on virtualization and the complete IT stack required to make virtual environments operate. Through efficient use of virtualization, organizations working with LogicsOne gain significant cost savings benefits, accelerated application adoption cycles, improved data processing, and improved ability to advance their business and IT objectives—from day one of working with LogicsOne.","Cloud Infrastructure, Consulting, Enterprise Software, Information Technology, Software, Telecommunications",http://www.logicsone.com,"Alpharetta, Georgia, United States",Leader in Cloud Technologies,"429,973",,,,,,,,,,,,,"Greater Atlanta Area, East Coast, Southern US",Closed,2004-01-01,year,,51-100,,,,,,
Candor,https://www.crunchbase.com/organization/candor-e951,,"Cloud Data Services, Cloud Infrastructure, Consulting",https://candor.cloud/,"Phoenix, Arizona, United States","Candor specializes in cloud infrastructure, virtual and physical servers, cloud optimization, management, advice, and consultation services.","430,128",,,,,,,,,,,,,"Greater Phoenix Area, Western US",Active,2019-01-01,year,,11-50,,,,,,
CyberCentric,https://www.crunchbase.com/organization/cyber-centric,"CyberCentric uses artificial intelligence to ensure that your most sensitive data is only held by those authorized to view it. CyberCentric can be used on their cloud infrastructure or on your organization’s private infrastructure. After installation, the software begins to search your internal network and the external web for copies of your sensitive data which may have been leaked without your knowledge. CyberCentric then begins to take steps to recover or permanently delete the leaked data and prevent further leakage of additional data. The system can be installed within hours.","Artificial Intelligence, Cloud Infrastructure, Cyber Security, Software",http://www.cybercentric.com/,"New York, New York, United States",CyberCentric is an enterprise-focused cyber security platform that monitors sensitive data and controls access to prevent unauthorized use.,"438,286",,,,,,,,,,,,,"Greater New York Area, East Coast, Northeastern US",Active,2016-10-03,day,1,1-10,Jeremiah Steptoe,,,,,
YAXA,https://www.crunchbase.com/organization/yaxa,"YAXA is a cyber security company that specializes in protecting digital assets on premise or in the cloud. The solution leverages ensemble machine learning algorithms to detect suspicious behaviors in real-time without raising false alarms, and triggers autonomous challenge response to thwart internal attacks, thereby preventing an extended breach such as data/IP theft and fraudulent transactions. YAXA was founded by Kalpesh Sheth and Ramesh Gupta in 2015; and is headquartered in Concord, Massachusetts.","Cloud Infrastructure, Cloud Security, Cyber Security, Fraud Detection, Intrusion Detection, Machine Learning, Network Security, Web Apps",http://www.yaxa.io,"Concord, Massachusetts, United States",YAXA solution is a real-time risk monitoring and threat remediation platform for enterprises seeking to actively block malicious behaviors.,"439,780",,,,,,,,,,,,,"Greater Boston Area, East Coast, New England",Active,2015-05-04,day,2,1-10,"Kalpesh Sheth, Ramesh Gupta",,,,,
Omnibond,https://www.crunchbase.com/organization/omnibond,"Omnibond is a foundational software technology company focused on software engineering and support for Cloud, HPC and Big Data, security and identity management, and computer vision technologies. Our HPC products include OrangeFS and CloudyCluster, which runs on RedHat to simplify HPC in the AWS cloud.","Cloud Infrastructure, Cyber Security, Enterprise Software, Information Technology, Software",http://www.omnibond.com,"Anderson, South Carolina, United States","Software Development firm started in the Identity Management space, expanding into computer vision, parallel storage, HPC Cloud Automation","443,802",,,,,,,,,,,,,"East Coast, Southern US",Active,1999-01-01,year,,11-50,,,,185881,USD,185881
Uncorporeal Systems Inc.,https://www.crunchbase.com/organization/uncorporeal-systems-inc,,"Augmented Reality, Cloud Infrastructure, Computer Vision, Virtual Reality",http://uncorporeal.com,"San Francisco, California, United States","Capture anything, anywhere, with Uncorporeal's 3D Reality Capture Software for Volumetric Virtual & Augmented Reality.","444,262",,,,,,,,,,,,,"San Francisco Bay Area, West Coast, Western US",Closed,2015-06-05,day,2,11-50,"Kul Wadhwa, Roderick O'Hara",,,,,
Legologix,https://www.crunchbase.com/organization/legologix,"Legologix provides cloud services including AWS, Azure, GRC, and ServiceNow. Legologix set up a hybrid cloud environment using secure, and private connections to cloud services. Care for people, deliver results through innovation, and believe in the usage of accurate technology to complete tasks at a given time.","Cloud Data Services, Cloud Infrastructure, Information Technology, IT Management, Private Cloud",https://legologix.com,"Edison, New Jersey, United States",Legologix is a cloud services company.,"444,272",,,,,,,,,,,,,"Greater New York Area, East Coast, Northeastern US",Active,,,,251-500,,,,,,
Fifteen Twenty Technological Holdings Inc.,https://www.crunchbase.com/organization/fifteen-twenty-technological-holdings-inc,Engineering solutions to support enterprise needs—no matter the size of your organization. Our world-class capabilities will resolve issues by securing more value and bringing your business acumen into the future.,"Cloud Infrastructure, Construction, Environmental Engineering, Human Computer Interaction, Life Science, Quality Assurance, Retail, Software, Web Design, Web Development",https://www.fifthteentwenty.com/,"Grapevine, Texas, United States",Fifteen Twenty Technological Holdings is an engineering company with a focus of business infrastructures,"448,886",,,,,,,,,,,,,"Dallas/Fort Worth Metroplex, Southern US",Active,2015-04-05,day,1,1-10,Christopher Jenkins,,,,,
OneIT,https://www.crunchbase.com/organization/oneit-236e,,"Cloud Infrastructure, Consulting, Cyber Security, Information Technology",https://www.youroneit.com,"Pearland, Texas, United States","OneIT is an IT company that provides cybersecurity, cloud, and BCDR services.","450,068",,,,,,,,,,,,,"Greater Houston Area, Southern US",Active,2010-01-01,year,,11-50,,,,,,
Stratus10 Cloud Computing Services,https://www.crunchbase.com/organization/stratus10-cloud-computing-services,"Stratus10 is an Amazon Web Services (AWS) Advanced Consulting partner helping companies migrate their infrastructure and applications to the cloud and helping them implement best practices. Stratus10 specializes in migration services, DevOps Automation, and Application Modernization to help clients take full advantage of the latest services AWS has to offer.","Cloud Computing, Cloud Infrastructure, Cloud Management, Information Technology, Professional Services",https://stratus10.com,"San Diego, California, United States",Stratus10 is an AWS Advanced Consulting partner helping companies migrate and manage their infrastructure on the AWS cloud.,"451,213",,,,,,,,,,,,,"Greater San Diego Area, West Coast, Western US",Active,2017-08-01,day,1,11-50,Oscar Moncada,,,,,
Micfo,https://www.crunchbase.com/organization/micfo,"Micfo is an infrastructure as a service (IaaS) provider operating one of the largest networks of globally-dispersed cloud platforms. Through the thoughtful expansion of its scalable and geocentric infrastructure, Micfo's strategy has been to grow its client base by delivering what it promises and measuring the results of that delivery relentlessly.","Cloud Infrastructure, Data Center, Information Services, Information Technology, Web Hosting",https://www.micfo.com/,"Charleston, South Carolina, United States","Micfo is an infrastructure as a service (IaaS) provider that offers custom hosting solutions that are scalable, reliable, and geo-diverse.","455,221",,,,,,,,,,,,,"East Coast, Southern US",Active,1999-01-01,year,1,11-50,Amir Golestan,,,602836,USD,602836
Common Knowledge Technology,https://www.crunchbase.com/organization/common-knowledge-technology,,"Cloud Infrastructure, Information Technology, Project Management",https://www.ck-tek.com/,"Englewood, Colorado, United States","Common Knowledge Technology provides IT solutions such as project management, hosted solutions and business continuity planning.","463,129",,,,,,,,,,,,,"Greater Denver Area, Western US",Active,2003-01-01,year,,11-50,,,,156567,USD,156567
Edison & Black,https://www.crunchbase.com/organization/edison-black,"Edison and Black provides ServiceNow implementation and cloud solutions for our partners. Headquartered in New York, and born in the cloud, we serve companies of all sizes -- of all locations.","Cloud Infrastructure, IT Management, Professional Services",http://edisonandblack.com,"New York, New York, United States",Top ServiceNow Consulting Firm,"471,011",,,,,,,,,,,,,"Greater New York Area, East Coast, Northeastern US",Active,2017-01-20,day,,11-50,,,,,,
Cloud Rush,https://www.crunchbase.com/organization/cloud-rush,,"Cloud Data Services, Cloud Infrastructure, Data Center, Data Storage, Information Technology",https://cloud-rush.com,"Atlanta, Georgia, United States","Cloud Rush is an IT firm that specializes in data centers, customized cloud hosting solutions and innovative cloud services.","472,483",,,,,,,,,,,,,"Greater Atlanta Area, East Coast, Southern US",Active,2019-01-01,year,,1-10,,,,,,
Arroyo Networks,https://www.crunchbase.com/organization/arroyo-networks,"Arroyo delivers software-driven network security, allowing IT professionals to enhance their traditional networks with solutions capable of withstanding the challenges of today’s cyber-security landscape.  Introducing INFLOW by Arroyo. INFLOW elminates the need to purchase expensive, slow, and outdated networking appliances and virtual machines. INFLOW is a Networking-as-a-Service Platform which been built from the ground up, leveraging recent advances in Cloud-Native Network Functions (CNFs). Customers can subscribe to and use INFLOW to increase their network security, either in the cloud or on-premise, by extending their edge and applying advanced network functions. Networks can be upgraded with next-generation firewalls, intrusion detection and prevention, phishing protection, user VPNs, load-balancing and much more. All available at the click of a button and without hardware and VMs. With no systems to install or manage, no firmware to update, no rules to keep in sync: INFLOW lowers administrative overhead while offering heightened security. No Hardware, No Firmware: Just Security.","Cloud Infrastructure, Cyber Security, IT Infrastructure, Network Security, Software Engineering",https://arroyonetworks.com,"Hancock, Michigan, United States","Delivering peace of mind, by replacing traditional networking with software defined security solutions.","476,608",,,,,,,,,,,,,"Great Lakes, Midwestern US",Closed,2018-01-01,year,2,1-10,"Cedric Kennedy, Matthew Ellison",,,,,
ID8,https://www.crunchbase.com/organization/id8,"ID8 is an Internet marketing company to provide online advertising, web development, and lead generation. Their staff become an extension of your team to help you build, design, or dream up the next idea. They come up with products, services, processes, and strategies that help companies move into the future.","Advertising, Cloud Infrastructure, Internet, Marketing, Social Media Marketing, UX Design, Web Design, Web Development",https://www.id8.io,"Sarasota, Florida, United States",ID8 is a digital marketing agency.,"476,928",,,,,,,,,,,,,"East Coast, Southern US",Active,2015-01-01,year,,11-50,,1,,,,
Cloudbreak Enterprises,https://www.crunchbase.com/organization/cloudbreak-enterprises,,"Cloud Infrastructure, Information Technology, Software",https://www.cloudbreakenterprises.com/,"Houston, Texas, United States",Cloudbreak Enterprises helps b2b industries to develop and grow by providing the latest technology and funding platform.,"478,341",,,,,,,,,,,,,"Greater Houston Area, Southern US",Active,2020-01-01,year,,11-50,,,,,,
Winstri Hosting,https://www.crunchbase.com/organization/winstri-hosting,"Previously known as Emperor Hosting, Winstri Hosting is a hosting company headquartered in North Carolina that currently provides hosting in Dallas, TX, New York Metro, NY and London UK with a goal of providing the best services and support at the best possible price.","Cloud Computing, Cloud Data Services, Cloud Infrastructure, Cloud Storage, Information Technology, Private Cloud",https://www.winstrihosting.com,"Raleigh, North Carolina, United States",Cloud Hosting Company,"479,120",,,,,,,,,,,,,"Research Triangle, East Coast, Southern US",Active,2015-10-01,month,2,1-10,"David Everly, Nathan Wilson",,,,,
Powertools,https://www.crunchbase.com/organization/powertools,,"Cloud Infrastructure, Consulting, Information Technology, Software",https://www.powertools.dev/,"Los Angeles, California, United States",Powertools is an IT services company that helps to deploy static sites and ship serverless apps and software to multiple clouds.,"480,820",,,,,,,,,,,,,"Greater Los Angeles Area, West Coast, Western US",Active,2020-01-01,year,,1-10,,,,,,
CPACinc,https://www.crunchbase.com/organization/cpacinc,,"Cloud Infrastructure, Information Technology, Internet, Internet of Things, Telecommunications",https://www.cpacinc.com,"Anaheim, California, United States","CPACinc is a provider of cloud, security and telecom solutions, SD-WAN & networking, back-up & recovery, internet of things and consulting.","481,679",,,,,,,,,,,,,"Greater Los Angeles Area, West Coast, Western US",Active,1994-01-01,year,,11-50,,,,57744,USD,57744
Unigma,https://www.crunchbase.com/organization/unigma,"Unigma is a cloud management service that designs and develops a unified cloud monitoring tool to manage and report on end users’ clouds, from a single pane of glass. The company offers monitoring, alerting, automation, cost management, and reporting for public clouds. Unigma was founded by Kirill Bensonoff in 2015 and is headquartered in Framingham, Massachusetts.","Cloud Infrastructure, Cloud Management, Enterprise Software, IT Management, SaaS, Software",https://www.unigma.com,"Framingham, Massachusetts, United States",Unigma’s mission is to help IT organizations simplify the cloud,"482,820",,,,,,,,,,,,,"Greater Boston Area, East Coast, New England",Active,2015-10-01,day,1,1-10,Kirill Bensonoff,,,7715791,USD,7715791
New York Internet,https://www.crunchbase.com/organization/new-york-internet-2,"Our customers want customized, mission-critical solutions and those are NYI’s specialty. We opened our first facility in Lower Manhattan in 1996, and we’ve expanded our network and infrastructure services coast to coast since then. Our complementary portfolio of services includes colocation, cloud services and managed services, disaster recovery and business continuity planning. We not only serve the Northeast but also have key partnerships in place with best-in-breed providers to extend our data center, managed and cloud services coast to coast.  NYI is where you need us to be with the expertise you can count on.","Cloud Computing, Cloud Infrastructure, Cloud Security, Cyber Security, Internet, Network Security, Web Hosting",http://www.nyi.net,"New York, New York, United States","NYI offers services that include colocation, cloud & managed services, disaster recovery and business continuity planning","490,968",,,,,,,,,,,,,"Greater New York Area, East Coast, Northeastern US",Active,1996-01-01,year,1,11-50,Erik Koblence,,,,,
AT&T Business,https://www.crunchbase.com/organization/at-t-business,,"Cloud Data Services, Cloud Infrastructure, Hardware, Internet, Internet of Things, Telecommunications, Wireless",https://www.business.att.com,"Dallas, Texas, United States","AT&T Business is a telecommunications firm that provides IoT, cybersecurity, mobility, VoIP and cloud services.","495,305",,,,,,,,,,,,,"Dallas/Fort Worth Metroplex, Southern US",Active,,,,,,,,,,
zColo,https://www.crunchbase.com/organization/zcolo,"zColo, a Zayo Group company, provides carrier-neutral, interconnection focused colocation services in 13 domestic locations. zColo is the exclusive operator of the 60 Hudson Street (NYC) Meet-Me-Room and other interconnection focused colocation facilities in the NY/NJ metro market, Pittsburgh, Nashville, Memphis, Cincinnati, Cleveland, Columbus, Minneapolis, Las Vegas, Chicago and Los Angeles.","Cloud Infrastructure, Mobile, Telecommunications",http://www.zcolo.com,"Louisville, Ohio, United States",Colocation and interconnection services,"498,230",,,,,,,,,,,,,"Great Lakes, Midwestern US",Active,2009-01-01,year,,1001-5000,,,,,,
KnuEdge,https://www.crunchbase.com/organization/knuedge,,"Artificial Intelligence, Cloud Infrastructure, Information Services, Information Technology",http://www.knuedge.com,"San Diego, California, United States",KnuEdge is building the world's most scalable compute fabric designed for machine intelligence.,"499,501",,,,,,,,,,,,,"Greater San Diego Area, West Coast, Western US",Closed,2005-01-01,year,1,11-50,Daniel S. Goldin,,,,,
Peak Hosting,https://www.crunchbase.com/organization/peak-web,"Peak Hosting delivers managed hosting and so much more. Its Operations-as-a-Service offering provides its customers with the complete management of their entire operations department. Peak Hosting’s team of veteran engineers design it, build it and maintain it – delivering to its customers Everything but your code® and removing the associated headaches of keeping their technical operations and infrastructure running. Peak Hosting takes care of the servers, storage, network and security. More than just a cloud vendor, Peak Hosting seamlessly integrates with its customers to own everything in the data center, enabling customers to focus on their core business.","Cloud Computing, Cloud Infrastructure, Enterprise Software, Information Technology, Internet, SaaS",http://www.peakhosting.com,"Tualatin, Oregon, United States","We design, build, host, and support mission critical infrastructure for web, mobile, and on-prem applications.","499,317",,,,,,,,,,,,,"West Coast, Western US",Active,2001-01-01,year,1,11-50,Jeffrey Papen,,,,,
Dataedge,https://www.crunchbase.com/organization/dataedge,,"Cloud Infrastructure, Cyber Security, Information Technology",http://www.dataedge.com,"Olathe, Kansas, United States","Dataedge is an IT company that provides cybersecurity, network, cloud infrastructure, data storage and disaster recovery services.","503,339",,,,,,,,,,,,,Midwestern US,Active,1999-01-01,year,1,1-10,Rob Didlake,,,143412,USD,143412
5 Point Technology,https://www.crunchbase.com/organization/5-point-technology,"5 Point Technology is a full-service information technology security and infrastructure company. Its ability is to serve as a navigational beacon for the clients, helping them remain balanced and well-positioned to maximize business outcomes. It offers services like managed services, security and compliance, cloud and resilient infrastructure, and more.","Cloud Infrastructure, Cloud Security, Information Technology, IT Infrastructure",http://www.5pointtechnology.com,"Plymouth, Minnesota, United States",5 Point Technology is an information technology and services company.,"507,072",,,,,,,,,,,,,"Greater Minneapolis-Saint Paul Area, Great Lakes, Midwestern US",Active,2017-01-01,year,,1-10,,,,,,
DoctoDoor,https://www.crunchbase.com/organization/doctodoor,,"Cloud Infrastructure, Health Care, Information Technology",https://www.doctodoor.com,"Satellite Beach, Florida, United States","Doctodoor is a custom-branded digital health solution for clinicians & patients to connect, communicate, engage, and transform patient lives","509,875",,,,,,,,,,,,,"East Coast, Southern US",Active,2015-01-01,day,,11-50,,,,,,
Nuway Solutions,https://www.crunchbase.com/organization/nuway-solutions,,"Cloud Infrastructure, Enterprise Applications, Information Technology",https://nuwaysolutions.com/,"Princeton, New Jersey, United States",Nuway Solutions engages in the design and delivery of digital solutions with a focus on innovation and strategic foresight to maximize ROI.,"510,614",,,,,,,,,,,,,"East Coast, Northeastern US",Active,2013-01-01,year,,11-50,,,,,,
