Organization Name,Organization Name URL,Full Description,Industries,Website,Headquarters Location,Description,CB Rank (Company),SEMrush - Monthly Visits,SEMrush - Average Visits (6 months),SEMrush - Monthly Visits Growth,SEMrush - Visit Duration Growth,SEMrush - Visit Duration,SEMrush - Page Views / Visit,SEMrush - Page Views / Visit Growth,SEMrush - Bounce Rate,SEMrush - Bounce Rate Growth,SEMrush - Global Traffic Rank,SEMrush - Monthly Rank Change (#),SEMrush - Monthly Rank Growth,Headquarters Regions,Operating Status,Founded Date,Founded Date Precision,Number of Founders,Number of Employees,Founders,Apptopia - Number of Apps,Apptopia - Downloads Last 30 Days,Aberdeen - IT Spend,Aberdeen - IT Spend Currency,Aberdeen - IT Spend Currency (in USD)
CloudMatos,https://www.crunchbase.com/organization/cloudmatos,"Pioneering the world of self-healing, self-aware, self-sustaining, self-resilient, self-secure and Intelligent remediation, CloudMatos brings a complete security and governance solution for your cloud infrastructure.","Cloud Computing, Cloud Infrastructure, Cloud Security, Developer APIs, Software",https://cloudmatos.com,"Livermore, California, United States","CloudMatos specializes in cloud security, intelligent remediation, self-healing cloud infrastructure, and governance solution.","195,740",593,,326.62%,-65.91%,60,1.97,-1.69%,50.93%,,"7,878,755","-1,690,181",-17.66%,"San Francisco Bay Area, West Coast, Western US",Active,2020-01-01,year,1,1-10,Maulik Shyani,,,,,
AH Infotech,https://www.crunchbase.com/organization/ah-infotech,,"Cloud Infrastructure, Information Technology, Professional Services",https://www.ahinfotechusa.com,"Princeton, New Jersey, United States",AH Infotech is an IT consulting firm that offers cloud solutions such as cloud infrastructure and applications for business.,"871,707",569,,,,0,1,,100%,,"8,036,178",,,"East Coast, Northeastern US",Active,2015-01-01,year,,101-250,,,,,,
Wanclouds Inc.,https://www.crunchbase.com/organization/wanclouds,"Wanclouds, a leading multi-cloud SaaS solution and managed service provider, helps enterprises with cloud deployments, migrations, cloud management, and protecting their cloud infrastructure in time and cost-efficient ways.  The company’s multi-cloud Migration as a Service (MaaS) and Disaster Recovery as a Service (DRaaS) cloud offerings reduce the financial investment and remove the technical complexities that halt or delay businesses from migrating on-premise to the cloud, moving across clouds, managing and optimizing cloud infrastructure, or setting up backup and restore protection. Its SaaS-based automation & migrations suite, VPC+, provides a single pane of glass for managing and protecting multi-cloud environments through a centralized cross-cloud solution.  Wanclouds is an AWS, Google Cloud, IBM Cloud partner and is headquartered in Santa Clara, CA.","Cloud Computing, Cloud Infrastructure, Cloud Management, SaaS, Software",https://www.wanclouds.net/,"Santa Clara, California, United States","Re-Imagining Multi-Cloud Migrations, Disaster Recovery, Visualization, and Compliance delivered as a Service","234,438",563,,-80.57%,111.67%,"2,159",2.36,15.21%,72%,-12.75%,"8,047,351","3,750,430",87.28%,"San Francisco Bay Area, Silicon Valley, West Coast",Active,2014-01-02,day,1,51-100,Faiz Khan,1,,50474,USD,50474
"Ziggle Tech, Inc.",https://www.crunchbase.com/organization/ziggletech,"An award winning New York-based creative, technology, and digital marketing agency helping mid-level enterprises to exploit the evolving world of cloud, digital, and platforms through digital transformation.  Our assistance towards mid-level enterprises helps them to re-platform their technology and successfully imbibe strategy and consultancy for digital transformation. Needless to say, our assistance is at par with Accenture, IBM, and Deloitte whose prime focus is on large enterprises.","Cloud Infrastructure, Consulting, E-Commerce Platforms, Enterprise Applications, Enterprise Resource Planning (ERP), Fashion, Information Technology, Software",https://www.ziggletech.com/,"New York, New York, United States","We are an award-winning digital transformation agency. We provide strategy, design and technology services to mid-level enterprises.","314,231",558,,-86.73%,-98.07%,33,2,-83.95%,0%,,"8,055,734","4,387,243",119.59%,"Greater New York Area, East Coast, Northeastern US",Active,2015-07-01,day,1,51-100,Rocky Panjwani,,,,,
AeroComInc.com,https://www.crunchbase.com/organization/aerocominc-com,"AeroComInc is an online platform that enables its users to post and view reviews on cloud and telecom service providers and products. The platform allows its users to post reviews based on products or providers. In addition, it enables its users to search for reviews on services providers. Furthermore, it offers access, cloud, and IT support services to its clients. AeroComInc was launched in 2003 by Mike Smith and is based in California.","Cloud Computing, Cloud Data Services, Cloud Infrastructure, Information Technology, Telecommunications, VoIP",http://www.aerocominc.com,"Newport Beach, California, United States","AerocomInc is a review website for business IT buyers, where they write and browse reviews on cloud and telecom service providers.","1,382,460",558,,,,0,1,,100%,,"8,014,765",,,"Greater Los Angeles Area, West Coast, Western US",Active,2003-05-01,day,1,11-50,Mike Smith,,,56363,USD,56363
HackerStrike,https://www.crunchbase.com/organization/hackerstrike,"Hackerstrike provides cloud-based security solutions and technology services. Hackerstrike is an integrated platform and solutions company that complements existing security solutions. In addition to the Hackerstrike Cloud, each device comes with a thin, high-performance local agent. The platform identifies and stops ransomware execution by continuously learning from endpoints on the network.","Cloud Infrastructure, Network Security, Software",https://hackerstrike.com/,"Los Altos, California, United States",Hackerstrike offers cloud-based security services and technology.,"1,044,226",556,,131.67%,,0,1,0%,100%,0%,"8,024,148","-834,099",-9.42%,"San Francisco Bay Area, Silicon Valley, West Coast",Active,2020-01-01,year,1,1-10,Ralph Aceves,,,,,
MerQube,https://www.crunchbase.com/organization/merqube,"MerQube is a cloud native indexing platform designed for designing, calculating, and disseminating financial indices at scale. In the growing space of passive (index-linked) indexing, MerQube provides robust financial indices in the areas of equities, futures and options and ESG and has the expertise that spans market-capitalization weighted indices to risk-premia, volatility, thematics, and ESG.","Cloud Computing, Cloud Infrastructure, Financial Services, FinTech, Information Services",https://merqube.com,"San Francisco, California, United States",MerQube is a Cloud-native financial indexing platform.,"16,171",493,"2,093.67",196.99%,,0,1,-33.33%,100%,100%,"8,218,208","-1,543,761",-15.81%,"San Francisco Bay Area, West Coast, Western US",Active,2019-01-01,month,3,1-10,"Keith Loggie, Praveen Yalagandula, Vinit Srivastava",,,,,
Multiledgers,https://www.crunchbase.com/organization/multiledgers,"Who we Are In a world of complex technology offers, we want to integrate and simplify to empower organizations with robust IT infrastructure and cutting-edge security. A group of different technology companies to support our business goals focusing on Infrastructure such as multicloud IaaS, BaaS and other complementary technologies. Global Presence from developing our proprietary platform to providing services. First In The World Developing its main technology in research by its founders since 2016, Multiledgers was born as the first company in the world to use Blockchain for IT infrastructure management bringing unprecedented transparency and resilience. Its internal infrastructure is supported by a private Blockchain network that is distributed by several cloud providers, bringing a robust profile to its activities.","Blockchain, Cloud Computing, Cloud Infrastructure, IaaS",https://multiledgers.com,"Lewes, Delaware, United States",Consolidated Management Tool Operating as an integration hub for different cloud and blockchain services and resources,"498,926",493,,,,65,3,,0%,,"8,203,001",,,"East Coast, Southern US",Active,2017-12-01,day,4,11-50,"Alan Badin, Marcela Gonçalves, Paulo Brizola, Pedro Souza",,,,,
Sunshower.io,https://www.crunchbase.com/organization/sunshower-io,"Sunshower.io helps organizations of all sizes manage the entire lifecycle of their cloud infrastructure in a cloud-agnostic way, from the initial deployment, through management, to the inevitable right-sizing.","Cloud Data Services, Cloud Infrastructure, Cloud Management, SaaS",https://sunshower.io/,"Fort Collins, Colorado, United States",Cloud SaaS,"432,067",486,,-98.19%,,0,1,-44.44%,100%,66.67%,"8,324,814","7,083,183",570.47%,Western US,Active,2018-01-01,year,3,1-10,"Josiah Haswell, Lisa Gumerman, Tiffany Myers",,,,,
Inkrypt,https://www.crunchbase.com/organization/inkrypt,A content-hosting platform that combines decentralization with anonymity to provide comprehensive front-to-back-end censorship-resistance.,"Blockchain, Cloud Infrastructure, Information Technology, Internet, Software",https://www.inkrypt.io/,"Boston, Massachusetts, United States","A privacy-centric, decentralized content-hosting platform","85,466",480,,,,0,1,,100%,,"8,382,698",,,"Greater Boston Area, East Coast, New England",Active,2018-01-01,month,5,1-10,"Arkam Javed, Farhan Javed, Muhammad Ali Chaudhary, Rohan Chaudhary, Wardah Chaudhary",,,,,
Techno Bytes,https://www.crunchbase.com/organization/techno-bytes,,"Business Intelligence, Cloud Infrastructure, Consulting, Staffing Agency, Web Development",https://www.techno-bytes.com,"Ashland, Massachusetts, United States",Techno Bytes is a technology hybrid consulting and staffing services company.,"1,409,311",480,,9.84%,,0,1,-87.5%,100%,,"8,331,044","563,393",7.25%,"Greater Boston Area, East Coast, New England",Active,2014-01-01,year,,51-100,,,,39111,USD,39111
PALCO,https://www.crunchbase.com/organization/palco,,"Cloud Infrastructure, Logistics, Network Hardware, Supply Chain Management",https://gotopalco.com/,"Huntsville, Alabama, United States",PALCO is a global post-sales service supply chain management company.,"641,832",451,,,,0,1,,100%,,"8,512,365",,,Southern US,Active,1986-01-01,year,,51-100,,,,3143986,USD,3143986
Diatec,https://www.crunchbase.com/organization/diatec-7c3c,,"Cloud Infrastructure, Information Technology, Management Consulting, Professional Services, Software",https://diatec.ie/,"Ireland, Indiana, United States","Diatec is an IT firm that offers Microsoft 365 and azure deployments, Autodesk support, BIM consultancy, and IT support services.","661,046",441,853,-13.87%,"18,325%","1,474",3,0%,0%,-81.11%,"8,535,412","409,626",5.04%,"Great Lakes, Midwestern US",Active,1984-01-01,year,,51-100,,,,,,
Newt Global,https://www.crunchbase.com/organization/newt-global,"Newt Global is a leading global Information Technology and Consulting company which focuses on Cloud Transformation, DevOps Transformation, Digital Initiatives, and Automation. Newt Global harnesses the power of Cloud, DevOps and emerging digital technologies integrated into a versatile platform, to help clients become productive and competitive.","Cloud Infrastructure, Cloud Management, Consulting, Database, Information Technology, Legal, Software",https://newtglobal.com/,"Texas, South Carolina, United States","Newt Global is a global Information Technology and Consulting company which focuses on Cloud Transformation, DevOps & Digital Initiatives.","197,909",434,"3,984.67",-69.84%,-99.63%,4,2,71.41%,0%,993.57%,"8,571,043","2,781,331",48.04%,"East Coast, Southern US",Active,2004-01-01,year,1,501-1000,Neeta Goel,,,,,
Virtual Instruments,https://www.crunchbase.com/organization/virtual-instruments-corporation,"Virtual Instruments is the leader in IT Infrastructure Performance Management for the physical, virtual, and cloud computing environments. Virtual Instruments is a dynamic, fast-growing technology company with a performance driven culture. Founded in June 2008 we are headquartered in the heart of the Silicon Valley, led by an industry-proven executive team, and backed by a group of highly experienced and successful investors. As a company, we are focused on delivering unparalleled value to our customers through a truly innovative combination of disruptive technology and revolutionary services. Our customers represent industry leading brands in every major vertical market, all of whom have some of the most performance sensitive and complex IT environments in the world. Our unwavering commitment to our customers' success, ensuring the performance and availability of their mission critical application workload as they migrate from physical to virtual and cloud computing environments, is what has fueled our record growth and is driving the ongoing development of our award winning Infrastructure Performance Management platform, VirtualWisdom.","Cloud Infrastructure, Enterprise Software, Real Time, Software",http://www.virtualinstruments.com,"San Jose, California, United States","Virtual Instruments offers IT infrastructure performance management solutions for physical, virtual and cloud computing environments.","22,084",422,"1,839",-72.24%,-83.55%,0,1,0%,100%,0%,"8,597,728","3,028,558",54.38%,"San Francisco Bay Area, Silicon Valley, West Coast",Closed,2008-06-01,day,1,101-250,Mark Urdahl,,,2104134,USD,2104134
MSI Americas,https://www.crunchbase.com/organization/msi-americas,,"Cloud Infrastructure, Cyber Security, Professional Services, Telecommunications",https://msiamericas.com/,"St. Petersburg, Florida, United States","MSI Americas is a telecommunication company that specializes in cybersecurity, 5G, cloud, consulting, and network infrastructure services.","293,577",414,,,,85,5.4,,12.08%,,"8,638,399",,,"Tampa Bay Area, East Coast, Southern US",Active,2005-01-01,year,,101-250,,,,739713,USD,739713
Gurulize,https://www.crunchbase.com/organization/gurulize,"Our mission is to enable every individual/company to digitize and serve their expertise to the world without boundaries – via their very own platforms created with our 360-degree online consulting platform builder, Gurulize. Our vision is to expand Information Democratization and enable any kind of expertise of anyone to be reachable by anyone around the world via means of state-of-art technologies. Our Story Gurulize is created in the heart of Istanbul, Turkey by Teknocat LABS, www.teknocatlabs.com, which created successful telecom, software, and business intelligence companies in the region before Gurulize. The companies have established many enterprises and mass targeting projects touching more than the quarter of the population and nearly half of the fortune 500 companies in Turkey and the region and with Gurulize they wanted to leverage their expertise to create platforms, enabling many businesses to run their own B2C, B2B, and B2B2C platforms. Europe company (HQ) is in Tallinn, Estonia and the USA company office is in Los Angeles, CA, USA. Gurulize serves customers from different regions and enables their payment services via a suitable company depending on their regulations. Gurulize does not only allow its users to create catalogue front end applications, rather Gurulize has integration with Gurulize Voice Server Application for SIP/GSM connectivity, and Gurulize Video Server Application for WEBRTC connectivity which is leveraged from 15 years of experience of Teknocat LABS telecom software business.","Cloud Infrastructure, Information Technology, Online Portals, PaaS, SaaS, Software",http://www.gurulize.com,"Los Angeles, California, United States",Gurulize is a SaaS for entrepreneurs who wants to build an online consultancy platform to serve online paid audio/video sessions.,"282,522",412,,,,47,5.62,,42.23%,,"8,641,351",,,"Greater Los Angeles Area, West Coast, Western US",Active,2020-01-01,year,1,11-50,Ali Yildirim,,,,,
Amberflo,https://www.crunchbase.com/organization/amberflo,"Amberflo is a cloud metering and usage-based pricing and billing platform.  Amberflo enables companies to build, operate, and succeed with usage-based pricing plans, on-demand metered invoicing and billing. Highly configurable and cloud-native, our platform enables real-time metering of usage and consumption and modern usage-based pricing plans to help companies to deliver delightful Product-Led Growth (PLG) engagement experience with Usage-Based Pricing (UBP) and drive highest levels of revenue and adoption.","Cloud Data Services, Cloud Infrastructure, Information Services, Software",https://www.amberflo.io/,"Santa Clara, California, United States","Amberflo is a cloud metering and usage-based pricing platform that offers real-time usage metering, and on-demand invoicing and billing.","20,233",407,,-97.59%,-79.41%,139,4,77.02%,0%,-52.48%,"8,653,514","7,020,348",429.86%,"San Francisco Bay Area, Silicon Valley, West Coast",Active,2020-01-01,year,2,1-10,"Lior Mechlovich, Puneet Gupta",,,,,
Joule Ventures,https://www.crunchbase.com/organization/janvest-technologies,"Joule Ventures is a U.S.-based partner-only seed fund providing best-in-class structural and commercialization support to Israel’s most compelling enterprise-focused entrepreneurs. Our dedication to founders is evident in the efficiency of our operations, the value we deliver starting well before the investment, and our commitment to day one relationship building between key stakeholders. In an increasingly transactional market, we remain a steadfast  people-first, principles-driven investor.","Big Data, Business Intelligence, Cloud Infrastructure, Cyber Security, Internet of Things",http://www.joulevc.com,"New York, New York, United States",Joule is a U.S.-based partner-only seed fund investing in enterprise-focused Israeli founders,"229,876",405,,,,101,2,,0%,,"8,697,315",,,"Greater New York Area, East Coast, Northeastern US",Active,2010-02-01,day,3,1-10,"Brian Rosenzweig, Dafna Winocur Biran, Daniel Frankenstein",,,,,
"Intotoware, Inc.",https://www.crunchbase.com/organization/intotoware-inc,"Intotoware is a Hybrid Cloud IT Automation platform that reduces the costs, resources, and complexities of managing and securing IT networks. Our patented software orchestrates our fully integrated, scalable solution resulting in minimized hardware, unified on-premises and private cloud resource management, and optimized network performance.","Cloud Data Services, Cloud Infrastructure, Cloud Storage, Data Storage, Network Hardware, Network Security, Private Cloud, Software",https://www.intotoware.com,"Jupiter, Florida, United States",Hybrid Cloud Converged IT Automation Platform,"379,180",405,,8.87%,,0,1,0%,100%,0%,"8,691,605","-106,382",-1.21%,"Greater Miami Area, East Coast, Southern US",Active,2020-11-20,day,2,1-10,"Farsheed Atef, Nima Sajadi",,,,,
Cyber Chasse Inc,https://www.crunchbase.com/organization/cyber-chasse,"Cyber Chasse is a one-stop solution for all your IT security needs. We deal with all sorts of IT security solutions with a passion for delivering the best value for the money you spend. Cyber Chasse understands the issues involved in your IT infrastructure and provides a hassle-free solution. We make a massive difference to your business by offering viable solutions in Education, E-Commerce, Staffing, Cyber Security, Artificial Intelligence, Machine Learning, Big Data, Internet of Things, Enterprise Applications, Cloud Computing and Cloud Infrastructure.","Artificial Intelligence, Big Data, Cloud Computing, Cloud Infrastructure, Consulting, Cyber Security, Enterprise Applications, Internet of Things, Machine Learning, Training",https://cyberchasse.com/,"Tampa, Florida, United States",We deal with all sorts of IT security solutions with a passion for delivering the best value for the money you spend.,"230,228",387,"7,866",-90.16%,-95.92%,13,2.27,35.96%,36.69%,-44.97%,"8,731,393","5,103,853",140.7%,"Tampa Bay Area, East Coast, Southern US",Active,2018-10-01,day,2,51-100,"Anilkumar Jayaprakash, Nidhi Thakkar",,,280083,USD,280083
API Fortress,https://www.crunchbase.com/organization/api-fortress,"API Fortress is a platform for companies that want to achieve full testing automation of their APIs. The platform enables testers and developers to create and automate functional tests, virtualize APIs, and perform load tests. It enables them to save time with automated test generation, collaborate with an intuitive interface, and validate deployments to catch problems before your customers or partners. API Fortress was founded in 2015.","Cloud Infrastructure, Developer APIs, Developer Tools, Enterprise Software, SaaS, Test and Measurement",http://apifortress.com,"New York, New York, United States",API Fortress is a platform for companies that want to achieve full testing automation of their APIs.,"202,772",386,"6,665",532.79%,-81.82%,0,1,0%,100%,0%,"8,733,427","-1,292,744",-12.89%,"Greater New York Area, East Coast, Northeastern US",Active,2014-01-01,year,1,11-50,Patrick Poulin,,,,,
Cosync,https://www.crunchbase.com/organization/cosync,,"Cloud Infrastructure, Information Technology, Software",https://cosync.io,"Cary, North Carolina, United States",Cosync is a cloud based software platform for developers and businesses building collaborative apps on top of MongoDB Realm.,"1,910,991",383,,,,0,1,,100%,,"8,768,982",,,"Research Triangle, East Coast, Southern US",Active,2018-01-01,year,,1-10,,,,,,
The Smart Panda Corporation,https://www.crunchbase.com/organization/the-smart-panda-corporation,,"Cloud Computing, Cloud Infrastructure, Cloud Management, Health Care, Information Technology",https://thesmartpanda.com,"Minden, Nevada, United States","The Smart Panda Corporation provides cloud infrastructure and migration, SaaS and other technology solutions to education and healthcare.","865,952",381,,30.48%,,0,1,0%,100%,0%,"8,798,341","-351,727",-3.84%,Western US,Active,2007-01-01,year,,1-10,,,,,,
Cyemptive Technologies,https://www.crunchbase.com/organization/cyemptive-technologies,Cyemptive Technologies is a provider of failsafe cybersecurity solutions that do not rely on the traditional detect.,"Cloud Infrastructure, Cyber Security, Information Services, Information Technology, PaaS",https://www.cyemptive.com/,"Snohomish, Washington, United States",Cyemptive Technologies is a cybersecurity company providing IT infrastructure solutions.,"62,360",372,,-86.83%,,0,1,-80.15%,100%,81.39%,"8,792,863","4,608,408",110.13%,"Greater Seattle Area, West Coast, Western US",Active,2014-01-01,year,1,101-250,Rob Pike,,,362504,USD,362504
Symbits,https://www.crunchbase.com/organization/symbits,,"Cloud Infrastructure, Information Technology, IT Infrastructure",https://symbits.com/,"Coral Gables, Florida, United States","Symbits is an IT company that provides outsourcing, cloud solutions, designing of network infrastructure and remote assistance services.","523,648",372,,-71.56%,,5,2,100%,0%,,"8,798,334","2,641,155",42.9%,"Greater Miami Area, East Coast, Southern US",Active,,,,5001-10000,,,,42677,USD,42677
Interbix,https://www.crunchbase.com/organization/interbix-holdings,"Interbix is a technology-focused holdings company. Interbix was incorporated in Novemeber of 2019 by two companies both wanting to join forces to create consumer-centric brands. Under our brands, we strive to provide consumers with best-in-class services at affordable prices. Some of our brands include companies such as XenoNode and Virtmo.","Cloud Infrastructure, Information Technology, Internet, Software, Web Hosting",https://www.interbix.net,"Claymont, Delaware, United States",A technology-focused holdings company working to make launching projects easier.,"543,560",372,,,,0,1,,100%,,"8,782,038",,,"Greater Philadelphia Area, East Coast, Southern US",Active,2019-11-27,day,2,1-10,"Jayson Fong, Thanh Hung",,,,,
Tatras Data,https://www.crunchbase.com/organization/tatras-data,,"Big Data, Cloud Data Services, Cloud Infrastructure, Data Integration, Machine Learning, Management Consulting",http://tatrasdata.com,"Mount Pleasant, South Carolina, United States","Tatras Data is focused on providing Data Science as a service with a mixed approach of Staff Augmentation, Consulting and Project Management","186,309",369,,,,0,1,,100%,,"8,835,133",,,"East Coast, Southern US",Active,,,1,11-50,Sarabjot Singh Anand,,,,,
PerezCarreno & Coindreau,https://www.crunchbase.com/organization/perezcarreno-coindreau,,"Cloud Infrastructure, Information Technology, Software, Web Apps",https://perezcarreno.com/,"San Antonio, Texas, United States",PerezCarreno & Coindreau is a full-service boutique software development firm specializing in custom online applications.,"1,380,861",364,,,,0,1,,100%,,"8,882,834",,,Southern US,Active,2012-01-01,year,,1-10,,,,,,
Eureka Software Solutions,https://www.crunchbase.com/organization/eureka-software-solutions-inc,"Eureka Software Solutions is a development partner that provides its clients with custom software for mobile and the cloud. It offers products and services covering a range of areas, including enterprise software, mobile applications, SaaS-based platforms, cloud apps, APIs, and technical strategy. Eureka Software Solutions founded 1986 by Monty Myers, and is based in Austin, Texas.","Cloud Computing, Cloud Infrastructure, Developer Tools, Enterprise Software, Infrastructure, Mobile, Software",http://eurekasoft.com/,"Austin, Texas, United States","Eureka Software, in Austin TX, builds custom software and excels at product development, strategy solutions, mobile apps, and cloud dev.","212,172",357,"4,398.5",-70.59%,160%,0,1,0%,100%,0%,"8,862,371","2,604,957",41.63%,Southern US,Active,1986-01-01,day,1,11-50,Monty Myers,,,406866,USD,406866
