Organization Name,Organization Name URL,Full Description,Industries,Website,Headquarters Location,Description,CB Rank (Company),SEMrush - Monthly Visits,SEMrush - Average Visits (6 months),SEMrush - Monthly Visits Growth,SEMrush - Visit Duration Growth,SEMrush - Visit Duration,SEMrush - Page Views / Visit,SEMrush - Page Views / Visit Growth,SEMrush - Bounce Rate,SEMrush - Bounce Rate Growth,SEMrush - Global Traffic Rank,SEMrush - Monthly Rank Change (#),SEMrush - Monthly Rank Growth,Headquarters Regions,Operating Status,Founded Date,Founded Date Precision,Number of Founders,Number of Employees,Founders,Apptopia - Number of Apps,Apptopia - Downloads Last 30 Days,Aberdeen - IT Spend,Aberdeen - IT Spend Currency,Aberdeen - IT Spend Currency (in USD)
Mastercard,https://www.crunchbase.com/organization/mastercard,"Mastercard provides payment processing products and solutions, and related consulting services. It serves consumers and businesses in the United States and internationally. The company offers credit, debit, prepaid, personal, commercial, chip, and contactless cards; loyalty and reward solutions; and cardholder benefits and services. It also provides payment processing solutions; and payment security and fraud management solutions to monitor, detect, and fight fraud through the transaction lifecycle. In addition, it offers payment-focused consulting, information, and outsourcing services to financial institutions and merchants; and franchising activities. MasterCard was founded in 1966 and is headquartered in Purchase, New York with offices in Singapore, Australia, China, the United Arab Emirates, Egypt, Hong Kong, India, Indonesia, Japan, Korea, Malaysia, Morocco, New Zealand, the Philippines, South Africa, Taiwan, Canada, Czech Republic, Germany, Greece, Hungary, Ireland, Italy, Poland, Portugal, Romania, the Russian Federation, Spain, Sweden, Switzerland, Turkey, the United Kingdom, Argentina, Brazil, Colombia, Peru, and Venezuela.","Cloud Data Services, Financial Services, Information Technology, Payments",http://www.mastercard.com,"Purchase, New York, United States","Mastercard provides payment processing products and solutions, and related consulting services.","11,098","25,624,645","23,832,791.33",-4.14%,-9.33%,350,1.35,-2.88%,79.3%,-0.43%,"6,305",15,0.24%,"Greater New York Area, East Coast, Northeastern US",Active,1966-12-16,day,1,5001-10000,Wells Fargo,120,"165,445",1551889328,USD,1551889328
Business Wire,https://www.crunchbase.com/organization/business-wire,"Business Wire operates as a trusted news source for press releases, photos, multimedia, and regulatory filings. It allows member companies and organizations to transmit their news releases, regulatory filings, photos, and other multimedia content to journalists, news media, trade publications, financial professionals, institutional and individual investors, internet portals, information websites, investor services, regulatory authorities, business-to-business decision-makers, and the general public in the Americas, Europe, the Asia-Pacific, the Middle East, and Africa. The company’s solutions include Smart News Release platform, which provides text news releases and multimedia content; Smart Marketing Page, a communications platform that leverages content from marketing and public relations to create an SEO-enhanced interactive multimedia news and information experience for consumers, reporters, and target audiences; and NewsTrak, which offers news release distribution statistics, website posting reports, online viewership data, media clips, media intelligence, and reputation management and analytics; corporate social responsibility, investor targeting, and online newsrooms. Business Wire also offers EDGAR, SEDAR, and the United Kingdom regulatory filings, including disclosure fulfillment in Belgium, Denmark, Finland, France, Germany, Ireland, the Netherlands, Luxembourg, Sweden, and Switzerland; and disclosure, industry reach, press release distribution, measurement and monitoring, search engine optimization, and fax and email services. The company was founded in 1961 and is headquartered in San Francisco, California. U.S. editorial teams are located in Charlotte, Cleveland, Miami, Nashville, Phoenix, Philadelphia, Newport Beach, San Diego, and the Silicon Valley.","Advertising, Broadcasting, Cloud Data Services, Customer Service, Digital Media, Media and Entertainment, Social Media, Social News, Stock Exchanges",http://www.businesswire.com,"San Francisco, California, United States","Business Wire is a well-respected global news source for press releases, photos, multimedia, and regulatory filings.","115,369","6,695,598","6,482,795.33",8.89%,62.2%,472,1.45,3.42%,78.02%,2.74%,"24,345","-1,565",-6.04%,"San Francisco Bay Area, West Coast, Western US",Active,1961-10-02,day,1,501-1000,Lorry I. Lokey,2,,,,
Finicity,https://www.crunchbase.com/organization/finicity,"Finicity is a developer of a real-time financial data aggregation and insight platform used to drive financial decision making. It aims to help individuals, families, and organizations make smarter financial decisions through safe and secure access to fast, high-quality data. The company, which launched its first financial product in 2000, has since grown to provide financial data APIs, credit decisioning tools, and financial wellness solutions. Finicity partners with influential financial institutions and disruptive fintech providers alike to give consumers a leg up in a complicated financial world. It has played a key role in innovative solutions like Experian’s Boost and it helps Rocket Mortgage by Quicken Loans access consumer-permissioned data for mortgage decisions.","Banking, Big Data, Cloud Data Services, Data Integration, Data Visualization, Financial Services, FinTech, Payments",http://www.finicity.com,"Salt Lake City, Utah, United States","Finicity provides open banking services, real-time financial data access and insights.","47,252","5,206,563","5,248,111.5",1.12%,16.62%,435,1.35,1.82%,78.04%,0.52%,"29,840","2,596",9.53%,Western US,Active,1999-01-01,year,3,501-1000,"Nicholas Thomas, Steven Smith, Warren Rosner",1,,5698840,USD,5698840
DreamHost,https://www.crunchbase.com/organization/dreamhost,"DreamHost provides domain registration, web hosting and cloud services to 1.5 million sites, blogs and applications, and supports over 400,000 web designers, developers, content creators, small businesses and entrepreneurs with the power of the Open Web.","Cloud Computing, Cloud Data Services, Internet, Software, Web Hosting",http://www.dreamhost.com,"Los Angeles, California, United States","DreamHost provides web hosting, domain registration, and cloud services for individuals, small businesses, and developers.","18,229","3,508,054","3,012,432.83",33.02%,0.65%,771,4.67,5.35%,39.03%,-9.42%,"41,802","-9,384",-18.33%,"Greater Los Angeles Area, West Coast, Western US",Active,1997-09-22,day,4,501-1000,"Dallas Kashuba, Josh Jones, Michael Rodriguez, Sage Weil",,,50436,USD,50436
Informatica,https://www.crunchbase.com/organization/informatica,"Informatica LLC provides business solutions for the Cloud, big data, real-time, and streaming. More than 7,000 organizations around the world turn to Informatica for data solutions that power their businesses. Digital transformation changes expectations: better service, faster delivery, with less cost. They are entering Data 3.0, where data powers digital transformation, and they’re prepared to help clients lead—in any sector, category or niche.  Informatica provides foresight to become more agile, realize new growth opportunities, and create new inventions.","Analytics, Big Data, Cloud Computing, Cloud Data Services, Cyber Security, Data Integration",https://www.informatica.com,"Redwood City, California, United States",Informatica is an enterprise cloud data management that accelerates data-driven digital transformation.,"61,518","3,059,046","2,806,969.17",13.12%,-28.08%,612,2.27,-10.28%,63.47%,19.17%,"46,606","-3,530",-7.04%,"San Francisco Bay Area, Silicon Valley, West Coast",Active,1993-02-01,day,2,1001-5000,"Arnold Silverman, Diaz Nesamoney",3,,,,
Equinix,https://www.crunchbase.com/organization/equinix,"Equinix is an internet company that provides data center services for companies, businesses, and organizations. It offers a software application platform designed for digital businesses that help its users to connect to their customers, employees, and partners. The company was founded in 1998 and headquartered in Redwood City, California.","Cloud Data Services, Data Center, Information Technology, Infrastructure, Internet, Software",http://www.equinix.com,"Redwood City, California, United States","Equinix is an internet company that provides data center services for companies, businesses, and organizations.",554,"2,109,030","1,581,237.67",277.62%,-3.67%,971,3.98,34.21%,41.73%,-17.2%,"60,733","-92,083",-60.26%,"San Francisco Bay Area, Silicon Valley, West Coast",Active,1998-01-01,year,5,5001-10000,"Al Avery, Charles Meyers, Jay Adelson, Raouf Abdel, William Norton",,,899781750,USD,899781750
ConnectWise,https://www.crunchbase.com/organization/connectwise,"ConnectWise is a software company that transforms how technology solution providers build, manage, and grow their businesses. The company powering Technology Solution Providers to achieve their vision of success in their As-a-Service business with intelligent software, expert services, an immersive IT community, and a vast ecosystem of integrations. The software solutions deliver the results companies want at each step of their business journey. Today more than 5,000 technology organizations, including IT solution providers, MSPs, system integrators, software developers, and VARs, rely on ConnectWise to achieve greater accountability, operational efficiency, and profitability in their businesses. The ConnectWise Business Management Solution integrates business-process automation, help desk and customer service, sales, marketing, project management, and business analytics that dramatically streamline a company's operations. ConnectWise was established in 1982 and is headquartered in Tampa, Florida, United States.","B2B, Cloud Data Services, Consulting, Information Technology, Legal, SaaS, Software",http://ConnectWise.com,"Tampa, Florida, United States","ConnectWise is a software company that transforms how technology solution providers build, manage, and grow their businesses.","3,025","1,260,694","998,277.67",95.26%,-15.77%,566,2.16,0.25%,71.54%,0.32%,"92,382","-53,681",-36.75%,"Tampa Bay Area, East Coast, Southern US",Active,1982-01-01,year,1,1001-5000,Arnie Bellini,8,"16,886",1961326,USD,1961326
Digital-Edge,https://www.crunchbase.com/organization/digital-edge,"Skilled and accredited, with a proven track record for over 20 years, Digital Edge operates exclusively within prime data center facilities providing Enterprise IT Services expertise in: - Managed Cloud Services                                                                                                                                                                                                                                 - Private and Hybrid Cloud                                                                                                                                                                                                                                 - Infrastructure as a Service                                                                                                                                                                                                                              - IT Support and Outsourcing                                                                                                                                                                                                                            - 24/7 NOC and SOC Operation                                                                                                                                                                                                                        - Business Continuity and Disaster Recovery Digital Edge’s organization is nicely balanced between their experience and ability to support a number of Enterprise Class IT organizations with complex needs and large processing demands, while staying quick and flexible. Internally, the Digital Edge team strives to deliver any solution with Stability, Security, Efficiency, and Compliance. This is the heartbeat of Digital Edge. They achieve this drive through years of experience in engineering solutions, high level of IT management automation and constant innovation.","Cloud Data Services, Cloud Security, Compliance, Enterprise Software, Information Technology, Private Cloud, Technical Support",https://www.digitaledge.net,"Staten Island, New York, United States","Digital Edge provides unparalleled Managed Cloud Solutions, as well as superior Information Technology Support services.","179,888","1,229,777","1,548,359.33",182.87%,32.98%,"3,117",16.51,36.68%,5.92%,-52.33%,"91,164","-91,488",-50.09%,"Greater New York Area, East Coast, Northeastern US",Active,1996-01-01,year,1,11-50,Michael Petrov,,,304951,USD,304951
IDrive Inc.,https://www.crunchbase.com/organization/idrive-inc,"IDrive Inc. is a privately held company specializing in cloud storage, online backup, file sharing, remote access, compliance and related technologies. Core services include IDrive®, RemotePC™ and IBackup. The company's services help over 4 million customers back up over 500 Petabytes of data.","Cloud Data Services, Cloud Storage, Compliance, Flash Storage, Internet, Meeting Software, Security, Software",http://www.idrive.com,"Calabasas, California, United States",Cloud Backup provider allowing users to backup unlimited devices into a single account. Services offered include IDrive e2 and RemotePC.,"127,895","976,397","909,630.5",17.44%,33.49%,837,3.5,-6.7%,47.73%,10.41%,"111,684","-9,746",-8.03%,"Greater Los Angeles Area, West Coast, Western US",Active,1995-01-01,year,1,251-500,Raghu Kulkarni,21,"1,402",623491,USD,623491
Insight,https://www.crunchbase.com/organization/insight,"Insight offers organizations with Insight Intelligent Technology Solutions™ and services to maximize the business value of IT. It specializes in  Digital Innovation, Cloud + Data Center Transformation, Connected Workforce, and Supply Chain Optimization solutions and services. The company was founded in 1988 and is headquartered in Tempe, Arizona. .","Cloud Data Services, Information Technology, IT Management",http://www.insight.com,"Tempe, Arizona, United States",Insight empowers organizations with Insight Intelligent Technology Solutions™ and services to maximize the business value of IT.,"50,058","880,113","922,717.33",-3.34%,11.08%,441,2.33,-15.82%,62.95%,16.1%,"116,507","9,682",9.06%,"Greater Phoenix Area, Western US",Active,1988-01-01,year,5,5001-10000,"Allister Frost, Brian Schuliger, Eric Crown, Tim Crown, Timothy A. Crown",,,,,
Teradata,https://www.crunchbase.com/organization/teradata,"Teradata is the connected multi-cloud data platform for enterprise analytics company. Our enterprise analytics solve business challenges from start to scale. Only Teradata gives you the flexibility to handle the massive and mixed data workloads of the future, today. Teradata offers analytic data platforms, applications, and services for data warehousing and analytic technologies. The company was founded in January 1979 and is globally headquartered in San Diego, California.","Analytics, Big Data, Business Intelligence, Cloud Data Services, Cloud Storage, Consulting, Marketing, Private Cloud, SaaS, Software",https://www.teradata.com,"San Diego, California, United States",Teradata is the connected multi-cloud data platform company. Our enterprise analytics solve business challenges from start to scale.,"83,879","517,688","459,339.33",10.26%,88.48%,720,2.9,29.29%,53.18%,-12.98%,"177,644","-5,739",-3.13%,"Greater San Diego Area, West Coast, Western US",Active,1979-01-01,day,7,5001-10000,"Carroll Reed, David Hartke, Jack Shemer, Jerold Modes, Philip Neches, Walter Muir, William Worth",12,,5373,USD,5373
1Path,https://www.crunchbase.com/organization/onepath-systems-llc,,"Cloud Data Services, Communications Infrastructure, Information Technology, IT Infrastructure",https://1path.com,"Kennesaw, Georgia, United States","1Path is the one source for all things to do with designing, deploying, and supporting technology from cable to cloud.","163,136","379,808","140,265.33",24.03%,-0.55%,"2,153",5.42,-2.15%,16.74%,-21.7%,"212,657","-20,917",-8.96%,"Greater Atlanta Area, East Coast, Southern US",Active,1997-01-01,year,,501-1000,,,,11645379,USD,11645379
NetDocuments,https://www.crunchbase.com/organization/netdocuments,"NetDocuments enables businesses of all sizes to create, secure, manage, access, and collaborate on documents and email anywhere at any time. With hundreds of thousands of users across 140 countries, organizations enjoy the power and simplicity of built-in disaster recovery, matter centricity, enterprise search, mobility, records management, collaboration, and compliance for documents and email. It was founded in 1999 and headquartered in Lehi, Utah.","Cloud Data Services, Email, Enterprise Software, SaaS, Software",http://netdocuments.com,"Lehi, Utah, United States","NetDocuments enables businesses of all sizes to create, secure, manage, access, and collaborate on documents and email anywhere, any time.","12,321","352,196","233,295.83",10.35%,39.43%,732,3.72,22.37%,30.52%,-14.51%,"232,661","-7,501",-3.12%,Western US,Active,1999-01-01,year,1,251-500,Kenneth Duncan,10,25,,,
Digital River,https://www.crunchbase.com/organization/digital-river,"Founded in 1994, Digital River is a leading global provider of Commerce-as-a-Service solutions. The company offers multi-tenant, SaaS commerce, payments and marketing services to business-to-business (B2B) and business-to-consumer (B2C) digital product and cloud service companies as well as branded manufacturers. Customers range in size from small to mid-sized companies to multi-national enterprises from a variety of industries, including, software, consumer electronics, computer games, publishing, travel, music, video games, electronic toys, housewares, medical equipment, power tools and direct-selling, among others. In 2013, Digital River processed more than $30 billion in online transactions.  Digital River’s commerce, payments and marketing solutions operate as part of its customers' commerce sales channels. The solutions facilitate commerce transactions, drive traffic to online stores, and enable increased conversion rates and sales through the offering of local payment methods. The company’s services include responsive and adaptive site design, development and hosting of commerce stores, merchandising, order management, fraud prevention screening, processing of popular local online payment methods, transacting in global currencies, export controls and management, tax compliance and management, digital product delivery via download, integration with third-party agencies for physical product fulfillment, multi-lingual customer service, subscription management, and online marketing services, including email marketing, paid search program management, website optimization, web analytics and reporting, among other programs.  Digital River is headquartered in Minnetonka, Minnesota with more than 30 offices around the world, including Seattle, Washington; Aliso Viejo, San Diego and San Francisco, California; Victoria, BC, Canada; Cologne, Germany; London, England; Shannon, Ireland; Stockholm, Sweden; Luxembourg, Luxembourg; Moscow, Russia; Shanghai and Beijing China; São Paulo, Brazil; Taipei, Republic of China (Taiwan); and Tokyo, Japan. Digital River’s clients include Acer, Adobe, ArenaNet, Autodesk, AVAST, BlackBerry, Expedia.com, HarperCollins, Jawbone, Kaspersky Lab, Lenovo, Logitech, Mattel, McAfee, Microsoft, Nuance, Panasonic, Razer, Samsung, SanDisk, Seagate, Siemens, Skullcandy, Spotify, Square Enix, TechSmith, Thunder Tiger, Ticketmaster, Trend Micro, Ubisoft, Vistaprint, VMware, Western Digital and Wix.com.","Broadcasting, Cloud Data Services, E-Commerce, Payments, Retail, Software",http://digitalriver.com,"Minnetonka, Minnesota, United States","Global Commerce, Marketing and Payments","7,928","337,085","470,532.83",7.1%,-41.2%,254,2.6,10.01%,57.17%,4.4%,"231,241","1,970",0.86%,"Greater Minneapolis-Saint Paul Area, Great Lakes, Midwestern US",Active,1994-01-01,year,1,1001-5000,Joel Ronning,1,,,,
Salesforce Foundation,https://www.crunchbase.com/organization/salesforce-org,"Salesforce Foundation provides cloud-based solutions based on the Salesforce platform for nonprofits and educational institutions. It offers donated and discounted technologies to connect their organizations and accelerate their impact. It also provides grants inspired by its employees, technologies, and communities. The company is driven to promoting a culture of caring and helping employees give back. As a social enterprise, the more missions its technology supports, the more it can invest back into the community, creating an endless circle of good. Salesforce.org was founded in 2000 and is headquartered in San Francisco, California.","Cloud Data Services, Information Technology, Internet, Non Profit, Software",http://www.salesforce.org,"San Francisco, California, United States",Salesforce Foundation provides cloud-based solutions based on the Salesforce platform for nonprofits and educational institutions.,"177,044","325,402","266,252.33",2.81%,31.9%,306,1.64,27.2%,73.7%,-10.15%,"245,734","4,235",1.75%,"San Francisco Bay Area, West Coast, Western US",Active,2000-01-01,year,1,10001+,Suzanne DiBianca,,,,,
ATTOM Data Solutions,https://www.crunchbase.com/organization/attom-data-solutions,"ATTOM Data Solutions provides premium property data to power products that improve transparency, innovation, efficiency and disruption in a data-driven economy. ATTOM multi-sources property tax, deed, mortgage, foreclosure, environmental risk, natural hazard, and neighborhood data for more than 155 million U.S. residential and commercial properties covering 99 percent of the nation’s population. A rigorous data management process involving more than 20 steps validates, standardizes and enhances the data collected by ATTOM, assigning each property record with a persistent, unique ID — the ATTOM ID. The 20TB ATTOM Data Warehouse fuels innovation in many industries including mortgage, real estate, insurance, marketing, government and more through flexible data delivery solutions that include bulk file licenses, property data APIs, real estate market trends, marketing lists, match & append and introducing the first property data delivery solution, a cloud-based data platform that streamlines data management – Data-as-a-Service (DaaS).","Analytics, Big Data, Cloud Data Services, Commercial Real Estate, Real Estate, Real Estate Investment",https://www.attomdata.com,"Irvine, California, United States",ATTOM Data Solutions is a market-leading provider of real estate and property data.,"112,256","312,178","182,930.83",34.02%,77.74%,583,1.84,23.86%,64.36%,-16.93%,"252,928","-45,566",-15.27%,"Greater Los Angeles Area, West Coast, Western US",Active,1996-01-01,year,1,101-250,Rob Barber,,,108707,USD,108707
Aprimo,https://www.crunchbase.com/organization/aprimo,"Aprimo delivers technology and insight that accelerates marketing productivity and the ability of marketing to document performance. Aprimo provides an Enterprise Marketing Management (EMM) product to leading marketing organizations around the world. Aprimo's software is built on its visionary Enterprise Marketing Backbone which uses a services oriented architecture (SOA) that eliminates marketing as an island of automation.  Aprimo is the global leader in delivering technology and insight that accelerates marketing productivity and the ability of marketing to document effective performance. Aprimo provides an Enterprise Marketing Management (EMM) product to leading marketing organizations around the world. Aprimo's software is built on its visionary Enterprise Marketing Backbone™ which uses a services oriented architecture (SOA) that eliminates marketing as an island of automation. Aprimo Marketing Studio offers an integrated, interactive marketing solution that enables to develop, implement and manage every aspect of online marketing activities. Aprimo Marketing Studio includes traffic generation features missing from nearly all existing marketing automation products. Marketing Studio is designed as a true Software-as-a-Service system to tap underserved market and establish a leadership position in the emerging Online Marketing Management space aimed at mid-size and larger companies.","Cloud Data Services, Enterprise Software, Marketing, Software",http://www.aprimo.com,"Indianapolis, Indiana, United States",Aprimo provides an enterprise marketing management solution that enables businesses to implement and manage online marketing activities.,"125,638","268,193","402,274.83",29.03%,34.94%,954,4.34,14.19%,29.86%,4.15%,"270,929","-33,836",-11.1%,"Great Lakes, Midwestern US",Active,1998-01-01,year,1,10001+,Bill Godfrey,,,,,
