Organization Name,Organization Name URL,Full Description,Industries,Website,Headquarters Location,Description,CB Rank (Company),SEMrush - Monthly Visits,SEMrush - Average Visits (6 months),SEMrush - Monthly Visits Growth,SEMrush - Visit Duration Growth,SEMrush - Visit Duration,SEMrush - Page Views / Visit,SEMrush - Page Views / Visit Growth,SEMrush - Bounce Rate,SEMrush - Bounce Rate Growth,SEMrush - Global Traffic Rank,SEMrush - Monthly Rank Change (#),SEMrush - Monthly Rank Growth,Headquarters Regions,Operating Status,Founded Date,Founded Date Precision,Number of Founders,Number of Employees,Founders,Apptopia - Number of Apps,Apptopia - Downloads Last 30 Days,Aberdeen - IT Spend,Aberdeen - IT Spend Currency,Aberdeen - IT Spend Currency (in USD)
"Zia Consulting, Inc.",https://www.crunchbase.com/organization/zia-consulting,"Zia Consulting is an award-winning system integrator of content management, process management, document capture, and cloud sharing technologies. We address the needs of enterprises to better manage, process, and secure documents by automating business processes and enhancing information governance. Our vertical accelerators for insurance, mortgage, accounting, manufacturing, and more are utilized by some of the world's largest enterprises to reduce costs, increase efficiency, and mitigate risk. To learn more, visit www.ziaconsulting.com.","Business Intelligence, Cloud Storage, Compliance, Consulting, Document Management, Enterprise Applications, Information Technology, Management Information Systems",https://www.ziaconsulting.com/,"Boulder, Colorado, United States","Zia is an award-winning system integrator of content management, process management, document capture, and cloud sharing technologies.","241,119","4,775","25,522.33",-74.15%,-83.59%,184,1.94,11.41%,37.21%,-26.24%,"3,474,996","2,000,324",135.65%,"Greater Denver Area, Western US",Active,2003-05-01,month,3,51-100,"Jeff Barry, Mike Mahon, Pat Myers",1,,748432,USD,748432
MSRcosmos LLC,https://www.crunchbase.com/organization/nsrcosmos-llc,"MSRcosmos, a MSRcosmos group company, is a fast-growing global IT services company with unmatched capabilities across the service value chain of intelligent automation, cloud, data &  analytics, enterprise applications, and IT infrastructure.  At MSRcosmos, we believe in the power to inspire and shape businesses and communities through technology. With a global network of strategic partners and extensive expertise in Cloud, Data/AI, Applications and Automation, our products, services, and solutions help companies transform their businesses.  “Promise delivered” is our brand proposition, orchestrated via staunch delivery commitments, path-breaking solutions, highly differentiated talent, and a  methodical approach. This belief has enabled MSRcosmos to be a preferred partner of choice for many customers across diverse industries in the USA, Europe,  India, and Australia Headquartered in the US, MSRCosmos has a strong presence in the US, India, and Australia.","Analytics, Business Intelligence, Cloud Data Services, Cloud Management, Cloud Storage, Data Integration, Data Mining, Data Visualization, Enterprise Resource Planning (ERP), Infrastructure",http://www.msrcosmos.com/,"Stockton, California, United States","MSRcosmos, part of MSRcosmos Group, pioneers in digital transformation using the best of cloud, data & ai and automation.","136,265","4,692","10,549.83",-82.93%,-67.67%,150,1.79,-31.95%,49.08%,-23.37%,"3,534,698","2,313,502",189.45%,"West Coast, Western US",Active,2008-02-19,day,2,1001-5000,"Devi Kondapi, SivaGopal Modadugula",3,,592130,USD,592130
Blooksy,https://www.crunchbase.com/organization/blooksy,Blooksy is a cloud-based software platform that has everything authors need to easily write and publish their books.,"Cloud Storage, Software",https://blooksy.com/,"Atlanta, Georgia, United States",Blooksy is a cloud-based software platform.,"95,679","4,517","6,400.5",228.51%,-75.29%,43,2.5,-0.02%,50%,-59.58%,"3,585,868","-2,602,846",-42.06%,"Greater Atlanta Area, East Coast, Southern US",Active,2021-01-01,year,1,,Anthony Joiner,,,,,
ORock Technologies,https://www.crunchbase.com/organization/orock-technologies,"ORock Technologies is a small business Infrastructure as a Service (IaaS) and Cloud Service Provider (CSP) serving technology companies and enterprise customers in defense, government, and highly regulated industries. ORock’s unique architecture includes a private, carrier-grade dark fiber network and a FedRAMP Moderate open-source cloud. It was designed for secure data operations and delivers a combination of data security, performance, flexibility, compliance, and control that most CSPs cannot provide. ORock solutions include secure cloud & IaaS; application hosting; FedRAMP authorization services; and secure connectivity and mobility. As a Red Hat Certified Cloud & Service Provider (CCSP), ORock is authorized to host and resell certified Red Hat offerings on-demand.","Big Data, Cloud Computing, Cloud Data Services, Cloud Infrastructure, Cloud Security, Cloud Storage, Cyber Security, IaaS, Information Technology, Private Cloud, SaaS",http://www.orocktech.com,"Reston, Virginia, United States","ORock Technologies provides IaaS and cloud services to IT companies and customers in defense, government, and regulated industries.","24,067","4,435",,-23.2%,"4,574.65%","3,319",1.64,-34.93%,67.96%,569.56%,"3,589,165","784,388",27.97%,"Washington DC Metro Area, East Coast, Southern US",Active,2014-01-01,year,2,11-50,"Gregg Hrncir, John Leon",,,,,
Parature,https://www.crunchbase.com/organization/parature,"Parature provides on-demand customer service software, making it possible for any business to leverage the Internet to provide outstanding customer service and online support. Parature provides an efficient way to serve, support, retain, engage with and maximize the value of every customer. Parature's software-as-a-service (SaaS) delivery and integrated, intuitive design enable organizations to run efficiently.  Parature's flagship product, Parature Customer Service software, integrates a customer portal, rich knowledgebase and full trouble ticket software in one dynamic system that manages all your support needs.  Parature announced a new social response management product called ""Parature for Facebook"", the Industry's First and Only Customer Service Application for Directly Engaging with Customers, Prospects and Fans on Facebook.  The product now supports Twitter as well. Founded in 2001, today Parature helps support more than 55 million end users worldwide. Parature is at work in a wide variety of organizations including national associations, leading educational institutions, technology companies, and diverse industries from gaming/interactive media & entertainment, to retail, healthcare and government. Source: [Karan Rawat](http://seosmomarketing.blogspot.com/)","Cloud Storage, Customer Service, Internet, SaaS, Software",http://www.parature.com,"Herndon, Virginia, United States",Parature develops cloud-based customer service software that enables companies to provide on-demand customer service and online support.,"211,322","4,218",,,,0,1,,100%,,"3,687,703",,,"Washington DC Metro Area, East Coast, Southern US",Closed,2000-06-15,day,2,51-100,"Ching-Ho Fung, Duke Chung",,,,,
BTerrell Group,https://www.crunchbase.com/organization/bterrell-group,,"Cloud Storage, Internet, Software",http://www.bterrell.com/,"Addison, Texas, United States",BTerrell Group is a software company located in Addison.,"481,548","3,979",,50.15%,,0,1,0%,100%,0%,"3,767,171","-706,345",-15.79%,"Dallas/Fort Worth Metroplex, Southern US",Active,1991-01-01,day,,11-50,,,,51021,USD,51021
Permanent.org,https://www.crunchbase.com/organization/permanent-org,,"Charity, Cloud Storage, Data Storage, Non Profit",https://www.permanent.org/,"Austin, Texas, United States",Permanent.org is non-profit organization that offers data storage facilities for companies.,"552,574","3,914","7,969",-39.71%,200%,156,3.63,263.34%,63.33%,-36.67%,"3,781,463","1,144,901",43.42%,Southern US,Active,2014-01-01,year,,1-10,,,,25315,USD,25315
K3 Technology,https://www.crunchbase.com/organization/k3-technology,,"Cloud Infrastructure, Cloud Storage, Cyber Security, Information Technology, IT Management",https://k3techs.com,"Denver, Colorado, United States","K3 Technology is an information technology company that provides cybersecurity, cloud infrastructure, and IT management services.","312,343","3,804","3,080.83",158.42%,,0,1,0%,100%,0%,"3,827,350","-2,158,665",-36.06%,"Greater Denver Area, Western US",Active,2017-01-01,year,1,11-50,Kelly Kercher,,,21149,USD,21149
MassiveGRID,https://www.crunchbase.com/organization/massivegrid,"MassiveGRID is a global high-end Service Provider, with over 19 years of hands-on experience in the fields of high-availability service hosting, turn-key service solution & development. Our services are designed for demanding clients that run Business Critical Services or need high performance & large network capacity. MassiveGrid’s client portfolio includes financial institutions, telecoms & cutting-edge technology organizations, among others. Our extensive technical expertise and broad experience in problem solving allows us to provide high-quality customized telecoms & IT solutions to any technology challenge. Operations Center engineers are available 24x7x365 and handle on-the-spot any network issue. We are committed in providing a leading-class service and we are able to offer 100% service uptime through our 100% SLA. Our Infrastructure is multi-clustered. Every cluster consists of many hardware servers, all of them in high-availability mode. Client’s servers run in a complete virtual environment fully isolated with each other on our clusters. If a hardware server in any of our clusters fails, then the services that were running in that hardware server get moved instantly to other servers of the cluster. Our storage is highly available as well. Unlike other cloud providers, we use clustered storage for top reliability in a multi-replicated architecture. Apart from reliable, our storage is very fast too, since we use Pure SSD. Our highly available storage cluster is self-healing and offers 100% storage uptime. Our network is also based on high-availability architecture and is fully redundant. The best Tier-1 Internet Providers are used for our links, which are at least duplicated. All Network elements are also following at least N+1 redundancy architecture. Traffic is automatically re-routed, in the event of a link failure. Upon client’s request, we can offer protection up to 4.5Tbps Distributed Denial of Service (DDoS) attacks. MassiveGRID is the ultimate cloud hosting provider. Our unmatched expertise allows us to define our industry's best practices and thus leads to a unique value proposition. Entry-level clients and enterprises with business-critical activities alike trust MassiveGRID for their day to day cloud management.","Cloud Computing, Cloud Infrastructure, Cloud Security, Cloud Storage, IaaS, Information Technology, Internet, IT Infrastructure, PaaS, Private Cloud",https://www.massivegrid.com,"New York, New York, United States",The High-Availability Cloud Provider,"229,322","3,385","3,382.67",-51.84%,-56.43%,755,4.06,-65.97%,63.33%,-71.62%,"4,038,327","1,381,924",52.02%,"Greater New York Area, East Coast, Northeastern US",Active,2016-05-26,day,1,11-50,Vasileios Stoidis,,,,,
"Otixo, Inc.",https://www.crunchbase.com/organization/otixo,"Otixo brings team collaboration and communication into one place, so you can get more work done.  Otixo enables you to connect all your Cloud Drives and to collaborate with your Team. Get access to more than 30 Cloud Drives, such as Google Drive, Box, Dropbox, MEGA, OneDrive, FTP and many more. Transfer your cloud contents easily from one cloud to another or search for specific files using the extended search functionality. With the Otixo Team Spaces you get an advanced collaboration tool where you can invite your family members, friends, coworkers and all the people you know. Create a Team Space, invite people and chat with them about the files shared in the Space or about projects. Stay up-to-date with the notifications in your Team Channel. Find your own Personal Cloud Drive and your own Personal Team Space as default additions to your account to get you started right away. Move your projects forward by inviting the right people!","Cloud Infrastructure, Cloud Storage, Content, Data Integration, Data Storage, Online Portals, Productivity Tools, Project Management, Sharing Economy, Video Conferencing",https://www.otixo.com,"San Francisco, California, United States",All your team collaboration and cloud management in one place,"77,669","3,353","3,986.67",6.89%,,0,1,0%,100%,0%,"4,010,631","54,935",1.39%,"San Francisco Bay Area, West Coast, Western US",Active,2010-04-12,day,1,1-10,Jens Birnbaum,5,,,,
a COUPLE of GURUS,https://www.crunchbase.com/organization/a-couple-of-gurus,"a COUPLE of GURUS is an award-winning IT services company helping world-changing organizations with Managed IT services, managed cybersecurity, cloud solutions, IT consulting, and more. We know that you want to change the world, and we want to help. To do that, we will secure and streamline your business IT to solve today’s problems and meet tomorrow’s goals. World-changing organizations that we support include just about any Business, Regulated Manufacturers (such as Medical Device manufacturers/Biotech companies and DoD manufacturers and contractors), and Non-Profit organizations. Need Regulatory Compliance help? We got you covered! We distinguish ourselves from other providers by utilizing a more personal and fun touch. Our team puts a strong emphasis on clear and open communication so we can best get to know our clients and their needs. Strong relationships lead to successful partnerships, and we love nothing more than growing and having fun alongside our clients. Partner with us and leverage our extensive knowledge and expertise. With a COUPLE of GURUS watching over your business IT and aligning your technology to your organization's vision, you can confidently put more resources towards what's important.","Cloud Management, Cloud Security, Cloud Storage, Compliance, Cyber Security, IT Infrastructure, IT Management, Network Security, Private Cloud, Technical Support",https://www.acoupleofgurus.com/,"Minneapolis, Minnesota, United States",a COUPLE of GURUS is an award-winning IT services company helping world-changing organizations with Managed IT services and more.,"400,101","3,129","2,862",19.25%,209.09%,34,2,-20%,42.95%,15.32%,"4,143,569","-196,098",-4.52%,"Greater Minneapolis-Saint Paul Area, Great Lakes, Midwestern US",Active,2002-02-25,day,2,11-50,"Anne Schoolcraft, Keith Schoolcraft",,,108021,USD,108021
KeepItSafe,https://www.crunchbase.com/organization/keepitsafe,"KeepItSafe is a cloud data backup company specializing in disaster recovery and business continuity. Backed by a $1.2 billion public company, j2 Global®, Inc. (NASDAQ: JCOM), KeepItSafe meets data-security protection regulations with ISO 27001, SOC 2, HIPAA, and PCI compliance in 20+ data centers across three continents.  KeepItSafe’s holistic approach leverages its global footprint and best-of-breed technologies to deliver comprehensive data availability and as-a-Service solutions by offering custom managed and monitored services with 24/7 live support. KeepItSafe’s secure enterprise-class data centers support virtual-, physical-, and cloud-to-cloud solutions with 256-bit encryption and multi-cloud scalability via a global network of service providers, system integrators, and cloud resellers.","Cloud Data Services, Cloud Infrastructure, Cloud Storage, Data Storage, SaaS",http://www.keepitsafe.com,"Los Angeles, California, United States","KeepItSafe offers global cloud data availability for Backup, Disaster Recovery-as-a-Service (DRaaS), Endpoint and SaaS data protection. ","196,839","3,101","4,515.83","2,303.88%",107.89%,14,2.96,189.33%,21.57%,-78.26%,"4,156,890","-5,465,712",-56.8%,"Greater Los Angeles Area, West Coast, Western US",Active,2003-06-03,day,2,501-1000,"Alexander Hagerup, Eoin Blacklock",,,,,
Decision Minds,https://www.crunchbase.com/organization/decision-minds,,"Artificial Intelligence, Cloud Storage, Information Technology, Machine Learning, Virtualization",http://www.decisionminds.com/,"Milpitas, California, United States","Decision Minds is an IT firm that specializes in data virtualization, machine learning, artificial intelligence & cloud analytics services.","149,721","2,919",,128.58%,66.67%,0,1,-25.01%,100%,49.99%,"4,351,090","-2,127,411",-32.84%,"San Francisco Bay Area, Silicon Valley, West Coast",Active,2013-01-01,year,2,101-250,"Balaji Rajagopalan, Murali Pabbisetty",,,1500000,USD,1500000
Hammerspace,https://www.crunchbase.com/organization/hammerspace-4936,"Hammerspace breaks data free from the constraints of storage systems, making it possible for users and applications to access data from anywhere by providing the software-defined data platform and data services for your Global Data Environment. 1.	Unified Data Access Layer (UDAL)  •	Global File System •	Linux, Windows, Kubernetes, VMWare, MacOS  2.	Data Orchestration Tools •	Objective-based policies •	File-driven data mobility and replication •	Universal data movers •	Customizable metadata •	Supports over 100 individual volumes / buckets 3.	Automated Data Services •	Replication  •	Snapshots with file-level recovery •	WORM •	Tiering and mobility •	Undelete •	Versioning •	Encryption 4.	Universal Storage Options  •	Multi-Cloud, Multi-Region, Hybrid-Cloud •	Multi-Data Center •	Software Defined Storage (utilize existing storage or choice of commodity) •	Block / NAS / Object / Snowflake","Cloud Data Services, Cloud Storage, Data Storage, Information Technology, Software",https://hammerspace.com/,"San Mateo, California, United States",Hammerspace is a software-defined data platform that creates a Global Data Environment to connect users and applications with their data.,"116,309","2,756","3,409.5",40.47%,-97.31%,0,1,0%,100%,0%,"4,382,517","-366,039",-7.71%,"San Francisco Bay Area, Silicon Valley, West Coast",Active,2018-01-01,year,1,11-50,David Flynn,,,,,
Aeeiee,https://www.crunchbase.com/organization/aeeiee,,"Apps, Cloud Storage, IT Infrastructure, Software, Web Design, Web Hosting",https://www.aeeiee.com/,"Tempe, Arizona, United States","Aeeiee specializes in IT solutions, search engine optimization, cloud architecture, AWS hosting, web design and app development services.","451,883","2,650","2,123.67",-2.18%,-87.9%,101,1.09,-28.79%,91.02%,9.98%,"4,473,837","200,314",4.69%,"Greater Phoenix Area, Western US",Active,2015-01-01,year,1,1-10,David Ovienmhada,1,43,,,
Totaldocs,https://www.crunchbase.com/organization/totaldocs,,"Cloud Storage, Information Technology, Software",https://totaldocs.com,"Miami, Florida, United States","Totaldocs offers cloud solutions for finance, health, insurance, and public sectors.","790,315","2,350",,-6.75%,,0,1,0%,100%,0%,"4,808,535","233,750",5.11%,"Greater Miami Area, East Coast, Southern US",Active,1988-01-01,year,,1-10,,,,,,
Amaryllo Inc.,https://www.crunchbase.com/organization/amaryllo-international,"Based in Irvine, California, Amaryllo builds internet infrastructures and integrates layers of technologies, so consumers and enterprises can benefit from its pay-as-you-go services. Amaryllo generates service income such as video cloud storage, business analytics, data backup service, etc. through Amaryllo empowered devices.","Cloud Data Services, Cloud Storage, Information Technology, Network Security, PaaS, SaaS, Smart Home, Software, Video Streaming, Wireless",http://www.amaryllo.us,"Irvine, California, United States",Amaryllo is a Platform as a Service company providing business analytics and unlimited cloud storage services on a pay-as-you-go business.,"67,188","2,320",,10.11%,-97.26%,0,1,-50%,100%,,"4,736,606","79,989",1.72%,"Greater Los Angeles Area, West Coast, Western US",Active,2012-01-01,year,1,51-100,Marcus Yang,,,,,
Excelero Storage,https://www.crunchbase.com/organization/excelero-storage,"Excelero developed NVMesh, a software platform that manages and secures virtual arrays of NVMe flash drives as block storage available across public and private clouds. The software supports Kubernetes containers.","Cloud Storage, Data Storage, Enterprise Software, Flash Storage, Software",http://www.excelero.com,"Santa Clara, California, United States",Excelero Storage is a Software-defined block storage for cloud and enterprise applications at any scale.,"21,741","2,203",,358.96%,,0,1,0%,100%,0%,"4,917,202","-3,481,640",-41.45%,"San Francisco Bay Area, Silicon Valley, West Coast",Active,2014-01-01,year,4,11-50,"Lior Gal, Ofer Oshri, Omri Mann, Yaniv Romem",,,,,
Cloudwalks,https://www.crunchbase.com/organization/cloudwalk-hosting-solution,"Cloudwalks is a leading QuickBooks Hosting provider in more than 10 countries. We have gained very rich experience in Hosted Tax and Accounting applications in a cloud environment. Cloudwalks hosts all popular accounting software, such as QuickBooks, Peachtree, Sage accounting software, etc. We at Cloudwalks host all versions of QuickBooks accounting software including Pro, Premier, Enterprise, QuickBooks Canada, and all industry-specific versions from the year 2010 onwards in a multi-user environment.","Cloud Computing, Cloud Infrastructure, Cloud Storage, Private Cloud, Web Hosting",https://www.cloudwalks.com,"New York, New York, United States",Cloudwalks is a QuickBooks hosting provider offering customized virtual office solutions.,"363,063","2,184",,,,171,1.25,,74.91%,,"4,929,231",,,"Greater New York Area, East Coast, Northeastern US",Active,2010-09-18,day,1,11-50,Michael Goldfine,,,,,
CloudBasic,https://www.crunchbase.com/organization/cloudbasic,"Operator of a company designed to offer enterprise cloud technology products. The company's enterprise cloud technology products help to connect any combination of cloud, on-premises and legacy applications, enabling customers to work efficiently and increase their productivity.",Cloud Storage,https://cloudbasic.net/,"Irvine, California, United States",CloudBasic is an operator of a company designed to offer enterprise cloud technology products.,"748,431","2,154","2,837.33",121.38%,25%,0,1,0%,100%,0%,"4,848,561","-1,625,729",-25.11%,"Greater Los Angeles Area, West Coast, Western US",Active,2008-01-01,year,,,,,,,,
Morro Data,https://www.crunchbase.com/organization/morro-systems,"Morro Data is revolutionizing storage for Small and Medium Businesses (SMBs) with the first true storage platform for SME that combines the local gigabit performance of a NAS with the reliability, accessibility, and scalability of the cloud. Morro Data was founded by Paul Tien (founder of ReadyNAS, acquired by NETGEAR) and his core team.","Cloud Data Services, Cloud Storage, File Sharing",http://www.morrodata.com/,"Fremont, California, United States","Morro CloudNAS: fastest 3-in-1 solution for File Storage, Multi-OfficeSync, DataRecovery. The power of the cloud with local NAS performance.","336,532","2,129","2,167.17",-19.87%,-99.44%,0,1,0%,100%,0%,"4,866,739","558,135",12.95%,"San Francisco Bay Area, Silicon Valley, West Coast",Active,2013-11-01,day,1,11-50,Paul Tien,,,,,
Televere Systems,https://www.crunchbase.com/organization/televere-systems,,"Cloud Storage, Health Care, Information Technology, Software",https://televeresystems.com/,"Janesville, Wisconsin, United States",Televere Systems is a software company that develops customized solutions to build digital imaging platforms for healthcare sectors.,"737,128","2,097","13,161.17",-75.27%,146.43%,266,1.79,78.68%,86.89%,-13.11%,"4,888,373","2,638,087",117.23%,"Great Lakes, Midwestern US",Active,1996-01-01,year,,11-50,,,,21088,USD,21088
Cave Consulting,https://www.crunchbase.com/organization/cave-consulting,"Since 1992, Cave Consulting has been helping businesses, cities, counties, and schools improve their operations with creative solutions and unconventional technologies.","Cloud Data Services, Cloud Infrastructure, Cloud Management, Cloud Security, Cloud Storage, Government, GovTech, Productivity Tools, Software, Web Design",https://www.caveconsulting.com/,"Dallas, Texas, United States",Showing businesses and governments how a digital workplace can improve operations and streamline their processes using the cloud.,"840,502","2,089",,-14.53%,,0,1,0%,100%,0%,"5,007,893","374,026",8.07%,"Dallas/Fort Worth Metroplex, Southern US",Active,1992-01-01,year,2,1-10,"Ellis Cave, Todd Cave",,,,,
MOLTEN,https://www.crunchbase.com/organization/molten,"MOLTEN empowers rights holders of media content _____________ MOLTEN is a cloud platform that streamlines core operations of media and entertainment enterprises. MOLTEN digitizes and connects the myriad rights, content and licensing operations across film/TV enterprises, empowering their teams with real-time insight and automation tools to do more.  Built by a team from MIT with professionals from the industry, this state-of-the-art vertical-cloud platform hosts over 175M film and TV rights today.","B2B, Cloud Computing, Cloud Infrastructure, Cloud Storage, Digital Media, Intellectual Property, Media and Entertainment, SaaS",https://moltencloud.com,"Cambridge, Massachusetts, United States",Radically simplifying digital media operations globally,"11,126","2,059","1,737.33",-26.99%,-87.3%,8,1.29,-31.55%,70.62%,27.24%,"4,916,044","728,765",17.4%,"Greater Boston Area, East Coast, New England",Active,2018-01-01,year,1,11-50,Arjun Mendhi,,,,,
