Organization Name,Organization Name URL,Full Description,Industries,Website,Headquarters Location,Description,CB Rank (Company),SEMrush - Monthly Visits,SEMrush - Average Visits (6 months),SEMrush - Monthly Visits Growth,SEMrush - Visit Duration Growth,SEMrush - Visit Duration,SEMrush - Page Views / Visit,SEMrush - Page Views / Visit Growth,SEMrush - Bounce Rate,SEMrush - Bounce Rate Growth,SEMrush - Global Traffic Rank,SEMrush - Monthly Rank Change (#),SEMrush - Monthly Rank Growth,Headquarters Regions,Operating Status,Founded Date,Founded Date Precision,Number of Founders,Number of Employees,Founders,Apptopia - Number of Apps,Apptopia - Downloads Last 30 Days,Aberdeen - IT Spend,Aberdeen - IT Spend Currency,Aberdeen - IT Spend Currency (in USD)
9Star Research,https://www.crunchbase.com/organization/9star-research,"9Star Research Inc. provides Internet single sign-on (SSO) and cloud identity security solutions. The company offers Shibboleth, SAML, and OAuth open standards compliant on-premise SSO software, as well as on-demand SSO SaaS/cloud services to enterprise and SaaS customers worldwide. Its products include ProtectNetwork that enables enterprises to provide their users and applications in bulk for SSO authentication and access management; Shimla SSO solution for secure Shibboleth/SAML SSO in the Joomla CMS platform; ActiveShareFS 2007 Shibboleth/SAML SSO Solution, an Internet SSO solution for Microsoft SharePoint 2007; and ActiveShareFS 2010 Shibboleth/SAML SSO Solution, an Internet SSO solution for Microsoft SharePoint 2010. The company also provides services, such as hosted Shibboleth/SAML SSO cloud services, Shibboleth/SAML SSO on-premises services, Shibboleth SSO annual support and maintenance services, SimpleSAMLphp SSO on-premises services, and federated identity management services. It serves large and SMB organizations in higher education, government, financial, healthcare, automotive, and consumer markets. The company was founded in 2002 and is based in Austin, Texas.","Cloud Data Services, Information Technology, SaaS",http://www.9starinc.com,"Austin, Texas, United States",9Star Research provides internet single sign-on (SSO) and cloud identity security solutions.,"206,413",,,,,,,,,,,,,Southern US,Active,2002-01-01,year,,501-1000,,,,,,
"Key Information Systems, Inc.",https://www.crunchbase.com/organization/key-information-systems,"Key Information Systems, Inc. is an information technology company. It provides information technology systems integration, computing, storage, and networking solutions through infrastructure-as-a-service module.  The company offers cloud infrastructure, colocation, storage and content management, business continuity, virtualization, and optimization solutions. It also provides critical assessment, financing, installation, training, maintenance, server, and managed and connectivity services. Key Information Systems, Inc. was founded in 1999 and is headquartered in Agoura Hills, California.","Cloud Data Services, Enterprise Software",http://www.keyinfo.com,"Agoura Hills, California, United States","Key Information Systems, Inc. provides the Western United States with IT solutions.","208,902",,,,,,,,,,,,,"Greater Los Angeles Area, West Coast, Western US",Active,1999-01-01,year,1,51-100,Lief Morin,,,104766,USD,104766
AWH,https://www.crunchbase.com/organization/awh,Digital product consulting & creation firm for competitive advantage.,"Cloud Data Services, Data Integration, Data Visualization, Database, Enterprise Applications, Enterprise Software, Mobile Apps, Product Management, Software Engineering, UX Design, Web Development",http://awh.net/,"Dublin, Ohio, United States",Digital product consulting & creation firm for competitive advantage.,"213,511",,,,,,,,,,,,,"Great Lakes, Midwestern US",Active,1995-01-01,year,2,11-50,"Christopher Slee, Ryan Frederick",,,154316,USD,154316
Corus360,https://www.crunchbase.com/organization/corus360,"Corus360 is an innovative solutions company that empowers organizations to build, transition, and ultimately transform their environments to reach desired outcomes through seamless resilience, selecting the right people, and implementing ideal technologies.","Cloud Data Services, Data Center, Network Security",http://corus360.com/,"Norcross, Georgia, United States",Corus360 operates as an innovative solutions company.,"224,816",,,,,,,,,,,,,"Greater Atlanta Area, East Coast, Southern US",Active,1998-01-01,year,2,251-500,"Hank Unverzagt, Mark Metz",,,381414,USD,381414
Element Technologies,https://www.crunchbase.com/organization/element-technologies,"Element Technologies is a consulting firm that delivers legal technology services. Element’s certified experts in the legal industry offer thought leadership and technology services to law firms including IT managed services, cloud, cybersecurity, procurement, document management, and litigation support services.","Cloud Data Services, Consulting, Information Technology, Legal, Management Consulting",http://www.ele-ment.com,"Minneapolis, Minnesota, United States",Element Technologies is a consulting firm that delivers legal technology services.,"225,065",,,,,,,,,,,,,"Greater Minneapolis-Saint Paul Area, Great Lakes, Midwestern US",Closed,1987-01-01,year,1,11-50,Jeff Holds,,,284642,USD,284642
Sajan,https://www.crunchbase.com/organization/sajan,Sajan provides cloud-based translation software and client service typically to enterprise-level clients looking to localize content.,"Cloud Data Services, Enterprise Software, Software, Translation Service",http://www.sajan.com,"River Falls, Wisconsin, United States",Sajan provides cloud-based language translation software and technology solutions.,"227,665",,,,,,,,,,,,,"Greater Minneapolis-Saint Paul Area, Great Lakes, Midwestern US",Active,1997-01-01,year,,51-100,,,,,,
PrismTech,https://www.crunchbase.com/organization/prismtech,"PrismTech is a provider of software platforms and tools for the Internet of Things, Industrial Internet and advanced wireless communications. PrismTech's products and services include: Vortex - Intelligent Data Sharing Platform for Business Critical Internet of Things (IoT) applications. Combining deterministic data delivery, system-wide data sharing and support for data analytics, Vortex helps system integrators, OEMs, device platform vendors and Cloud service providers (SaaS, PaaS and DaaS) deliver 'Smart' solutions for many vertical markets, including: Healthcare, Energy, Transportation, Smart Cities and Industrial Automation. Vortex provides efficient, secure and interoperable real-time Device to Device (D2D) and Device to Cloud information sharing. It is a key enabler for systems that have to reliably and securely deliver high volumes of real-time data with stringent end-to-end qualities-of-service (QoS). http://www.prismtech.com/vortex Spectra - Software Defined Radio (SDR) and Software Communications Architecture (SCA) solutions: Spectra CX a model-driven development tool that  simplifies, accelerates, and validates the SDR/SCA development process; Spectra CF a high performance, low footprint, COTS SCA Core Framework; Spectra CDB a fully integrated and optimized SDR middleware stack running across a wide range of FPGA, DSP and GPP processing elements; Spectra DTP - a wideband, high performance, baseband and RF SDR Development and test platform. http://www.prismtech.com/spectra DDS Community - an open source implementation of the OMG Data Distribution Service for Real-Time Systems (DDS) standard. DDS Community has experienced swift adoption in a variety of application domains characterized by the need to distribute high volumes of data with predictable low Haber latencies, such as, Radar Processors, Flying and Land Drones, Combat Management Systems, Air Traffic Management, High Performance Telemetry, Large Scale Supervisory Systems, and Automated Stocks and Options Trading. http://www.prismtech.com/dds-community The company was founded by Keith Steele in 1992 and is headquartered in Boston, Massachusetts. It has operations in Boston, Massachusetts, as well as in the United Kingdom, the Netherlands, and France. PrismTech Corporation operates as a subsidiary of PrismTech Holdings Ltd.","Big Data, Cloud Computing, Cloud Data Services, Cloud Infrastructure, Data Integration, Enterprise Software, Information Technology, Internet of Things, Software",http://www.prismtech.com,"Woburn, Massachusetts, United States","PrismTech provides software platforms and tools for the Internet of Things, Industrial Internet and advanced wireless communications.","228,839",,,,,,,,,,,,,"Greater Boston Area, East Coast, New England",Active,1992-01-01,year,1,51-100,Keith Steele,1,,,,
ACTS,https://www.crunchbase.com/organization/acts-332c,,"Cloud Data Services, Cloud Security, Information Services, Information Technology",https://www.actsolution.net,"Jacksonville, Florida, United States","ACTS is a solution provider such as cloud managed & security, IT consulting and DevOps services.","230,314",,,,,,,,,,,,,"East Coast, Southern US",Active,2002-01-01,year,1,51-100,James Farhat,,,510512,USD,510512
Pinnacle Business Systems,https://www.crunchbase.com/organization/pinnacle-business-systems,"For over two decades Pinnacle Business Systems, Inc. (PBS) has been designing and implementing technology solutions for customers across various industries. By establishing key relationships with industry leading manufacturers such as IBM, EMC, Hewlett-Packard, VMware and Microsoft, Pinnacle is uniquely qualified to deliver the right solution to fit your business needs.","Big Data, Cloud Data Services, Information Technology",http://www.pbsnow.com,"Edmond, Oklahoma, United States","For over two decades Pinnacle Business Systems, Inc. (PBS) has been designing and implementing technology solutions for customers across","243,741",,,,,,,,,,,,,Southern US,Active,1988-01-01,year,,51-100,,,,3990956,USD,3990956
Automated Business Solutions,https://www.crunchbase.com/organization/automated-business-solutions-inc,"Automated Business Solutions provides printers, copiers, scanners, postage machines, faxes, multi-function machines, networks, document management, workflows, IT solutions, services, and security. Their services include VOIP, network, email security, cloud, and managed services.","Cloud Data Services, Computer, Consumer Electronics, Information Technology, Sales, Software",https://www.absne.com,"Warwick, Rhode Island, United States",Automated Business Solutions provides office technology solutions and managed IT services.,"247,377",,,,,,,,,,,,,"East Coast, New England, Northeastern US",Active,1992-01-01,year,2,101-250,"Alan Albergaria, Robert Maceroni",,,,,
Waypoint Consulting,https://www.crunchbase.com/organization/waypoint-consulting-llc,"Waypoint is a leading provider of business intelligence, data management, and analytics solutions across the US. We have an impeccable track record with a blend of business knowledge, technical skills, and consulting expertise that translates into more value and less risk for our clients. With more than 18 years of experience, Waypoint is recognized among the most reputable analytic solution providers in the U.S. today.","Analytics, Big Data, Business Intelligence, Cloud Data Services, Consulting, CRM, Data Integration, Data Visualization, Information Technology",http://waypointco.com,"West Chester, Pennsylvania, United States",Leading Data Management & Analytics Solutions Provider,"248,219",,,,,,,,,,,,,"Greater Philadelphia Area, Great Lakes, Northeastern US",Active,2001-01-01,year,1,11-50,David Huebner,,,203685,USD,203685
EBM,https://www.crunchbase.com/organization/ebm-ba53,,"Cloud Data Services, Cyber Security, Information Technology, Software",https://www.ebmusa.com/,"Trumbull, Connecticut, United States",EBM is an IT solutions and service provider company.,"253,566",,,,,,,,,,,,,"East Coast, New England, Northeastern US",Active,1972-01-01,year,,101-250,,,,36671,USD,36671
ActivePrime,https://www.crunchbase.com/organization/activeprime,"ActivePrime™ provides innovative, automated customer intelligence solutions helping more than 120,000 users in 42 countries. Their data quality and fuzzy search technologies enable their customers to generate consolidated, actionable customer intelligence from both cloud and on-premise data. They historically have optimized their solutions for CRM systems. But today, they also extend beyond CRM to provide a unified view of customers across enterprise systems.","Business Intelligence, Cloud Data Services, CRM, Data Center, Software",https://activeprime.com,"Mountain View, California, United States","ActivePrime provides innovative, automated customer intelligence solutions.","256,431",,,,,,,,,,,,,"San Francisco Bay Area, Silicon Valley, West Coast",Active,2001-01-01,year,1,11-50,Clint Bidlack,,,181056,USD,181056
Online Tech,https://www.crunchbase.com/organization/online-tech,"Online Tech offers a full spectrum of HIPAA and PCI compliant hosting solutions including colocation, managed dedicated servers and cloud hosting in our Michigan and Indiana SSAE 16 and SOC 2 compliant data centers.","Cloud Computing, Cloud Data Services, Cloud Infrastructure, Cloud Management, Cloud Security, Information Technology, Virtualization, Web Hosting",http://www.onlinetech.com,"Ann Arbor, Michigan, United States","Midwest's leader in secure, compliant hosting services including cloud hosting, disaster recovery, offsite backup services and colocation.","260,577",,,,,,,,,,,,,"Great Lakes, Midwestern US",Active,1994-01-01,year,1,51-100,Yan Ness,4,,,,
Aquilent,https://www.crunchbase.com/organization/aquilent,"Aquilent is the recognized leading provider of Web and Cloud solutions shaping the next generation of technology for the federal government. Aquilent delivers transformative solutions with an emphasis on technology strategy, enterprise content management, web portals & applications, and acquisition & grants management systems. Their commitment to deliver tangible, highly strategic results for their clients’ most pressing problems is underscored by their 4-Point Aquilent Advantage™.","Cloud Data Services, Service Industry, Web Hosting",http://www.aquilent.com,"Laurel, Maryland, United States",Aquilent is the recognized leading provider of Web and Cloud solutions shaping the next generation of technology for the federal,"261,831",,,,,,,,,,,,,"Greater Baltimore-Maryland Area, Washington DC Metro Area, East Coast",Active,2002-01-01,year,1,501-1000,David Fout,,,,,
Vexcel,https://www.crunchbase.com/organization/vexcel,"Vexcel Corp. is a remote sensing company with headquarters in Boulder, Colorado. The company's legacy offerings to government and commercial markets include turnkey satellite ground systems, a range of remote sensing imagery processing products, and advanced radar processing and geospatial services. The company was acquired by Microsoft Corporation on May 3, 2006.","Cloud Data Services, Cloud Management, Information Technology",http://www.vexcel.com,"Boulder, Colorado, United States",Vexcel provides program management and contract management.,"280,598",,,,,,,,,,,,,"Greater Denver Area, Western US",Active,1985-01-01,year,,51-100,,,,,,
Abbott,https://www.crunchbase.com/organization/abbott-2fba,"Abbott Informatics supports the rapidly changing data management needs of various organizations. Abbott solutions integrate with current systems, and can rapidly be configured to fit your unique workflows without adding complexity or interrupting daily operations.","Cloud Data Services, Customer Service, Information Technology, Software",https://www.informatics.abbott/,"Florida, New York, United States","Abbott work with for all lab data management needs that offer LIMS, SDMS, ELN solutions.","290,344",,,,,,,,,,,,,"Greater New York Area, East Coast, Northeastern US",Active,1986-01-01,year,,,,,,,,
Upper Quadrant,https://www.crunchbase.com/organization/upper-quadrant,"Upper Quadrant is an analytics, data science, and technology firm that offers predictive marketing automation, automated spreadsheets, and many other services. It also offers UQube, a web-based platform that enables its users to automate their data, processes, and reporting. Upper Quadrant was founded in 2001 and is based in Reston, Virginia.","B2B, Business Intelligence, Cloud Data Services, Data Visualization, SaaS",http://www.upperquadrant.com,"Reston, Virginia, United States",Upper Quadrant is a cloud-based application used for data collection and reporting for businesses.,"294,552",,,,,,,,,,,,,"Washington DC Metro Area, East Coast, Southern US",Active,2001-01-01,year,1,11-50,Scott Rakestraw,,,23638,USD,23638
Connect Computer,https://www.crunchbase.com/organization/connect-computer,"Connect Computer is a full-service IT solutions provider that is composed of IT professionals ready to serve businesses and enterprises. It specializes in Small-Medium Business & Enterprise Network Integration, Managed Services, SaaS, Cloud Services and Disaster Recovery & Business Continuation Solutions from our Fairfield Data Center. Its business model is free of service level agreements that only serve to benefit the vendor providing them, long-term support contracts that lock you into an agreement and tiered service plans.  It is a company of problem solvers and solution providers. It pride itself in staying a step ahead of the latest developments in information technology.","Cloud Data Services, Enterprise Software, Information Services, Information Technology, Professional Services, SaaS",http://www.connectcomputer.com,"Fairfield, Connecticut, United States",Connect Computer is a full-service IT solutions provider that is composed of IT professionals ready to serve businesses and enterprises.,"299,526",,,,,,,,,,,,,"East Coast, New England, Northeastern US",Active,1985-01-01,year,1,11-50,Chris Keenum,,,106825,USD,106825
BTI Telecom Corp.,https://www.crunchbase.com/organization/bti-telecom-corp,"BTI Telecom is an integrated communications provider (ICP) serving primarily  small and medium-sized business customers in the southeastern United States. The Company offers a full suite of integrated retail services to business customers, including local, long distance, data, Internet access, frame relay, paging, Web design and hosting, and other enhanced services.","Cloud Data Services, Outsourcing, Telecommunications",http://www.btitele.com,"Raleigh, North Carolina, United States",BTI Telecom is an integrated communications provider (ICP) serving primarily small and medium-sized business company.,"304,687",,,,,,,,,,,,,"Research Triangle, East Coast, Southern US",Active,1983-01-01,year,,11-50,,,,,,
Innate EHR,https://www.crunchbase.com/organization/innate-ehr,,"Cloud Data Services, Health Care, Information Technology",https://helloinnate.com/,"Sapulpa, Oklahoma, United States",Innate provides patient-centered healthcare tech tools that concentrate on chiropractic and expand to physical therapy and general medicine.,"310,197",,,,,,,,,,,,,Southern US,Active,2000-01-01,day,,1-10,,,,,,
Field Control Analytics,https://www.crunchbase.com/organization/field-control-analytics,,"Analytics, Cloud Data Services, Software",https://fieldcontrolanalytics.com/,"Dallas, Texas, United States",Field Control Analytics specializes in cloud-based construction and labour data analytics software solutions.,"312,573",,,,,,,,,,,,,"Dallas/Fort Worth Metroplex, Southern US",Active,2001-01-01,year,,251-500,,,,,,
Global Network Services,https://www.crunchbase.com/organization/global-network-services,"GNS specialize in fully integrated voice, hosted services and traditional on-premise equipment options, along with large access fibre based internet solutions. GNS has implemented complex applications for individual and enterprise organizations including MPLS, Co-Location and Cloud-based services, together with fully integrated IP telephony hardware and hosted services.","Cloud Data Services, Consulting, Information Services, Internet, Web Hosting",https://www.gnssolutions.net,"Orlando, Florida, United States","Global Network Services are centred around networking and video, voice, and other support and managed services.","317,405",,,,,,,,,,,,,"East Coast, Southern US",Active,1993-01-01,year,,11-50,,,,94067,USD,94067
ABM,https://www.crunchbase.com/organization/abm-82fc,,"Business Information Systems, Business Intelligence, Cloud Data Services",https://www.abmfw.com/,"Fort Wayne, Indiana, United States",ABM is a single source for business productivity solutions.,"317,437",,,,,,,,,,,,,"Great Lakes, Midwestern US",Active,1953-01-01,day,1,11-50,Elmer Maucher,,,98021,USD,98021
Servcom USA,https://www.crunchbase.com/organization/servcom-usa,"Servcom USA is an information technology and services company. They provide business networking, computer repair, and consulting services to businesses and not-for-profit organizations.","Business Development, Cloud Data Services, Cyber Security, Information Technology, Service Industry",https://www.servcomusa.com/,"Rock Hill, South Carolina, United States",Servcom USA provides business-oriented IT products and services.,"320,892",,,,,,,,,,,,,"East Coast, Southern US",Active,1999-01-01,year,,11-50,,,,236230,USD,236230
AlphaCentrix,https://www.crunchbase.com/organization/alphacentrix,"AlphaCentrix provides data management solutions, application hosting, and professional services that simplify investment operations for the world’s leading investment managers, fund administrators, and prime brokers. AlphaCentrix is based in New York, New York with offices in Dallas, Texas, Riyadh, Saudi Arabia, and Mumbai, India.","Cloud Data Services, Data Integration, FinTech, Information Technology, Outsourcing, Software",https://alphacentrix.com/,"Jersey City, New Jersey, United States","AlphaCentrix provides technology solutions to investment managers, fund administrators, and prime brokers.","321,983",,,,,,,,,,,,,"Greater New York Area, East Coast, Northeastern US",Active,2002-01-01,year,,11-50,,,,,,
Aptiva Corp,https://www.crunchbase.com/organization/aptiva-corp,,"Analytics, Cloud Data Services, Cyber Security, IT Infrastructure",https://www.aptivacorp.com/,"North Brunswick, New Jersey, United States","Aptiva Corp offers a wide range of IT Solutions such as digital banking, data analytics, cybersecurity, IT support and cloud services.","322,755",,,,,,,,,,,,,"Greater New York Area, East Coast, Northeastern US",Active,1997-01-01,year,,1001-5000,,,,557743,USD,557743
Armeta Analytics,https://www.crunchbase.com/organization/armeta-analytics,,"Analytics, Business Intelligence, Cloud Data Services, Information Technology, Predictive Analytics",https://www.armeta.com/,"Dallas, Texas, United States","Armeta Analytics specializes in business intelligence, marketing analytics, predictive analytics, and customer segmentation services.","323,418",,,,,,,,,,,,,"Dallas/Fort Worth Metroplex, Southern US",Active,1998-01-01,year,,11-50,,,,94126,USD,94126
DataTel Communications,https://www.crunchbase.com/organization/datatel-communications,,"Cloud Data Services, Information Technology, Telecommunications",https://www.datatelco.com,"Meridian, Idaho, United States","DataTel Communications provides carrier, voiceover IP solutions, cloud data, internet, and VMware services.","331,887",,,,,,,,,,,,,Western US,Active,1963-01-01,year,,11-50,,,,,,
NST Systems,https://www.crunchbase.com/organization/nst-systems,"NST Systems Inc. is based in Stamford, CT and has been providing expert IT consulting services & support services to small and medium-sized businesses in Fairfield and Westchester counties and the New York City metro area since 1994. NST’s mission is to provide “peace of mind” to our clients. Our team is made up of senior IT professionals with decades of experience, which allows our customers to receive top-tier, personalized IT service 100% of the time.","Cloud Data Services, Cloud Security, Cyber Security, Information Services, Information Technology",https://www.nstsystems.com/,"Stamford, Connecticut, United States",NST Systems providing expert IT consulting services & support services to small and medium-sized businesses.,"338,034",,,,,,,,,,,,,"East Coast, New England, Northeastern US",Active,1994-01-01,year,,11-50,,,,105075,USD,105075
Superior Solutions,https://www.crunchbase.com/organization/superior-solutions,,"Cloud Data Services, Consulting, Virtualization",https://superiorsolution.com,"Duluth, Georgia, United States","Superior Solutions delivers virtualization, PBX phone systems, cloud, network monitoring, backup and consulting services.","338,438",,,,,,,,,,,,,"Greater Atlanta Area, East Coast, Southern US",Active,2000-05-01,day,,11-50,,,,198457,USD,198457
Falkon Technologies,https://www.crunchbase.com/organization/falkon-technologies,,"Cloud Computing, Cloud Data Services, Information Technology, IT Management, Management Consulting, Software, Web Development",https://www.falkon.net,"Mckinney, Texas, United States","Falkon Technologies is a technology consulting firm offering strategic creative web development, custom application & database development.","340,691",,,,,,,,,,,,,"Dallas/Fort Worth Metroplex, Southern US",Active,1998-01-01,year,,11-50,,,,60042,USD,60042
