Organization Name,Organization Name URL,Full Description,Industries,Website,Headquarters Location,Description,CB Rank (Company),SEMrush - Monthly Visits,SEMrush - Average Visits (6 months),SEMrush - Monthly Visits Growth,SEMrush - Visit Duration Growth,SEMrush - Visit Duration,SEMrush - Page Views / Visit,SEMrush - Page Views / Visit Growth,SEMrush - Bounce Rate,SEMrush - Bounce Rate Growth,SEMrush - Global Traffic Rank,SEMrush - Monthly Rank Change (#),SEMrush - Monthly Rank Growth,Headquarters Regions,Operating Status,Founded Date,Founded Date Precision,Number of Founders,Number of Employees,Founders,Apptopia - Number of Apps,Apptopia - Downloads Last 30 Days,Aberdeen - IT Spend,Aberdeen - IT Spend Currency,Aberdeen - IT Spend Currency (in USD)
ZL Technologies,https://www.crunchbase.com/organization/zl-technologies,"Based in the heart of Silicon Valley, ZL Technologies (ZL) is an industry leader in enterprise-class information governance software.  The award-winning ZL Unified Archive:registered: is the industry’s most comprehensive information governance solution, combining eDiscovery, compliance, records management, and storage optimization under one architecture. ZL has been recognized as a Leader in Gartner’s Magic Quadrant for Enterprise Information Archiving (EIA) based on both the quality of its flagship offering and its unwavering commitment to customer satisfaction. ZL’s history, vision, and commitment to attracting and retaining the highest caliber of talent ensure that Unified Archive will be the go-to information governance solution—for Fortune 500 companies and public sector agencies with high data volumes alike—for years to come.","Cloud Data Services, Ediscovery, Email, Information Technology, Software",http://www.zlti.com,"Milpitas, California, United States",ZL Technologies develops and distributes enterprise-level software related to information governance and electronic content archiving.,"127,418","3,904","39,739.83",-28.17%,-0.62%,161,1.85,-64.21%,87.81%,36.82%,"3,784,690","794,304",26.56%,"San Francisco Bay Area, Silicon Valley, West Coast",Active,1999-01-01,year,1,101-250,Kon Leong,,,1035884,USD,1035884
Oasis Broadband,https://www.crunchbase.com/organization/oasis-broadband,,"Cloud Data Services, Consulting, Customer Service, Internet, Telecommunications",https://oasisbroadband.net,"Colfax, California, United States","Oasis Broadband provides reliable, secure broadband internet, data, and voice services to underserved remote homes, businesses.","1,329,215","3,701","3,293.67",-28.76%,"1,059.38%",371,2.66,75.48%,44.63%,-27.15%,"3,875,755","528,821",15.8%,"West Coast, Western US",Active,2002-01-01,year,,1-10,,,,,,
DART Tech,https://www.crunchbase.com/organization/dart-tech,,"Cloud Data Services, Cyber Security, Information Technology",https://dartmsp.com/,"Tampa, Florida, United States","DART Tech is a provider of technology solutions, security and services.","782,546","3,598",,,,53,1.67,,66.67%,,"3,892,976",,,"Tampa Bay Area, East Coast, Southern US",Active,1982-01-01,year,,11-50,,,,,,
RadarSync,https://www.crunchbase.com/organization/radarsync,"RadarSync develops a computer driver and software update tool. RadarSync is a world leader in PC update and data aggregation technologies. Their vision is to create a free, open community for software lovers to discover, share backup, update the software they use daily. The RadarSync brand is owned by SNG Networks, a privately owned company with 12 employees and offices located in Illinois, California, and Israel. SNG Networks' other assets include Home Radio and ComplainApp. RadarSync was founded by Noam Gordon.","Cloud Computing, Cloud Data Services, Information Technology, Software",http://www.radarsync.com,"Highland Park, Illinois, United States",RadarSync develops a computer driver and software update tool.,"1,637,020","3,562","3,761.17",-48.29%,-98.7%,1,1.03,-68.02%,96.63%,119.61%,"3,937,868","1,260,015",47.05%,"Greater Chicago Area, Great Lakes, Midwestern US",Active,2001-01-01,day,1,1-10,Noam Gordon,,,,,
Chelsio Communications,https://www.crunchbase.com/organization/chelsio-communications,"Chelsio is a technology company focused on solving high performance networking and storage challenges for virtualized enterprise data centers, cloud service installations, and cluster computing environments.   Now shipping its fourth generation protocol acceleration technology, Chelsio is delivering hardware and software solutions including Unified Wire Ethernet network adapter cards, unified storage software, high performance storage gateways, unified management software, bypass cards, and other solutions focused on specialized applications.    Chelsio is a privately-held subsystems company headquartered in Sunnyvale, California.","Cloud Data Services, Data Center, Network Security, Web Hosting",http://www.chelsio.com,"Sunnyvale, California, United States",Chelsio Communications offers high-performance networking and storage solutions for virtual data centers and cloud environments.,"156,582","3,553","14,186.67",-53.02%,-79.18%,51,1.47,-45.17%,81.26%,164.86%,"3,941,245","1,421,438",56.41%,"San Francisco Bay Area, Silicon Valley, West Coast",Active,1997-01-01,year,1,101-250,Kianoosh Naghshineh,,,,,
Asac Communications,https://www.crunchbase.com/organization/asac-communications,,"Cloud Data Services, Consulting, Information Technology, Private Cloud, Professional Services, Technical Support, Web Development",https://www.asac.as/,"Spain, Georgia, United States",ASAC Communications is a Technological Consulting company that helps Public and Private Entities to digitize.,"547,684","3,518","4,419",-56.82%,992.19%,699,12,200%,0%,0%,"3,940,606","1,639,157",71.22%,"East Coast, Southern US",Active,1997-01-01,year,,101-250,,,,,,
LANsolutions,https://www.crunchbase.com/organization/lansolutions,,"Cloud Data Services, IT Management, Security",http://www.lansolutions.net,"San Diego, California, United States","LANsolutions focuses on managed IT services, cloud services, IT support, security, backup, and recovery.","661,905","3,487","4,547.33",40.49%,-89.42%,771,2.8,179.55%,39.78%,-60.22%,"3,977,780","-625,318",-13.58%,"Greater San Diego Area, West Coast, Western US",Active,1996-01-01,day,,11-50,,,,565206,USD,565206
CSPi Technology Solutions,https://www.crunchbase.com/organization/cspi-b6ef,,"Cloud Data Services, Information Technology, IT Infrastructure, Unified Communications",https://www.cspitechsolutions.com,"Deerfield Beach, Florida, United States","CSPi Technology Solutions is an IT solution firm that offers vital managed, professional, and cloud services.","1,047,965","3,414",,"1,334.45%",,18,2.13,113.33%,14.09%,-85.91%,"4,023,628","-5,445,505",-57.51%,"Greater Miami Area, East Coast, Southern US",Active,1968-01-01,year,,101-250,,,,,,
VLC Solutions,https://www.crunchbase.com/organization/vlc-solutions,"VLC Solutions is an IT Services and IT Management Company specializing in Microsoft Dynamics 365 Business Central, E-Commerce, Business Process, Cloud Solutions, ERP Solutions, Network systems solutions and maintenance.","Cloud Data Services, E-Commerce, Enterprise Resource Planning (ERP), Information Technology",https://www.vlcsolutions.com/,"Schaumburg, Illinois, United States",VLC Solutions is serving in information technology field.,"1,035,327","3,237",,,,3,1.17,,95.64%,,"4,092,929",,,"Greater Chicago Area, Great Lakes, Midwestern US",Active,2001-01-01,year,,11-50,,,,657390,USD,657390
Digital Map Products,https://www.crunchbase.com/organization/digital-map-products,"At Digital Map Products, we provide context to the world around you with the most extensible location intelligence platform available. For more than 19 years, we’ve been on a mission to embed the power of location technology into the workflows of every business and government entity in North America, helping them make better, faster decisions.  Our location intelligence platform provides businesses and government agencies with compelling insights to make the most confident decisions.  Our Applications Powerfully visualize and analyze data with our turnkey map-based real estate applications, featuring rich content and best practice workflows. When you’re ready to grow, our extensible applications grow with you.  Our Web Services Stream the latest content into your website or application in real-time. Our robust web services ensure you always have the most current data at your fingertips.   Our Map-Ready Content Leverage nationwide parcel boundaries combined with property and tax attributes, as well as our other comprehensive, map-ready datasets – hazards, demographics, school district rankings, and more. Our Professional Services Extend the value of our platform with expert advice, design, and execution from our Consulting Services team.  Did you know? Over 350,000 users rely upon our location technology and data every day, enabling communication to millions of their customers and constituents. We update over 72 million data records every month delivering the most accurate and timely information possible. And, in aggregate, our customers access our servers via multiple data centers more than 5.0 billion times per month (that’s 8,680 times per second). We serve a global customer base with offices in the United States and Canada. For more information, visit our website at https://www.digmap.com. Want to join our growing team? Check out open positions at https://www.digmap.com/careers/open-positions.","Cloud Data Services, Geospatial, Location Based Services, PaaS, Real Estate, SaaS, Software",https://www.digmap.com,"Irvine, California, United States",We provide context to the world around you with the most extensible location intelligence platform available.,"20,486","2,774","19,054",1.17%,-92.42%,5,1.48,-0.48%,51.75%,1.47%,"4,372,043","121,309",2.85%,"Greater Los Angeles Area, West Coast, Western US",Closed,2000-10-01,month,1,101-250,James Skurzynski,4,70,1445365,USD,1445365
"Netrix IT, LLC",https://www.crunchbase.com/organization/netrix-it-llc,"Client-Driven: We believe your success equates to ours. We will go above and beyond to make sure your technology delivers value. Employee-Focused:  We are committed to continually mastering new skills to ensure quality IT support every time. Integrity-Inspired: When you work with us, we take full responsibility for our commitments and always keep your best interests at heart. Strategically Collaborative: We believe in the power of innovating as a team, and we continually encourage collaboration. Respectful and Challenging: While we treat everyone like family, we also challenge each other and confront issues with a sense of urgency.","Cloud Data Services, IT Infrastructure, Management Consulting, Network Security, Professional Services, Virtualization",http://www.netrixit.com,"Eagan, Minnesota, United States",Think for a minute about how your business runs.,"456,527","2,759",,,,143,2.43,,52.34%,,"4,483,068",,,"Greater Minneapolis-Saint Paul Area, Great Lakes, Midwestern US",Active,1988-01-23,day,1,51-100,Mike Blom,,,303165,USD,303165
ADPC,https://www.crunchbase.com/organization/adpc,"ADPC is a provider of administrative and accounting computer-based financial services in the educational sector. Their solutions include cloud, hybrid, off-site, mail-in, in-house services, and tech support. They provide trends in accounting,  activity funds, inventory, and staff development. The customer queries are addressed through phone, online form, and email.","Cloud Data Services, Software, Technical Support",https://www.adpcnet.com,"Ponca City, Oklahoma, United States",ADPC provides automated accounting solutions for public schools and career centers.,"1,564,049","2,750",,-20.63%,,0,1,-68.75%,100%,150%,"4,386,669","560,324",14.64%,Southern US,Active,1968-01-01,year,,1-10,,,,,,
thinkIT Solutions,https://www.crunchbase.com/organization/thinkit-solutions,"ThinkIT Solutions provides managed IT services for New Orleans and the surrounding areas.  ThinkIT Solutions is a full-service Information Technology management firm. ThinkIT has provided information technology services nationwide since 2001. The company believes that businesses of every size, in all industries, deserve IT services of the highest quality.","Cloud Data Services, Information Services, Information Technology",https://thinkitsolutions.com/,"New Orleans, Louisiana, United States",thinkIT Solutions works with companies to set up online security and enterprise networking.,"1,079,049","2,730","1,951.5",59.28%,-81.25%,3,1.67,-41.64%,32.67%,391.28%,"4,403,298","-557,711",-11.24%,Southern US,Active,2001-01-01,year,,11-50,,,,51212,USD,51212
LocationSmart,https://www.crunchbase.com/organization/locationsmart,"LocationSmart® is the worldwide Cloud Location Services market leader for connected devices based in Carlsbad, CA. LocationSmart is the leading provider of cloud-based location services for gaming geolocation compliance and IoT asset management. This company was founded in 1995 by Masoud Motamedi and Mario Proietti. While it is headquartered in the San Diego area, it has clients based throughout the United States and around the world, serving customers ranging from startups to Fortune 500 companies.  We offer location services for the iGaming Industry. Our location services provide geolocation compliance in the Daily Fantasy Sports, Lottery Courier, Online Poker, and Online Casino sectors.  At LocationSmart, customers can get help with context-aware, local and hyper-local applicant development. This comprehensive, location platform works across all connected device types, platforms and networks. Some of LocationSmart's customers include Fortune 500 businesses and multinational corporations. Depending on the industry, LocationSmart can help with transportation, roadside services, proximity marketing, financial transaction verification and contact centers.  The History Behind LocationSmart  Originally, LocationSmart was founded under the name of TechnoCom Corporation in 1995. Its initial goal was to help wireless carriers with their mobile location requirements. Because of its innovative products and services, Deloitte chose TechnoCom as one of the top 50 fastest growing tech companies in Los Angeles for four years in a row.  In October 2010, LocationSmart was developed as a division of TechnoCom Corporation. Since it was initially founded, LocationSmart has worked to help people and businesses around the world with location-based services. This company currently has the largest American footprint of any business for location-based services. To make user adoption even easier, the company has pioneered innovative methods for gaining privacy consent.  In 2021, LocationSmart was ranked as the best cloud-based location service provider in the world according to Corporate Vision Magazine. Their services work across 15 billion devices around the world. What Can LocationSmart Do? LocationSmart offers a powerful platform for location determination that is designed to be cloud-based. This trusted service helps to raise an organization's business intelligence by delivering additional data, improving the company's operational efficiencies and lowering overall costs. LocationSmart's location-as-a-service platform also helps companies improve their customer engagement and security. It enables location based on IP address, cell or wi-fi ID, web browser and mobile app SDK. Businesses can also use options like LocationSmart's device profile and messaging services. The messaging option allows companies to create geo-enabled SMS, in-app messages and standalone campaigns. The two-way messaging involves complete SMS management that works with more than 60 different carriers. Meanwhile, the device profile option uses the cloud to conduct real-time device verification. Because of this, the device profile can help companies validate their returning customers and halt cybercriminals. This technique uses real-time risk scoring and behavior analytics to determine which devices may pose a risk for a company's security. With the geofencing and privacy features, businesses can ensure their clients' privacy and create geo-relevant campaigns. Geofencing helps companies create a radius for providing ads and other services. With LocationSmart's privacy features, businesses can include consent controls and reminders for their users. From advanced reporting requirements to world-class security, LocationSmart offers a variety of services for modern businesses and tech companies.","Cloud Data Services, Enterprise Software, Location Based Services, Logistics, Mobile, PaaS, SaaS, Wireless",https://www.locationsmart.com,"Carlsbad, California, United States",LocationSmart® is the leading provider of cloud-based location services for gaming geolocation compliance and IoT asset management.,"55,156","2,667","4,647.17",-11.04%,"1,164.04%","1,441",2,-42.86%,50%,0%,"4,453,310","374,159",9.17%,"Greater San Diego Area, West Coast, Western US",Active,1995-01-01,year,2,11-50,"Mario Proietti, Masoud Motamedi",1,,836172,USD,836172
FaxCore,https://www.crunchbase.com/organization/faxcore,,"Cloud Data Services, Internet",https://www.faxcore.com/,"Parker, Colorado, United States","Faxcore is a provider of advanced cloud faxing services, fax servers and support.","494,795","2,592",,-32.43%,,0,1,-81.25%,100%,200.03%,"4,520,121","853,050",23.26%,"Greater Denver Area, Western US",Active,2002-01-01,day,,11-50,,,,155694,USD,155694
Innovative Management Solutions,https://www.crunchbase.com/organization/innovative-management-solutions,,"Cloud Data Services, Information Technology, Web Hosting",https://ims-web.com,"Dallas, Texas, United States","Innovative Management Solutions is an IT company that provides data center security, cloud hosting, risk management services.","1,170,055","2,566","3,374.17",694.43%,-29.59%,0,1,0%,100%,0%,"4,538,368","-3,812,907",-45.66%,"Dallas/Fort Worth Metroplex, Southern US",Active,1993-01-01,year,,11-50,,,,604749,USD,604749
Acropolis Technology Group,https://www.crunchbase.com/organization/acropolis-tech,Acropolis Technology Group is a fully managed IT solution provider for the small to medium sized business. Acropolis Technology takes a strategic approach in aligning IT with Business; empowering organizations with a staff rivaling any Fortune 500 Company.,"Cloud Data Services, Consulting, Information Technology, IT Management, Software",https://www.acropolistech.com/,"Saint Louis, Missouri, United States","The premier IT Solution provider in the St. Louis area. Hosted solutions, Managed Services, IT Support and C level IT consultants.","419,991","2,565",,,,0,1,,100%,,"4,631,932",,,Midwestern US,Active,1996-01-01,year,2,51-100,"Brad Butler, Tracy Butler",,,431146,USD,431146
KCS - Krish Compusoft Services,https://www.crunchbase.com/organization/kcspl-krish-compusoft-services-pvt-ltd,"KCS is enabling technology convergence to transform businesses with consulting, solutions, product engineering, and professional services. As a cloud and data solutions company with expertise on various technology platforms, the company helps global customers achieve digital transformation and provide smart product solutions with their tech consulting, bespoke solutions, as well as professional services. Clients across the globe can navigate their digital journey with integrated technology models, business intelligence, and next-gen tech expertise to catalyze change. Its pragmatic approach to technology with agile methodologies helps deliver unprecedented levels of solutions, service performances, and customer delight. With almost two decades of experience and more than 80% of referral business, KCS delivered with process discipline while following CMMI Level 3, ISO 27001 standards and partnering with Microsoft Gold partner, Google cloud partner, Amazon cloud partner as well as other OEMs. Krish Compusoft Services was established in Milpitas, California by Vishal Shukla in 2001.","Apps, Cloud Data Services, Consulting, Information Technology, Internet, Retail, Retail Technology, Software",http://www.kcsitglobal.com,"Milpitas, California, United States","KCS is enabling technology convergence to transform businesses with consulting, solutions, product engineering, and professional services.","161,601","2,486","4,017.17",187.4%,546.15%,575,1.96,96.38%,71.42%,-28.58%,"4,600,709","-2,096,048",-31.3%,"San Francisco Bay Area, Silicon Valley, West Coast",Active,2001-08-15,day,1,251-500,Vishal Shukla,,,,,
SSE,https://www.crunchbase.com/organization/sse-3,"Systems Service Enterprises is a  technology and training industries. The company is comprised of two core lines of business, training services and network services, and serves both commercial and government markets.  SSE’s training expertise includes front-end analysis, courseware development, and courseware revision and maintenance for government entities. Their network expertise includes IT outsourcing, IT consulting, IT project services, IT security, and cloud-based solutions. SSE is also a preferred supplier of electronic classrooms, with the capability to plan, design and deploy the necessary infrastructure to support the learning environment.","Cloud Data Services, Consulting, Cyber Security, Energy, Information Technology",http://www.SSEinc.com,"St Louis, Missouri, United States",SSE plc is a British energy company,"257,707","2,363","2,519.17",-18.88%,276.19%,0,1,0%,100%,0%,"4,792,499","505,878",11.8%,Midwestern US,Active,1966-01-01,year,1,101-250,Susan Elliott,,,1015027,USD,1015027
Adistec,https://www.crunchbase.com/organization/adistec,"Adistec, is a leading value-added distributor in Latin America and the Caribbean region, with more than 13 years of experience delivering information technology solutions.Their portfolio includes leading solutions from: VMware, Cisco, Fortinet, Dell EMC, Veritas,Veeam, Kaspersky etc. .","Cloud Data Services, CRM, Data Storage, Information Technology, Security, Virtualization",https://www.adistec.com/,"Florida, New York, United States",It is a value-added distributor.,"230,368","2,306","5,749",-42.93%,365.45%,512,1.64,-6.69%,68%,-14.94%,"4,849,335","1,112,284",29.76%,"Greater New York Area, East Coast, Northeastern US",Active,2002-01-01,year,1,251-500,Fabian Sperman,,,,,
Ontario Systems,https://www.crunchbase.com/organization/ontario-systems,"Ontario Systems, LLC is a leading provider of revenue cycle management (RCM) and accounts receivable management (ARM) software, services and solutions to the collections, healthcare and government industries. Established in 1980 and headquartered in Muncie, Ind., Ontario Systems also has a location in Vancouver, Wash., and employees in 27 states. Ontario Systems offers a full portfolio of software, services and business process expertise, including product brands such as Artiva RM™, Artiva HC™, Contact Savvy, Columbia Ultimate and RevQ. Ontario Systems customers include eight of the 10 largest ARM companies and five of the 15 largest hospital networks in the U.S. With Ontario Systems’ solutions, hospital network customers actively manage over $40 billion in receivables collectively.","Cloud Data Services, Document Management, Software",http://www.ontariosystems.com/,"Muncie, Indiana, United States",Ontario Systems is a provider of revenue cycle management.,"125,298","2,249","5,991",-63.84%,-98.77%,1,2,-33.33%,50%,-68.69%,"4,886,631","2,078,246",74%,"Great Lakes, Midwestern US",Active,1980-01-01,year,2,251-500,"Ron Fauquher, Wil Davis",,,3984236,USD,3984236
Kinetic Technology Group,https://www.crunchbase.com/organization/kinetic-technology-group,,"Cloud Data Services, Consulting, Data Storage, Information Technology",https://kinetictg.com/,"Dallas, Texas, United States","Kinetic Technology Group provides managed IT and managed security services, IT consulting services, data backup, and cloud services.","506,498","2,190",,,,497,1.37,,81.51%,,"4,926,088",,,"Dallas/Fort Worth Metroplex, Southern US",Active,1997-01-01,year,,11-50,,,,77158,USD,77158
DesignMind,https://www.crunchbase.com/organization/designmind,"DesignMind is a consulting company specializing in Databases, Business Intelligence, Big Data, Cloud, and Mobile Solutions. Our clients are in San Francisco, Silicon Valley, and the West.  We help organizations organize, maintain, understand, and optimize their data. We specialize in Application Development (web, mobile), Data Warehousing, Dashboards, Big Data, Data Science, Cloud, and Systems Integration. Our clients range from mid-sized to enterprise businesses, plus smaller companies experiencing hyper-growth. The technologies we leverage include SQL Server, Hadoop, Power BI, SharePoint, .NET, and Java  to deliver data-related services to our clients.  DesignMind's partners include Microsoft, Cloudera, MapR, Qubole, Hortonworks, Tableau, and Profisee. Industries served include High Tech, Financial Services, Food and Beverage, Biotech, Healthcare, Manufacturing, Retail, and Legal. Solutions include Data Warehouses, Enterprise Analytics Hubs, Dashboards, Reports, Custom Software, and Mobile Apps.  DesignMind also provides Data Science, Machine Learning, and data integration services.","Analytics, Big Data, Business Intelligence, Cloud Data Services, Data Integration, Data Mining, Data Visualization, Mobile Apps, Software, Web Development",http://designmind.com,"San Francisco, California, United States","Consulting firm specializing in Big Data Analytics, Business Intelligence, Custom Software Development, and Data Science","268,789","2,189","5,130.83",-74.73%,221.43%,45,1.67,-0.37%,32.57%,1.97%,"4,926,714","2,572,238",109.25%,"San Francisco Bay Area, West Coast, Western US",Active,1995-09-01,day,1,51-100,Mark Ginnebaugh,,,,,
