Organization Name,Organization Name URL,Full Description,Industries,Website,Headquarters Location,Description,CB Rank (Company),SEMrush - Monthly Visits,SEMrush - Average Visits (6 months),SEMrush - Monthly Visits Growth,SEMrush - Visit Duration Growth,SEMrush - Visit Duration,SEMrush - Page Views / Visit,SEMrush - Page Views / Visit Growth,SEMrush - Bounce Rate,SEMrush - Bounce Rate Growth,SEMrush - Global Traffic Rank,SEMrush - Monthly Rank Change (#),SEMrush - Monthly Rank Growth,Headquarters Regions,Operating Status,Founded Date,Founded Date Precision,Number of Founders,Number of Employees,Founders,Apptopia - Number of Apps,Apptopia - Downloads Last 30 Days,Aberdeen - IT Spend,Aberdeen - IT Spend Currency,Aberdeen - IT Spend Currency (in USD)
Axalume,https://www.crunchbase.com/organization/axalume,"Axalume has developed proprietary technologies that combine silicon photonic circuits with silicon electronics to solve looming interconnect bottlenecks for servers, datacenters, and high-performance computing and networking systems.  As a new, fabless semiconductor startup, theirtechnology has been critically evaluated and hailed by commercial, academic, and government institutions. They are on-track to deliver electronic-photonic integrated circuit (EPIC) chipsets to serve future datacenter and cloud computing market segments. Their products will include silicon photonics IP, chipsets, and architecture for transforming Internet data centers to make them faster, lower cost, and more space- and energy-efficient. Their technology will deliver up to a 4.5x improvement in size (density), a 3.5x improvement in energy efficiency, and a 2x improvement in latency versus currently available networking components. Our optical switching chipsets will enable datacenter operators to offer improved, faster, and more secure services to their customers with even higher scalability and efficiency.","Cloud Computing, Cloud Infrastructure, Cloud Storage, Field-Programmable Gate Array (FPGA), GPU, Semiconductor",https://axalume.com/,"La Jolla, California, United States",Axalume has developed proprietary technologies that combine silicon photonic circuits,"52,693",,,,,,,,,,,,,"Greater San Diego Area, West Coast, Western US",Active,2017-01-01,year,3,1-10,"Ashok Krishnamoorthy, Jock Bovington, Saman Saeedi",,,,,
HeartCloud,https://www.crunchbase.com/organization/heartcloud-inc,"HeartCloud is a secure web-based application that enhances the functionality of the smartwatch. The health records are represented in new ways and compare time periods to find patterns in health. Mileage durations, paddles per circuit, training patterns using mapping, workout tracking, and monitoring productivity changes. HeartCloud displays customer mobility activities and objectives.","Cloud Storage, Health Care, Internet, Medical",https://heartcloud.io,"Los Angeles, California, United States",Turn remotely-measured data into enhanced patient care and new revenue.,"75,417",,,,,,,,,,,,,"Greater Los Angeles Area, West Coast, Western US",Active,2017-01-01,year,2,1-10,"Alex Podobas, JD, Ian Cook, MD",,,,,
Blocky,https://www.crunchbase.com/organization/blocky,"Blocky helps people trust data. Our novel blockchain solution, Zipperchain, scales to millions of transactions per second with extremely low and predictable costs. It is also the most environmentally sustainable blockchain solution to date. We are a small company with a new solution in a crowded and loud industry. We are looking for early adopters who are interested in furthering the conversation around data integrity. Our solution is designed to provide data integrity at scale without the sensationalism of cryptocurrencies, tokens, or NFTs. We are the no-hype blockchain for trustworthy data.","Blockchain, Cloud Storage, Information Services",https://www.blocky.rocks/,"Bozeman, Montana, United States","Blocky helps people trust data. Our technology, Zipperchain, scales to millions of txs/second with extremely low and predictable costs.","81,428",,,,,,,,,,,,,Western US,Active,2018-01-01,day,3,1-10,"David L. Millman, Mike Wittie, Taylor Heinecke",,,,,
Maginatics,https://www.crunchbase.com/organization/maginatics,"Maginatics simplifies and modernizes enterprise storage with a software-only solution that brings the agility and economics of object storage (“cloud storage”) into the enterprise in a way that meets the most stringent security, scalability, and data accessibility requirements. Their solution addresses applications and workloads for both traditional and mobile users without disrupting existing workflows. They solve business-critical problems that include secure and scalable file sharing and collaboration, NAS transformation, and optimized migration to the cloud of scale-out workloads such as genomic analyses in the Life Sciences, render farms in Media and Entertainment, and large-scale Web server farms across industries. Maginatics was founded in 2010 and is based in Mountain View, California.","Cloud Storage, Enterprise, Enterprise Software",http://maginatics.com,"Mountain View, California, United States",Maginatics is a modern enterprise storage company developing the MagFS that brings easy and secure cloud storage to the enterprise.,"82,056",,,,,,,,,,,,,"San Francisco Bay Area, Silicon Valley, West Coast",Closed,2010-01-01,year,2,11-50,"Amarjit Gill, Jay Kistler",,,,,
CloudByte,https://www.crunchbase.com/organization/cloudbyte,CloudByte provides containerized unified storage solutions to enterprises and service providers.,"Cloud Storage, Enterprise Software, Virtualization",https://www.cloudbyte.com,"San Jose, California, United States",CloudByte provides Containerized Enterprise Storage through it's ElasiStor suite of products,"82,616",,,,,,,,,,,,,"San Francisco Bay Area, Silicon Valley, West Coast",Active,2011-11-16,day,3,51-100,"Evan Powell, Philippe Theriault, Uma Mukkara",,,,,
CloudInsyte,https://www.crunchbase.com/organization/cloudinsyte,"CloudInsyte's ""Smart Vendor Marketplace"" uses data to ethically and accurately match IT teams with the vendors and service providers that are the right fit based on their unique needs and preferences. The company is also a brokerage for cloud, software, security, and data center infrastructure. Joshua Ferry and Kate Huber established the company in Buffalo, New York in 2019.","Cloud Data Services, Cloud Infrastructure, Cloud Management, Cloud Security, Cloud Storage, Data Center, IaaS, Software",https://cloudinsyte.com,"Buffalo, New York, United States",CloudInsyte offers a platform that uses data to accelerate and simplify IT procurement decisions.,"89,201",,,,,,,,,,,,,"Great Lakes, East Coast, Northeastern US",Active,2019-01-01,year,3,11-50,"Joshua Ferry, Joshua Ferry, Katelyn Huber",,,,,
SenseLoaf,https://www.crunchbase.com/organization/senseloaf,SenseLoaf.AI helps transform your HR Tech business with SenseLoaf AI Cloud and quickly build & deploy AI use cases for the HR Industry,"Artificial Intelligence, Cloud Infrastructure, Cloud Management, Cloud Storage, Human Resources, Intelligent Systems, Machine Learning, Natural Language Processing, Private Cloud, Recruiting",https://senseloaf.ai/,"Austin, Texas, United States",AI Cloud Transformation for HR Tech,"89,511",,,,,,,,,,,,,Southern US,Active,2018-12-14,day,2,1-10,"Gautam Khurana, Prakhar Agrawal",,,,,
CCE Technologies,https://www.crunchbase.com/organization/ccm-technologies,"CCE Technologies develops IP, versus writing software based on customers' specifications. It works with customers to build products that bring clarity and order to workplace communications. They use host communication tools email systems, CRM software, VoIP lines, conferencing software, and online cloud data storage.","Cloud Storage, Customer Service, Information Technology, Software",https://cceintl.com,"Hackensack, New Jersey, United States","CCE Technologies create IP, versus writing software based on customers specification.","90,083",,,,,,,,,,,,,"Greater New York Area, East Coast, Northeastern US",Active,2013-01-01,year,2,101-250,"Pawel Kisielewski, Peter Hammond",,,,,
AirMettle,https://www.crunchbase.com/organization/airmettle,"AirMettle is a software-defined storage platform with integrated distributed parallel processing enabling direct queries of semi-structured content in storage. They can transform disparate data formats into exactly those required by analysis tools, substantially reducing network traffic.","Analytics, Cloud Storage, Software",https://airmettle.com,"Houston, Texas, United States",AirMettle develops a real-time smart data lake solution that simplifies big data analytics and accelerates processing.,"91,444",,,,,,,,,,,,,"Greater Houston Area, Southern US",Active,2021-01-01,year,,,,,,,,
Dittach,https://www.crunchbase.com/organization/dittach-,"Every year, the average email-user accumulates 5,000 email attachments & spends 180 hours on attachment-management. Dittach solves that problem with a fully-integrated Gmail plugin that elegantly & unobtrusively arrays all attachments in one browsable, searchable, configurable feed — in a sidebar in your inbox. After locating an attachment in your Dittach feed, you can manage it within our software; download, forward or print it, or view the original email to which it was attached.  For more info, please visit us online at www.dittach.com","Cloud Data Services, Cloud Management, Cloud Storage, Email, Mobile, Productivity Tools, Software, Web Apps",http://www.dittach.com,"New York, New York, United States",Cloud and email storage management platform,"99,010",,,,,,,,,,,,,"Greater New York Area, East Coast, Northeastern US",Closed,2014-06-01,day,4,1-10,"Adam Stern, Daniel Gelernter, Ivan Fan, Moshe Lifschitz",1,,,,
"Daplie, Inc.",https://www.crunchbase.com/organization/daplie,"Daplie builds hardware and software that allows for secure ownership and access to your digital life. Currently offering Cloud: an encrypted, private, secure, and social cloud system for the home and small business. Instead of data and control of connected devices being held by companies or governments, Cloud retains the encrypted data and access privileges to the connected devices and puts the owner in full control. Add stackable storage drives and an IoT unit right on top to securely manage all of your smart devices. Daplie also manages the OAuth3 protocol and provides automated domain and encryption setup through Daplie Domains.","Cloud Computing, Cloud Infrastructure, Cloud Security, Cloud Storage, Hardware, Internet of Things, Private Cloud",https://daplie.com,"Provo, Utah, United States",Daplie is laying the groundwork for a distributed Internet that is accessible to everyone.,"108,051",,,,,,,,,,,,,Western US,Closed,2015-08-12,day,3,11-50,"Alvin ONeal, Brian Bourgerie, Bryson Hill",,,,,
AppAll Mobile,https://www.crunchbase.com/organization/appall-mobile,"AppAll is a mobile platform that enables its users to store application data on the cloud. The platform enables its users to store and run incompatible Android applications. The platform provides them with remote servers that hosts and streams the app whenever required. It provides support for Android, Windows, and iOS applications. AppAll was launched in 2016.","Apps, Cloud Storage, Mobile, Private Cloud, Virtualization",http://www.appallmobile.com,"Seattle, Washington, United States",An App that allows you to store other apps remotely so they don't take up any space on your device,"170,056",,,,,,,,,,,,,"Greater Seattle Area, West Coast, Western US",Active,2016-03-01,month,2,11-50,"Natalie Vold, Pavel Astakhov",,,,,
Nubisio,https://www.crunchbase.com/organization/nubisio,"nubisio, inc. develops next generation managed cloud storage software solutions to fundamentally change the way businesses and individuals store and manage their data growth using the cloud. We deliver high performance, scalable, secure, flexible and easy to use solutions to enable business and personal applications to use cloud storage as a seamless extension of their primary storage. Our philosophy is simple: Be effective, be creative, be friendly, have fun and let’s disrupt the status quo! We are a start-up looking for individuals who share our passion for excellence, for developing technology to make businesses and people’s lives easier, and for being an agent of change in the industry.","Cloud Storage, Enterprise Software, Information Technology, Software",http://nubisio.com,"Reston, Virginia, United States",Nubisio develops managed cloud storage software solutions for businesses and individuals to manage storage growth.,"174,103",,,,,,,,,,,,,"Washington DC Metro Area, East Coast, Southern US",Closed,2011-01-01,year,4,11-50,"Daniel Birnbaum, Dror Albo, Jimmy Garcia-Meza, Yaron Laufer",,,,,
Appranix,https://www.crunchbase.com/organization/appranix,"Appranix delivers a simple and fully managed cloud application resilience service. With Appranix, cloud applications can achieve much better resilience by completely leveraging cloud platforms' native redundancy and data infrastructure. Appranix's patented technology creates a cloud time machine to deliver any cloud resource recovery at any point-in-time, in any region of the cloud with a single API call or touch of a button. Organizations leverage Appranix platform capabilities for backup and recovery, DR, HADR, cyber resilience, chaos engineering, cloud region syncing, cross-region recovery, or SOC II compliance.","Cloud Computing, Cloud Data Services, Cloud Infrastructure, Cloud Management, Cloud Storage, Information Technology, Software",https://www.appranix.com/,"Boston, Massachusetts, United States",Appranix delivers Cloud Application Resilience with an app-centric all cloud resources backup & recovery and DR,"180,360",,,,,,,,,,,,,"Greater Boston Area, East Coast, New England",Active,2016-12-19,day,1,11-50,Govind Rangasamy,,,,,
Tabania,https://www.crunchbase.com/organization/tabania,"Tabania is an American online e-commerce platform providing users to purchase and sell products. Tabania facilitates consumer-to-consumer and business-to-consumer sales through it's online platform. Operating in more than 84 countries, Tabania provides its services through websites such as Tabania.com, Tabania.ca, Tabania.in, Tabania.ru, Tabania.mx, Tabania.fr, Tabania.uk, and more, along with the mobile application for IOS and Android devices. The company was founded in 2018 and is headquartered in San Francisco, California, and has offices in other countries.","Affiliate Marketing, Cloud Storage, Developer APIs, Developer Tools, E-Commerce, Enterprise Resource Planning (ERP), Enterprise Software, Productivity Tools, Retail, Task Management",https://www.tabania.com,"San Francisco, California, United States",Tabania is an e-commerce buying & selling platform for consumers and sellers,"198,213",,,,,,,,,,,,,"San Francisco Bay Area, West Coast, Western US",Active,2018-06-22,day,1,51-100,Steven Lee,,,,,
Adept Cloud,https://www.crunchbase.com/organization/adept-cloud,"Adept Cloud, Inc. is a venture-backed provider of the industry's first cloud-managed private collaboration solution. Its adeptCloud solution enables businesses to easily collaborate internally and externally while maintaining the uncompromising security of the private cloud. Unlike existing private collaboration solutions, adeptCloud is managed in the cloud, taking the complexity out of data privacy and enabling deployment and configuration to take place in minutes not months. adeptCloud simplifies collaboration for users, who can access documents from the desktop, mobile devices or via the Web. Founded in 2011, adeptCloud is simplifying the process of collaboration on sensitive business files using multiple devices and across complex networks.","Cloud Storage, Enterprise Software, Information Technology, Security, Software",http://adeptcloud.com,"San Mateo, California, United States",Adept Cloud provides cloud-managed private collaboration solutions enabling businesses to securely collaborate internally and externally.,"219,507",,,,,,,,,,,,,"San Francisco Bay Area, Silicon Valley, West Coast",Active,2011-06-01,day,1,11-50,Frank-Robert Kline,,,,,
Guardx,https://www.crunchbase.com/organization/guardx,"Machine learning startup focused on unstructured data extraction. Providing end to end solutions for data extraction, data processing, secure data storage for banks, rating agencies, legal firms and other verticals. Based in Midtown NYC, Fairfield CT and Singapore. ","Big Data, Cloud Storage, Data Storage, Data Visualization, Machine Learning, Software",http://www.guardxinc.com,"New York, New York, United States",GuardX Inc is a Machine Learning startup that is focused on unstructured data extraction and data lifecycle.,"225,434",,,,,,,,,,,,,"Greater New York Area, East Coast, Northeastern US",Active,2015-06-01,day,1,11-50,Anand Chavan,,,,,
Memory Lane,https://www.crunchbase.com/organization/memory-lane-2,"Vision: Memory Lane reminds users of their lives and histories by using voice computing to experience popular and personal memories stored in the cloud. Mission: Memories make us who we are. As we age, we collect billions of bits of memories. Sometimes, our physical and mental health causes us to lose sight of our memories which causes us to forget who we are. Thanks to easy to use technology like voice computing, we can now access our memories easily, reminding us of the great lives we led and sharing them with the younger generations to come.  Objectives: We empower active aging and longevity using software on voice computing platforms like Amazon’s Alexa to deliver reminiscence therapy. Our application Memory Lane is available for free on the Alexa skill store and uses historic audio clips to take visitors to any year from 1906 to present day. These recordings spark memories about what happened in the user’s life within a given year. Version 2 of Memory Lane will sync to a web interface to enable creation of unique personal memories uploaded by the individual (as a digital diary) or by loved ones who share reminiscences. Strategy: We are enabling voice computing in every room in every senior care facility in America. We can do this by creating a management system for voice computing devices and A.I. applications that provide customize experiences for aging individuals. Caregivers will have the ability to conduct daily tasks with greater ease, set up scheduling tasks and engage in activities. Our flagship product, Memory Lane, is ideal to help bring families closer together around the memories of the aging individual and be used in existing memory care programs throughout the country. Action Plans: We are working with four large organizations in New York and Vermont to pilot the use of Alexa in daily operations and host Memory Lane workshops to keep care-recipients engaged with each other, their caregivers, friends, and families. Our pilot will focus on feedback from caregivers, cognitively healthy seniors, those with early dementia, and then those with dementia.  In 2017, we will develop Memory Lane V2 with subscription and also develop for Google Assistant. We will continue to curate and expand the public Memory Lane library. We are establishing partnerships to run pilot studies in senior assisted living and memory care facilities. We are raising funds to pay our coders and complete our research study on Alexa & aging.","Apps, Cloud Storage, Software",http://memorylane.ai/,"Brooklyn, New York, United States","Your memories in the cloud, powered by voice","230,551",,,,,,,,,,,,,"Greater New York Area, East Coast, Northeastern US",Active,2015-01-01,year,1,1-10,Andy Kropa,,,,,
Lingocard,https://www.crunchbase.com/organization/lingocard,"Global education network for study of any foreign languages and speaking practice.  Frequency dictionaries, English slang and idioms.  Mobile application with millions of flash cards, tools for improving vocabulary and online chatting.  Spaced repetition learning system.","Cloud Storage, Education, Information Technology, Language Learning, Mobile, Social Network, Software",https://lingocard.com,"Sunnyvale, California, United States",Global education network for study of any foreign languages and speaking practice.,"234,817",,,,,,,,,,,,,"San Francisco Bay Area, Silicon Valley, West Coast",Active,2019-08-01,month,1,11-50,Andrew Kuzmin,1,1,,,
Streamload,https://www.crunchbase.com/organization/streamload,"One of the first Internet storage services, receiving various accolades for innovative products between 2002 and 2006. Known for unlimited storage and features such as Streambeam, allowing for files to be quickly uploaded and shared with other users.","Cloud Storage, Consumer, File Sharing, Software",http://www.streamload.com,"San Diego, California, United States","One of the first Internet storage services, receiving various accolades for innovative products between 2002 and 2006.","241,660",,,,,,,,,,,,,"Greater San Diego Area, West Coast, Western US",Active,1998-01-01,year,1,51-100,Steve Iverson,,,,,
Hypersphere,https://www.crunchbase.com/organization/hypersphere-8322,HYPERSPHERE is a decentralized cybersecure network and computation platform based on diverse device types with built-in sustainable crypto-economy. ,"Blockchain, Cloud Computing, Cloud Data Services, Cloud Infrastructure, Cloud Security, Cloud Storage, Cryptocurrency, Cyber Security, Network Security",https://hypersphere.ai/,"San Francisco, California, United States",Cybersecure Network Cryptocurrency,"247,828",,,,,,,,,,,,,"San Francisco Bay Area, West Coast, Western US",Active,2011-06-01,month,1,51-100,Evgen Verzun,,,,,
Precision Computer Services,https://www.crunchbase.com/organization/precision-computer-services,,"Cloud Storage, Cyber Security, Information Technology, Project Management, Recruiting",https://precisiongroup.com/,"Shelton, Connecticut, United States","Precision Computer Services provides project management, data center, networking, cloud backup, disaster recovery & cybersecurity solutions.","257,888",,,,,,,,,,,,,"East Coast, New England, Northeastern US",Active,1989-01-01,year,1,101-250,FitzSimons Irene,,,873142,USD,873142
"VIAAS, Inc.",https://www.crunchbase.com/organization/viaas-inc,"VIAAS, formerly CudaCam by Barracuda Networks, is an integrated cloud-based video surveillance service provider, selling turn-key solutions to qualified commercial customers through channel partners, VAR’s and systems integrators.  VIAAS video surveillance as a service (VSaaS) was launched in 2008 under Barracuda Networks ownership, and was spun out as a new corporation (VIAAS, Inc.) in June 2017.   VIAAS designs and engineers the complete solution and  has cameras manufactured to its specifications through an OEM supplier arrangement.  The VIAAS platform includes proprietary cloud-camera connectivity firmware, cloud navigation, administration, video storage, playback, and data architecture. The VIAAS Secure Cloud platform is hosted on Amazon Web Services (AWS).     To date, VIAAS has delivered thousands of cameras to hundreds of SMB, education and enterprise customers, throughout the US, Canada, and Mexico. With 10 years of experience, VIAAS is among the most mature and advanced VSaaS solutions in the market and holds 3 issued U.S. patents. ","Cloud Storage, Cyber Security, Hardware, Information Technology, SaaS, Security, Video Streaming",https://viaas.com,"Campbell, California, United States","Complete Cloud Video Surveillance (VSaaS) for Commercial, Education and Government Customers.","279,401",,,,,,,,,,,,,"San Francisco Bay Area, Silicon Valley, West Coast",Active,2017-01-01,year,1,11-50,Matt Connolly,,,17779,USD,17779
CrowdStorage,https://www.crunchbase.com/organization/crowdstorage,"Crowdstorage provides Polycloud storage that helps to deliver S3-compatible cloud storage to data diligent businesses. The Polycloud architecture uses extra space on devices to build a secure, reliable, global network for cloud storage. They offer storage solutions covering everything from enterprise-grade fractioned storage for large businesses, home office solutions, and device backup for individuals.","Cloud Management, Cloud Storage, Private Cloud, Software",https://crowdstorage.com,"Lehi, Utah, United States",Crowdstorage is a platform for data centers and cloud storage.,"282,070",,,,,,,,,,,,,Western US,Active,2018-01-01,year,,1-10,,,,,,
StorSimple,https://www.crunchbase.com/organization/storsimple,"StorSimple has developed an application-optimized hybrid storage solution for SharePoint, Exchange, Windows User Files, and Virtual Machines that delivers consistent storage performance at scale, significantly simplifies data protection, and reduces cost by up to 90 percent compared to traditional enterprise storage used with these applications. StorSimple is based in Silicon Valley and is funded by Redpoint Ventures and Index Ventures.","Cloud Storage, Enterprise, Enterprise Software",http://www.storsimple.com,"Santa Clara, California, United States",StorSimple is a hybrid storage solution providing consistent storage performance and data protection for enterprise storages.,"283,521",,,,,,,,,,,,,"San Francisco Bay Area, Silicon Valley, West Coast",Active,2009-01-01,year,2,10001+,"Guru Pangal, Ursheet Parikh",,,,,
