Organization Name,Organization Name URL,Full Description,Industries,Website,Headquarters Location,Description,CB Rank (Company),SEMrush - Monthly Visits,SEMrush - Average Visits (6 months),SEMrush - Monthly Visits Growth,SEMrush - Visit Duration Growth,SEMrush - Visit Duration,SEMrush - Page Views / Visit,SEMrush - Page Views / Visit Growth,SEMrush - Bounce Rate,SEMrush - Bounce Rate Growth,SEMrush - Global Traffic Rank,SEMrush - Monthly Rank Change (#),SEMrush - Monthly Rank Growth,Headquarters Regions,Operating Status,Founded Date,Founded Date Precision,Number of Founders,Number of Employees,Founders,Apptopia - Number of Apps,Apptopia - Downloads Last 30 Days,Aberdeen - IT Spend,Aberdeen - IT Spend Currency,Aberdeen - IT Spend Currency (in USD)
Seagate Technology,https://www.crunchbase.com/organization/seagate,"Seagate offers consumers and businesses with data storage solutions to create, share, and preserve digital content. It designs, develops, and manufactures external and internal hard disk drives and associated software products. It sells its disk drives primarily to major original equipment manufacturers (OEMs), distributors, and retailers. The company produces a range of disk drive products addressing enterprise applications, where its products are designed for enterprise servers, mainframes, and workstations; client compute applications, where its products are designed for desktop and notebook computers; and client non-compute applications, where its products are designed for a range of end user devices such as digital video recorders (DVRs), personal data backup systems, portable external storage systems, and digital media systems. In addition to manufacturing and selling disk drives, it provides data storage services for small- to medium-sized businesses, including online backup, data protection, and recovery.","Cloud Storage, Consumer Electronics, Data Storage, Flash Storage, Hardware, Information Services, Manufacturing, Software",http://www.seagate.com,"Cupertino, California, United States","Seagate offers consumers and businesses with data storage solutions to create, share, and preserve digital content.","87,197","4,202,052","4,036,220.67",-13.52%,53.76%,429,2.6,7.8%,56.15%,-3.65%,"35,492","6,801",23.7%,"San Francisco Bay Area, Silicon Valley, West Coast",Active,1979-01-01,year,2,10001+,"Alan Shugart, Finis Conner",26,"1,066",,,
Syncplicity,https://www.crunchbase.com/organization/syncplicity,"[Syncplicity](http://www.syncplicity.com/) provides file synchronization, back-up, and sharing. The service allows users to protect files with real-time backups and to share their files with others. Syncplicity offers unlimited storage and offers one click syncing and sharing.","Aerospace, Cloud Storage, Enterprise Software, Information Technology, Software",http://www.syncplicity.com,"Santa Clara, California, United States","Syncplicity is an enterprise-grade cloud file storage platform providing backup, sharing and synchronization solutions.","172,295","3,483,152","1,733,797.5",304.89%,83.85%,"3,074",13.37,47.91%,21.89%,12.2%,"41,209","-70,295",-63.04%,"San Francisco Bay Area, Silicon Valley, West Coast",Active,2007-01-01,year,2,11-50,"Isaac Hall, Leonard Chung",2,4,,,
Vultr Holdings Corporation,https://www.crunchbase.com/organization/vultr-holdings-llc,"Vultr, the Independent Cloud, provides developers and businesses around the world with easy-to-use, high-performance cloud infrastructure at a fraction of the cost of the Big Tech clouds. Featuring virtualized Cloud Compute, Bare Metal, and managed Kubernetes, Vultr has enabled over a million customers to run applications on an elastically scalable cloud that delivers industry-leading price-performance. Many customers prefer Vultr because it offers more than 20 data center locations, across 5 continents, allow them to minimize latency by placing computing power close to end users. Vultr is profitable, privately owned, and part of The Constant Company, LLC. Vultr Holdings was founded in 2014 by David Aninowsky with offices in Central New Jersey and South Florida.    We're hiring!  Join our team today at vultr.com/company/careers/","Cloud Computing, Cloud Infrastructure, Cloud Storage, Web Hosting",https://www.vultr.com,"West Palm Beach, Florida, United States","Vultr, the Independent Cloud, provides developers and businesses with powerful cloud infrastructure at an unbeatable price.","86,236","2,560,197","2,627,488.67",0.67%,14.38%,827,4.58,-2.3%,47.28%,-2.78%,"53,678","1,177",2.24%,"Greater Miami Area, East Coast, Southern US",Active,2014-01-01,year,1,101-250,David Aninowsky,,,,,
VPSie,https://www.crunchbase.com/organization/vpsie,"VPSie is a powerful, resilient cloud hosting ecosystem, supporting Linux common flavors, Windows server platforms as well as pre-made one-click apps. The industry serves a diverse and global customer base including; entrepreneurs, students, start-ups, and established businesses and developer types all over the world.","Cloud Data Services, Cloud Storage, Internet",https://www.vpsie.com,"Staten Island, New York, United States",VPSie is the automation hosting provider that delivers cloud hosting.,"213,735","1,493,450","1,391,489.5",118.88%,2.35%,"3,617",6.18,1.66%,38.86%,-15.17%,"81,240","-59,095",-42.11%,"Greater New York Area, East Coast, Northeastern US",Active,2014-01-01,year,,1-10,,,,,,
STACKPATH,https://www.crunchbase.com/organization/stackpath,"StackPath is a cloud platform built at the internet’s edge, providing infrastructure and services physically closer to the source or destination of data than hyperscale cloud service providers. StackPath Edge Compute (including virtual machines and containers), Edge Delivery (including CDN and serverless scripting), and Edge Security (including WAF) solutions run in edge locations strategically deployed in high-density markets and united by a secure global network and a single management system. Customers ranging from Fortune 50 enterprises to one-person startups trust StackPath to give their latency-sensitive workloads and real-time applications the speed, security, and efficiency they require. StackPath was founded in 2015, is headquartered in Dallas, and operates around the world.","Cloud Computing, Cloud Data Services, Cloud Infrastructure, Cloud Management, Cloud Security, Cloud Storage, Internet, Private Cloud",https://www.stackpath.com/,"Dallas, Texas, United States","Edge computing, edge delivery, & edge security solutions, enabling businesses to build, accelerate, & protect latency-sensitive workloads.","22,543","1,245,319","637,086.5",307.58%,69.28%,"1,102",5.13,39.52%,17.64%,-42.43%,"93,475","-156,613",-62.62%,"Dallas/Fort Worth Metroplex, Southern US",Active,2015-01-01,year,4,251-500,"James Leaverton, Jason Gulledge, Lance Crosby, Ryan Carter",,,3056185,USD,3056185
Reflected Networks,https://www.crunchbase.com/organization/reflected-networks,,"Cloud Storage, Information Technology, Web Hosting",https://reflected.net,"Longwood, Florida, United States","Reflected Networks provides cloud storage, managed hosting, and custom hosting services.","280,298","1,239,472","996,060.5",20.46%,65.11%,459,3.02,19.23%,17.82%,-16.14%,"90,626","-6,672",-6.86%,"East Coast, Southern US",Active,2001-01-01,year,,11-50,,,,,,
SeamlessDocs,https://www.crunchbase.com/organization/seamlessdocs,"SeamlessDocs empowers governments to go paperless and deliver better online services to citizens and staff. They specialize in form automation software and offer solutions to help governments go digital, deliver online services, and automate business processes. To date, SeamlessDocs has worked with hundreds of local and state agencies across the US, allowing millions of citizens to submit online forms from any browser or device with eSignatures, payments, and attachments. By providing governments with the tools to digitize their paper processes, the company hopes to shed light on its mission statement: ""Government is Beautiful.""","Cloud Storage, Enterprise Software, Government, GovTech, Information Technology, Software",https://www.SeamlessDocs.com,"New York, New York, United States",SeamlessDocs is no-code platform for form automation and eSignatures that governments use to digitize PDFs and optimize online services.,"14,335","1,236,730","792,894.5",90.67%,6.8%,424,1.77,-7.17%,72.08%,37.79%,"93,687","-51,863",-35.63%,"Greater New York Area, East Coast, Northeastern US",Active,2011-07-15,day,2,11-50,"Chachi Camejo, Jonathon Ende",,,42228,USD,42228
IDrive Inc.,https://www.crunchbase.com/organization/idrive-inc,"IDrive Inc. is a privately held company specializing in cloud storage, online backup, file sharing, remote access, compliance and related technologies. Core services include IDrive®, RemotePC™ and IBackup. The company's services help over 4 million customers back up over 500 Petabytes of data.","Cloud Data Services, Cloud Storage, Compliance, Flash Storage, Internet, Meeting Software, Security, Software",http://www.idrive.com,"Calabasas, California, United States",Cloud Backup provider allowing users to backup unlimited devices into a single account. Services offered include IDrive e2 and RemotePC.,"127,895","976,397","909,630.5",17.44%,33.49%,837,3.5,-6.7%,47.73%,10.41%,"111,684","-9,746",-8.03%,"Greater Los Angeles Area, West Coast, Western US",Active,1995-01-01,year,1,251-500,Raghu Kulkarni,21,"1,402",623491,USD,623491
MobiSystems,https://www.crunchbase.com/organization/mobisystems,"MobiSystems has been a leading provider of mobile productivity and business applications for over 20 years. Our solutions extend the usability of mobile devices across platforms, allowing for enhanced desktop-grade productivity regardless of location. As the developer of the award winning mobile app OfficeSuite, MobiSystems serves over 500 million individual and enterprise users in 195 countries. OfficeSuite leads app downloads and ratings in Google Play, Amazon App Store and Samsung Apps, as well as Apple's App Store.","Cloud Storage, Enterprise Software, Information Technology, Mobile Apps, Productivity Tools, Software",https://www.mobisystems.com/,"San Diego, California, United States",MobiSystems has been a leading provider of mobile productivity and business applications for over 20 years.,"166,660","825,621","1,313,971",-23.82%,34.94%,363,1.89,6.5%,46.99%,-21.6%,"122,033","28,532",30.52%,"Greater San Diego Area, West Coast, Western US",Active,2001-01-01,day,4,101-250,"Dimitar Mitev, Dimitar Mitev, Stanislav Minchev, Steve Gogov",,,50673,USD,50673
Middlespot,https://www.crunchbase.com/organization/middlespot,"Manage links, docs, feeds, images, videos, plugins and more on a visual desktop synced with Google Drive. Spend less time looking and more time doing. We rely on our digital resources when we're running a project or just managing our daily routines. But we've found bookmarking tedious, cloud drives linear, and other apps trying to do too much. It doesn't need to be this way. Imagine an enormous, borderless webpage, where you are free to group, cluster, and arrange digital resources that are most important to you. That's middlespot, the best way to keep the important resources we want always at our fingertips, organized how we work. Middlespot is free to use.","Cloud Storage, Productivity Tools, Search Engine, Visual Search",http://middlespot.com,"Bonita Springs, Florida, United States",Middlespot is an interactive content creation platform for designers.,"231,495","591,878","206,681.67",191.34%,"59,100%",592,1.33,13.61%,74.95%,-10.06%,"155,425","-154,051",-49.78%,"East Coast, Southern US",Active,2016-03-25,day,1,1-10,Scott Brownlee,,,,,
Teradata,https://www.crunchbase.com/organization/teradata,"Teradata is the connected multi-cloud data platform for enterprise analytics company. Our enterprise analytics solve business challenges from start to scale. Only Teradata gives you the flexibility to handle the massive and mixed data workloads of the future, today. Teradata offers analytic data platforms, applications, and services for data warehousing and analytic technologies. The company was founded in January 1979 and is globally headquartered in San Diego, California.","Analytics, Big Data, Business Intelligence, Cloud Data Services, Cloud Storage, Consulting, Marketing, Private Cloud, SaaS, Software",https://www.teradata.com,"San Diego, California, United States",Teradata is the connected multi-cloud data platform company. Our enterprise analytics solve business challenges from start to scale.,"83,879","517,688","459,339.33",10.26%,88.48%,720,2.9,29.29%,53.18%,-12.98%,"177,644","-5,739",-3.13%,"Greater San Diego Area, West Coast, Western US",Active,1979-01-01,day,7,5001-10000,"Carroll Reed, David Hartke, Jack Shemer, Jerold Modes, Philip Neches, Walter Muir, William Worth",12,,5373,USD,5373
Playbook,https://www.crunchbase.com/organization/playbook-com,"Playbook, as a beautiful, organized home base for all creative work. For teams, Playbook makes it easy to share, and collaborate on visual projects; and for freelancers, Playbook makes collaborating with clients and sharing their work with the world totally seamlessly. Playbook runs on advanced and intelligent technology. It automatically imports, tags, categorizes your entire media library, in minutes.","Cloud Storage, Digital Marketing, Digital Media, Graphic Design, Productivity Tools",http://playbook.com/,"San Francisco, California, United States",Playbook organize your creative files visually and intelligently.,"7,523","411,492","239,104",54.29%,67.43%,735,2.97,56.55%,42.11%,-28.86%,"200,999","-56,030",-21.8%,"San Francisco Bay Area, West Coast, Western US",Active,2020-01-03,day,2,1-10,"Alex Zirbel, Jessica Ko",,,,,
Dell EMC,https://www.crunchbase.com/organization/emc,"Dell EMC is a part of the Dell Technologies family of brands.  Dell Technologies is a unique family of businesses that provides the essential infrastructure for organizations to build their digital future, transform IT and protect their most important asset: information. The company services customers of all sizes across 180 countries – ranging from 98 percent of the Fortune 500 to individual consumers – with the industry's most comprehensive and innovative portfolio from the edge to the core to the cloud. Dell EMC is a global leader in enabling businesses and service providers to transform their operations and deliver information technology as a service (ITaaS). Fundamental to this transformation is cloud computing. Through innovative products and services, Dell EMC accelerates the journey to cloud computing, helping IT departments to store, manage, protect and analyze their most valuable asset — information — in a more agile, trusted and cost-efficient way. Dell EMC is a manufacturer of software and systems for information management and storage. Dell EMC produces a range of enterprise storage products, including hardware disk arrays and storage management software. Its flagship product, the Symmetrix, is the foundation of storage networks in many large data centers.","Cloud Computing, Cloud Infrastructure, Cloud Management, Cloud Security, Cloud Storage, Collaboration, Data Storage, IT Infrastructure, Software, Virtualization",https://www.dellemc.com/,"Hopkinton, Massachusetts, United States",DEll EMC manufactures information management and storage software systems.,"121,101","394,040","533,833.67",-17.75%,193.85%,526,1.32,-17.56%,88.19%,9.92%,"207,187","36,662",21.5%,"Greater Boston Area, East Coast, New England",Closed,1979-01-01,year,1,10001+,Roger Marino,11,,,,
ownCloud,https://www.crunchbase.com/organization/owncloud,"ownCloud is the company behind the ownCloud project – the most downloaded open source project for data and file sync, share and view. ownCloud enables businesses to host their own, on premises or remote, cloud storage while maintaining regulatory and compliance needs. Located in Boston, Massachusetts with an international office in Germany we offer your cloud with your data – your way!","Cloud Storage, Enterprise Software, Open Source",http://owncloud.com,"Lexington, Massachusetts, United States","ownCloud, an open-source project that enables businesses to host their own cloud storage while maintaining regulatory and compliance needs.","41,013","391,141","399,264",-4.55%,-66.73%,367,2.12,-22.74%,55.79%,11.02%,"216,265","14,708",7.3%,"Greater Boston Area, East Coast, New England",Active,2011-01-01,year,3,101-250,"Frank Karlitschek, Holger Dyroff, Markus Rex",2,0,118919,USD,118919
Ubidots,https://www.crunchbase.com/organization/ubidots,"Ubidots specialized in connected hardware and software solutions to remotely monitor, control, and automate processes for healthcare clients at well funded startups and Fortune 1,000s in the American Southeast and across Latin America. Between 2012 and 2014, Ubidots expanded their support industries and accomplished countless internet connected projects across – Healthcare, Energy / Utilities, Manufacturing, Transportation, and Retail – learning the many small characteristics of IoT and Cloud enablement that digital transformation experts cannot speak to unless they have gotten their hands dirty in the field. With a strong backbone and a steadfast determination to be more than another Latin American “copy-cat,” Ubidots joined the Boston MassChallenge Accelerator in 2014, pivoting into a global product-based cloud IoT startup, gaining US venture and support and leaving behind the local services business. Since Ubidots pivot in 2014, Ubidots has become known within hardware, software, embedded engineering, and maker circles as the affordable, reliable, and most useable platform in an IoT platform ecosystem filled with strong competition.","Analytics, Cloud Storage, Data Visualization, Developer Platform, Internet of Things, Software",https://ubidots.com,"Doral, Florida, United States",Ubidots is an Internet of Things (IoT) application builder with data analytics and visualization.,"180,267","361,694","335,392.33",-25.79%,-11.44%,"1,339",2.78,-38.88%,55.55%,47.82%,"219,999","51,490",30.56%,"Greater Miami Area, East Coast, Southern US",Active,2013-06-01,month,4,11-50,"Agustin Pelaez, Gustavo Andrés Angulo, Juan Pablo Velasquez, Sergio Marin",,,,,
BitWits,https://www.crunchbase.com/organization/bitwits,,"Cloud Storage, Information Technology, Network Hardware",https://www.bitwits.com/,"Phoenix, Arizona, United States","BitWits is an information technology and services company that provides Broadband Connections, Network Installation & Cloud Storage.","1,856,000","356,280","78,141.5",516.64%,50%,21,2.25,27.18%,35%,-43.13%,"230,723","-531,278",-69.72%,"Greater Phoenix Area, Western US",Active,1997-01-01,year,,1-10,,,,,,
MinIO,https://www.crunchbase.com/organization/minio-inc,"MinIO is a high-performance, Kubernetes-native object store. Optimized for cloud-native workloads, MinIO is completely compatible with S3, inside AWS or on other public and private clouds and Kubernetes distributions. Enterprises use MinIO to deliver against ML/AI, analytics, backup and archival workloads - all from a single platform. MinIO is open sourced under the GNU AGPL v3 license.","Big Data, Cloud Storage, Data Center, Internet, Open Source, Software",https://www.min.io,"Redwood City, California, United States","MinIO offers high-performance, S3 compatible object storage for multi-cloud architectures. Software-defined, cloud-native + 100% opensource.","3,273","327,636","313,345.83",6.03%,-40.81%,441,1.66,-14.49%,70.47%,7.26%,"244,597",-902,-0.37%,"San Francisco Bay Area, Silicon Valley, West Coast",Active,2014-11-22,day,4,51-100,"Anand Babu Periasamy, Frederick Kautz, Garima Kapoor, Harshavardhana .",,,,,
Schedule360,https://www.crunchbase.com/organization/schedule360,Schedule360 offers software solutions to optimize staffing and employee scheduling for organizations.,"Cloud Storage, Software, Web Apps",https://schedule360.com/,"Grandville, Michigan, United States",Schedule360 offers software solutions to optimize staffing and employee scheduling for organizations.,"564,665","277,578","293,020.67",20.87%,98.58%,697,10.92,-7.22%,40.83%,23.35%,"264,559","-20,398",-7.16%,"Great Lakes, Midwestern US",Active,2000-01-01,year,1,11-50,Tony Torti,,,,,
Bublup,https://www.crunchbase.com/organization/bublup,"Save everything in visual folders.  Invite your friends to share and collaborate.  Find out what's bubbling up for you!  Bublup supercharges your productivity and unleashes your full creative potential because all your information is in one place, organized and displayed the way you want, whether you’re using Bublup for business, teaching, or personal use.","Cloud Storage, Education, Information Technology, Internet, Productivity Tools, Social Bookmarking, Software",https://www.bublup.com/,"Arlington, Virginia, United States",Insta-organize anything.,"152,526","234,344","189,217.83",27.49%,-38.48%,542,3.32,62.11%,52.92%,-14.19%,"308,254","-42,588",-12.14%,"Washington DC Metro Area, East Coast, Southern US",Active,2014-01-01,year,2,11-50,"Alain Cohen, Marc Cohen",,,,,
Iron Mountain,https://www.crunchbase.com/organization/iron-mountain,"Iron Mountain Incorporated provides information protection and storage, and related services for various media in North America, Europe, Latin America, and Asia Pacific. The company's services comprise records management, data protection and recovery, and information destruction. The records management services include records management program development and implementation to help customers comply with specific regulatory requirements; implementation of policy-based programs that feature secure storage for media consisting of paper, flexible retrieval access, and retention management; digital archiving and related services for secure long-term archiving of electronic records; and specialized services for vital records and regulated industries, such as healthcare, energy, and financial services. The data protection and recovery services comprise disaster preparedness, planning, support and secure, and off-site vaulting of data backup media for data recovery in the event of a disaster, human error, or virus; online backup and recovery solutions for desktop and laptop computers and remote servers; and technology escrow services to protect and manage source code and other proprietary information. The information destruction services include secure shredding services; and DataDefense, which provides automatic and intelligent encryption of sensitive PC data. The company also sells corrugated cardboard storage cartons; and provides consulting, facilities management, fulfillment, and other outsourcing services. It serves commercial, legal, banking, healthcare, accounting, insurance, entertainment, and government organizations. The company was founded in 1951 and is headquartered in Boston, Massachusetts.","Big Data, Cloud Storage, Digital Signage, Information Services, Security, Software",http://www.ironmountain.com,"Boston, Massachusetts, United States",Iron Mountain provides online backup and data protection.,"3,587","187,541","291,783.17",-28.1%,-52.49%,334,1.79,-14.21%,54.34%,-7.41%,"346,125","85,069",32.59%,"Greater Boston Area, East Coast, New England",Active,1951-01-01,year,1,10001+,Herman Knaust,,40,50653702,USD,50653702
Sortly,https://www.crunchbase.com/organization/my-things-app,"Sortly make it easy for you (or your team) to see what you have, where it it and who has it. Our innovative system enables you to VISUALLY track your items and any of their details for a more intuitive (and less maddening) way to track your things across multiple locations.  Featured by 100+ leading media outlest including ABC, FOX, The New York Times and Forbes. #1 Ranked and rated Inventory app on the App store and Google Play store. With over 5 million items organized.","Android, Business Information Systems, Cloud Storage, Collectibles, Consumer Software, Embedded Systems, Home and Garden, iOS, Mobile, Productivity Tools, SaaS, Small and Medium Businesses, Software, Web Apps",http://sortly.com/business,"Redwood City, California, United States","Sortly is the leading ""mobile centric"" inventory platform that is simplifying how businesses and consumers keep track of their stuff.","125,818","184,614","802,896.5",-91.26%,-87.21%,757,2.21,-52.77%,65.69%,167.9%,"363,549","302,927",499.7%,"San Francisco Bay Area, Silicon Valley, West Coast",Active,2013-09-23,day,1,1-10,Dhanush Balachandran,,,,,
Wasabi Technologies,https://www.crunchbase.com/organization/wasabi-technologies-inc,"Wasabi provides simple, predictable and affordable hot cloud storage for businesses all over the world. It enables organizations to store and instantly access an unlimited amount of data at 1/5th the price of the competition with no complex tiers or unpredictable egress fees. Trusted by tens of thousands of customers worldwide, Wasabi has been recognized as one of technology’s fastest-growing and most visionary companies. Created by Carbonite co-founders and cloud storage pioneers David Friend and Jeff Flowers, Wasabi has secured $495 million in funding to date and is a privately held company based in Boston.","Cloud Computing, Cloud Data Services, Cloud Storage, Database, Information Technology",http://www.wasabi.com,"Boston, Massachusetts, United States",Wasabi is a cloud storage company delivering cost effective and secure cloud storage solutions.,"1,829","179,609","351,501",-62.6%,154.77%,614,1.86,21.81%,64.14%,-18.16%,"356,445","186,178",109.34%,"Greater Boston Area, East Coast, New England",Active,2015-01-01,year,2,101-250,"David Friend, Jeff Flowers",,,1203817,USD,1203817
