Organization Name,Organization Name URL,Full Description,Industries,Website,Headquarters Location,Description,CB Rank (Company),SEMrush - Monthly Visits,SEMrush - Average Visits (6 months),SEMrush - Monthly Visits Growth,SEMrush - Visit Duration Growth,SEMrush - Visit Duration,SEMrush - Page Views / Visit,SEMrush - Page Views / Visit Growth,SEMrush - Bounce Rate,SEMrush - Bounce Rate Growth,SEMrush - Global Traffic Rank,SEMrush - Monthly Rank Change (#),SEMrush - Monthly Rank Growth,Headquarters Regions,Operating Status,Founded Date,Founded Date Precision,Number of Founders,Number of Employees,Founders,Apptopia - Number of Apps,Apptopia - Downloads Last 30 Days,Aberdeen - IT Spend,Aberdeen - IT Spend Currency,Aberdeen - IT Spend Currency (in USD)
Voice Assist,https://www.crunchbase.com/organization/voice-assist,"Voice Assist is a hosted speech applications company focused on enabling access to any information through any device using speech technology. There award-winning technology allows consumers and business clients to use simple voice commands to dial, email, text or post to social networks. The company offers private labeled versions to wireless and wireline carriers, as well as marketing companies. Voice Assist functionality powers many new service offerings, including a safe driving application that enables drivers to keep their eyes on the road rather than on the phone. Maximizing driving safety and improving personal productivity are just a few of its many benefits.","Cloud Data Services, Information Technology, Messaging, Mobile, Software, Speech Recognition, Telecommunications",http://www.voiceassist.com,"Lake Forest, California, United States",Voice Assist is a hosted speech applications company enabling access to any information through any device using speech technology.,"861,125",,,,,,,,,,,,,"Greater Los Angeles Area, West Coast, Western US",Active,2002-01-01,year,,11-50,,,,,,
Proteam Technologies,https://www.crunchbase.com/organization/proteam-technologies,,"Apps, Cloud Data Services, Information Technology, Software",https://proteaminc.com,"Phoenix, Arizona, United States","Proteam Technologies is an IT company that provides cloud migration, app modernization, business integration, platform deployment services.","861,892",,,,,,,,,,,,,"Greater Phoenix Area, Western US",Active,2002-01-01,year,,1-10,,,,,,
FTS Telecom,https://www.crunchbase.com/organization/fts-telecom,"FTS is a cloud-based phone service provider to run the business efficiently. They are providing phones with conference and video calling options, call recording options, and some other options for business purposes.","Business Development, Cloud Data Services, Telecommunications, Wireless",https://www.ftstelecom.com/,"Longwood, Florida, United States",FTS is a cloud based phone service provider to run business from anywhere.,"864,265",,,,,,,,,,,,,"East Coast, Southern US",Active,1997-01-01,year,,11-50,,,,57146,USD,57146
AccTech consulting,https://www.crunchbase.com/organization/acctech,,"Accounting, Cloud Data Services, Software",https://www.acctech.com,"Aldie, Virginia, United States","AccTech consulting enhances business operations and technologies with outsourcing, cloud accounting and software analysis services.","871,010",,,,,,,,,,,,,"Washington DC Metro Area, East Coast, Southern US",Active,1997-01-01,year,,1-10,,,,,,
Advanced Classroom Technologies,https://www.crunchbase.com/organization/advanced-classroom-technologies-4671,"Advanced Classroom Technologies is dedicated to providing educational technology solutions for classrooms and professional development programs for teachers in an effort to make the classroom environment a productive, engaging place for teachers and students.","Cloud Data Services, Education, Software",https://www.advclasstech.com,"Arlington, Washington, United States",Advanced Classroom Technologies is dedicated to providing educational technology solutions for classrooms and professional development.,"876,477",,,,,,,,,,,,,"Greater Seattle Area, West Coast, Western US",Active,1995-01-01,year,,11-50,,,,170902,USD,170902
SOS,https://www.crunchbase.com/organization/solutions-oriented-systems,,"Cloud Data Services, IT Management, Management Consulting, Professional Networking",http://www.sosinc.com,"Seattle, Washington, United States","SOS is an IT firm that delivers network installation, system monitoring, conferencing and cloud storage solutions.","877,148",,,,,,,,,,,,,"Greater Seattle Area, West Coast, Western US",Active,1996-01-01,day,1,1-10,Mohammad R. Khorasani,,,,,
Soft Skills,https://www.crunchbase.com/organization/soft-skills-81a2,,"Cloud Data Services, CRM, Information Technology, Software",https://www.softskills.com,"Hoboken, New Jersey, United States",Soft Skills provides CRM solutions for cloud and SaaS technologies.,"879,599",,,,,,,,,,,,,"Greater New York Area, East Coast, Northeastern US",Active,1993-01-01,year,,1-10,,,,,,
Uptime Consulting,https://www.crunchbase.com/organization/uptime-consulting,"Uptime Consulting is a company's IT infrastructure, but also to be proactive in IT support and prevent problems from occurring. They are proficient in all major computing architectures and platforms, including windows, linux, and macintosh in both server and workstation environments. They are engaged in medical disciplines and have contracts with many physician, dental, and health insurance companies.","Cloud Data Services, IT Infrastructure, Network Security",https://calluptime.com,"Albany, New York, United States",Uptime Consulting is an IT company that offers security and cloud based services.,"882,957",,,,,,,,,,,,,"East Coast, Northeastern US",Active,2000-01-01,year,,1-10,,,,,,
Kinetic Technology Solutions,https://www.crunchbase.com/organization/kinetic-technology-solutions,,"Cloud Data Services, Consulting, Software, Training",https://www.kinetictraining.com/,"Portland, Oregon, United States","Kinetic Technology Solutions specializes in the design, development, delivery, and management of corporate training programs and services.","891,219",,,,,,,,,,,,,"West Coast, Western US",Active,1987-01-01,year,,11-50,,,,,,
Mercury Communication Services of Austin,https://www.crunchbase.com/organization/mercury-communication-services-of-austin,,"Cloud Data Services, Telecommunications",https://www.mercury-austin.com,"Austin, Texas, United States","Mercury Communication Services of Austin is a telecommunication company that provides cabling, cloud-based services, and technology.","891,555",,,,,,,,,,,,,Southern US,Active,1991-01-01,year,,11-50,,,,,,
Agency Technologies,https://www.crunchbase.com/organization/ati-44d0,,"Cloud Data Services, Information Technology, Software",http://www.agencytech.com,"Cincinnati, Ohio, United States","ATI is an IT company that provides cloud solutions, network management and software development services.","897,360",,,,,,,,,,,,,"Great Lakes, Midwestern US",Active,1997-01-01,year,,1-10,,,,,,
Key Solutions,https://www.crunchbase.com/organization/key-solutions-c529,,"Cloud Data Services, Computer, Information Technology, Software",https://www.keysol.com,"Cold Spring, Kentucky, United States","Key Solutions provides network design, cloud solutions, print, backup & recovery, software, and IT staffing services.","898,409",,,,,,,,,,,,,Southern US,Closed,1990-01-01,year,,11-50,,,,,,
Internetwerx,https://www.crunchbase.com/organization/internetwerx,,"Cloud Data Services, Information Technology",https://www.internetwerx.com,"Dallas, Texas, United States","Internetwerx is a company which provides IT Consulting, Server Management, Network Management, Cybersecurity Consulting & Cloud Services.","899,617",,,,,,,,,,,,,"Dallas/Fort Worth Metroplex, Southern US",Active,1990-01-01,year,,1-10,,,,142426,USD,142426
PPI Business Services,https://www.crunchbase.com/organization/ppi-a4f0,,"Cloud Data Services, Financial Services, Human Resources",https://www.ppibusinessservices.com,"Fresno, California, United States","PPI Business Services offers HCM cloud technology, talent management services, payroll tax solutions for companies & financial institutions.","901,896",,,,,,,,,,,,,"West Coast, Western US",Active,1981-01-01,day,,101-250,,,,,,
Settlement Management Solution,https://www.crunchbase.com/organization/settlement-management-solution,"SMS facilitates docuSign integrates with streamline, Their integration enables to upload and track electronic signature documents without leaving StreamLine.","Cloud Computing, Cloud Data Services, Cloud Infrastructure, Cloud Management, Customer Service, Software",https://www.smscorp.com/about/,"Irvine, California, United States",SMS is customer-focused software to simplify the real estate closing process.,"909,224",,,,,,,,,,,,,"Greater Los Angeles Area, West Coast, Western US",Active,1111-01-01,year,,1-10,,,,,,
Innovative411,https://www.crunchbase.com/organization/innovative411,,"Cloud Data Services, Hardware, Information Technology, Software",http://wesolvethat.com/,"Chino, California, United States","Innovative411 provides solutions to make your Home and Business smarter & more efficient that can automate lighting, HVAC, security, audio.","911,376",,,,,,,,,,,,,"Greater Los Angeles Area, Inland Empire, West Coast",Active,1995-01-01,year,,1-10,,,,61540,USD,61540
DevSelect,https://www.crunchbase.com/organization/devselect,,"Cloud Data Services, Cyber Security, Professional Services, Software",https://www.devselect.com,"Seattle, Washington, United States","DevSelect is a software company that provides DevOps, cloud, cyber security, and team building services.","915,009",,,,,,,,,,,,,"Greater Seattle Area, West Coast, Western US",Active,1999-01-01,year,,11-50,,,,,,
Datatex,https://www.crunchbase.com/organization/datatex-a1cc,,"Cloud Data Services, Consulting, IT Infrastructure, Virtualization",https://datatex.net/,"Desoto, Texas, United States",Datatex is an IT service and consulting firm that provides onsite and remote support for businesses and residential users.,"917,676",,,,,,,,,,,,,"Dallas/Fort Worth Metroplex, Southern US",Active,1975-01-01,year,,1-10,,,,,,
"Icon Voice Networks, LLC",https://www.crunchbase.com/organization/icon-voice-networks-llc,,"Cloud Data Services, Telecommunications, Video",https://iconvn.com,"Irving, Texas, United States","Icon Voice Networks specializes in cloud and customer based voice, video and unified communications platforms.","924,727",,,,,,,,,,,,,"Dallas/Fort Worth Metroplex, Southern US",Active,1975-01-01,year,,11-50,,,,642524,USD,642524
Alexaur Technology,https://www.crunchbase.com/organization/alexaur-technology,,"Cloud Data Services, Information Technology, Network Security",https://www.alexaur.com,"Katy, Texas, United States","Alexaur Technology provides IT consulting, backup & recovery solutions, network security, cloud integration, and remote workforce services.","927,327",,,,,,,,,,,,,"Greater Houston Area, Southern US",Active,2001-01-01,year,,1-10,,,,,,
Executive IT,https://www.crunchbase.com/organization/executive-it,,"Cloud Data Services, Cyber Security, Information Technology",https://www.exec-it.com/,"Norcross, Georgia, United States","Executive IT provides cloud solutions, cybersecurity, hosting, backup ,disaster recovery, maintenance and web services.","930,186",,,,,,,,,,,,,"Greater Atlanta Area, East Coast, Southern US",Active,2000-01-01,year,,1-10,,,,66443,USD,66443
At Comm,https://www.crunchbase.com/organization/at-comm,,"Cloud Data Services, Software, Telecommunications",https://www.atcomm.com/,"Manchester, New Hampshire, United States","At Comm is a provider of call accounting, reporting systems and cloud based services.","936,085",,,,,,,,,,,,,"East Coast, New England, Northeastern US",Active,1982-01-01,day,,11-50,,,,,,
Acolyte Technologies Corporation,https://www.crunchbase.com/organization/acolyte-technologies-corporation,"Acolyte Technologies Corporation offers consulting services, cloud solutions, big data, app development, web development, web design services, networking services, microsoft integrations, apple integrations, open source solutions, disaster recovery, web hosting services, virtual servers, and server visualization services.","Cloud Data Services, Software, Web Development, Web Hosting",https://www.acolyte.net,"Middlebury, Connecticut, United States",Acolyte Technologies Corporation provides computer networking and communications services.,"939,177",,,,,,,,,,,,,"East Coast, New England, Northeastern US",Active,1991-01-01,year,,11-50,,,,,,
Trefil Consulting,https://www.crunchbase.com/organization/trefil-consulting,"Trefil Consulting is an IT organization. They provide end-to-end solutions tailored to meet the technology demands of today. Their services are cloud services, IT consulting, cyber security, and managed services. They provide both remote and onsite technical support for their business.","Cloud Data Services, Consulting, Cyber Security, IT Management",http://www.trefilconsulting.com,"Bolingbrook, Illinois, United States","Trefil Consulting provides IT consulting, cyber security, managed, and cloud services.","939,327",,,,,,,,,,,,,"Greater Chicago Area, Great Lakes, Midwestern US",Active,2001-01-01,year,,1-10,,,,54011,USD,54011
Safebit Solutions,https://www.crunchbase.com/organization/safebit-solutions,,"Cloud Data Services, Information Technology, Security",https://www.safebitsolutions.com,"Houston, Texas, United States","Safebit Solutions provides cloud hosting, IT infrastructure, cloud phone systems, procurement, and Microsoft technologies services.","941,029",,,,,,,,,,,,,"Greater Houston Area, Southern US",Active,1997-01-01,year,,1-10,,,,45761,USD,45761
DocuRehab,https://www.crunchbase.com/organization/docurehab,"DocuRehab they provide advancement and progress accordingly, they strive to improve education through better teachers, tools, and methods.","Cloud Data Services, Scheduling",http://www.docurehab.com,"Palm Beach Gardens, Florida, United States",DocuRehab is a Collaborative Team.,"943,716",,,,,,,,,,,,,"Greater Miami Area, East Coast, Southern US",Active,1998-01-01,day,,,,,,,,
I2T2,https://www.crunchbase.com/organization/i2t2,,"Cloud Data Services, Information Technology, IT Management, Software, Staffing Agency",http://i2t2.com/,"Red Bank, New Jersey, United States","I2T2 is an IT firm offering application development, staffing solutions, Cloud support & other services.","946,985",,,,,,,,,,,,,"Greater New York Area, East Coast, Northeastern US",Active,1997-01-01,year,,11-50,,,,,,
New Hope Telephone Cooperative,https://www.crunchbase.com/organization/new-hope-telephone-cooperative,,"Cloud Data Services, Internet, Network Security",https://nhtc.coop/,"New Hope, Alabama, United States","New Hope Telephone Cooperative is a technology firm providing Broadband Internet, advanced Wi-Fi, and telephone services.","947,686",,,,,,,,,,,,,Southern US,Active,1951-01-01,year,,11-50,,,,,,
LifeGrid Internet,https://www.crunchbase.com/organization/lifegrid-internet,,"Cloud Data Services, ISP, Web Hosting",https://www.lifegrid.com/,"Indianapolis, Indiana, United States","LifeGrid Internet is an internet service provider and cloud hosting data center serving Indianapolis, Indiana and the surrounding area.","954,363",,,,,,,,,,,,,"Great Lakes, Midwestern US",Active,1995-01-01,day,,1-10,,,,75549,USD,75549
Domino Comp,https://www.crunchbase.com/organization/domino-comp,,"Cloud Data Services, Information Technology, Software",http://www.dominocomp.com,"San Jose, California, United States","Domino Comp specializes in information technology, software, cloud, security, storage, and high-density computing.","959,385",,,,,,,,,,,,,"San Francisco Bay Area, Silicon Valley, West Coast",Active,1997-01-01,day,,1-10,,,,166761,USD,166761
Global Cloud Solutions,https://www.crunchbase.com/organization/global-cloud-solutions,,"Cloud Data Services, Information Technology, Software",https://gcsiweb.com,"Binghamton, New York, United States",Global Cloud Solutions provides custom solutions using cloud platforms to help companies generate business value from technology.,"963,934",,,,,,,,,,,,,"East Coast, Northeastern US",Active,2002-01-01,year,,1-10,,,,,,
Vet Rocket,https://www.crunchbase.com/organization/vet-rocket,,"Cloud Data Services, Data Storage, Medical",https://vetrocket.com/,"Santa Clara, California, United States",Vet Rocket provides cloud-based PACS storage solutions for the veterinary market.,"979,556",,,,,,,,,,,,,"San Francisco Bay Area, Silicon Valley, West Coast",Active,2001-01-01,day,,1-10,,,,61197,USD,61197
Renaissance Intercomputing,https://www.crunchbase.com/organization/renaissance-intercomputing,"Renaissance Intercomputing specializes in a wide range of services, including IT services and solutions for small and medium-sized businesses. They provide managed services, cloud computing, network security, data backup and recovery, and VoIP services. IT manages all of its clients' IT services for a flat rate.","Cloud Data Services, Database, Information Technology, Network Security",https://www.intercompute.com,"Utah, Tennessee, United States",Renaissance Intercomputing is an information technology solution provider.,"987,896",,,,,,,,,,,,,Southern US,Active,1996-01-01,year,,11-50,,,,,,
Occams Resources,https://www.crunchbase.com/organization/occams-resources,"Occams Resources collaboration tools plug the project into the global scientific network of like-minded colleagues, suppliers, and sources of financing. They provide tools and applications that work the way they work and integrate readily with the existing software. The Occams Resources network platform enables people in the Life Sciences to manage their networks simply in one place. On one platform, they provide a comprehensive set of practical tools that save time and cost, eliminate unnecessary bureaucracy, and empower people to interact with each other inside their department and across the globe.","Cloud Data Services, Information Technology, Mobile Apps, Software",https://occamsresources.com,"New Haven, Connecticut, United States",Occams Resources provides businesses with cloud-based solution packages.,"1,000,601",,,,,,,,,,,,,"East Coast, New England, Northeastern US",Active,2001-01-01,year,,1-10,,,,,,
OM Group,https://www.crunchbase.com/organization/om-group-976a,,"Analytics, Cloud Data Services, Information Technology, Software",https://www.omgroupinc.us/,"Piscataway, New Jersey, United States","OM Group provides application development, cloud migration, agile methodology, storage, and data analytics services.","1,002,885",,,,,,,,,,,,,"Greater New York Area, East Coast, Northeastern US",Active,2001-01-01,year,,51-100,,,,,,
Willits Technologies,https://www.crunchbase.com/organization/willits-technologies,"Willits Technologies is an IT service provider. They provide managed IT services, business data management, security, and phone systems with reliable support. They provide IT solutions and managed services to make clients' businesses productive and get their investment in technology. Their services include hardware, software, labor, cloud-hosted servers, and monitoring.","Cloud Data Services, Hardware, Information Technology, Software",https://wti.cc,"Houston, Texas, United States",Willits Technologies provides IT support for SMEs.,"1,005,835",,,,,,,,,,,,,"Greater Houston Area, Southern US",Active,1998-01-01,year,,1-10,,,,35497,USD,35497
Data Services,https://www.crunchbase.com/organization/data-services,,"Cloud Data Services, Email Marketing, Marketing",https://www.dataservicesinc.com,"Salisbury, Maryland, United States","Data Services offers email marketing, postal optimization, financial, and data compiling solutions.","1,006,121",,,,,,,,,,,,,"East Coast, Southern US",Active,1967-01-01,year,,11-50,,,,,,
Cobar Resources,https://www.crunchbase.com/organization/cobar-resources,,"Business Intelligence, Cloud Data Services, Data Integration",http://cobar-resources.com/,"Frederick, Maryland, United States",Cobar Resources expertise in business intelligence and data integration services for large and SMBs.,"1,008,577",,,,,,,,,,,,,"Washington DC Metro Area, East Coast, Southern US",Active,1993-01-01,year,,1-10,,,,,,
"Just Networks, Inc.",https://www.crunchbase.com/organization/just-networks-inc,,"Cloud Data Services, Consulting, Information Technology, Internet",https://www.justnet.com,"Chicago, Illinois, United States",Just Networks is a computer systems integrator and value-added reseller in Chicago.,"1,009,008",,,,,,,,,,,,,"Greater Chicago Area, Great Lakes, Midwestern US",Active,1993-01-01,year,,51-100,,,,,,
zConnect,https://www.crunchbase.com/organization/zconnect,,"Apps, Cloud Data Services, Information Technology, Web Design, Web Development",https://www.zconn.net,"Norcross, Georgia, United States","zConnect is a cloud network company providing web design, hosting, application development & cloud services.","1,022,177",,,,,,,,,,,,,"Greater Atlanta Area, East Coast, Southern US",Active,1994-01-01,year,,1-10,,,,,,
Data Instruments,https://www.crunchbase.com/organization/data-instruments,,"Ad Network, Cloud Data Services, Network Hardware",http://www.workstation.net,"Marietta, Georgia, United States",Data Instruments is a cloud data network services company located in Marietta.,"1,027,098",,,,,,,,,,,,,"Greater Atlanta Area, East Coast, Southern US",Active,1989-01-01,day,,,,,,,,
Advanced Office Products,https://www.crunchbase.com/organization/advanced-office-products,,"Cloud Data Services, Document Management, Internet, IT Management",https://www.aopinc.com/,"Lake Charles, Louisiana, United States","Advanced Office Products offers custom technology solutions, internet, cloud data, document, and office equipment services for businesses.","1,032,749",,,,,,,,,,,,,Southern US,Active,1992-01-01,year,1,11-50,Scott Greene,,,,,
NuLeaf Technologies,https://www.crunchbase.com/organization/nuleaf-technologies,,"Cloud Data Services, Data Visualization, Information Technology, Web Design",https://www.nuleaftechnologies.com,"Millersville, Maryland, United States","NuLeaf Technologies is a full-service technology, security, and compliance serving the cannabis and medical marijuana industry.","1,032,817",,,,,,,,,,,,,"Greater Baltimore-Maryland Area, East Coast, Southern US",Active,1986-01-01,year,,51-100,,,,,,
Macrotech Solutions,https://www.crunchbase.com/organization/macrotech-solutions,,"Cloud Computing, Cloud Data Services, Information Technology",https://macrotech-solutions.com,"New York, New York, United States","Macrotech Solutions is an It solutions firm that deals in cloud, telecom & IT services.","1,034,901",,,,,,,,,,,,,"Greater New York Area, East Coast, Northeastern US",Active,1996-01-01,year,,1-10,,,,,,
Rollcage Technology,https://www.crunchbase.com/organization/rollcage-technology,,"Cloud Data Services, Cloud Infrastructure, Information Technology",http://www.rollcagetech.com,"East Granby, Connecticut, United States","Rollcage Technology offers Oracle cloud services, PeopleSoft security solutions and disaster recovery options.","1,034,915",,,,,,,,,,,,,"East Coast, New England, Northeastern US",Active,2002-01-01,year,,11-50,,,,,,
Data Management Assistance Corp.,https://www.crunchbase.com/organization/data-management-assistance-corp,"Data Management Assistance Corp. owns the very popular Unibase Technology. Unibase by DMAC is a PCI (Payment Card Industry) Data Security Standard compliant, powerful data entry and image entry program constantly being updated.","Cloud Data Services, Data Center, Information Technology",https://www.dmac-unibase.com/,"Round Rock, Texas, United States",Data Management Assistance Corp. owns the very popular Unibase Technology.,"1,038,375",,,,,,,,,,,,,Southern US,Active,1989-01-01,year,,,,,,49837,USD,49837
InnoVest Group,https://www.crunchbase.com/organization/innovest-group,,"Apps, Cloud Data Services, Information Technology, Outsourcing, Professional Services",https://www.theinnovestgroup.com/,"Mclean, Virginia, United States","InnoVest Group is a consulting firm that offers digital transformation, ITO, data analytics, and enterprise business solutions.","1,039,207",,,,,,,,,,,,,"Washington DC Metro Area, East Coast, Southern US",Active,1996-01-01,year,,251-500,,,,,,
ISC,https://www.crunchbase.com/organization/i-s-consulting,,"Cloud Data Services, IT Management, Network Security, Outsourcing",http://www.isconsulting-inc.com,"Gainesville, Florida, United States","ISC engages in IT management, cloud hosting, network security and collaboration services.","1,042,169",,,,,,,,,,,,,"East Coast, Southern US",Active,1996-01-01,day,1,1-10,Steve Heimberger,,,,,
Varay Managed IT (El Paso),https://www.crunchbase.com/organization/varay-managed-it-el-paso,"Varay Managed IT, founded in 2002, is a locally owned and operated business focused on providing clients with managed IT, cybersecurity, IT consulting, and business continuity services. Varay allows clients to focus on their core business by handling their IT issues and tasks. Varay’s client base covers multiple industries, including Financial, Healthcare, Manufacturing, Wholesale, Logistics, Gas, and Oil.","Cloud Computing, Cloud Data Services, Cloud Infrastructure, Cloud Management, Cloud Security, Consulting, Information Technology",https://www.varay.com/varay-managed-it-in-el-paso-texas,"El Paso, Texas, United States","Managed IT, Cybersecurity, Cloud Services, IT Consulting, Business Continuity and Disaster Recovery","1,053,629",,,,,,,,,,,,,Southern US,Active,2002-01-01,year,,11-50,,,,,,
Amgentech Inc.,https://www.crunchbase.com/organization/amgentech-inc,,"Cloud Data Services, Information Technology, Network Security",https://amgentech.com,"Ormond Beach, Florida, United States","Amgentech has been providing IT services and solutions that specialist of computer installations, wide and local area network installations.","1,057,514",,,,,,,,,,,,,"East Coast, Southern US",Active,2001-01-01,day,,1-10,,,,20972,USD,20972
