Organization Name,Organization Name URL,Full Description,Industries,Website,Headquarters Location,Description,CB Rank (Company),SEMrush - Monthly Visits,SEMrush - Average Visits (6 months),SEMrush - Monthly Visits Growth,SEMrush - Visit Duration Growth,SEMrush - Visit Duration,SEMrush - Page Views / Visit,SEMrush - Page Views / Visit Growth,SEMrush - Bounce Rate,SEMrush - Bounce Rate Growth,SEMrush - Global Traffic Rank,SEMrush - Monthly Rank Change (#),SEMrush - Monthly Rank Growth,Headquarters Regions,Operating Status,Founded Date,Founded Date Precision,Number of Founders,Number of Employees,Founders,Apptopia - Number of Apps,Apptopia - Downloads Last 30 Days,Aberdeen - IT Spend,Aberdeen - IT Spend Currency,Aberdeen - IT Spend Currency (in USD)
Network Integrators,https://www.crunchbase.com/organization/network-integrators,"Network Integrators provides IT services and solutions for small and medium businesses and their owners. Their services include managed services, data backup recovery, IT services, network security, cloud computing, and computer repair services. They offer computer, data, and hard drive backup, as well as system recovery.","Cloud Computing, Information Services, Network Security, Technical Support",https://www.network-chicago.com,"Mundelein, Illinois, United States","Network Integrators offers IT, network security, cloud computing, data backup, and recovery services.","758,928",,,,,,,,,,,,,"Greater Chicago Area, Great Lakes, Midwestern US",Active,1992-01-01,year,,1-10,,,,,,
PACETEL,https://www.crunchbase.com/organization/pacetel,"PACETEL is a non-fee based consultant that has been in business since 1991. PACETEL specializes in a multitude of telecommunication areas including contract negotiations, cloud computing, Content Delivery Methods (CDN), managed hosting, WAN design, custom fiber design, international services, global IP access, traditional voice, VoIP,  and continual customer support that far exceeds what you’ve experienced from carriers before.","Cloud Computing, Internet, Telecommunications",https://pacetel.com,"Scottsdale, Arizona, United States","PACETEL specializes in telecommunication service areas including cloud computing, managed hosting, WAN design, global IP access and VoIP.","763,300",,,,,,,,,,,,,"Greater Phoenix Area, Western US",Active,1991-01-01,day,,1-10,,,,,,
Beck Computer Systems,https://www.crunchbase.com/organization/beck-computer-systems,,"Cloud Computing, Cyber Security, Information Technology, Internet, Professional Services, VoIP",https://www.beckcomputers.com/,"Lakewood, California, United States","Beck Computer Systems is a technology company that specializes in IT consulting, management, security and cloud services for businesses.","763,151",,,,,,,,,,,,,"Greater Los Angeles Area, West Coast, Western US",Active,1983-01-01,year,,11-50,,,,65272,USD,65272
Total Business Systems,https://www.crunchbase.com/organization/total-business-systems,Total Business Systems is a technology consulting company. All the essentials of business voice and data services are provided by total business systems in an managed package. A complete and affordable selection of Voice and Data Services is available through Total Business Systems.,"Cloud Computing, Consulting, Information Technology",https://www.tbs1.com,"Jacksonville, Florida, United States","Total Business Systems offers IT consulting, cloud, security systems, and video surveillance services.","763,944",,,,,,,,,,,,,"East Coast, Southern US",Active,1991-01-01,year,,1-10,,,,76545,USD,76545
Professional accounting solutions,https://www.crunchbase.com/organization/professional-accounting-solutions,,"Accounting, Cloud Computing",http://www.profact.com,"Gaithersburg, Maryland, United States","Professional accounting solutions is a proven model for back office operations in hotels, casinos and more.","766,477",,,,,,,,,,,,,"Washington DC Metro Area, East Coast, Southern US",Active,1992-01-01,day,,11-50,,,,133077,USD,133077
Exelos,https://www.crunchbase.com/organization/exelos,"Exelos offers services from design and procurement thru backup and disaster planning and recovery to ongoing helpdesk support, active monitoring, and preventive maintenance. They cover every facet of IT that a small business might need. They provide Cloud Services, Disposal & Recycling, Financing, Monitor & Manage, Software, and many more.","Cloud Computing, Finance, Information Technology, Software",https://exelos.com,"Greensburg, Pennsylvania, United States",Exelos is the company that provides IT services to small and medium sized businesses.,"772,307",,,,,,,,,,,,,"Great Lakes, Northeastern US",Active,1986-01-01,year,,1-10,,,,23935,USD,23935
Casey Associates,https://www.crunchbase.com/organization/casey-associates,,"Cloud Computing, Document Management, Hardware",https://scanneddocs.com/,"Lenexa, Kansas, United States","Casey Associates offers scanning, document management services and cloud hosting solutions.","782,779",,,,,,,,,,,,,Midwestern US,Active,1984-01-01,year,,1-10,,,,98525,USD,98525
Alert Solutions,https://www.crunchbase.com/organization/alert-solutions-0925,,"Cloud Computing, Internet, Messaging",https://www.alertsolutions.com,"Cranston, Rhode Island, United States",Alert Solutions offers cloud-based multi-channel messaging and communication solutions.,"783,804",,,,,,,,,,,,,"East Coast, New England, Northeastern US",Active,1989-01-01,day,1,11-50,David Baeder,,,,,
PAR IT Consulting,https://www.crunchbase.com/organization/par-it-consulting,"PAR IT Consulting offers a service company’s network on an ongoing basis with a service experience tailored to their needs. It can include things like customer and employee information, sales, and finances. Database management includes organizing that data to ensure compliance, security, and performance of data-driven applications. They develop and maintain IT services that are delivered over the internet or a dedicated cloud network.","Cloud Computing, Consulting, Information Technology, Network Security, Security",https://www.par.consulting/,"Evansville, Indiana, United States",PAR IT Consulting is an information technology consulting company.,"784,685",,,,,,,,,,,,,"Great Lakes, Midwestern US",Active,1960-01-01,year,,1-10,,,,,,
Superior Computer Services,https://www.crunchbase.com/organization/superior-computer-services,,"Cloud Computing, Consulting, IT Management, Software, Web Hosting",http://www.supercompserv.com,"Mount Vernon, New York, United States",Superior computer services is a technology firm that offers a comprehensive range of IT services for small businesses.,"796,364",,,,,,,,,,,,,"Greater New York Area, East Coast, Northeastern US",Active,1981-03-01,month,,1-10,,,,64106,USD,64106
IT4,https://www.crunchbase.com/organization/it4,"IT4 provides comprehensive IT solutions and services, including VoIP phone solutions, security, IT management, network monitoring, cloud services, on-site technical assistance, backup and business continuity, project planning, and management.","Cloud Computing, Information Technology, Project Management",https://www.it4yourbusiness.com,"Medford, Massachusetts, United States",IT4 offers IT solutions and managed services to businesses and non-profit organizations.,"816,988",,,,,,,,,,,,,"Greater Boston Area, East Coast, New England",Active,1989-01-01,year,,11-50,,,,,,
Technology Consultants,https://www.crunchbase.com/organization/technology-consultants,,"Cloud Computing, Information Services, Information Technology",https://www.tcivt.net,"South Burlington, Vermont, United States",Technology Consultants is an IT consulting and support services firm.,"818,751",,,,,,,,,,,,,"New England, Northeastern US",Active,1986-01-01,year,,1-10,,,,65407,USD,65407
PC911,https://www.crunchbase.com/organization/pc911,"PC911 is an industry-leading information technology consulting and software development company. It helps organizations build and maintain an optimal IT architecture, and implement cost-effective solutions leveraging the hardware, software, and processes most suitable for its clients. It offers services like managed it services, network monitoring, backup and disaster recovery, web application design, and development, mobile app development, cloud computing, virtualization, seo, and social media marketing, antivirus protection, and more.","Cloud Computing, Information Technology, Mobile Apps, Network Security, SEO, Social Media Marketing, Software, Virtualization, Web Design, Web Development",https://www.pc911ny.com,"New York, New York, United States",PC911 is an information technology consulting and software development company.,"824,697",,,,,,,,,,,,,"Greater New York Area, East Coast, Northeastern US",Active,1995-01-01,year,,11-50,,,,,,
CCR Technology Partners,https://www.crunchbase.com/organization/ccr-technology-partners,,"Cloud Computing, Cyber Security, Information Technology",https://goccr.com,"Fishers, Indiana, United States","CCR Technology Partners is a Technology Consulting Firm that provides cybersecurity, cloud computing and managed IT services.","825,280",,,,,,,,,,,,,"Great Lakes, Midwestern US",Active,1988-07-01,day,,1-10,,,,,,
DataNet Systems,https://www.crunchbase.com/organization/datanet-systems-a99e,,"Cloud Computing, Consulting, Information Technology, Network Hardware",https://www.dnetsystems.com/,"Austin, Texas, United States","DataNet Systems provides IT systems, networking and cloud services.","827,195",,,,,,,,,,,,,Southern US,Active,1989-01-01,year,,1-10,,,,,,
TriTel Networks,https://www.crunchbase.com/organization/tritel-networks,,"Cloud Computing, Information Technology, Telecommunications",http://www.tritel.com/,"Murray, Utah, United States","TriTel Networks offers cloud business communications, business phone systems and IT services.","839,035",,,,,,,,,,,,,Western US,Active,1984-06-04,day,,11-50,,,,34037,USD,34037
Shamrock Communications,https://www.crunchbase.com/organization/shamrock-communications,,"Cloud Computing, Telecommunications",http://shamrock-ip.com/,"Katy, Texas, United States","Shamrock Communications is a UCaas VoIP Cloud provider located in Houston, Texas.","842,327",,,,,,,,,,,,,"Greater Houston Area, Southern US",Active,1990-01-01,year,,101-250,,,,,,
Reliance Technologies,https://www.crunchbase.com/organization/reliance-technologies-inc,,"Cloud Computing, Consulting, Database, E-Commerce, VoIP",http://www.reliancetechnologies.com,"Stamford, Connecticut, United States","Reliance Technologies provides a full spectrum of IT services that include VoIP, database, LAN, WAN, cloud and e-commerce solutions.","846,173",,,,,,,,,,,,,"East Coast, New England, Northeastern US",Active,1992-01-01,year,,11-50,,,,25350,USD,25350
The Collective Group,https://www.crunchbase.com/organization/the-collective-group,,"Cloud Computing, Cyber Security, Virtualization",https://www.collectivegroup.com,"Cedar Park, Texas, United States","The Collective Group specializes in cybersecurity, data protection, networking, cloud computing, virtualization, and storage management.","847,083",,,,,,,,,,,,,Southern US,Active,1994-01-01,year,,101-250,,,,,,
Progressive Consulting,https://www.crunchbase.com/organization/progressive-consulting,,"Cloud Computing, Consulting, Information Technology",https://www.progressgroup.com,"Westbury, New York, United States","Progressive Consulting provides implementation, training, support, and maintenance of IT services.","849,101",,,,,,,,,,,,,"Greater New York Area, East Coast, Northeastern US",Active,1989-01-01,year,,11-50,,,,,,
CSI,https://www.crunchbase.com/organization/csi-0910,,"Cloud Computing, IT Management, Software",http://computer-systems.com/index.php,"Fishers, Indiana, United States","CSI offers cloud backup, hardware solutions, networks system, data services, software applications and system integration.","851,961",,,,,,,,,,,,,"Great Lakes, Midwestern US",Active,1986-01-01,year,,11-50,,,,,,
Intermedia,https://www.crunchbase.com/organization/intermedia-7566,"Intermedia cloud technologies make it easy for our customers to communicate, collaborate and share information .Intermedia is a cloud communications company that helps over 122,000 businesses connect better – through voice, video conferencing, chat, contact center, business email and productivity, file sharing and backup, security, archiving, and more","Cloud Computing, Cloud Data Services, Software",https://www.zlago.com,"Seattle, Washington, United States",Intermedia multi-platform customer spotlight series honoring business leaders whose vision and drive are redefining the customer experience.,"860,470",,,,,,,,,,,,,"Greater Seattle Area, West Coast, Western US",Active,1995-01-01,year,,11-50,,,,,,
Dixon Sports Computing,https://www.crunchbase.com/organization/dixon-sports-computing,,"Cloud Computing, CMS, Software",https://www.dixonsports.com/,"Long Beach, California, United States","Dixon Sports Computing specializes in content management, database, software and cloud computing for various sports.","860,821",,,,,,,,,,,,,"Greater Los Angeles Area, West Coast, Western US",Active,1992-01-01,year,,1-10,,,,77158,USD,77158
ZZ Computer,https://www.crunchbase.com/organization/zz-computer,"ZZ Computer provides cyber security, cloud solution, web development, and web design services. They also provide IT support and consulting services, data backup and disaster recovery to cloud service, Microsoft Exchange email hosting, hosted PBX phone system, and managed security services. They provide customized IT-managed solutions to the customer and company needs. The customer contact through phone number, email, and application form.","Cloud Computing, Consulting, Cyber Security, Information Technology, Web Design, Web Development",https://zzcomputer.com,"Los Angeles, California, United States",ZZ Computer is a business IT consultancy.,"862,712",,,,,,,,,,,,,"Greater Los Angeles Area, West Coast, Western US",Active,1992-01-01,year,,1-10,,,,,,
CNC,https://www.crunchbase.com/organization/cnc-589e,,"Cloud Computing, Information Technology, Telecommunications",http://www.cnc.info/,"Birmingham, Alabama, United States",CNC provides businesses a variety of systems and related services for data and telephony.,"866,577",,,,,,,,,,,,,Southern US,Active,1983-01-01,day,,11-50,,,,,,
Net56,https://www.crunchbase.com/organization/net56,,"Cloud Computing, Cyber Security, IT Management",https://www.net56.com/,"Deer Park, New York, United States","Net56 is an IT firm that provides a wide range of services including IT management, cloud computing, cybersecurity and hosting services.","876,436",,,,,,,,,,,,,"Greater New York Area, East Coast, Northeastern US",Active,1980-01-01,year,,11-50,,,,,,
Synergy,https://www.crunchbase.com/organization/synergy-4dc0,,"Cloud Computing, Cyber Security, IT Infrastructure",https://www.synergyits.com,"Cheektowaga, New York, United States","Synergy is an IT company that offers IT infrastructure, cybersecurity, IT managed and cloud services to businesses.","880,448",,,,,,,,,,,,,"East Coast, Northeastern US",Active,1971-01-01,year,,101-250,,,,,,
Alinco IT,https://www.crunchbase.com/organization/alinco-it,"Alinco IT is an authorized reseller for most major hardware and software manufacturers. It is committed to providing the customers with best-in-class service. It is an integral part of today’s cost-cutting and growth initiatives. It offers services like procurement services, network services, cloud services, and professional services.","Apps, Cloud Computing, IT Management, Outsourcing, Procurement, Professional Services, Web Hosting",https://www.alinco.net,"Fullerton, California, United States","Alinco IT is a provider of total network solutions, professional, cloud and procurement services.","883,270",,,,,,,,,,,,,"Greater Los Angeles Area, West Coast, Western US",Active,1984-01-01,year,,11-50,,,,151440,USD,151440
Global Mobility Services,https://www.crunchbase.com/organization/global-mobility-services,,"Artificial Intelligence, Big Data, Cloud Computing, Machine Learning",https://gmobility.com/,"Schaumburg, Illinois, United States","Global Mobility Services provides web development, AI, machine learning, security and managed IT services.","887,274",,,,,,,,,,,,,"Greater Chicago Area, Great Lakes, Midwestern US",Active,1993-01-01,year,,11-50,,,,362359,USD,362359
GIG IT,https://www.crunchbase.com/organization/gig-it,,"Cloud Computing, Computer, Data Center, Information Technology, VoIP, Wireless",https://www.gigsystems.com/,"Burlington, Massachusetts, United States","GIG IT providing a complete suite of IT solutions gig computers is the premier IT consulting firm, cloud computing, data center, wireless.","889,694",,,,,,,,,,,,,"Greater Boston Area, East Coast, New England",Active,1992-01-01,year,,,,,,,,
Lantek,https://www.crunchbase.com/organization/lantek-8425,,"Cloud Computing, Information Technology, Network Hardware, Small and Medium Businesses, Software",https://www.lantekit.com,"Kutztown, Pennsylvania, United States","Lantek offers computer network products, IT security, cloud computing, and software services.","892,209",,,,,,,,,,,,,"Great Lakes, Northeastern US",Active,1978-01-01,year,,11-50,,,,,,
GABN,https://www.crunchbase.com/organization/gabn,,"Cloud Computing, Consulting, Network Security, Software, Telecommunications",https://gabn.net,"Augusta, Georgia, United States","GABN works alongside business leaders to design, deliver, and manage the world’s best unified communications and connectivity solutions.","894,505",,,,,,,,,,,,,"East Coast, Southern US",Active,1995-01-01,year,,1-10,,,,398551,USD,398551
Nebulogic,https://www.crunchbase.com/organization/nebulogic,,"Cloud Computing, CRM, Information Technology",https://www.nebulogic.com,"Plano, Texas, United States","NebuLogic is an IT provider of enterprise-class on-premise, cloud-based, and hybrid digital transformation solutions.","896,291",,,,,,,,,,,,,"Dallas/Fort Worth Metroplex, Southern US",Active,1995-01-01,day,,101-250,,,,231474,USD,231474
Phoenix Web Group,https://www.crunchbase.com/organization/phoenix-web-group,,"Cloud Computing, Information Technology, Software, UX Design, Web Development",https://phoenixwebgroup.com,"Waverly, Nebraska, United States","Phoenix Web Group develops custom web, mobile and cloud applications as well as offers business process automation & UI/UX design solutions.","903,804",,,,,,,,,,,,,Midwestern US,Active,1987-01-01,year,,11-50,,,,,,
Settlement Management Solution,https://www.crunchbase.com/organization/settlement-management-solution,"SMS facilitates docuSign integrates with streamline, Their integration enables to upload and track electronic signature documents without leaving StreamLine.","Cloud Computing, Cloud Data Services, Cloud Infrastructure, Cloud Management, Customer Service, Software",https://www.smscorp.com/about/,"Irvine, California, United States",SMS is customer-focused software to simplify the real estate closing process.,"909,224",,,,,,,,,,,,,"Greater Los Angeles Area, West Coast, Western US",Active,1111-01-01,year,,1-10,,,,,,
Kates Technology,https://www.crunchbase.com/organization/kates-technology,,"Cloud Computing, Network Security, Project Management, Virtualization",https://katestech.com,"Scottsdale, Arizona, United States","Kates Technology provides data recovery, backup, network security, virtualization, cloud computing, and project management services.","911,955",,,,,,,,,,,,,"Greater Phoenix Area, Western US",Active,1995-01-01,year,,11-50,,,,44801,USD,44801
A-Tech Computer Service,https://www.crunchbase.com/organization/a-tech-computer-service,"A-Tech Computer Service provides IT service, network services, consulting, computer networking support and solutions for small to mid-size businesses.","Cloud Computing, Information Services, Internet, Software",https://www.a-techinc.com/,"Elgin, Illinois, United States","A-Tech Computer Service provides IT service, cloud computing, wireless LAN-based mobile computing solutions and network services.","915,923",,,,,,,,,,,,,"Greater Chicago Area, Great Lakes, Midwestern US",Active,1984-01-01,day,,1-10,,,,82536,USD,82536
Digicomp Networks,https://www.crunchbase.com/organization/digicomp-networks,,"Cloud Computing, Data Integration, Network Security, VoIP",https://www.digicompnetworks.com,"Westlake Village, California, United States","Digicomp Networks specializes in network security, data backup, web hosting, mobile connectivity, on site consulting and cloud services.","919,453",,,,,,,,,,,,,"Greater Los Angeles Area, West Coast, Western US",Active,1991-01-01,year,,,,,,16968,USD,16968
Ken Leiner Associates,https://www.crunchbase.com/organization/ken-leiner-associates,,"Apps, Big Data, Business Intelligence, Cloud Computing, Database, Enterprise, Network Security",https://itsearch.com/,"Kensington, Maryland, United States","Ken Leiner Associates is a leading executive recruitment agency that recruits sales, strategic and communications expertise at all levels.","921,607",,,,,,,,,,,,,"Washington DC Metro Area, East Coast, Southern US",Active,1991-01-01,year,,11-50,,,,119575,USD,119575
NYNJA Technology Solutions,https://www.crunchbase.com/organization/nynja-technology-solutions,,"Cloud Computing, Consulting, Information Technology",https://www.nynja.com,"Suffern, New York, United States",NYNJA Technology Solutions provide managed IT services and flat-rate support for small to mid-size businesses.,"921,820",,,,,,,,,,,,,"Greater New York Area, East Coast, Northeastern US",Active,1995-01-01,year,,1-10,,,,,,
Network Engineering & Security,https://www.crunchbase.com/organization/network-engineering-security-b987,,"Cloud Computing, Information Technology, IT Infrastructure, Network Security, Virtualization",https://www.net-engineering.com,"Becket, Massachusetts, United States","Network Engineering & Security specializes in managed IT, infrastructure, cloud computing, and network organization solutions.","934,517",,,,,,,,,,,,,"East Coast, New England, Northeastern US",Active,1994-11-01,month,,1-10,,,,,,
TCI,https://www.crunchbase.com/organization/tci-f3bb,"TCI offers business phones, voice over internet protocol, conferencing, mobility, telework, remote access, network infrastructure, data cabling, voice cabling, local area network, data center, collocation, wireless networks, managed services plans, service support, proactive monitoring, prepaid support, adhoc support, information technology support, projects support, and more.","Cloud Computing, Telecommunications, VoIP",https://www.tcicomm.com,"Springfield, Virginia, United States",TCI is a telecommunications company.,"936,569",,,,,,,,,,,,,"Washington DC Metro Area, East Coast, Southern US",Active,1980-01-01,year,,11-50,,,,,,
Arcisphere Technologies,https://www.crunchbase.com/organization/arcisphere,,"Cloud Computing, Consulting, Software",http://arcisphere.com/,"Newtown, Pennsylvania, United States","Arcisphere Technologies deals with software development, consulting, and cloud computing.","937,170",,,,,,,,,,,,,"Greater Philadelphia Area, Great Lakes, Northeastern US",Active,1992-01-01,year,,11-50,,,,,,
Clearview International,https://www.crunchbase.com/organization/clearview-international,"Clearview International LLC has been bringing clients improved IT strategy and services since 1996. Through North Texas and Waco data centers, Clearview provides a redundant, reliable, scalable and practical suite of services that can be tailored to support clients' needs from business and IT strategy to complete computing infrastructure. Clearview is headquartered in Dallas, Texas and has offices throughout North America, Europe and Australia","Cloud Computing, Information Technology, Software",http://www.clearviewmgmt.com,"Dallas, Texas, United States",Clearview International LLC has been bringing clients improved IT strategy and services since 1996.,"942,443",,,,,,,,,,,,,"Dallas/Fort Worth Metroplex, Southern US",Active,1995-01-01,year,1,11-50,Clay Hill,,,,,
KKI Corporation,https://www.crunchbase.com/organization/import-automotive-repair,,"Cloud Computing, Information Technology, SaaS, Software, Web Development",https://kkicorp.com/,"Modesto, California, United States","KKI Corporation is in software solutions, web development, cloud computing, SAAS and technical support services.","943,505",,,,,,,,,,,,,"West Coast, Western US",Active,1975-01-01,year,,11-50,,,,120894,USD,120894
42,https://www.crunchbase.com/organization/42-69a7,"42's information technology consulting services offer an unparalleled breadth of technical skills, plus personal service that makes you feel heard and valued. They excel at transforming IT systems from disruptive obstacles into productivity-enhancing tools. Our flat-fee technical support programs are designed for companies with a wide range of needs, from just the basics to total insurance.","Cloud Computing, Consulting, Information Technology, Security, Service Industry",https://www.42inc.com/,"Berkeley, California, United States","42's IT consulting services offer an unparalleled breadth of technical skills, plus personal service.","950,764",,,,,,,,,,,,,"San Francisco Bay Area, West Coast, Western US",Active,1992-01-01,year,,11-50,,,,,,
DenaliTEK,https://www.crunchbase.com/organization/denalitek,,"Cloud Computing, Computer, IT Management, Professional Networking",https://denalitek.com,"Anchorage, Alaska, United States","DenaliTEK is a company that has evolved from simple vision, believing that any technology experience must be market oriented & predictable.","951,909",,,,,,,,,,,,,Western US,Active,1991-01-01,day,,11-50,,,,381235,USD,381235
