Organization Name,Organization Name URL,Full Description,Industries,Website,Headquarters Location,Description,CB Rank (Company),SEMrush - Monthly Visits,SEMrush - Average Visits (6 months),SEMrush - Monthly Visits Growth,SEMrush - Visit Duration Growth,SEMrush - Visit Duration,SEMrush - Page Views / Visit,SEMrush - Page Views / Visit Growth,SEMrush - Bounce Rate,SEMrush - Bounce Rate Growth,SEMrush - Global Traffic Rank,SEMrush - Monthly Rank Change (#),SEMrush - Monthly Rank Growth,Headquarters Regions,Operating Status,Founded Date,Founded Date Precision,Number of Founders,Number of Employees,Founders,Apptopia - Number of Apps,Apptopia - Downloads Last 30 Days,Aberdeen - IT Spend,Aberdeen - IT Spend Currency,Aberdeen - IT Spend Currency (in USD)
ProcurePort,https://www.crunchbase.com/organization/procureport,"ProcurePort's Procurement Software tool kit includes  -Requisition Software -RFQ Software -RFP Software -Auction Software including Reverse Auctions, Forward Auctions, Dutch Auction -Supplier Management Software with Supplier Scorecards -Contract Management Software -Purchase Order and Invoice Management Software including Inventory Management and Supplier Catalogs -Spend Analysis Software","Auctions, Cloud Computing, Enterprise Software, Procurement, Software, Supply Chain Management",https://www.procureport.com,"Indianapolis, Indiana, United States",ProcurePort is a leader in providing Cloud Hosted e-Procurement Solutions and Sourcing Services.,"203,806","3,582","7,416.67",-65.44%,353.5%,"2,653",26.69,"1,607.8%",62.76%,-29.48%,"3,898,755","1,869,514",92.13%,"Great Lakes, Midwestern US",Active,2011-11-01,day,,11-50,,,,,,
Eagle,https://www.crunchbase.com/organization/eagle-1265,"Eagle is an information technology solutions company. Their solutions include Omni channel AI, AIVA, ACD, zero-hop networks, IoT and M2M, network operations center, and private WAN. They provide IT consulting services, open-source, AWS, database management, life cycle management, enterprise architecture, search engine optimization, tech concierge, technology enablement, and cloud computing.","Cloud Computing, Information Technology, IT Management, Telecommunications",https://eagle.net,"New York, New York, United States",Eagle is an IT and telecom solutions provider.,"858,319","3,452",,,,0,1,,100%,,"4,009,198",,,"Greater New York Area, East Coast, Northeastern US",Active,2012-01-01,year,,11-50,,,,,,
StreamStar,https://www.crunchbase.com/organization/streamstar,"StreamStar is engaged in the development and manufacture of software and hardware solutions for the video streaming industry. StreamStar was founded by Rado Toth in 2013 and is based in Bratislava, Slovakia.","Cloud Computing, Software, Video, Video Streaming, Web Hosting",http://www.streamstar.com,"Redwood City, California, United States",StreamStar is a manufacturer of software and hardware solutions for the streaming video industry.,"319,586","3,432","2,726.5",-8.11%,-98.81%,7,1.28,-68%,98.46%,357.95%,"4,016,898","172,983",4.5%,"San Francisco Bay Area, Silicon Valley, West Coast",Active,2013-01-01,year,1,1-10,Rado Toth,,,,,
CCS Technology,https://www.crunchbase.com/organization/ccs-technology-8b80,,"Apps, Cloud Computing, Enterprise Resource Planning (ERP), IT Management, Security",https://www.ccstechnologygroup.com,"Rolling Meadows, Illinois, United States","CCS Technology focuses on IT management, cloud solutions, enterprise resource planning, CRM, security, and app development.","1,062,156","3,419","5,979.33",-3.69%,,0,1,-30.17%,100%,76.09%,"3,984,069","202,151",5.35%,"Greater Chicago Area, Great Lakes, Midwestern US",Active,2013-01-01,year,,11-50,,,,,,
IPfolio,https://www.crunchbase.com/organization/ipfolio,"Drawing on over 15 years experience in software development and Intellectual Property (IP) management, IPfolio is an independent spin-off of IP management solutions provider Unycom. Headquartered in Berkeley, CA, IPfolio offers a fresh new approach to IP management.  Our software makes IP Management simpler and more visual. A lightweight, accessible tool, it enables you to easily organize and intuitively manage every asset within your IP portfolio through each lifecycle stage. Using a highly automated workflow, IPfolio increases administrative efficiency while enabling organization-wide collaboration and smarter IP decision-making.","Cloud Computing, Computer, Software",http://www.ipfolio.com,"Berkeley, California, United States",Next-Generation Intellectual Property Management,"44,451","3,357","2,618",5.5%,445.45%,240,1.71,13.87%,58.37%,-20.63%,"2,143,622","-37,859",-1.74%,"San Francisco Bay Area, West Coast, Western US",Active,2012-01-01,year,1,11-50,Rupert Mayer,,,,,
CyberBahn Federal Solutions,https://www.crunchbase.com/organization/cyberbahn-federal-solutions,,"Cloud Computing, Cyber Security, Management Consulting, Software Engineering, Training",https://www.cyberbahnit.com/,"Arlington, Virginia, United States",CyberBahn Federal Solutions offers technology and management consulting along with cyber security and cloud computing solutions.,"481,835","3,287","3,458.17",75.59%,-77.78%,0,1,-45.26%,100%,477.7%,"4,096,236","-979,851",-19.3%,"Washington DC Metro Area, East Coast, Southern US",Active,2013-01-01,year,,51-100,,,,194983,USD,194983
Arganteal,https://www.crunchbase.com/organization/arganteal,"Arganteal provides a suite of vendor-agnostic virtualization design and deployment tools and related services that help enterprises realize the promise of cloud computing in production environments where flexibility, reliability, and redundancy are essential. It was founded in 2012 and headquartered in Austin, Texas.","Automotive, Cloud Computing, Virtualization",http://arganteal.com,"Austin, Texas, United States",Arganteal provides a suite of vendor agnostic virtualization design and deployment tools and related services.,"100,608","3,280",,,,39,4.5,,50%,,"4,049,611",,,Southern US,Active,2012-01-01,year,2,11-50,"Russell Sellers, Steve Kelley",,,,,
Cloudwell,https://www.crunchbase.com/organization/cloudwell-da60,,"Business Intelligence, Cloud Computing, Software, Windows",https://cloudwell.io,"Arlington, Virginia, United States",Cloudwell provides enterprise business applications for Microsoft 365 and Azure.,"1,249,232","3,069",,902.94%,,0,1,0%,100%,0%,"4,175,292","-4,303,653",-50.76%,"Washington DC Metro Area, East Coast, Southern US",Active,2012-01-01,year,,11-50,,,,,,
Cobalt Iron,https://www.crunchbase.com/organization/cobalt-iron,"Cobalt Iron is the global leader in SaaS-based enterprise data protection. Through analytics and automation, Compass from Cobalt Iron enables enterprises to transform and optimize legacy backup solutions into a simple cloud-based architecture. Processing more than 7 million jobs a month for customers in 44 countries, Cobalt Iron delivers modern enterprise data protection for enterprise customers. Cobalt Iron reduces overall capex by more than 50 percent while eliminating backup failures and inefficiencies. Cobalt Iron uses a SaaS based, pay as you grow model. This means we don’t over-charge with pricing packages. Instead, we only bill you for the exact amount of data you need backed up and protected. This allows us to easily scale with your business while simultaneously cutting your data storage and backup costs by upwards of 50%. At the same time, our platform allows for you to easily observe and manage backup and protection processes from one, easy to understand interface. This means you no longer have to switch between several software offerings just to see what your data is doing. This has helped our customers to reduce complexity and increase productivity by over 80%.","Analytics, Cloud Computing, Cyber Security, Enterprise Software, Flash Storage, SaaS, Software",https://www.cobaltiron.com,"Lawrence, Kansas, United States",Cobalt Iron is the global leader in SaaS-based enterprise data protection.,"171,170","2,966","2,270.33",130.64%,-59.04%,84,1.15,14.73%,86.51%,-13.49%,"4,321,698","-2,132,565",-33.04%,Midwestern US,Active,2013-01-01,year,1,11-50,Richard Spurlock,,,31627,USD,31627
Alef Edge,https://www.crunchbase.com/organization/alefedge,"Alef is the first global edge API platform company that empowers enterprises to create, customize, and control their own private mobile network - in 60 minutes. We simplify the complexity of 5G and edge computing through a suite of APIs and tools that allow for more control and security with less overhead, while operating at a fraction of the cost of legacy mobile network providers. Leading systems integrators, distributors, and technology partners, and developers trust us to help power the edge economy and enable companies and communities to connect with a purpose.","Cloud Computing, Internet, Mobile, Private Cloud, SaaS, Telecommunications",https://www.alefedge.com/,"New York, New York, United States","Mobile SaaS, Private Mobile Network, Edge Computing, APIs, Edge as a Service","7,457","2,957",,-64.01%,,8,1.42,43.86%,76.31%,-43.86%,"4,263,574","1,692,667",69.13%,"Greater New York Area, East Coast, Northeastern US",Active,2013-01-01,year,2,51-100,"Ganesh Sundaram, Steven Spencer",,,,,
Diamond,https://www.crunchbase.com/organization/diamond-web-services,"Diamond was founded in 2012 by developers committed to building well-crafted systems with active attention to best practices in process, performance, security and accessibility. Our team consists of more than 50 people; most working directly on client projects day-to-day. Diamond maintains a large body of skilled developers and quality assurance engineers who are supported by our Project Management, DevOps, and Operations teams. Our team stays up to date on the latest languages, frameworks, and infrastructure options to design innovative solutions suited to each project. We work closely with our clients to design and build amazing apps. We’re with you the whole way, from discovery to launch and maintenance. Our years of experience in design, development, quality assurance, and project management in the media and entertainment industry sets us apart from other agencies.","Cloud Computing, Digital Media, Enterprise Software, Professional Services, Recruiting, Software",http://diamond.la,"Los Angeles, California, United States","Diamond is a digital agency in Los Angeles specializing in scalable, high-performance web and mobile applications.","260,358","2,877","2,355.17",-18.89%,"1,117.39%",560,4,157.96%,50%,11.26%,"4,308,708","525,781",13.9%,"Greater Los Angeles Area, West Coast, Western US",Active,2012-05-01,day,2,101-250,"Joe Devon, Robert Cuadra",14,,,,
TruQC,https://www.crunchbase.com/organization/truqc,"TruQC is cloud-based industrial painting job-site documentation for the iPad. Carefully developed to conform with industry standards and required reports, TruQC brings objectivity and efficiency back to the job-site. TruQC offers several job-site documentation report types for the iPad including Timesheet Report, Expense Report, Daily Inspection Report, Toolbox Talk Report, Weekly Environmental Report, Incident Report and Take 5 Report.","Apps, Cloud Computing, Data Storage, Industrial, Software",http://www.truqcapp.com,"Missouri City, Missouri, United States",TruQC is a cloud-based industrial painting quality control and documentation application for the iPad.,"56,935","2,842","7,252.5",-81.66%,73.27%,0,1,-10.87%,100%,13.88%,"4,421,920","2,712,845",158.73%,Midwestern US,Active,2011-01-01,year,2,11-50,"Benjamin Chute, Ross Boyd",1,,,,
Lodgistics,https://www.crunchbase.com/organization/lodgistics,,"Cloud Computing, Hospitality, Software",https://lodgistics.com,"Raleigh, North Carolina, United States",Lodgistics is a cloud-based communications and task management platform for the hotel industry.,"243,610","2,830",,-53.61%,,322,2.07,6.24%,55.22%,924.49%,"4,429,769","1,566,475",54.71%,"Research Triangle, East Coast, Southern US",Active,2012-01-01,year,3,1-10,"Jessica Kramer, Nikhil Natu, Shaunak Patel",,,,,
VivSoft Technologies,https://www.crunchbase.com/organization/vivsoft-technologies,,"Artificial Intelligence, Blockchain, Cloud Computing",https://www.vivsoft.io/,"Ashburn, Virginia, United States","VivSoft Technologies is an IT firm that provides cloud migrations, artificial intelligence, blockchain & cutting edge technology solutions.","280,457","2,807",,91.08%,,41,1.46,45.78%,54.24%,-45.76%,"4,350,575","-1,357,487",-23.78%,"Washington DC Metro Area, East Coast, Southern US",Active,2011-01-01,year,1,11-50,Navin Gunalan,,,,,
DivvyCloud,https://www.crunchbase.com/organization/divvycloud,"DivvyCloud protects your cloud and container environments from misconfigurations, policy violations, threats, and IAM challenges. With automated, real-time remediation DivvyCloud customers achieve continuous security and compliance, and can fully realize the benefits of cloud and container technology.","Cloud Computing, Cloud Management, Cloud Security, SaaS, Security",https://divvycloud.com,"Arlington, Virginia, United States","DivvyCloud automates the protection of cloud and container environments from misconfigurations, policy violations, and threats.","24,196","2,734","7,742.17",-36.24%,157.14%,36,1.22,10.49%,83.65%,-11.87%,"4,400,647","910,063",26.07%,"Washington DC Metro Area, East Coast, Southern US",Active,2013-01-01,year,2,101-250,"Brian Johnson, Chris DeRamus",,,,,
TeKnoluxion Consulting,https://www.crunchbase.com/organization/teknoluxion-consulting,,"Big Data, Cloud Computing, Software, Web Development",https://teknoluxion.com,"Washington, District of Columbia, United States","TeKnoluxion specializes in web and application development, cloud computing, big data, enterprise operations and management solutions.","721,990","2,718",,,,243,2.5,,50%,,"4,410,789",,,"Washington DC Metro Area, Southern US",Active,2013-01-01,year,,101-250,,,,,,
MedTel.com,https://www.crunchbase.com/organization/medtel-com,"Medtel offers cloud-based coordination of surgical workflow. Currently, there is a gap within a typical hospital’s IT systems where the coordination of surgical procedures is handled via paper and telephone leading to costly consequences such as delayed cases or not having the appropriate implants available. Medtel facilitates cost savings and coordination in the surgical suite, connecting all key parties efficiently in real-time Medtel.com Inc. is a privately held healthcare startup based in New York City.","Cloud Computing, Digital Signage, Health Care, Search Engine",http://www.medtel.com,"New York, New York, United States",Medtel improves surgical workflow by providing an automated surgical dashboard and vendor relationship management technology.,"44,733","2,679","2,926.83",2.92%,712.55%,674,3,200%,50%,-50%,"4,445,647","90,090",2.07%,"Greater New York Area, East Coast, Northeastern US",Active,2011-01-01,year,2,101-250,"Dan Brodsky, Harold Mondschein",,,,,
Urolime,https://www.crunchbase.com/organization/urolime,,"Cloud Computing, Electronic Design Automation (EDA), Information Technology, Software Engineering",https://urolime.com/,"Dallas, Texas, United States","Urolime deals with DevOps consulting as well as solutions in cloud migration, automation, disaster recovery and managed services.","434,254","2,514","2,571.67",-17.71%,-97.44%,7,1.03,-22.57%,98.41%,46.1%,"4,580,813","553,956",13.76%,"Dallas/Fort Worth Metroplex, Southern US",Active,2011-01-01,year,,101-250,,,,,,
Uturn Data Solutions,https://www.crunchbase.com/organization/uturn-data-solutions,Uturn Data Solutions is an IT consultancy at the nexus of data strategy and cloud computing.,"Cloud Computing, Consulting, Information Technology, Internet",https://www.uturndata.com,"Chicago, Illinois, United States",Uturn Data Solutions is an IT consultancy at the nexus of data strategy and cloud computing.,"426,561","2,498","4,554.67",503.38%,100%,219,1.72,71.7%,28.3%,-71.7%,"4,593,545","-3,291,405",-41.74%,"Greater Chicago Area, Great Lakes, Midwestern US",Active,2013-01-01,year,1,11-50,Adam Dillman,,,,,
Shibumi,https://www.crunchbase.com/organization/shibumi,"Shibumi is a cloud-based enterprise application that provides the work management, collaboration, and performance measurement necessary to deliver successful business initiatives and optimize results. The company is focused on what customers need to execute business activity ranging from a single key initiative to an enterprise business improvement program. It reduces the need for time-consuming manual effort compiling status, impact, and results and helps get teams back to their most important job executing. Shibumi helps teams stop spending the majority of their week in meetings and accelerate their actions with a focus on measurable results.  The application is easy to use, intuitive interface, that requires little or no training means that any user can focus on getting work done rather than endless stakeholder reporting. It was founded in 2011 and is headquartered in Norwalk, Connecticut, United States.","B2B, Cloud Computing, Collaboration, Enterprise Software, Mobile, Social Media, Software, Web Development",http://www.shibumi.com,"Norwalk, Connecticut, United States","Shibumi is a cloud-based enterprise app providing work management, collaboration and performance measurement services for businesses.","14,979","2,479","3,607.83",-31.27%,-93.88%,0,1,-9.62%,100%,11.92%,"4,698,349","808,296",20.78%,"East Coast, New England, Northeastern US",Active,2011-01-01,year,4,51-100,"Jason Bobby, Ken Pellegrino, Mark DiGirolamo, Robert Nahmias",,,152454,USD,152454
Orbitera,https://www.crunchbase.com/organization/orbitera-inc,"Orbitera is a cloud commerce company that simplifies and automates the buying and selling of products in the cloud. It enables the operations and processes that software and service providers rely on to sell, distribute, and deliver their solutions. Orbitera also enables enterprise customers to buy, use, and manage these solutions. Its platform offers packaging and provisioning for enterprise applications. It has billing and cost optimization capabilities.","Cloud Computing, E-Commerce, Marketing Automation, SaaS, Software",http://www.orbitera.com,"West Hollywood, California, United States",Orbitera is a cloud commerce company that simplifies and automates the buying and selling of products in the cloud.,"93,555","2,443",,,,6,1.16,,84.32%,,"2,531,353",,,"Greater Los Angeles Area, West Coast, Western US",Closed,2011-05-07,day,2,11-50,"Brian Singer, Firas Bushnaq",,,,,
Qwire,https://www.crunchbase.com/organization/qwire-inc,"Qwire is a technology company that provides tools for streamlining audiovisual production. The company offers Qwire, a cloud-based data and media management software platform that vastly improves workflow from inception to delivery for people involved in creating, recording, manipulating, placing, project managing, licensing, delivering, and administering music in films and TV shows. Qwire Holdings was founded in 2012 and is based in New York, United States.","Cloud Computing, Information Technology, Music, Software, Video",http://qwire.com/,"Tarrytown, New York, United States","Qwire creates collaborative solutions for music clearance, licensing music, and cue sheet reporting, for media companies.","67,311","2,434",,73.61%,,0,1,0%,100%,0%,"4,639,790","-1,252,362",-21.25%,"Greater New York Area, East Coast, Northeastern US",Active,2012-01-01,year,3,1-10,"Jon Ehrlich, Leigh Roberts, Scott Freiman",,,,,
PushMon,https://www.crunchbase.com/organization/pushmon,"Cloud-based monitoring service for scripts, jobs, apps and batches. PushMon is a new kind of cloud-based monitoring system. Instead of checking public facing servers on a regular basis, PushMon will wait for pings from the objects being monitored. These objects are usually batch jobs, scheduled/cron scripts, backups, or test scripts, but really are anything that has access to the internet and can call a URL on a regular basis. If PushMon does not receive the URL ""ping"" by the specified schedule (like every hour, or every day or even by 5:00 PM every Fri), it will send an alert (email, IM, SMS, Twitter and/or phone call). It can monitor your database backups, your cron scripts, your background tests, your internet connectivity, your batch jobs, and a lot more. It also has an advanced but easy to use scheduling feature to alert you of problems as soon as possible.","Cloud Computing, Information Technology, Mobile Apps, Software",http://www.pushmon.com,"Seymour, Connecticut, United States",PushMon provides cloud-based software monitoring services for business customers.,"1,360,756","2,330",707.33,700.69%,,371,7.5,650%,50%,-50%,"4,830,551","-4,342,891",-47.34%,"East Coast, New England, Northeastern US",Active,2011-01-01,year,,11-50,,,,,,
Azuqua,https://www.crunchbase.com/organization/azuqua,"Azuqua helps the world’s leading companies integrate their SaaS applications and automate time-consuming, repetitive work so they can deliver better employee and customer experiences and redefine productivity across the organization. Azuqua's platform is intuitive, powerful, and resilient. The visual drag and drop interface without the need for code makes this platform usable for business and IT. Azuqua solves even the toughest problems with hundreds of comprehensive connectors and a rich library of business logic and data processing functions. Azuqua is resilient and will give the user ease-of-mind. You can trust your automations will run on-time, every time and that your data will be secured.","Cloud Computing, Cloud Management, Data Integration, Enterprise Software, Marketing Automation, SaaS, Software",http://www.azuqua.com,"Seattle, Washington, United States",Azuqua helps people integrate their SaaS applications and build powerful automations to save time and eliminate manual work.,"34,711","2,182","2,436.33",223.74%,-22.22%,0,1,0%,100%,0%,"4,930,667","-2,731,583",-35.65%,"Greater Seattle Area, West Coast, Western US",Active,2011-01-01,year,2,51-100,"Craig Unger, Nikhil Hasija",,,,,
Aragon Research Inc.,https://www.crunchbase.com/organization/aragon-research-inc,"Aragon Research is the newest technology research and advisory firm. Aragon delivers high impact interactive research and advisory services to provide enterprises the insight they need to help them make better technology and strategy decisions. Aragon Research serves business and IT leaders and has a proven team of veteran analysts. For more information, visit https://www.aragonresearch.com.","Cloud Computing, Computer Vision, Contact Management, Digital Marketing, E-Learning, Sales Automation, Security, Unified Communications",https://aragonresearch.com,"Morgan Hill, California, United States","Aragon delivers trusted advisory, interactive research and consulting services to enterprises.","248,386","2,147","55,204.83",-30.65%,28%,0,1,-47.23%,100%,35.72%,"4,957,069","798,407",19.2%,"San Francisco Bay Area, Silicon Valley, West Coast",Active,2011-08-15,day,1,11-50,Jim Lundy,,,59082,USD,59082
WALT Labs,https://www.crunchbase.com/organization/walt-labs,"Walt Labs is an IT application development organization, specializing in cloud management. They offer Cloud Migration, App Modernization, Cloud Support, GSuite Support. They are headquartered out of Houston Texas, but also have a global office site in London UK.","Apps, Cloud Computing, Cloud Management, SaaS, Software",https://waltlabs.io,"Spring, Texas, United States",WALT Labs is a software company that offers cloud based solutions.,"260,675","2,098",,-21.28%,,0,1,0%,100%,0%,"4,887,612","583,863",13.57%,"Greater Houston Area, Southern US",Active,2012-01-01,year,,11-50,,,,,,
Scale 24x7,https://www.crunchbase.com/organization/scale-24x7,,"Cloud Computing, Information Services, Information Technology, Software",https://www.escala24x7.com/,"Miami, Florida, United States",Escala24x7 identify your needs & implement a solution for your cloud services on the Amazon Web Services & Google Cloud Platform platforms,"713,229","2,096",,917.48%,,7,1.22,21.85%,89.07%,-10.93%,"5,001,109","-4,615,469",-47.99%,"Greater Miami Area, East Coast, Southern US",Active,2013-01-01,year,,11-50,,,,,,
DevNetwork,https://www.crunchbase.com/organization/devnetwork,"DevNetwork is the leading global developer community & conference company.  Events: DeveloperWeek, Integrate, API World, DataWeek, mobileWeek, CTO Talks, Hirepalooza (10,000+ annual attendees).  DevNetwork keeps you current on new developer technologies. The team has been producing tech conferences in the SF Bay area (and Seattle, Los Angeles, New York City) for the past 5 years.  Events include: Integrate & DataWeek + API World, the largest API and vendor-neutral data conference & expo and DeveloperWeek, the largest full-stack developer conference & expo.","Analytics, Cloud Computing, Events",http://www.devnetwork.com,"San Francisco, California, United States",Global developer community & leading producer of conferences & events for the developer industry,"285,920","2,055","2,930.33",35.64%,-27.42%,135,1.68,6.26%,65.86%,8.22%,"5,032,472","-873,783",-14.79%,"San Francisco Bay Area, West Coast, Western US",Active,2011-11-01,day,2,1-10,"Geoff Domoracki, Jonathan Pasky",,,185179,USD,185179
