Organization Name,Organization Name URL,Full Description,Industries,Website,Headquarters Location,Description,CB Rank (Company),SEMrush - Monthly Visits,SEMrush - Average Visits (6 months),SEMrush - Monthly Visits Growth,SEMrush - Visit Duration Growth,SEMrush - Visit Duration,SEMrush - Page Views / Visit,SEMrush - Page Views / Visit Growth,SEMrush - Bounce Rate,SEMrush - Bounce Rate Growth,SEMrush - Global Traffic Rank,SEMrush - Monthly Rank Change (#),SEMrush - Monthly Rank Growth,Headquarters Regions,Operating Status,Founded Date,Founded Date Precision,Number of Founders,Number of Employees,Founders,Apptopia - Number of Apps,Apptopia - Downloads Last 30 Days,Aberdeen - IT Spend,Aberdeen - IT Spend Currency,Aberdeen - IT Spend Currency (in USD)
Trimax Secure,https://www.crunchbase.com/organization/trimax-secure,"You need a partner that takes your best interests to heart and has the capacity to make your business goals a reality. That’s why TrimaxSecure works with leading technologies from major cloud providers including Microsoft, Amazon Web Services (AWS), RedHat and VMware. We are equipped to solve your most complicated business problems with solutions that are right for you. With over 20 years of extensive Information Technology knowledge, our team brings a depth of experience to cloud migration planning and implementation for Microsoft Azure and Amazon Web Services (AWS). We can also extend your business applications such as Dynamics 365 Sales or Business Central by providing Application Development Services.","Cloud Computing, Cloud Management, Cloud Security, IT Infrastructure, IT Management, Software",https://trimaxsecure.com/,"Saint Paul, Minnesota, United States",TrimaxSecure is an Amazon Web Services & Microsoft certified Cloud Service Provider that help you assess and migrate your IT to the cloud.,"797,600",,,,,,,,,,,,,"Greater Minneapolis-Saint Paul Area, Great Lakes, Midwestern US",Active,2013-01-01,year,,11-50,,,,,,
WorkView,https://www.crunchbase.com/organization/workview,"WorkView provides cloud-based enterprise work management solutions to companies of all sizes.  Built to address today’s dynamic work environment, WorkView enables people to efficiently organize and manage their work while driving better communication, visibility and accountability throughout their organization.","Cloud Computing, Project Management, Software",https://www.workview.com,"Lenexa, Kansas, United States",WorkView provides cloud-based enterprise work management solutions to companies of all sizes.,"799,695",,,,,,,,,,,,,Midwestern US,Active,2013-01-01,year,,1-10,,,,,,
Exa Data,https://www.crunchbase.com/organization/exa-data-inc,,"Business Intelligence, Cloud Computing, Mobile Apps, Software",https://www.exadatainc.com,"Piscataway, New Jersey, United States","Exa Data provides noteworthy software & technology services including cloud computing, BI, mobile apps development, digital automation, etc.","801,519",,,,,,,,,,,,,"Greater New York Area, East Coast, Northeastern US",Active,2011-01-01,year,,51-100,,,,,,
BetaBulls,https://www.crunchbase.com/organization/betabulls,,"Analytics, Cloud Computing, Information Technology, Software",https://betabulls.com,"North Brunswick, New Jersey, United States","BetaBulls is an IT firm that provides application support, big data analytics, software development, IoT Design & cloud computing services.","801,711",,,,,,,,,,,,,"Greater New York Area, East Coast, Northeastern US",Active,2013-01-01,year,,11-50,,,,,,
Intela Solutions,https://www.crunchbase.com/organization/intela-solutions,"Intela’s tech and Edu labs provide cost-effective, industrialized software and information technology solutions around the world.","Big Data, Blockchain, Cloud Computing, EdTech, Software, Software Engineering",https://www.intela.io,"Las Vegas, Nevada, United States","Intela Solutions is a software development company developing cloud computing, BDaaS, DSaaS, blockchain, research, and education platforms.","807,876",,,,,,,,,,,,,Western US,Active,2012-01-01,year,,,,,,,,
SpydrSafe Mobile Security,https://www.crunchbase.com/organization/spydrsafe-mobile-security,"SpydrSafe Mobile Security has designed the first-of-its-kind Mobile Application Security platform that controls how mobile apps access, use and share corporate data on smartphones and tablets. It is the only solution that provides enterprise IT uniform and fine-grained policy control over ANY mobile app, whether pre-loaded, downloaded from commercial app stores, or developed in-house.  SpydrSafe was founded in 2011 by seasoned enterprise security professionals and engineers from McAfee/Intel with more than 16 years of combined experience in mobile security. SpydrSafe is headquartered outside of Washington, DC.","Cloud Computing, Enterprise Software, Mobile, Mobile Devices, Security, Software",http://www.spydrsafe.com,"Mclean, Virginia, United States","SpydrSafe Mobile Security offers a platform that manages how mobile apps access, use and share corporate data on smartphones and tablets.","807,689",,,,,,,,,,,,,"Washington DC Metro Area, East Coast, Southern US",Active,2011-09-01,day,2,1-10,"Kevin Sapp, Michael Pratt",,,,,
Mobile & Cloud Labs,https://www.crunchbase.com/organization/mobile-cloud-labs,,"Cloud Computing, Information Technology, Mobile, Software",https://mobilecloudlab.com,"Fremont, California, United States",Mobile & Cloud Labs are a creative team who obsess over pixel perfection and deliver functional solutions.,"812,647",,,,,,,,,,,,,"San Francisco Bay Area, Silicon Valley, West Coast",Active,2011-01-01,year,,51-100,,,,,,
VyonCloud,https://www.crunchbase.com/organization/vyoncloud,"VyonCloud provides cloud computing services. Services provided include for hosted applications, cloud solutions, and Office365. Cloud solutions provided include business cloud, virtual private server, cloud IT services, cloud IT managed services.","Cloud Computing, Cloud Infrastructure, Cloud Management, Information Technology, Private Cloud, Software",https://vyoncloud.com/,"Phoenix, Arizona, United States",VyonCloud is an information technology & services providing firm.,"812,746",,,,,,,,,,,,,"Greater Phoenix Area, Western US",Active,2012-01-01,year,,11-50,,,,,,
Kreo Solutions,https://www.crunchbase.com/organization/kreo-solutions,"Kreo Solutions provides its professional services and consulting, computer services and cloud hosting, it security and data protection, and VOIP and cloud-based phone services. The evolving technology environment accessing, designing, engineering, implementing, integrating, supporting, and aligning the right IT solutions to business requirements.","Cloud Computing, Consulting, Information Technology, Software",https://kreo.co,"Phoenix, Arizona, United States","Kreo Solutions provides information technology consulting, cloud hosting, and data protection services.","814,331",,,,,,,,,,,,,"Greater Phoenix Area, Western US",Active,2011-01-01,year,,11-50,,,,,,
Zaviya,https://www.crunchbase.com/organization/zaviya,,"Cloud Computing, Information Technology, Network Security",http://www.zaviya.net,"San Antonio, Texas, United States","Zaviya is an IT company that provides cloud computing, data virtualization solutions, and network security services.","815,443",,,,,,,,,,,,,Southern US,Active,2011-01-01,year,,11-50,,,,45342,USD,45342
Venture Pointe,https://www.crunchbase.com/organization/venture-pointe,,"Cloud Computing, Consulting, Cyber Security, IT Management, Web Hosting",https://www.venturepointe.com/,"Jacksonville, Florida, United States","Venture Pointe offers IT services like web hosting, cloud services, network support, IT consulting and cybersecurity.","818,498",,,,,,,,,,,,,"East Coast, Southern US",Active,2012-01-01,year,,1-10,,,,,,
Enteracloud Solutions,https://www.crunchbase.com/organization/enteracloud-solutions,Enteracloud Solutions provides cloud computing solutions for small and medium sized businesses.,"B2B, Cloud Computing, Computer, Consulting, Information Technology, Web Hosting",http://www.enteracloud.com,"Carlsbad, California, United States",Cloud Computing Solution Provider,"820,836",,,,,,,,,,,,,"Greater San Diego Area, West Coast, Western US",Active,2011-01-01,year,,11-50,,,,173491,USD,173491
Polleo Systems,https://www.crunchbase.com/organization/polleo-systems,"Polleo Systems provides cloud computing solutions that effectively align IT environments with business objectives. Organizations can move beyond the cloud with Polleo’s highly customized, predictable, scalable and redundant virtual environments. From hybrid server virtualization to complex data continuity plans, Polleo’s experienced team will define, create and implement the right cloud solutions for growing organizations.","Cloud Computing, Information Technology, Robotics, Software",https://www.polleosystems.com/,"Carmel, Indiana, United States", Polleo Systems design cloud solutions for growing organizations.,"835,085",,,,,,,,,,,,,"Great Lakes, Midwestern US",Active,2011-07-01,day,,1-10,,,,41916,USD,41916
Centroid,https://www.crunchbase.com/organization/centroid,,"Cloud Computing, Software, Software Engineering",http://www.centroid-llc.com,"Annapolis Junction, Maryland, United States","Centroid specializes in cybersecurity, software development, big data and cloud computing services.","835,516",,,,,,,,,,,,,"East Coast, Southern US",Active,2011-01-01,year,,11-50,,,,,,
Securify.US,https://www.crunchbase.com/organization/securify-us,"Security.US designed and implemented security systems and network security around the world. The company specializes in residential and commercial installs, from planning through integrating and delivering the final product. If you are a homeowner, architect, big or small business, they will not only help fill the security gaps in your life, but they will also keep it simple for you. Their expertise and professionalism are incorporated into every project and their support services are highly individualized to fit your requirements. Over the past ten years, their integrators have designed and implemented large-scale networks and security systems. Use the contact form at the bottom of this page to enquire about whether their services are right for you.","Cloud Computing, Consulting, Information Services, Information Technology, Security",https://www.securify.us/,"Los Altos, California, United States",Securify.US traveled the world designing and implementing security systems and network security.,"836,389",,,,,,,,,,,,,"San Francisco Bay Area, Silicon Valley, West Coast",Active,2013-01-01,year,,11-50,,,,80899,USD,80899
Cobooco Ltd,https://www.crunchbase.com/organization/cobooco-ltd,"CoBooCo offers the most comprehensive collaboration platform to replace legacy email communications. CoBooCo sits at the heart of an enterprise's IT communications architecture and allows customers to get the best out of their legacy investments in email, document sharing and messaging applications. CoBooCo provides instant access to the content stored in the application with team driven filters so that users are not inundated with irrelevant content but instead receive only communications concerning issues that directly impact them. CoBooCo optimises productivity for team working and collaborative initiatives both within and across enterprises. No software or hardware installations are required because CoBooCo's platform is provided as software-as-a-service.","Cloud Computing, Collaboration, Document Management, SaaS, Software",http://cobooco.com,"Texas City, Texas, United States",Online Collaboration Software Company,"840,372",,,,,,,,,,,,,"Greater Houston Area, Southern US",Active,2011-12-01,day,,11-50,,,,,,
Cloud ladder Consulting,https://www.crunchbase.com/organization/cloud-ladder-consulting,,"Cloud Computing, Cloud Data Services, Consulting",https://cloudladderconsulting.com,"Irving, Texas, United States",Cloud Ladder Consulting is a consulting and technology services organization that specializes in cloud computing.,"844,238",,,,,,,,,,,,,"Dallas/Fort Worth Metroplex, Southern US",Active,2012-01-01,year,,1-10,,,,,,
Bend Cloud,https://www.crunchbase.com/organization/bend-cloud,,"Cloud Computing, Information Technology, Software, Web Design",https://bendcloud.com/,"Bend, Oregon, United States","Bend Cloud offers cloud computing, web design, and IT management services.","844,696",,,,,,,,,,,,,"West Coast, Western US",Active,2013-01-01,year,,1-10,,,,,,
Cloud Shifters,https://www.crunchbase.com/organization/cloud-shifters,"Cloud Shifters is an agile Boston-based technology consultancy specializing in the sales, deployment and support of Google's cloud computing suite. We are an authorized Google Apps for Business partner reseller. Cloud Shifters was founded by a veteran technology professional with over 15 years of experience at companies including Google and Apple. We believe strongly that you should concentrate on growing your business and not on maintaining your own infrastructure. Stick to what you do best and let us handle the rest.","Cloud Computing, Consulting",http://www.cloudshifters.com,"Waltham, Massachusetts, United States",Cloud Shifters is an agile Boston based technology consultancy specializing in the sales and support of Google's cloud computing suite.,"847,079",,,,,,,,,,,,,"Greater Boston Area, East Coast, New England",Active,2013-01-01,year,,1-10,,,,,,
Opstera,https://www.crunchbase.com/organization/opstera,"Opstera is a PaaS Monitoring and Managed Services provider that helps manage Cloud applications, the underlying platform and dependent Cloud Services.   Opstera was recently acquired by Avanade to expands its Managed Services portfolio for the public cloud.","Cloud Computing, SaaS, Software",http://www.opstera.com,"Bellevue, Washington, United States",Opstera is a PaaS-based monitoring and managed services provider that helps manage cloud apps.,"850,084",,,,,,,,,,,,,"Greater Seattle Area, West Coast, Western US",Closed,2011-11-15,day,,11-50,,,,,,
MySocialCloud,https://www.crunchbase.com/organization/my-social-cloud,"MySocialCloud.com is an online web application that allows you to manage your online life in one simple “cloud”—your secure entry point to the online world. Created at the University of Southern California, MySocialCloud is a very young start-up that is eager to bring ease and simplicity to the web experience.  Their purpose is to help people manage their online lives. MySocialCloud allows people to store usernames and passwords for automatic login to any site. On MySocialCloud, people can also view their various streams from across the Internet—from sites such as Facebook, Twitter—all pulled together onto one, easy-to-view page. MySocialCloud utilizes advanced encryption to ensure your information is always secure—from the inside and the outside. No one at MySocialCloud will ever be able to access any of your data.","Apps, Cloud Computing, E-Commerce, Information Technology, Internet, Mobile Apps, Online Portals, Social Media",http://mysocialcloud.com,"Lucerne Valley, California, United States",MySocialCloud is an online web app that allows users to manage their online life in one cloud.,"850,436",,,,,,,,,,,,,"Greater Los Angeles Area, Inland Empire, West Coast",Closed,2011-05-26,day,2,1-10,"Scott Ferreira, Stacey Ferreira",,,,,
Novatech,https://www.crunchbase.com/organization/novatech-7ab3,,"Cloud Computing, Information Technology, Marketing, Web Development",https://novats.net,"El Paso, Texas, United States",Novatech provides information technology and marketing services.,"852,234",,,,,,,,,,,,,Southern US,Active,2012-01-01,year,,1-10,,,,43902,USD,43902
sizzlepig,https://www.crunchbase.com/organization/sizzlepig,We made it 90% faster for Brands to place images on every screen while saving 70%+ in production costs with our patented process for the cloud. ,"Cloud Computing, Digital Media, Productivity Tools, SaaS, Software",http://www.sizzlepig.com,"Detroit, Michigan, United States"," Patented cloud process, templated based mass custom images.","853,385",,,,,,,,,,,,,"Greater Detroit Area, Great Lakes, Midwestern US",Closed,2012-01-01,year,3,1-10,"andrea livingston, Eric Livingston, Mark Stewart",,,,,
Mashup,https://www.crunchbase.com/organization/mashup,,"Apps, Cloud Computing, E-Commerce, Mobile, Music, Social Media, Video Streaming",http://www.Mashup.com,"Minneapolis, Minnesota, United States","Mashup is a cloud-based online portal that lets its users play, share, discover, buy, and access music from around the world.","857,257",,,,,,,,,,,,,"Greater Minneapolis-Saint Paul Area, Great Lakes, Midwestern US",Active,2011-09-28,day,,1-10,,,,,,
LonoCloud,https://www.crunchbase.com/organization/lonocloud,"LonoCloud is a cloud operating system to federate multi-vendor clouds with greater control of security, fault tolerance, cloud scale, and performance for migrating mission-critical applications to the inter cloud. It is partnered with HP cloud services and Amazon web services to facilitate its users with technology. LonoCloud is a U.S.-based company that was founded in 2011 by Tom Caldwell and it was acquired by ViaSat in 2013.","Apps, Cloud Computing, PaaS, Software",http://www.lonocloud.com,"La Jolla, California, United States",LonoCloud is a cloud operating system that helps corporations with large scale security.,"858,771",,,,,,,,,,,,,"Greater San Diego Area, West Coast, Western US",Active,2011-01-01,year,1,11-50,Tom Caldwell,,,,,
CloudSpokes,https://www.crunchbase.com/organization/cloudspokes,"CloudSpokes connects businesses that need cloud development work with a worldwide community of experts. CloudSpokes is a marketplace where customers pay only for results and experts are rewarded based on the value they create, not how long it takes to do something. Multiple people compete to solve a problem, and the best solutions are rewarded.  This is fundamentally a crowdsourcing model for collaborative cloud development. Platforms include: Amazon Web Services, Cloud Foundry, Force.com, Heroku, Google App Engine, Microsoft Azure. Languages including: HTML5, JQuery Mobile, Ruby, Java, Javascript, Python, Node.js, Objective-C, .Net As of 03/13 CloudSpokes has over 70,000 members across 100+ countries.","Cloud Computing, Crowdsourcing, Software",http://www.cloudspokes.com,"San Francisco, California, United States",CloudSpokes connects businesses that need cloud development work with a worldwide community of experts.,"874,313",,,,,,,,,,,,,"San Francisco Bay Area, West Coast, Western US",Closed,2011-02-14,day,,1-10,,,,,,
Fearless Technology Group,https://www.crunchbase.com/organization/fearless-technology-group,,"Cloud Computing, Cloud Infrastructure, Information Technology",https://fearlesstg.com/#contact_anchor,"Golden, Colorado, United States","Fearless Technology Group is a technology consulting firm that helps modernize technology, architecture and solve critical business issues.","876,946",,,,,,,,,,,,,"Greater Denver Area, Western US",Active,2013-01-01,year,,11-50,,,,,,
Ascension Technology Group,https://www.crunchbase.com/organization/ascension-technology-group,"Ascension Technology Group (www.ascgp.com) is a next-generation provider of enterprise-class cloud advisory, cloud hosting, and consulting services and developer of B2B and B2C mobile app authentication and fraud prevention technology systems.    Their vision is simple. To be the trusted global cloud and secure layer technology provider for Fortune 500 and SME clients, delivering the highest quality and consistent level of cloud based services for clients worldwide.    Their mission is to transform the way companies work, by providing cloud technology and related services that make data and application services run 40 to 60% less costly, and provide patented technologies that safeguards and authenticates the B2B and B2C process.    Current annualized revenue exceeding $2.5M in 2015.   Projected revenue of $12.8M by 2018, and $32.77M by 2020.    Competitive Advantage  FULL LIFECYCLE PROVIDER (Single Throat to Choke):   Their Cloud Advisory/Hosting Services and Consulting Services ensure they are providing best in class solutions for clients ranging from SME to Fortune 500.    INTELLECTUAL PROPERTY   Ascension currently has US patent pending on three SAAS based cloud inventions.    Ascension Technology Group is a global company with offices in Atlanta, Washington DC, San Francisco, China, and Singapore. To learn more about Ascension Technology Group, please visit www.ascgp.com, call +1.678.288.5980, or email info@ascgp.com.",Cloud Computing,http://www.ascgp.com,"Atlanta, Georgia, United States",Ascension Technology Group is a next-generation provider of cloud technology services.,"888,628",,,,,,,,,,,,,"Greater Atlanta Area, East Coast, Southern US",Active,2012-04-17,day,1,11-50,David Chen,,,15635,USD,15635
StarTekk,https://www.crunchbase.com/organization/startekk,,"Cloud Computing, Information Technology, Management Consulting",https://startekk.net/,"Plano, Texas, United States","StarTekk renders a wide range of IT solutions such as cloud, testing, technology staffing, management and business process services.","889,541",,,,,,,,,,,,,"Dallas/Fort Worth Metroplex, Southern US",Active,2013-01-01,year,,11-50,,,,,,
Nodeable,https://www.crunchbase.com/organization/nodeable,"Nodeable provides real-time data stream processing for big data applications. Nodeable¹s StreamReduce engine aggregates, normalizes and analyzes data before it reaches Hadoop, significantly accelerating batch processing under MapReduce. Customers are up and running in under 15 minutes and scale large workloads easily with Nodeable¹s cloud-based deployment. Founded in 2011, the company is backed by True Ventures.","Analytics, Big Data, Cloud Computing",http://www.nodeable.com,"San Francisco, California, United States","Nodeable provides real-time data stream processing for big data applications by aggregating, normalizing and analyzing data for Hadoop.","890,673",,,,,,,,,,,,,"San Francisco Bay Area, West Coast, Western US",Active,2011-03-01,day,2,11-50,"Dave Rosenberg, Neil Levine",,,,,
Lehigh Valley Technology Company,https://www.crunchbase.com/organization/lehigh-valley-technology-company,,"Cloud Computing, Cyber Security, Information Technology, Software",https://www.lhvtech.com/,"Bethlehem, Pennsylvania, United States","Lehigh Valley Technology Company provides managed IT solutions, cyber security and cloud computing services.","891,457",,,,,,,,,,,,,"Great Lakes, Northeastern US",Active,2012-01-01,year,,1-10,,,,,,
Richtech,https://www.crunchbase.com/organization/richtech-9de8,"Richtech provides machine vision solutions to customers. They offer live monitoring, cloud capability, badge printing, and health screening. Their customers contact through phone, email, and online applications.","Cloud Computing, Hardware",https://www.richtech-ai.com,"Las Vegas, Nevada, United States",Richtech provides automated temperature screening systems.,"891,537",,,,,,,,,,,,,Western US,Active,2013-01-01,year,,101-250,,,,,,
CloudCompli,https://www.crunchbase.com/organization/cloudcompli,,"Cloud Computing, Environmental Consulting, Software",https://www.cloudcompli.com,"Aliso Viejo, California, United States",CloudCompli develops software with cutting-edge data management for all aspects of stormwater management to improve the environment.,"894,672",,,,,,,,,,,,,"Greater Los Angeles Area, West Coast, Western US",Active,2013-01-01,year,,11-50,,,,,,
Xoyte,https://www.crunchbase.com/organization/xoyte,,"Big Data, Cloud Computing, Cyber Security, Mobile Apps, Software Engineering",http://www.xoyte.com/,"Woodbridge, Virginia, United States","Xoyte specializes in mobile app development, template-based website design, big data, cloud computing, and cyber security services.","908,187",,,,,,,,,,,,,"Washington DC Metro Area, East Coast, Southern US",Active,2012-01-01,year,,11-50,,,,,,
Netvoix,https://www.crunchbase.com/organization/netvoix,,"Cloud Computing, Communications Infrastructure, IT Management, Network Security",http://www.netvoix.com,"Weston, Florida, United States","Netvoix is an IT company that renders network infrastructure, data center automation, unified communication and cloud computing solutions.","908,675",,,,,,,,,,,,,"Greater Miami Area, East Coast, Southern US",Active,2011-01-01,year,,1-10,,,,,,
Confluex,https://www.crunchbase.com/organization/confluex,"Confluex provides consulting, technology services, and project resources for mid to large companies to design and implement Service Oriented Architecture (SOA), cloud technologies, and business application integrations. Confluex works with companies in insurance, financial services, retail, logistics, and technology industries to help them understand modern systems architecture and fully exploit the value of leading-edge technology concepts that are commonplace in the tech sector. Confluex strives to be the leading provider of professional services for enterprise integration and cloud technologies through employing and developing professional employees with specialized expertise, building long-term value for Confluex customers, and sharing our knowledge through education.","Architecture, Big Data, Business Intelligence, Cloud Computing, Consulting, Data Integration, Software",http://www.confluex.com,"Seattle, Washington, United States",Confluex specialize in Enterprise Integration using MuleSoft's Anypoint platform (including Mule ESB).,"909,084",,,,,,,,,,,,,"Greater Seattle Area, West Coast, Western US",Closed,2011-11-01,day,2,11-50,"Erich Leipold, Phillip Grove",,,136147,USD,136147
