Organization Name,Organization Name URL,Full Description,Industries,Website,Headquarters Location,Description,CB Rank (Company),SEMrush - Monthly Visits,SEMrush - Average Visits (6 months),SEMrush - Monthly Visits Growth,SEMrush - Visit Duration Growth,SEMrush - Visit Duration,SEMrush - Page Views / Visit,SEMrush - Page Views / Visit Growth,SEMrush - Bounce Rate,SEMrush - Bounce Rate Growth,SEMrush - Global Traffic Rank,SEMrush - Monthly Rank Change (#),SEMrush - Monthly Rank Growth,Headquarters Regions,Operating Status,Founded Date,Founded Date Precision,Number of Founders,Number of Employees,Founders,Apptopia - Number of Apps,Apptopia - Downloads Last 30 Days,Aberdeen - IT Spend,Aberdeen - IT Spend Currency,Aberdeen - IT Spend Currency (in USD)
Synata,https://www.crunchbase.com/organization/synata,"Synata is an enterprise search engine for businesses that use cloud and on-premise software.The product connects users to their company’s structured and unstructured data so they can quickly find information across Salesforce, Google Apps, Box, Dropbox, Zendesk, JIRA, Workday, Sharepoint, Exchange, and more.","Cloud Computing, Enterprise Software, SaaS, Search Engine, Software",http://www.synata.com,"San Francisco, California, United States","Synata enables users to find files, emails, contacts and other information across software used at work.","113,113",,,,,,,,,,,,,"San Francisco Bay Area, West Coast, Western US",Closed,2012-09-01,day,4,1-10,"Amy Kalnoki, Carter Foxgrover, Jateen Joshi, Patrick White",,,,,
amSTATZ,https://www.crunchbase.com/organization/amstatz,"amSTATZ is a cloud based software for fitness professionals and studios who want to save time, stay organized and grow client relationships.  Unlike traditional fitness business software, amSTATZ streamlines your operations, from a simplified booking & payment process to the workout homework you assign to clients between sessions.","Cloud Computing, Enterprise Software, Fitness, Software",http://amstatz.com,"Chicago, Illinois, United States","amSTATZ is a cloud-based software for fitness professionals to streamline their booking, payment, and client communication procedures.","114,601",,,,,,,,,,,,,"Greater Chicago Area, Great Lakes, Midwestern US",Active,2012-01-01,year,3,11-50,"Bobby McDonald, Michael Piermont, Sergey Belyankin",,,,,
iQVCloud,https://www.crunchbase.com/organization/iqvcloud,"iQVCloud, LLC operates in the technology sector. The company was incorporated in 2012 and is based in Reno, Nevada.","Cloud Computing, Cyber Security, Information Technology, Software",http://www.iqvcloud.net,"Reno, Nevada, United States",iQVCloud is an IT company that provides encryption systems and related technology.,"116,258",,,,,,,,,,,,,Western US,Closed,2012-01-01,year,,1-10,,,,,,
"Go Factory, Inc.",https://www.crunchbase.com/organization/go-factory-inc,"GOFACTORY industrial IoT solutions connect machines, sensors, systems and people to drive insight and intelligent action. Rather than taking hours to diagnose a problem, The GOFACTORY cloud service, connected assets, and mobile application work together to maximize asset life and optimize service time. GOFACTORY analyzes data from all these inputs in real-time, and then arms the right people with the right information to solve critical issues quickly.  GOFACTORY also seamlessly manages predictive maintenance to improve efficiency and service levels.Solutions are currently being developed in renewable energy, cell towers, supply chain and logistics, oil and gas and general field service, fleet management, and asset management.  GOFACTORY was founded in 2011 and is headquartered in San Francisco, California.","Cloud Computing, Predictive Analytics",http://www.go-factory.com,"San Francisco, California, United States",GOFACTORY provides an Industrial IoT service that drives intelligent action when uptime is essential.,"120,884",,,,,,,,,,,,,"San Francisco Bay Area, West Coast, Western US",Closed,2011-04-11,day,3,1-10,"Bryan Hughes, Jeff Weitzman, Marcus Colombano",,,,,
Apiphany,https://www.crunchbase.com/organization/apiphany,"Apiphany is a  provider of API management and delivery solutions enabling organizations to successfully leverage the roaring mobile, social, and app economy. With its flexible cloud-based architecture, Apiphany empowers companies to securely develop new revenue channels, gain insight into their business, and spur innovation at a fast pace while keeping cost and usage under control. It was founded in 2012 and is based in Washington, DC, USA. How Apiphany Can Help? Apiphany offers a comprehensive, flexible, cloud-based API management solution that can help you:  •	Share data internally, with your partners, or with the developer community. •	Secure and monitor access to your API environment. •	Gain insight into your API ecosystem. •	Remain flexible and agile. •	Grow and scale as you need. •	Software as a Service offering with monthly billing. Some of our customers are: The Washington Post, NFLData, Random House, FlightLookup.","Cloud Computing, Consumer Electronics, Developer APIs, Internet, SaaS, Software",http://www.apiphany.com,"Washington, District of Columbia, United States","Apiphany provides API management and delivery solutions that enable organizations to leverage the mobile, social and app economy.","121,138",,,,,,,,,,,,,"Washington DC Metro Area, Southern US",Active,2012-05-15,day,1,11-50,Evgeny Popov,,,17382,USD,17382
ZeroDesktop,https://www.crunchbase.com/organization/zerodesktop,"The QualityTime app is created by a team of developers at ZeroDesktop, Inc., based in Silicon Valley. Leveraging their expertise in Cloud and Mobile technologies, their solutions focus on children, students, working professionals and parents to help guide, safeguard and monitor their activities on their mobile devices. Users from over 100+ countries are using their solutions today. ZeroDesktop also delivers innovative Unified Cloud API & Metadata Engine and content aggregation services for Cloud Content Management. Their technologies are used by consumers and are also licensed to leading Telcos, OEMs and ISVs in Europe and Asia. Our products include: www.zeropc.com  (Cloud navigator & content management) www.dinnertimeapp.com  (Cloud-based parental control) www.qualitytimeapp.com (Discover and manage your smartphone habits) www.miipc.com (Android desktop with cloud-based parental control)","Cloud Computing, Cloud Management, Software",http://www.zerodesktop.com,"San Mateo, California, United States","Leading developers for Cloud-based Parental Control, Time Management and Cloud Service Brokerage solutions for consumers, telcos and ISVs.","121,842",,,,,,,,,,,,,"San Francisco Bay Area, Silicon Valley, West Coast",Active,2011-02-10,day,2,11-50,"Richard Sah, Young Song",1,,54743,USD,54743
Jisto,https://www.crunchbase.com/organization/jisto-inc,Jisto solutions allows enterprises to run additional applications in their stranded server capacity without impacting the performance of their core applications.,"Big Data, Cloud Computing, Information Technology, Software",http://www.jisto.com,"Boston, Massachusetts, United States",Transforming idle computation cycles in organizations into a powerful cloud computing platform capable of taking on massive computations,"124,412",,,,,,,,,,,,,"Greater Boston Area, East Coast, New England",Closed,2013-01-01,year,2,1-10,"Aleksandr (Sasha) Biberman, Andrey Turovsky",,,,,
OpenWhere,https://www.crunchbase.com/organization/openwhere,"OpenWhere is a Virginia-based company that provides a unique blend of expertise in cloud computing, location-based services, open-source technologies, and big data analytics in order to build and deploy highly distributed M2M (machine to machine) systems for powering the next generation of information services solutions.","Analytics, Big Data, Cloud Computing, Computer, Software",http://www.openwhere.com,"Herndon, Virginia, United States",OpenWhere provides elements for building and deploying highly distributed M2M systems for powering information services solutions.,"126,179",,,,,,,,,,,,,"Washington DC Metro Area, East Coast, Southern US",Closed,2013-01-01,year,1,1-10,Brian E. O'Toole,,,,,
RevAPM,https://www.crunchbase.com/organization/rev-apm,"RevAPM accelerates your mobile Apps. We offer a global network with a customizable performance platform that provides deeper insight into both network and App performance data. Our platform lets you control the desired performance level of your Apps. The result? More responsive Apps, and happier, more satisfied users. Most importantly, your users stay connected and increase their engagement because RevAPM helps you eliminate slow connections and reduce mobile lag. Let RevAPM accelerate all your Mobile Apps so you can create the best user experience possible.","Analytics, Cloud Computing, Mobile, PaaS",http://www.revapm.com/,"San Jose, California, United States","RevAPM is a new mobile application platform that combines performance, protection, control, & visibility into one system","127,293",,,,,,,,,,,,,"San Francisco Bay Area, Silicon Valley, West Coast",Closed,2012-01-01,year,1,1-10,Jonathan Bosanac,,,,,
VisOps Inc.,https://www.crunchbase.com/organization/visops-inc-,"Cloud Computing SaaS Start-up focused on help the users to create, provision, manage and monitor full application stack on top of AWS.","Apps, Cloud Computing, Enterprise Software, SaaS",http://www.visualops.io,"San Francisco, California, United States",VisualOps offers an intuitive and integrated approach to cloud application development and maintenance,"127,957",,,,,,,,,,,,,"San Francisco Bay Area, West Coast, Western US",Active,2011-01-01,year,4,11-50,"Dan O'Prey, Jimmy Xu, Peng Zhao, Xu Wong",,,,,
UrbanEngineer,https://www.crunchbase.com/organization/urban-engineer,"This is a mobile and web application that instantly books a contractor to a project OR a full-time employee. UE allows you to search all your resume databases and paid job subscriptions in one search. Communicate with those candidates via text right from our system.  We solve the issue of not having access to your internal databases.NO more starting a candidate search from scratch every morning. Have access to all of your databases in one search, including any paid job board subscriptions. It's as simple as accept or decline! If a company does not want to use it as a recruiting application, they can hire UrbanEngineer to find the contractors and book them. UrbanEngineer pays the contractors directly through the site, it's a one stop environment for the contractors and the companies seeking them.","Cloud Computing, Employment, Enterprise Software, Mobile, Recruiting, Software",https://urbanengineer.com,"Novato, California, United States",Mobile and Web Application for instant booking on contract & full-time positions,"128,648",,,,,,,,,,,,,"San Francisco Bay Area, West Coast, Western US",Active,2013-01-01,year,2,11-50,"Bridget Shannon Cooper, Colleen Aljundi",,,,,
Mosaic Storage Systems,https://www.crunchbase.com/organization/mosaic-storage-systems,"Mosaic Storage Systems is a provider of digital asset storage services used to help professional photographers to store their photographs. Its digital asset storage services take digital copies of photographs, stores them on its servers, and make them accessible via the internet that enables users to store and share photographs securely. It was founded in 2011 and is based in Nashua, New Hampshire.","Cloud Computing, iOS, Photo Editing, Photography, Software",http://www.MosaicArchive.com,"Nashua, New Hampshire, United States",Mosaic Storage Systems is a provider of digital asset storage services used to help photographers to store their photographs.,"131,289",,,,,,,,,,,,,"East Coast, New England, Northeastern US",Active,2011-03-07,day,1,11-50,Gerard Murphy,2,,,,
Cloud Hosting Credits,https://www.crunchbase.com/organization/hrmarker,Cloud Hosting Credits Offers: AWS Credits and Azure Credits up to $150.000,"Cloud Computing, Human Resources, Information Technology, Internet, Location Based Services, Staffing Agency",https://cloud-hosting-credits.com,"New York, New York, United States",Cloud Hosting Credits Offers: AWS Credits and Azure Credits up to $150.000,"133,936",,,,,,,,,,,,,"Greater New York Area, East Coast, Northeastern US",Active,2013-01-01,year,,1-10,,,,,,
CumuLogic,https://www.crunchbase.com/organization/cumulogic,"CumuLogic is a software provider that enables enterprises and Cloud Providers to deliver AWS-compatible database services. CumuLogic Database Service is an “on-prem” platform empowering developers and DBAs with self service database access, while enabling IT Ops to retain control of the underlying infrastructure for governance and security. Databases supported include MySQL, Percona, MongoDB and Couchbase. With the CumuLogic platform you can offer database “as a service” on any private infrastructure: Infrastructure-as-a-Service (IaaS) cloud, bare metal or VM pools (note: CumuLogic is *not* a database distribution). By adding the CumuLogic DBaaS platform to your existing environment, you can eliminate 90% of the operational tasks and automate even the most complex operations like clustering and replication for MySQL, or sharding and replica sets for MongoDB. Enterprise developers have the flexibility to orchestrate data services and design application architectures to fit specific availability, scalability, disaster recovery and performance needs.","Cloud Computing, Cloud Data Services, IaaS, Software, Virtualization",http://www.cumulogic.com,"Santa Clara, California, United States",CumuLogic is a software provider enabling enterprises and cloud-computing providers to deliver AWS-like cloud services.,"133,990",,,,,,,,,,,,,"San Francisco Bay Area, Silicon Valley, West Coast",Active,2011-01-15,day,3,11-50,"Laura Ventura, Rajesh Ramchandani, Sandeep Patni",,,,,
Nuvola,https://www.crunchbase.com/organization/nuvola,"Nuvola is an internet company that offers a Cloud Services Brokerage that provides strategic guidance, acquisition, integration, deployment, and supports services. for cost-effective, scalable and secure cloud platforms; including Google, Amazon AWS, Okta, and Skyhigh Networks.  The company was founded in 2013 and headquartered in California, United States.","Apps, Cloud Computing, Cloud Data Services, Collaboration, Consulting, Identity Management, Search Engine",http://www.getnuvola.com,"Mountain View, California, United States","Nuvola offers a Cloud Services Brokerage that provides strategic guidance, acquisition, integration, deployment, and support services.","134,880",,,,,,,,,,,,,"San Francisco Bay Area, Silicon Valley, West Coast",Active,2013-01-01,year,2,11-50,"Alan McIntosh, David Giaramita",,,,,
LetusCloud,https://www.crunchbase.com/organization/letuscloud,"LetusCloud is a company specialized in virtualization & cloud computing. The goal is to bridge the gap between enterprises and virtualization. Through our innovative solution we will be providing Virtualization as a Service (VaaS) to all companies (small and big enterprises). Our services: 1) Nubes (latin for Cloud!): It's a simple GUI that is accessible on HTML5 browser. User will be able to design a virtual network using components such as PC, router, firewall, ..etc. 2) Nubes Pro: Similar to Nubes but allows more components such switchers, DMZ, more advanced routers and SAN storage. 3) Virtual Office: Using Nubes you can create an extension to your office by hosting some PCs on the cloud that will appear as part of your internal network. 4) Virtual Enterprise: If you have the hardware we can create a replica of your current enterprise network (including PCs, Routers, firewalls. . . etc) on the cloud and run it on your own data center. 5) Virtualization Consultation: If you want to move to the cloud and you want to have it in your data center then we can advise you on the technologies to use, best hardware combination. 6) Move Software to cloud: You have a web service written in C#, .net, Java or whatever programming language and you are expecting demands more than what you expected. You want your solution to run on the cloud and not modify a line in your code? Contact us, we can help!","Cloud Computing, Virtualization",http://www.letuscloud.com,"Anaheim, California, United States",LetusCloud is a company specialized in virtualization & cloud computing.,"137,405",,,,,,,,,,,,,"Greater Los Angeles Area, West Coast, Western US",Active,2011-01-01,year,3,11-50,"Darrin Morrish, Hadi Bahbouh, Philip McNeal",,,,,
Tactics Cloud,https://www.crunchbase.com/organization/tactics-cloud,"Tactics Cloud provides sales and marketing insights using billions of strands of publicly available social and business data to help identify individuals and groups with common skills, interests, and relationships. Unlike social media monitoring solutions, Tactics Cloud focuses on social network connections to provide unique insights","Apps, Cloud Computing, Software",http://tacticscloud.com,"New York, New York, United States",Tactics Cloud offers sales and marketing insights that help identify social media users with common skills and interests.,"140,219",,,,,,,,,,,,,"Greater New York Area, East Coast, Northeastern US",Active,2013-01-01,year,5,1-10,"Ardi Iranmanesh, Brian Jeffcock, Phil Renaud, Stephen Hankinson, Tim Burke",,,,,
Squirrell,https://www.crunchbase.com/organization/sqrl,"Sqrl is a web application that enables companies, startups, and enterprises to keep a track of client information and communication. It manages emails, calls, reminders, and other modes of communication with customers. It was founded in January 2013 and is based in Cincinnati, Ohio.","Accounting, Cloud Computing, Collaboration, CRM, Enterprise Software, Network Security, Project Management, SaaS, Software",http://getsqrl.com,"Cincinnati, Ohio, United States","Squirrell is a web application that enables companies, startups, and enterprises to keep a track of client information and communication.","146,025",,,,,,,,,,,,,"Great Lakes, Midwestern US",Active,2013-01-01,year,3,1-10,"Craig Baldwin, Ryan Baker, Ryan Watson",,,,,
Step Ahead Innovations,https://www.crunchbase.com/organization/step-ahead-innovations,"Step Ahead Innovations focuses on transferring research onto practical consumer products, including a product that monitors water quality. It develops innovative IoT water monitoring and management products that enable real-time, remote, automated monitoring of numerous water parameters with one compact Web-connected device. The company was co-founded by James Clark and Giuseppe Petrucci in 2012 and is based in South Burlington, Vermont.","Cloud Computing, Innovation Management, Water",http://stepaheadinnovations.com,"South Burlington, Vermont, United States","Step Ahead Innovations focuses on transferring research onto practical consumer products, including a product that monitors water quality.","146,063",,,,,,,,,,,,,"New England, Northeastern US",Closed,2012-01-01,year,2,11-50,"James Clark, Joe Petrucci",,,97591,USD,97591
AppScale Systems,https://www.crunchbase.com/organization/appscale-inc,"AppScale is a managed hybrid cloud infrastructure software that emulates the core AWS APIs. It enables customers to run AWS workloads on AppScale ATS in a service provider data center or on-premises without any code modification or rewriting.  AppScale customers are enterprises, government agencies and contractors, and 3rd party service providers. Typical use cases include Dev/Test on-ramp to AWS, repatriation off-ramp from AWS public cloud for competitive or cost reasons, and regulated industries with strict data control requirements.","Cloud Computing, Cloud Infrastructure, Data Center, Enterprise Software, Information Technology, Private Cloud, SaaS, Software",http://appscale.com,"Santa Barbara, California, United States",AppScale is hybrid cloud infrastructure software that emulates the core AWS APIs.,"146,763",,,,,,,,,,,,,"West Coast, Western US",Active,2012-01-01,year,4,11-50,"Chandra Krintz, Chris G. Bunch, Navraj (Raj) Chohan, Woody Rollins",,,,,
Cafe Learn,https://www.crunchbase.com/organization/cafe-learn,"Café Learn increases student success with a cloud-based platform that enables schools to evolve teaching and learning. Instructors can easily create, share and customize blended, social, and personalized course experiences—with complete content flexibility. They offer the first platform that is centered completely on student success—providing faculty with real time data on student mastery of measurable outcomes.","Cloud Computing, E-Learning, EdTech",http://www.cafelearn.com/,"Stamford, Connecticut, United States","Café Learn is a cloud-based, courseware and service that makes it easy for faculty to shift to blended, outcomes-based course design.","149,099",,,,,,,,,,,,,"East Coast, New England, Northeastern US",Active,2013-01-01,year,2,1-10,"Carrie O'Donnell, Matt Gurney",,,,,
Credii,https://www.crunchbase.com/organization/credii,"Credii automates the time and data-intensive process of shortlisting and selection that a business buyer goes through while sourcing software and IT services. Credii's tools record the context behind a user's requirement through a dynamic question flow, and many slice-and-dice features help visualize the most relevant options as a list, 2D graph or a comparison table, helping a user quickly and accurately create a customized shortlist. Credii currently offers selection widgets covering Cloud Computing (PaaS and IaaS), Social Media Monitoring, Marketing Analytics, Project Management, Web Conferencing and Internal Collaboration Software, and plans to extend coverage to over 100 domains.","Cloud Computing, Enterprise Software, Information Technology, Software",http://www.credii.com,"Mountain View, California, United States","Credii is a web platform for businesses to find, select and buy the right software and services for their needs.","149,444",,,,,,,,,,,,,"San Francisco Bay Area, Silicon Valley, West Coast",Active,2011-01-01,year,2,11-50,"Ayan Barua, Vamshi Mokshagundam",,,,,
Ekho,https://www.crunchbase.com/organization/ekho-inc,"Ekho is a digital advertising development platform designed to simplify, extend and enhance native advertising opportunities for brands. The Ekho product suite leverages “activated data” to provide a suite of Sales + Marketing tools across industries. The elegance of these tools is their integrated nature. Ekho Focus Sets generate contextual, time-critical lists of People and Content, which are then ranked and scored, in real-time by our proprietary algorithms.  SOCIAL LEAD GENERATION  •	Generate a real-time stream of ranked + scored leads focused on your business or product  •	Time-critical lists of Social ID's specific to a brand, product or topic to integrate with various Advertising API's  •	Improve conversion rates and enhance ROI for digital marketing efforts  •	Significantly reduce your costs for lead acquisition  CONTENT ENGINE  •	Ekho’s Top Content algorithm delivers the most recent, most relevant content about your area of interest  •	Build Community for your Digital Brand with relevant and timely content  •	Curate content streams to provide insight and commentary for your own original content  •	Recognize advertising and subscription-based revenue opportunities  DYNAMIC AD NETWORK  Ekho’s white-label-ready Leaderboards (built from our ranked and scored lead lists) plus new streams of relevant content provide advertising inventory where none existed.  •	Incremental revenue opportunities through display ads  •	Generate subscription revenue  •	Drive your Database Acquisition Strategy  •	Enhance ROI for Sales and Marketing programs  LEADERBOARD | COMMUNITY BOARD  Create community | Gamify your products, brand advocates or employees | Recognize the experts.  The Ekho Leaderboard, with customizable EkhoScore, allows you to score, rank and promote the people most important to your brand.  Twitter: @ekhoinc","Advertising, Analytics, Big Data, Cloud Computing, Data Visualization, Social Media",http://www.ekho.me,"San Rafael, California, United States","Ekho is a digital advertising development platform designed to simplify, extend and enhance native advertising opportunities for brands.","149,468",,,,,,,,,,,,,"San Francisco Bay Area, West Coast, Western US",Active,2012-11-15,day,3,1-10,"Bryan Levenson, Josh Camire, Kent Langley",,,,,
Mobiscope,https://www.crunchbase.com/organization/mobiscope,"Mobiscope is a mobile video monitoring service. Mobiscope allows to view full motion video from web cameras and network cameras on mobile (iOS, Android, BlackBerry, MIDP 2.0) or in a browser. With Mobiscope users may also view public web-cameras streaming places of interest worldwide. Mobiscope can be used to ensure home and small office security, as well as baby monitor or pet monitor. Mobiscope offers live stream from surveillance cameras, notifies via Push notification or email when motion is detected, records video and stores video recordings.","Cloud Computing, Cloud Data Services, Mobile",http://mobiscope.com,"Tenafly, New Jersey, United States",Mobiscope is a mobile video monitoring service for web and network cameras used for surveillance.,"150,176",,,,,,,,,,,,,"Greater New York Area, East Coast, Northeastern US",Active,2012-09-01,day,1,11-50,Igor Berezovsky,5,,,,
