Organization Name,Organization Name URL,Full Description,Industries,Website,Headquarters Location,Description,CB Rank (Company),SEMrush - Monthly Visits,SEMrush - Average Visits (6 months),SEMrush - Monthly Visits Growth,SEMrush - Visit Duration Growth,SEMrush - Visit Duration,SEMrush - Page Views / Visit,SEMrush - Page Views / Visit Growth,SEMrush - Bounce Rate,SEMrush - Bounce Rate Growth,SEMrush - Global Traffic Rank,SEMrush - Monthly Rank Change (#),SEMrush - Monthly Rank Growth,Headquarters Regions,Operating Status,Founded Date,Founded Date Precision,Number of Founders,Number of Employees,Founders,Apptopia - Number of Apps,Apptopia - Downloads Last 30 Days,Aberdeen - IT Spend,Aberdeen - IT Spend Currency,Aberdeen - IT Spend Currency (in USD)
Matterport,https://www.crunchbase.com/organization/matterport,"Matterport is the digital transformation of the built world. The Company’s groundbreaking spatial computing platform turns buildings into data making every space more valuable and accessible. Millions of buildings in more than 150 countries have been transformed into immersive Matterport digital twins to improve every part of the building lifecycle from planning, construction, and operations to documentation, appraisal and marketing.","3D Technology, Cloud Computing, Data Visualization, Virtual Reality",http://www.matterport.com,"Sunnyvale, California, United States",Matterport is a developer of a 3D media platform used to establish 3D and virtual reality models.,"17,479","28,175,899","30,384,739.67",-17.1%,3.16%,915,1.44,3.72%,78.23%,0.81%,"5,699",907,18.93%,"San Francisco Bay Area, Silicon Valley, West Coast",Active,2011-01-01,year,3,251-500,"Dave Gausebeck, Matt Bell, Mike Beebe",6,"122,043",,,
DigitalOcean,https://www.crunchbase.com/organization/digitalocean,"DigitalOcean is a cloud computing platform that deploys, manages, and scales applications of any size. Its infrastructure and platform-as-a-service solutions provide a no DevOps required experience, allowing developers to focus their energy on creating innovative software. By combining the power of simplicity, love for the developer community, an obsession for customer service, and the advantages of open source, DigitalOcean brings software development within the technical and economic reach of anyone around the world. DigitialOcean was formed in 2012 and is headquartered in New York, New York.","Cloud Computing, SaaS, Virtualization, Web Hosting",http://www.digitalocean.com,"New York, New York, United States","DigitalOcean provides a cloud platform to deploy, manage, and scale applications of any size.","18,797","25,870,482","20,655,641",12.5%,-24.26%,665,1.84,3.44%,73.06%,-1.4%,"6,249","-1,125",-15.26%,"Greater New York Area, East Coast, Northeastern US",Active,2012-01-01,year,4,501-1000,"Alec Hartman, Ben Uretsky, Mitch Wainer, Moisey Uretsky",,,18036123,USD,18036123
Zapier,https://www.crunchbase.com/organization/zapier,Zapier helps anyone to automate the most tedious parts of a day to day job. The company believes that there are jobs that a computer is best at doing and that there are jobs that a human is best at doing. Zapier wants to empower businesses everywhere to create processes and systems that let computers do what they are best at doing and let humans do what they are best at doing.,"Cloud Computing, Data Integration, SaaS, Software",https://www.zapier.com,"San Francisco, California, United States",Zapier allows its users to easily connect and automate the apps they use.,"46,090","10,027,485","12,418,483.67",-25.25%,-8.94%,652,3.35,-9.62%,51.99%,13.37%,"16,872","5,205",44.61%,"San Francisco Bay Area, West Coast, Western US",Active,2011-10-01,day,3,251-500,"Bryan Helmig, Mike Knoop, Wade Foster",,,,,
Workable,https://www.crunchbase.com/organization/workable-hr,"Workable is the world’s leading hiring platform. We provide in-house recruiters and hiring teams with more ways to find more qualified candidates, and help them work together to identify and hire the best. Companies who use our software get from requisition to offer letter faster, with automated and AI-powered tools that source and suggest candidates, simplify decision making and streamline the hiring process. Workable was founded in 2012, and has since helped more than 20,000 companies hire one million candidates. We employ over 250 people across Greece, Australia, the US and the UK, and work with a diverse group of organizations, including HireVue, JOEY Restaurants, Bevi, Soho House, RyanAir, Sephora and many more.","Cloud Computing, Human Resources, Recruiting, SaaS, Software",http://www.workable.com,"Boston, Massachusetts, United States","Workable is the world’s leading hiring platform, where companies find, evaluate and hire better candidates, faster.","2,480","9,303,986","13,785,581.83",-65.9%,-76.67%,507,1.63,32.28%,68.97%,-21.49%,"18,051","12,402",219.54%,"Greater Boston Area, East Coast, New England",Active,2012-09-01,day,2,251-500,"Nikos Moraitakis, Spyros Magiatis",1,202,,,
Algolia,https://www.crunchbase.com/organization/algolia,"Algolia is the search-as-a-service platform that enables companies of all sizes to deliver fast and relevant digital experiences that drive real results. With Algolia, consumers are able to easily find and discover what they want across the web, mobile, and voice. Algolia allows developers and business teams to build and optimize delightful Search & Discovery experiences that increase online engagement, conversion rates, and revenue.","Cloud Computing, Search Engine, Semantic Search, Vertical Search",https://www.algolia.com,"San Francisco, California, United States",Algolia is the Search-as-a-Service platform that enables companies to deliver fast and relevant digital experiences that drive real results.,"3,815","7,508,652","4,419,959.17",29.13%,36.74%,763,1.79,-17.08%,67.26%,16.07%,"22,010","-5,149",-18.96%,"San Francisco Bay Area, West Coast, Western US",Active,2012-01-01,year,2,501-1000,"Julien Lemoine, Nicolas Dessaigne",1,,1333712,USD,1333712
Segment,https://www.crunchbase.com/organization/segment-io,"Segment provides the customer data infrastructure that helps businesses put their customers first. Using Segment, companies can collect, unify, and connect their first-party to over 200 marketing, analytics, and data warehouse tools. It was founded in 2011 and headquartered in San Francisco, California.","Analytics, Big Data, Cloud Computing, Infrastructure, SaaS",http://segment.com,"San Francisco, California, United States",Segment provides customer data infrastructure that helps businesses put their customers first.,"7,460","6,105,188","6,867,675.83",-22.91%,-15.53%,555,1.46,6.68%,77.19%,-5.55%,"26,027","7,133",37.75%,"San Francisco Bay Area, West Coast, Western US",Active,2011-09-01,month,4,501-1000,"Calvin French-Owen, Ian Storm Taylor, Ilya Volodarsky, Peter Reinhardt",1,,337259,USD,337259
SOHA SYSTEMS,https://www.crunchbase.com/organization/soha-systems,"Soha Systems is the innovator of Enterprise Secure Access delivered as a service. Our service, Soha Cloud, creates a “cloud perimeter” to protect an organization’s infrastructure from Internet threats, including distributed denial of service (DDoS) attacks and botnets. Soha Cloud also minimizes a customer’s attack surface, hides applications from public exposure and grants authenticated users micro-granular access to specific applications. Unlike stand-alone, legacy security tools and network access methods, Soha Cloud integrates data path protection, identity access, application security and management visibility into a single solution to create a cloud perimeter between a user organization’s infrastructure and the Internet.","Cloud Computing, Enterprise Software, Network Security",https://www.akamai.com,"Sunnyvale, California, United States",Soha Systems is the innovator of Enterprise Secure Access delivered as a service.,"31,842","5,039,558","4,042,195.33",45.38%,65.14%,"1,833",12.74,139.71%,34.21%,-28.28%,"30,593","-7,150",-18.94%,"San Francisco Bay Area, Silicon Valley, West Coast",Closed,2013-01-01,year,2,11-50,"Hanumantha Kavuluru, Haseeb Budhani",3,,,,
AppSheet,https://www.crunchbase.com/organization/appsheet,"AppSheet is the intelligent no-code platform for business apps. It also enables business users to leverage their business data and build powerful, code-free apps. The company connects with a range of data sources including spreadsheets on Google Drive, Office 365, Dropbox, and Box, relational databases like SQLServer, MySQL, Postgres, AWS Aurora, and Oracle, cloud SaaS services like Salesforce, Smartsheet, AirTable, and many more.  AppSheet quickly generates a working application that can be customized, enhanced, branded and deployed. The apps can be rich in function (offline access, workflow rules, machine learning, etc) and run on the web, iOS, Android, and messaging platforms. AppSheet was founded in 2014 and is headquartered in Seattle, WA, USA.","Big Data, Cloud Computing, Developer Tools, Information Technology, iOS, Mobile Apps, Software",https://www.appsheet.com,"Seattle, Washington, United States",AppSheet is the intelligent no-code platform for business apps.,"11,950","4,996,151","3,324,040.5",116.92%,29.31%,"1,403",3.48,14.37%,40.04%,-16.77%,"30,746","-21,618",-41.28%,"Greater Seattle Area, West Coast, Western US",Active,2012-01-01,year,2,11-50,"Brian Sabino, Praveen Seshadri",5,"139,209",,,
Elastic,https://www.crunchbase.com/organization/elasticsearch,"Elastic develops the open source Elastic Stack (Elasticsearch, Kibana, Beats, and Logstash), X-Pack (which offers commercial features for the Elastic Stack), and Elastic Cloud (a family of SaaS offerings). To date, there have been more than 250 million cumulative downloads of the Elastic Stack.  Elastic is used by thousands of organizations including Cisco, eBay, Goldman Sachs, NASA, Microsoft, Mayo Clinic, The New York Times, Wikipedia, and Verizon to power mission-critical systems. Elastic is used for use cases that require search, logging, metrics, and security of data. Backed by Benchmark Capital, Index Ventures, and NEA with more than $100 million in funding, Elastic has a distributed workforce with more than 900 employees in 30 countries.","Analytics, Cloud Computing, Open Source, SaaS, Search Engine, Software",https://www.elastic.co,"Mountain View, California, United States","Elastic builds software to make data usable in real time and at scale for search, logging, security, and analytics use cases.",365,"4,657,458","4,796,840.33",8.67%,-8.82%,548,2.44,-8.26%,56.04%,4.67%,"33,175","-1,740",-4.98%,"San Francisco Bay Area, Silicon Valley, West Coast",Active,2012-02-01,day,4,1001-5000,"Shay Banon, Simon Willnauer, Steven Schuurman, Uri Boness",,,,,
9Cloud,https://www.crunchbase.com/organization/9cloud,,"Cloud Computing, Internet, Web Design, Web Hosting",https://www.9cloud.us/,"Boston, Massachusetts, United States",9Cloud is a content storage service for website owners that are hosted privately.,"782,176","3,038,491","3,825,205",245.77%,32.73%,438,1.78,3.95%,57.23%,-14.13%,"45,972","-63,770",-58.11%,"Greater Boston Area, East Coast, New England",Active,2013-01-01,year,,,,,,,,
Red Hat Ansible,https://www.crunchbase.com/organization/ansible,"Ansible is an automation engine that makes systems and applications simple to deploy. It does not require custom scripting or custom code, and it uses an automation language that is easy for anyone to understand and learn. The company also provides enterprise-ready commercial offerings that help teams manage complex multi-tier deployments by adding control, knowledge, and delegation to Ansible-powered environments. Ansible can be used by anyone, including sysadmins, developers, and IT managers. It was launched in 2013 by Michael DeHaan, Said Ziouani, Timothy Gerla, and is based in Santa Barbara, C.A.","Cloud Computing, Enterprise Applications, Enterprise Software, Internet, Software",http://ansible.com,"Santa Barbara, California, United States",Red Hat Ansible is an automation engine that makes systems and applications simple to deploy.,"46,781","2,671,136","3,565,922",-15.65%,69.52%,890,1.9,6.97%,61.81%,-9.46%,"50,636","10,088",24.88%,"West Coast, Western US",Active,2013-01-01,year,3,5001-10000,"Michael DeHaan, Saïd Ziouani, Timothy Gerla",,,,,
Zype,https://www.crunchbase.com/organization/zype,"Zype provides the infrastructure for digital video with a cloud-based platform to manage and distribute enterprise-grade video across the web, mobile, TV, and social media. Offering both developer-friendly tools such as customizable APIs as well as turnkey solutions for OTT apps and linear/FAST channels, Zype’s SaaS solutions enable video creators or distributors to quickly build, launch and manage superior video products at scale.","Cloud Computing, Digital Media, Mobile Advertising, Video, Video Streaming",http://www.zype.com,"New York, New York, United States",Zype provides the infrastructure for digital video with a cloud-based platform to manage and distribute enterprise-grade video.,"9,401","2,545,802","5,120,769.33",22.3%,108.41%,446,2.5,-48.6%,51.24%,120.29%,"52,459","-4,319",-7.61%,"Greater New York Area, East Coast, Northeastern US",Active,2013-01-01,year,2,11-50,"Chris Bassolino, Ed Laczynski",6,,238032,USD,238032
CircleCI,https://www.crunchbase.com/organization/circle-ci,"CircleCI’s continuous integration and delivery platform that helps software teams rapidly release code with confidence by automating the build, test, and deploy process. It lets teams ramp quickly, scale easily, and build confidently every day. Velocity is critical for software teams in today's competitive landscape, but maintaining speed can be difficult as apps and systems grow larger and more complex. CircleCI enables developers to detect and fix bugs before they even reach customers. Thousands of leading companies including Facebook, Kickstarter, Shyp, and Spotify rely on CircleCI to accelerate the delivery of their code and enable developers to focus on creating business value fast. CircleCI is a Bay Area Best Places to Work 2018 award winner from the San Francisco Business Times and Silicon Valley Business Journal. Founded in 2011 and headquartered in beautiful downtown San Francisco with a global remote workforce, CircleCI is venture-backed by Scale Venture Partners, DFJ, Baseline Ventures, and Harrison Metal Capital.","Cloud Computing, Developer Tools, Information Technology, PaaS, Productivity Tools, SaaS, Software",https://circleci.com,"San Francisco, California, United States",CircleCI is a continuous integration and delivery platform that automates development workflows and IT operations.,"14,937","2,234,549","2,424,478.17",-7.49%,3.69%,"1,012",2.64,6.23%,56.41%,2.9%,"58,055","7,325",14.44%,"San Francisco Bay Area, West Coast, Western US",Active,2011-01-01,year,2,501-1000,"Allen Rohner, Paul Biggar",,,,,
RIDERS,https://www.crunchbase.com/organization/riders,"RIDERS is a community united by a shared passion for extreme sports. It’s an App that connects Riders everywhere, giving them access to the world’s largest BMX, Skate, MTB, Wakeboard, Snowboard, Longboard and Ski tricks database containing detailed videos and step-by-step instructions from the pros. Riders can learn new tricks or simply upgrade their game, find spots, share videos and rate other Riders’ skills.  Beginners to pros, it allows users to share, socialize and compete with fellow Riders. Users can discuss stunts, create video feeds, rate and leave comments for other Riders. Riders is also an instrument for companies looking for new Pro Riders to endorse, and Pro Riders looking to show off their skills to potential sponsors.","Apps, Cloud Computing, Developer Tools, Internet, Mobile, Sports",https://riders.co,"Miami, Florida, United States",RIDERS is a community united by a shared passion for extreme sports.,"109,588","2,033,725","372,202.17","4,252.17%","1,300%",490,1.15,8.37%,86.6%,-9.49%,"64,148","-815,524",-92.71%,"Greater Miami Area, East Coast, Southern US",Active,2011-10-01,day,2,11-50,"Anatoly Chernyakov, Igor Debatur",1,,,,
Leadpages,https://www.crunchbase.com/organization/leadpages,"Leadpages provides HTML5 templates for contact pages, webinar pages, sales lead and other types of landing pages that customers use to improve leads and get better conversions. The service runs on Google App Engine and uses technology such as Big Table to analyze the landing page data. Unlike competitors that use  WYSIWYG (What You See Is What You Get), Leadpages does not have to translate into HTML. Instead the HTML pages are already made, which allows for the data to be decoupled and analyzed in the Google cloud stack. The pages are optimized for any mobile device.","Cloud Computing, Mobile, Software, Web Apps",https://www.leadpages.com,"Minneapolis, Minnesota, United States","Leadpages is a tool that lets you create launch pages, sales pages, pop ups, and other conversion pages.","14,817","1,864,523","1,568,512.17",124.87%,3.84%,838,4.52,11.11%,33.32%,-12.25%,"68,596","-53,062",-43.62%,"Greater Minneapolis-Saint Paul Area, Great Lakes, Midwestern US",Active,2012-11-01,day,2,101-250,"Clay Collins, Tracy Simmons",,,,,
WeVideo,https://www.crunchbase.com/organization/wevideo,"WeVideo is a unique cloud-based collaborative video editing service that helps people from all over the world simply create and share great-looking videos. The WeVideo editor is easy enough for first-time editors, and sophisticated enough to help anyone create a professional-looking video. WeVideo works through any browser and as an integrated video editor within YouTube and Google Drive. The company's headquarters are in Palo Alto, California and its services are based on technologies that originated in Scandinavia. WeVideo is a cloud-based solution with no software to download or install. All video editing takes place in a browser on your smartphone. Video clips can be uploaded from any device to your own personal media library in the cloud and combined with titles, transitions, effects, animation, music, and narration for professional-looking results. Users have full creative control over the final product compared to other automated solutions. The WeVideo platform uniquely enables social video creation by providing a collaborative online environment for video content aggregation and/or joint editing of the video story. All data uploaded to the system is safe from intrusion via highly encrypted password access, allowing you to control who is part of your video editing community. Finished videos can be shared on the WeVideo platform or published in Internet or HD broadcast quality to your favorite video-sharing site, social networking profile, blog, or other destination.","Cloud Computing, Collaboration, Enterprise Software, Music, Software, Video, Video Editing",http://www.wevideo.com,"Menlo Park, California, United States","WeVideo is a powerful, yet easy-to-use, cloud-based collaborative video creation platform.","106,699","1,549,353","1,591,231.17",89.19%,17.89%,547,2.11,8.21%,53.72%,-4.84%,"79,063","-43,721",-35.61%,"San Francisco Bay Area, Silicon Valley, West Coast",Active,2011-01-01,year,3,11-50,"Bjørn Rustberggaard, Jostein Svendsen, Roger Larsen",4,"59,117",,,
Kissflow,https://www.crunchbase.com/organization/kissflow,"Kissflow’s suite of no-code & low-code work management products are used by 10,000+ customers across 160 countries to create a digital workplace where work gets done seamlessly. Kissflow’s customers include more than 50 Fortune 500 companies. G2 Crowd named Kissflow as a leader in the BPM and Workflow category, with a customer satisfaction score of 4.3 out of 5, the highest in the category.","Business Information Systems, Cloud Computing, Collaboration, Enterprise Software, Procurement, Project Management, SaaS, Small and Medium Businesses, Software",https://kissflow.com,"Wilmington, Delaware, United States",Kissflow is a leading SaaS software provider in the work management space.,"70,534","1,288,531","1,027,476.33",78.74%,-3.39%,941,2.15,11.97%,71.53%,2.6%,"89,856","-37,043",-29.19%,"Greater Philadelphia Area, East Coast, Southern US",Active,2012-01-01,year,1,251-500,Suresh Sambandam,2,624,,,
Stackify,https://www.crunchbase.com/organization/stackify,"ACQUIRED BY NETREO APRIL 2021 Stackify offers software developers with solutions to monitor and manage their applications’ performance. It also provides a cloud-based solution that provides insights about the application’s performance. Stackify takes a payment from its customers for the services and solutions it provide. Stackify was founded by Matt Watson in January 2015 and is based in Leawood, Kansas.","Cloud Computing, Developer Tools, Enterprise Software, Information Technology, SaaS, Software",http://stackify.com,"Huntington Beach, California, United States",Stackify integrates application performance management with error and log management.,"49,258","1,282,134","1,455,933.5",-10.89%,-25.44%,378,1.32,-0.01%,80.94%,-4.77%,"88,368","12,943",17.16%,"Greater Los Angeles Area, West Coast, Western US",Closed,2012-01-15,day,1,11-50,Matt Watson,,,,,
Bitnami,https://www.crunchbase.com/organization/bitnami,"Bitnami is a library of popular server applications and development environments that can be installed with one click, either in your laptop, in a virtual machine or hosted in the cloud. They take care of compiling and configuring the applications and all of their dependencies (third-party libraries, language runtimes, databases) so they work out-of-the-box. The resulting packaged software (a 'stack') is then made available as native installers, virtual machines and cloud images. These Bitnami application packages provide a consistent, secure and optimized end-user experience when deploying any app, on any platform. Bitnami-packaged applications are deployed over a million times per month and Bitnami drove over 235 million hours of compute usage in 2015. Bitnami is the leading supplier of applications to the major cloud marketplaces: Amazon, Google, Oracle, Microsoft and VMware, among others.","Blogging Platforms, Cloud Computing, Content, Open Source, Software, Web Hosting",https://bitnami.com,"San Francisco, California, United States","Bitnami makes it easy to run your favorite web applications natively, virtually and in the cloud.","159,105","1,265,902","1,204,914",18.6%,20.44%,601,1.86,5.35%,70.22%,-3.6%,"92,087","-9,124",-9.01%,"San Francisco Bay Area, West Coast, Western US",Active,2011-01-01,year,2,51-100,"Daniel Lopez, Erica Brescia",,,248341,USD,248341
Vetter Software,https://www.crunchbase.com/organization/vetter-software,Vetter Software offers cloud-based practice management software for veterinarians.  Our mission is to help coordinate and improve the health of the world’s pets.,"Cloud Computing, Health Care, Information Technology, SaaS, Software, Veterinary",http://www.vettersoftware.com,"Redwood City, California, United States",Vetter Software is the leading cloud-based veterinary healthcare company. Cloud veterinary practice management.,"65,004","1,245,532","1,132,307.67",12.87%,-34.11%,"1,051",5.2,1.38%,26.14%,-25.91%,"90,319","-2,467",-2.66%,"San Francisco Bay Area, Silicon Valley, West Coast",Active,2011-09-11,day,1,11-50,Sagi Solomon,,,,,
CommunityForce,https://www.crunchbase.com/organization/communityforce,"CommunityForce is a global technology company that offers a full range of service modules to manage every aspect of business operations for philanthropic organizations, educational institutions, associations and other non-profit organizations. CommunityForce’s solutions offer the next generation of data capture and business intelligence in a fully automated platform to reduce cost and improve efficiency.","Cloud Computing, Document Management, Enterprise Software, Non Profit, Software",http://communityforce.com,"Ashburn, Virginia, United States",CommunityForce offers a range of service modules to manage various aspects of business operations.,"76,170","959,046","430,035.5",73.13%,-47.9%,87,1.66,-13.12%,76.49%,1.07%,"109,355","-44,331",-28.85%,"Washington DC Metro Area, East Coast, Southern US",Active,2012-01-01,year,1,11-50,Anwer Sheikh,,,215007,USD,215007
Talkdesk,https://www.crunchbase.com/organization/talkdesk,"Talkdesk offers an enterprise contact center platform that allows companies to make the customer experience a competitive advantage. With its performance and consumer-like ease of use, Talkdesk easily adapts to the evolving needs of sales and support teams and their end-customers, resulting in increased customer satisfaction, productivity, and cost savings. Over 1,400 innovative enterprises around the world, including IBM, Acxiom, and Zumiez rely on Talkdesk to power their customer interactions. The San Francisco, California-based company was formed by Cristina Fonseca and Tiago Paiva in 2011.","Cloud Computing, CRM, Customer Service, SaaS",http://talkdesk.com,"San Francisco, California, United States",Talkdesk offers an enterprise contact center platform that allows companies to make the customer experience a competitive advantage.,"27,427","894,715","433,800.17",22.92%,-28.67%,316,1.24,-20.72%,90.33%,8.66%,"115,159","-10,877",-8.63%,"San Francisco Bay Area, West Coast, Western US",Active,2011-01-01,year,3,1001-5000,"Cristina Fonseca, Ricardo Felix, Tiago Paiva",,,14446567,USD,14446567
