Organization Name,Organization Name URL,Full Description,Industries,Website,Headquarters Location,Description,CB Rank (Company),SEMrush - Monthly Visits,SEMrush - Average Visits (6 months),SEMrush - Monthly Visits Growth,SEMrush - Visit Duration Growth,SEMrush - Visit Duration,SEMrush - Page Views / Visit,SEMrush - Page Views / Visit Growth,SEMrush - Bounce Rate,SEMrush - Bounce Rate Growth,SEMrush - Global Traffic Rank,SEMrush - Monthly Rank Change (#),SEMrush - Monthly Rank Growth,Headquarters Regions,Operating Status,Founded Date,Founded Date Precision,Number of Founders,Number of Employees,Founders,Apptopia - Number of Apps,Apptopia - Downloads Last 30 Days,Aberdeen - IT Spend,Aberdeen - IT Spend Currency,Aberdeen - IT Spend Currency (in USD)
CSI Renting,https://www.crunchbase.com/organization/csi-renting,,"Cloud Computing, Leasing, Network Hardware",https://www.csirenting.com,"Barcelona, Catalonia, Spain",CSI Renting belongs to one of the business groups specialized in the leasing of ICT equipment.,"1,336,784","1,680",,"2,266.2%",-93.67%,113,3.98,32.54%,0%,,"5,282,453","-4,694,871",-47.06%,European Union (EU),Active,1972-01-01,year,,51-100,,,,,,
ABMI,https://www.crunchbase.com/organization/abmi-f7cd,,"Cloud Computing, Consulting, Cyber Security, Internet of Things, IT Infrastructure, Software Engineering",https://abmi-groupe.com,"Guyancourt, Ile-de-France, France","ABMI is an engineering company that offers design, IT infrastructure, robotics, IoT, cloud computing, and cybersecurity solutions.","922,263","1,625","9,764.5",-66.85%,-97.13%,7,1.23,-62.45%,77.15%,170.7%,"5,979,663","2,540,233",73.86%,European Union (EU),Active,1984-01-01,year,,501-1000,,,,,,
PQR,https://www.crunchbase.com/organization/pqr,"PQR is an independent IT consultant and supplier of innovative ICT infrastructure solutions. The organization not only advises clients on system configurations and technical designs, it also looks after the implementation, administration and security of ICT infrastructures. To give an example, PQR designed and installed the IT backbone for the Dutch speed camera system on behalf of the Dutch police force. Other clients include (local) municipalities and medium-sized private sector companies.","Cloud Computing, Consulting, Information Services, Information Technology",https://www.pqr.com/,"De Meern, Utrecht, The Netherlands",PQR is an independent IT consultant and supplier of innovative ICT infrastructure solutions.,"235,727","1,611","4,173.17",-89.22%,-80.56%,7,1.27,-36.88%,72.63%,43.57%,"5,725,091","4,069,003",245.7%,European Union (EU),Active,1990-01-01,year,1,101-250,Robert Pijselman,,,,,
Merrill Corporation,https://www.crunchbase.com/organization/merrill-associates-inc,"Merrill Corporation is committed to community and charitable projects. They use the surveying systems and design software for optimum quality and efficiency. Their integrated approach to project planning, innovative design, and construction services is based on a long history of success.","Cloud Computing, Telecommunications",https://www.merrillinc.com,"Maussane, Provence-Alpes-Cote d'Azur, France","Merrill Corporation is a civil engineering, site planning, and land surveying firm.","637,015","1,552",,,,294,4,,0%,,"5,812,580",,,European Union (EU),Active,1985-01-01,day,,11-50,,,,,,
Columbi Micro,https://www.crunchbase.com/organization/columbi-micro,,"Accounting, Cloud Computing, Cyber Security, Enterprise Resource Planning (ERP), IT Infrastructure, Software",https://www.columbi.no/,"Moss, Ostfold, Norway","Columbi Micro is a provider of software systems for accounting, HR, IT support, cybersecurity, ERP, and cloud solutions.","488,020","1,270",,51.55%,"1,025%",45,1.45,8.64%,77.6%,16.39%,"6,488,885","-238,945",-3.55%,"Nordic Countries, Scandinavia",Active,1986-04-03,day,1,11-50,Einar Øien,,,7753346,USD,7753346
XSTREAM,https://www.crunchbase.com/organization/x-stream,"XSTREAM Ltd. (formerly Site Systems) for 30 years working in the telecommunications market and is now recognized as a major player in the ICT market; with over 3000 installed systems, in 2009 he developed a business plan to become a local Telecommunications Operator offering Internet voice and data services. In 2011, upon completion of the business plan, it opened the first site for delivery of Broadband Intenet services in WiMax technology; in the same year was inaugurated the structure Data Center at its headquarters in Reggio Emilia, which offers services to the customers XSTREAM evolved as Cloud Computing. In addition to the strong propensity for technological innovation, XSTREAM srl has given great value to your team, to form highly specialized people in providing services and value-added solutions","Cloud Computing, Telecommunications",http://www.x-stream.biz/,"Reggio Nell Emilia, Emilia-Romagna, Italy",XSTREAM Ltd. (formerly Site Systems) for 30 years working in the telecommunications market.,"306,245","1,236","2,097.67",-64.09%,-98.89%,9,1.5,-66.67%,50%,33.33%,"6,707,838","2,732,852",68.75%,European Union (EU),Active,1984-01-01,year,,11-50,,,,,,
CoachingCloud,https://www.crunchbase.com/organization/coachingcloud,,"Cloud Computing, Information Technology, Software",https://www.coachingcloud.com,"London, England, United Kingdom",CoachingCloud is a software company that designs a network in the cloud for the improvement of online coaching and mentoring partnership.,"810,054","1,137","1,029.5",49.8%,-99.48%,2,1.67,-10.28%,33.33%,16.66%,"6,906,749","-556,794",-7.46%,,Active,1982-01-01,year,,1-10,,,,,,
TCC The Computer Company,https://www.crunchbase.com/organization/tcc-the-computer-company,,"Cloud Computing, Information and Communications Technology (ICT), Information Technology, Point of Sale, Software",https://www.thecomputercompany.nl,"Maastricht, Limburg, The Netherlands",TCC The Computer Company is a company that offers ICT services.,"468,781","1,060",,,,0,1,,100%,,"6,795,576",,,European Union (EU),Active,1987-01-01,year,,11-50,,,,,,
Filippetti Digital DNA,https://www.crunchbase.com/organization/filippetti-digital-dna,,"Cloud Computing, Cyber Security, Information Technology",https://www.filippetti.it/,"Falconara Marittima, Marche, Italy",Filippetti Digital DNA is a digital transformation company that provides system integration and multi-cloud services to its clients.,"689,917","1,006",,267.15%,"1,266.67%",164,1.25,-58.32%,75%,,"6,945,629","-1,700,444",-19.67%,European Union (EU),Active,1974-01-01,year,,101-250,,,,4698942,USD,4698942
SuperOffice Software,https://www.crunchbase.com/organization/superoffice-software,,"Cloud Computing, CRM, Software",https://www.superoffice.co.uk/,"Cranfield, Bedfordshire, United Kingdom","SuperOffice Software provides CRM solutions, platforms and consultation for marketing, sales and customer service.","938,735",887,,-75.84%,-83.25%,0,1,-34.92%,100%,24.86%,"7,132,851","3,406,745",91.43%,,Active,1989-01-01,year,,11-50,,,,,,
Xaris ICT & Telecom,https://www.crunchbase.com/organization/xaris-ict-telecom,,"Cloud Computing, Point of Sale, SaaS",https://www.xaris.nl,"Wognum, Noord-Holland, The Netherlands","Xaris ICT & Telecom offers cloud computing, cloud telephony, POS, and SAAS services.","1,539,019",868,,,,820,3,,50%,,"7,202,796",,,European Union (EU),Active,1988-01-01,year,,11-50,,,,,,
rjm,https://www.crunchbase.com/organization/rjm-a7a8,"rjm can advise you on the selection of hardware and software for your systems and projects. They can assist you in creating a threat analysis. Their consultants can assist you with the implementation of web projects, the move of business processes to a cloud , or new specifications for data storage and transfer.","Cloud Computing, Hardware, Sales, Software",https://www.rjm.de,"Lampertheim, Hessen, Germany","RJM provides geographic information, networks and servers services.","1,656,524",853,,,,0,1,,100%,,"7,193,208",,,European Union (EU),Active,1986-01-01,year,,1-10,,,,,,
Cis Valley,https://www.crunchbase.com/organization/cis-valley,,"Cloud Computing, Information Technology",http://www.cis-valley.fr,"Bruges, Aquitaine, France",Cis Valley is a specializes company in IT services - consulting firms.,"393,926",787,"249,021.17",3.42%,-99.41%,0,1,-33.36%,100%,100%,"7,386,352","-69,867",-0.94%,European Union (EU),Active,1986-01-01,day,,251-500,,,,,,
George Hay Chartered Accountants,https://www.crunchbase.com/organization/george-hay-chartered-accountants,"George Hay Chartered Accountants are professional chartered accountants and business advisers. They offer accounting and business advisory services, accounts preparation, audit services, business start ups, cloud accounting, making tax digital, outsourced services, probate, and estate services, small businesses, and taxation.","Accounting, Cloud Computing, Financial Services",https://www.georgehay.co.uk,"Biggleswade, Bedfordshire, United Kingdom",George Hay Chartered Accountants provides accounting and tax preparation services.,"1,514,957",785,,-12%,,62,2,100%,0%,0%,"7,398,481","272,792",3.83%,,Active,1939-01-01,year,,101-250,,,,31979999,USD,31979999
Suneco,https://www.crunchbase.com/organization/suneco,,"Application Performance Management, Cloud Computing, Digital Media, Professional Services",https://suneco.nl,"Zwolle, Overijssel, The Netherlands","Suneco is a technology company that offers application development, integration, digital transformation, and cloud computing services.","1,807,387",769,,,,397,6.07,,66.19%,,"7,476,677",,,European Union (EU),Active,1989-01-01,year,,11-50,,,,,,
Syscomm,https://www.crunchbase.com/organization/syscomm-27d2,"Syscomm needs to support an information technology department without any hassle. They can oversee all aspects of their information technology business through to managed information technology, ensuring they get the support and maintenance they need for their company.","Cloud Computing, Consulting, Information Technology, Network Hardware",https://www.syscomm.co.uk,"Coventry, Coventry, United Kingdom",Syscomm provides information technology and cloud services.,"1,122,206",750,,-51.64%,-46.01%,88,2,31.49%,0%,-52.1%,"7,474,135","1,970,584",35.81%,,Active,1984-01-01,year,,11-50,,,,,,
JVL,https://www.crunchbase.com/organization/jvl,,"Cloud Computing, Information Technology, Software",http://www.jvl.fr/,"Saint-cloud, Ile-de-France, France",JVL provides custom software solutions.,"1,648,343",713,,,,0,1,,100%,,"7,604,413",,,European Union (EU),Active,1989-01-01,day,,11-50,,,,,,
Alidata,https://www.crunchbase.com/organization/alidata-8dbc,,"Cloud Computing, Information Technology, SaaS, Software",http://www.alidata.pt,"Lisbon, Lisboa, Portugal","Alidata develops software solutions to optimize business processes and offers Saas, cloud computing, and technical assistance services.","867,697",696,,36.47%,,0,1,-33.33%,100%,100%,"7,705,502","-424,394",-5.22%,European Union (EU),Active,1984-01-01,day,,101-250,,,,,,
Ingemark,https://www.crunchbase.com/organization/ingemark,,"Cloud Computing, Software, Web Apps",http://www.ingemark.com,"Zagreb, Grad Zagreb, Croatia","Ingemark specializes in software development, web apps, cloud computing, and IT solutions.","1,148,869",655,,,,0,1,,100%,,"7,754,875",,,European Union (EU),Active,1990-01-01,day,1,11-50,Viktor Matic,,,,,
IPL Group,https://www.crunchbase.com/organization/ipl-group,"IPL Group is specialises in designing, building and managing secure business-critical software solutions for customers in both public and private sectors with core capabilities in digital and mobile solutions, data management and analytics.","Cloud Computing, Information Technology, Software",http://www.iplgroup.com/,"Bath, Bath and North East Somerset, United Kingdom","IPL Group is specialises in designing, building and managing secure business-critical software solutions.","632,992",654,,-52.37%,,0,1,-50%,100%,,"7,767,442","1,574,041",25.41%,,Active,1979-01-01,year,,11-50,,,,,,
Inetum Polska,https://www.crunchbase.com/organization/inetum-polska,,"Artificial Intelligence, Cloud Computing, Consulting, IT Management, Project Management",https://inetum.pl/en/,"Warszawa, Mazowieckie, Poland","Inetum Polska offers agile IT services, cloud, IA, artificial intelligence and other IT services.","639,311",622,"8,350.83",-88.52%,-83.2%,21,1.4,-48.27%,60%,31.67%,"7,899,953","4,624,970",141.22%,European Union (EU),Active,1970-01-01,year,,10001+,,,,,,
Contrac,https://www.crunchbase.com/organization/contrac,,"B2B, Cloud Computing, Consulting, Professional Services",https://www.contrac.co.uk,"Brough, York, United Kingdom","Contrac provides IT sourcing, hosting and cloud solutions, consultancy, managed and professional services.","766,442",600,,-60.58%,,88,3,200%,0%,,"7,978,251","2,084,946",35.38%,,Active,1972-01-01,year,,11-50,,,,,,
Paradise Computing,https://www.crunchbase.com/organization/paradise-computing,,"Cloud Computing, Information Technology, IT Infrastructure, Software",http://www.paradisecomputing.co.uk/,"Althorpe, North Lincolnshire, United Kingdom",Paradise is an IT company that provides high-quality business management solutions.,"997,345",534,,59.4%,,0,1,0%,100%,0%,"8,105,454","-845,640",-9.45%,,Active,1987-01-01,day,,11-50,,,,3396549,USD,3396549
Sanding,https://www.crunchbase.com/organization/sanding,,"Cloud Computing, Software, Web Apps",http://www.sanding.sk,"Bratislava, Bratislava, Slovakia (Slovak Republic)","Sanding specializes in IT solutions that offer network management, cloud services, cybersecurity, web apps, software and hardware.","946,535",513,"1,677.83",5.56%,,16,1.5,50.1%,50%,-50%,"8,123,902","660,405",8.85%,European Union (EU),Active,1990-01-01,day,,1-10,,,,,,
MostWare,https://www.crunchbase.com/organization/mostware,,"Cloud Computing, Information Technology, Infrastructure, IT Management, Machine Learning",https://mostware.nl/,"Leiden, Zuid-Holland, The Netherlands","MostWare is an IT company that offers cloud computing, smart data, infrastructure, machine learning, Azure and Microsoft 365 services.","954,108",511,,-67.41%,,0,1,-33.33%,100%,100%,"8,156,338","2,368,359",40.92%,European Union (EU),Active,1990-01-01,year,,11-50,,,,,,
Mid Blue International,https://www.crunchbase.com/organization/mid-blue-international,,"Application Performance Management, Cloud Computing, Virtualization",http://mid-blue.com/,"Dartford, Kent, United Kingdom","Mid Blue International delivers on-site virtualization, E-configuration, disaster recovery and cloud computing solutions for IBM systems.","2,080,113",499,,,,40,2,,0%,,"8,169,108",,,,Active,1988-01-01,year,,,,,,,,
Equation,https://www.crunchbase.com/organization/equation-4c19,"Equation is an IT service company that offers systems and network engineering such as: global infrastructure, security, virtualization, Telecom operator under the e-liance brand: Internet access, site interconnection, VoIP… Editor and integrator of EquaPRO, management solutions companies intended for SMEs / SMIs.","Cloud Computing, Enterprise Resource Planning (ERP), Infrastructure, Internet, Security, Software",https://www.equation.fr/,"Saint Etienne, Rhone-Alpes, France",Equation is an IT services company.,"741,247",448,,,,8,3,,0%,,"8,472,934",,,European Union (EU),Active,1985-01-01,year,,11-50,,,,,,
Bea Informatique,https://www.crunchbase.com/organization/bea-informatique,"Bea Informatique designs information systems so that they can evolve towards greater agility and dynamism. BEA offers a variety of hardware, software and peripherals that are designed to be used optimally. BEA provides computer equipment advice, supplies, and installations ranging from simple computer workstations to clustered servers and CAD stations.","Cloud Computing, Cyber Security, Infrastructure, IT Infrastructure",https://www.bea-informatique.fr,"Alès, Languedoc-Roussillon, France",Bea Informatique is an IT services company.,"1,135,497",447,,,,39,3,,0%,,"8,522,539",,,European Union (EU),Active,1986-01-01,year,,11-50,,,,,,
Deltascheme,https://www.crunchbase.com/organization/deltascheme,,"Cloud Computing, Consulting, Information Technology",https://deltascheme.com/,"Marlow, Buckinghamshire, United Kingdom","Deltascheme renders cloud computing, migration, sharepoint, consultancy and business intelligence solutions.","836,915",441,,,,0,1,,100%,,"8,508,447",,,,Active,1986-01-01,year,,11-50,,,,3434304,USD,3434304
EBM Office Centre,https://www.crunchbase.com/organization/ebm-office-centre,,"Cloud Computing, Data Storage, Network Hardware, Printing, Service Industry",https://www.ebm.co.uk/,"London, England, United Kingdom","EBM Office Centre specializes in HP support and services & also offers computing, printing, networking, cabling & infrastructure solutions.","1,030,812",392,,-21.44%,,0,1,0%,100%,0%,"8,736,577","539,513",6.58%,,Active,1984-01-01,year,,11-50,,,,3416248,USD,3416248
Infor,https://www.crunchbase.com/organization/infor-62d3,"INFOR offers products and services that contribute to creating buildings that are aesthetically pleasing, environmentally responsible, and economically practical. These objectives are to be achieved through constant dissemination of the most innovative methodologies emerging at the international level in this field, seeking to adjust these trends to the national market.","Cloud Computing, Construction, Professional Services, Technical Support",https://www.infor.pt,"Matosinhos, Porto, Portugal",Infor provides professional services in design and construction.,"563,966",328,,5.47%,,25,1.3,30.49%,69.51%,-30.49%,"9,039,465","24,460",0.27%,European Union (EU),Active,1972-01-01,year,,1-10,,,,,,
DSM Group,https://www.crunchbase.com/organization/dsm-group,"IT infrastructure should be as important to your business as the health of your staff. Keeping your IT systems running at their optimum level is not something that should be overlooked, for like one's health, poor maintenance can lead to drastic failures. An IT support agreement is an easy way of minimising IT system disruption and in many cases preventing it at all. Support agreements can be tailored to fit exact requirements and unlike many other IT support companies we do not insist on fixed contract terms. DSM can provide complete solutions from IT support, through backup solutions and Cloud Computing to Disaster Recovery.","Cloud Computing, Cloud Data Services, Cloud Infrastructure, Cloud Management, Data Center, Information Services, Information Technology, IT Management, Web Hosting",http://dsm-gb.co.uk,"Peterborough, Peterborough, United Kingdom","IT Solutions providor based in Peterborough. Services include Disaster Recovery, Cloud Solutions and Data Centre","404,473",321,,,,77,1.5,,50%,,"9,062,802",,,,Active,1987-01-01,year,1,11-50,Mike Richardson,,,,,
VINTIN,https://www.crunchbase.com/organization/vintin,"VINTIN unites sound expertise in all areas of the IT infrastructure right up to the cloud under one roof. Their VINTIN departments are historically grown, specialized contacts for your individual needs. With VINTIN today, they offer you and your company optimum solutions for data network technology and IT security, classic system house solutions such as backup, storage and server services, as well as modern solutions ranging from managed services to cloud computing and the complete outsourcing of your IT. Today more than 170 employees work at VINTIN. Around 150 technically highly trained specialists are available to you in the most diverse IT areas. VINTIN began in 1990 with the founding of DANES Datennetzwerktechnik GmbH. This was followed by specialized spin-offs such as their system house net2net GmbH, the cloud and outsourcing specialists at login2work GmbH and the experts for data centers of CENDACOM GmbH. Today, all teams are united under the umbrella of VINTIN.","Cloud Computing, Information Technology",https://www.vintin.de,"Sennfeld, Baden-Wurttemberg, Germany","VINTIN is a leading IT and digital specialist in the DACH region for digital work, cloud services, IT systems & security and data centers.","302,396",275,,,,0,1,,100%,,"9,283,884",,,European Union (EU),Active,1990-01-01,year,1,101-250,Michael Datzer,,,4724409,USD,4724409
ODV,https://www.crunchbase.com/organization/odv,"ODV is a modular tradesman software that assists companies in optimizing their operations. They build future-oriented businesses and save time and money with their innovative thinking. They offer digitalization, mobile working, advisory, consulting, funding programs, cloud computing, data security, and training.","Advice, Cloud Computing, Hardware, Information Technology, Software, Training",https://www.odv.de,"Stuttgart, Baden-Wurttemberg, Germany","ODV provides information technology, software, and hardware services.","868,271",265,,46.41%,,0,1,-66.67%,100%,,"9,318,321","32,902",0.35%,European Union (EU),Active,1986-01-01,year,,11-50,,,,4115964,USD,4115964
Diskel,https://www.crunchbase.com/organization/diskel,"Diskel Ltd has built a reputation for sensible advice and excellent support for their business and networking solutions. They are Microsoft and Pegasus accredited partners. Diskel is an IT Software Reseller and Developer, Supplier, Installation and Support Company. They delivering business solutions across a broad range of industries throughout the UK.","Cloud Computing, Developer Platform, Software, VoIP",https://diskel.co.uk/,"London, England, United Kingdom",Diskel is a business solution and software service provider.,"1,774,925",250,,,,0,1,,100%,,"9,365,529",,,,Active,1978-01-01,year,,11-50,,,,3396129,USD,3396129
Offitech,https://www.crunchbase.com/organization/offitech,"Offitech provides technology-based solutions for the office market. The market, sell, and support complete solutions, mainly for the IT market. In its position towards small and medium-sized companies, it is committed to its Security, Efficiency, and Financial Situation.","Cloud Computing, Customer Service, Information Technology, Printing, Software",https://www.offitech.se,"Mölndal, Vastra Gotaland, Sweden",Offitech offers information technology and cloud services.,"873,365",246,,,,75,7,,0%,,"9,446,737",,,"European Union (EU), Nordic Countries, Scandinavia",Active,1990-01-01,year,,101-250,,,,,,
Datel,https://www.crunchbase.com/organization/datel-5c30,,"Cloud Computing, CRM, Information Technology, Software",https://www.datel.info/,"Warrington, Warrington, United Kingdom",Datel is an IT company that provides customized business systems to optimize and support operations & processes for international clients.,"195,872",227,"1,305.17",-71.01%,,86,4.24,324.23%,18.94%,-81.06%,"9,574,361","2,235,037",30.45%,,Active,1981-01-01,year,,251-500,,,,4997525,USD,4997525
OnlineData,https://www.crunchbase.com/organization/onlinedata,,"Cloud Computing, Cyber Security, Software",http://www.onlinedata.gr,"Kallithéa, Attiki, Greece","OnlineData is a consultancy that offers software, cloud computing, cybersecurity, networks, and IT systems for transport management.","1,579,536",224,,,,0,1,,100%,,"9,540,993",,,European Union (EU),Active,1989-01-01,day,,11-50,,,,,,
Easify,https://www.crunchbase.com/organization/easify-96e0,,"Cloud Computing, Document Management, IT Management, Software",https://easify.no/,"Oslo, Oslo, Norway","Easify is an IT consultancy that offers payment terminals, document management, meeting and cloud computing solutions.","678,699",217,"13,991",-45.34%,276.47%,64,3.5,16.74%,0%,0%,"9,620,724","916,211",10.53%,"Nordic Countries, Scandinavia",Active,1987-01-01,day,,11-50,,,,,,
Global Software Partner,https://www.crunchbase.com/organization/globa-software-partner,"Global Software Partner (GSP) is a company specialized in Business Management Software. With a history of 30 years in the industry of software, we have a broad experience in deploying SAP Business One and SAP HANA. In addition, we are developers of Sector Specific Solutions or AddOns, SGI Solutions, integrated with SAP.  Our Sector Specific Solutions, SGI Solutions, are developed on the SAP HANA technology platform and enable higher ERP perfomance. This Solutions are Certified and Qualified by SAP, so it offer added value in terms of ensuring evolution, quality and functionality. With SGI Solutions sector specific modules for SAP, you can adress the specific challenges of your industry, adding value to the specific features of SAP. We are specialized in Solutions for Omnichannel Strategy, for example SGI Retail for Retail Solution, SGI Moda for Apparel & Footwear Industry and SGI Omnichanel for Marketplace & Ecommerce. Also, we provide optimization, custom programming, installation and maintenance services for SAP.  With more than 1.500 implantations and 5.000 users internationally, GSP is the ideal Partner for a highly competitive technological project.","Cloud Computing, Enterprise Resource Planning (ERP), Management Consulting, Software",https://www.gsp.es,"Barcelona, Catalonia, Spain","Global Software Partner provides full-service within business management software, ERP, cloud, and SAP solutions for SMEs.","855,996",170,,,,0,1,,100%,,"9,936,792",,,European Union (EU),Active,1982-01-01,year,,11-50,,,,4244597,USD,4244597
Dataplan,https://www.crunchbase.com/organization/dataplan-4e68,,"Business Intelligence, Cloud Computing, Finance, Software",https://www.dataplan.no/,"Sandnes, Rogaland, Norway","Dataplan renders advice, business intelligence, cloud, software, finance, accounting, payroll and IT services.","509,856",156,,-69.88%,-45.16%,0,1,-81.82%,100%,100%,"10,025,923","1,910,278",23.54%,"Nordic Countries, Scandinavia",Active,1988-01-01,day,,101-250,,,,4917099,USD,4917099
