Organization Name,Organization Name URL,Full Description,Industries,Website,Headquarters Location,Description,CB Rank (Company),SEMrush - Monthly Visits,SEMrush - Average Visits (6 months),SEMrush - Monthly Visits Growth,SEMrush - Visit Duration Growth,SEMrush - Visit Duration,SEMrush - Page Views / Visit,SEMrush - Page Views / Visit Growth,SEMrush - Bounce Rate,SEMrush - Bounce Rate Growth,SEMrush - Global Traffic Rank,SEMrush - Monthly Rank Change (#),SEMrush - Monthly Rank Growth,Headquarters Regions,Operating Status,Founded Date,Founded Date Precision,Number of Founders,Number of Employees,Founders,Apptopia - Number of Apps,Apptopia - Downloads Last 30 Days,Aberdeen - IT Spend,Aberdeen - IT Spend Currency,Aberdeen - IT Spend Currency (in USD)
Detron ICT,https://www.crunchbase.com/organization/detron-ict,Detron ICT is a consulting firm specializing in IT support and cloud based services.,"Cloud Computing, Consulting, Information Services",http://www.detron.nl,"Veenendaal, Utrecht, The Netherlands",Detron ICT is a consulting firm specializing in IT support and cloud based services.,"291,707",152,"21,508.83",-90.29%,-52%,0,1,-57.14%,100%,49.99%,"9,837,282","4,679,909",90.74%,European Union (EU),Active,1980-01-01,year,,501-1000,,,,,,
Mitan Telematica,https://www.crunchbase.com/organization/mitan-telematica,,"Cloud Computing, Information and Communications Technology (ICT), Wired Telecommunications",https://www.mitan.it,"Milan, Lombardia, Italy","Mitan Telematica is an ICT company that provides wireless, cloud computing, networking and unified communication services.","1,554,150",142,,,,9,2,,0%,,"10,093,963",,,European Union (EU),Active,1978-01-01,year,,11-50,,,,60750,USD,60750
Advisor ICT Solutions,https://www.crunchbase.com/organization/advisor-ict-solutions,Advisor ICT Solutions advises and communicates using the technology. It has provided future-proof solutions in the field of IT and communication. They provide people with an optimal and secure working environment. Advice is conditional on attention.,"Cloud Computing, Consulting, Customer Service, Information Technology, Telecommunications",https://www.advisor.nl,"Mijdrecht, Utrecht, The Netherlands",Advisor ICT Solutions provides information technology and cloud services.,"416,713",141,,-70.5%,,0,1,0%,100%,0%,"9,905,228","2,425,369",32.43%,European Union (EU),Active,1985-01-01,year,,51-100,,,,,,
invent,https://www.crunchbase.com/organization/invent-4e24,,"Cloud Computing, Information Technology, Software, Software Engineering",https://www.invent.de,"Bielefeld, Nordrhein-Westfalen, Germany","invent is a system solution, software development, and network solution provider company.","1,118,910",138,,,,0,1,,100%,,"9,944,872",,,European Union (EU),Active,1986-01-01,year,,11-50,,,,4023890,USD,4023890
2easy informatique,https://www.crunchbase.com/organization/2easy-informatique,,"Cloud Computing, Cloud Security, Data Storage",http://www.2easy.ch,"Payerne, Vaud, Switzerland",2Easy is an IT Firm that provides back-up and security for the data stored in the cloud.,"1,229,784",95,,,,8,2,,0%,,"10,406,805",,,,Active,1970-01-01,day,,1-10,,,,,,
GTI Software & Networking,https://www.crunchbase.com/organization/gti-software-networking,"GTI Software is a computer wholesaler specializing in Software and Cloud Solutions for the IT channel, was the first Spanish distributor to obtain the ISO 9001 certificate . Their company, founded in 1985, provides valuable software, hardware and technological solutions to thousands of distributors in Spain, Portugal and North Africa.","Cloud Computing, Information Technology, Software",http://www.gti.es,"San Fernando De Henares, Madrid, Spain",GTI Software is a computer wholesaler specializing in Software and Cloud Solutions for the IT channel.,"204,347",20,,,,0,1,,100%,,"10,394,111",,,European Union (EU),Active,1985-01-01,year,,101-250,,,,,,
Funn,https://www.crunchbase.com/organization/funn,,"Cloud Computing, Network Hardware, Security, Software",https://funn.no/,"Narvik, Nordland, Norway","Funn is a IT firm that renders colud computing, business insight, camera surveillance, hardware, network and telephony solutions.","567,862",13,,,,0,1,,100%,,"10,849,002",,,"Nordic Countries, Scandinavia",Active,1989-01-01,year,,101-250,,,,,,
BT Global Services,https://www.crunchbase.com/organization/bt-global-services,"BT Global Services is an IT company. It provides networked information technology services in the United Kingdom and internationally. It offers BT One for calls and lines services; BT Contact, a CRM that offers agent desktop applications, call and contact recording, cloud contact centers, customer premise equipment, inbound services, self-service and queue-management platforms, and work force management; and BT Compute for IT services, such as datacenter services and professional services for IT. The company also provides mobility services, including field force automation, fixed mobile convergence, flexible working services, mobility managed services, secure remote access, and supply chain solutions; BT Connect for network services comprising access choices, application performance management, and internet services. BT Global Services was founded in 1989 and is headquartered in London, England.","Cloud Computing, Mobile, Professional Services, Service Industry, Telecommunications, TV",http://www.globalservices.bt.com/uk/en/home,"London, England, United Kingdom",BT Global Services plc is a division of United Kingdom telecommunications operator BT Group.,"175,286",,,,,,,,,,,,,,Active,1989-01-01,year,,10001+,,1,,28021539,USD,28021539
Cancom UK&I,https://www.crunchbase.com/organization/cancom-uk-i,"Cancom offers professional, cloud-based managed, support and service delivery services.","Cloud Computing, Consulting, Professional Services",https://www.cancom.co.uk/,"London, England, United Kingdom","Cancom offers professional, cloud-based managed, support and service delivery services.","212,899",,,,,,,,,,,,,,Active,1990-01-01,year,2,251-500,"Klaus Weinmann, Raymond Kober",,,,,
myairops,https://www.crunchbase.com/organization/airops-software,"myairops is an aviation software company based at Farnborough airport, the heart of premium aviation. myairops takes pride in providing first-class support to all their clients. The team has a wealth of experience both in the air and on the ground and therefore can provide the best solutions, using knowledge gained from first-hand experience.  Committed to simplifying the complexity of modern operations by providing simple, secure, scalable products that are designed for people, myairops consists of development teams, QA testers, operational support, and worldwide technical support. myairops strives to accommodate the aviation industries need for state-of-the-art software. myairops is a business aviation product ecosystem that provides SaaS and mobile app solutions for business aviation operators and ground facilities.  Born from Airops Software, the development team have a thirty-year track record in delivering solutions for business aviation including one of the first commercial business aviation flight operation platforms. More details can be found at https://www.myairops.com","Air Transportation, Cloud Computing, Consulting, Fleet Management, Information Technology, Internet, SaaS, Software, Travel",http://www.myairops.com,"Farnborough, Hampshire, United Kingdom",Business aviation product ecosystem that provides SaaS and mobile app solutions for business aviation operators and ground facilities.,"226,314",,,,,,,,,,,,,,Active,1989-01-01,year,,51-100,,,,,,
Selenity,https://www.crunchbase.com/organization/selenity,"Selenity transforms organisations and empowers people through cloud technologies, anytime, anyplace, and on any device. Providing fast and innovative solutions that reduce costs, increase efficiency and ensure compliance to HR and Finance. Working with a wide range of organisations across a diverse range of industry sectors; from SMEs through to global brands, Selenity believes in driving innovation and enthusiasm through a strong cultural belonging and a happy work life balance, a philosophy that is evident through every part of the organisation. Simplify the way you submit, authorise, reimburse and audit employee business expenses. Online or with our next generation Expenses Mobile app, the Selenity Expenses software enables your employees to scan their receipts and capture their mileage with GPS accuracy, right from their smartphones wherever they are. Designed to bring you proven savings with up to a 20% decrease in expense spend whilst significantly driving down process costs and improving compliance. You can enjoy maximum VAT reclamation and reduce overspend through accurate and compliant claims. Selenity ER Tracker is a cloud-based HR case management system designed to improve compliance, increase visibility and reduce case management errors. Turn your paper HR policies into manageable, visible stages and steps; featuring integrated emails, letter templates, reminder and alerts, and real-time dashboards.  Discover how collaborative and proactive case management resolves cases quicker whilst reducing case costs and absence rates. Data analysis helps to spot trends and risks to prevent cases before they happen.","Cloud Computing, SaaS, Software",https://www.selenity.com/,"Lincoln, Lincolnshire, United Kingdom","Selenity provides fast, innovative and configurable cloud tech that reduce costs, increase efficiency and ensure compliance to HR & finance.","261,991",,,,,,,,,,,,,,Active,1989-01-01,year,,51-100,,5,"4,638",,,
CCE,https://www.crunchbase.com/organization/cce,"CCE is one of the UK’s leading independent IT companies providing IT Infrastructure, Cloud and Managed Print Solutions to improve your productivity. We deliver: IT Design & Consultancy IT Infrastructure installation Private Cloud, ISP & Data Centres Flexible support packages 24/7/365 UK based service desk UK & European Coverage Cost saving Managed Print Services CCE has the resources & expertise to manage all your IT needs, or simply boost your in-house team when required. Our IT solutions & flexible support packages enable better workflow for your organisation.","Cloud Computing, Cloud Data Services, Cloud Infrastructure, Information Technology, IT Infrastructure, IT Management",https://cce.co.uk,"London, England, United Kingdom","Managed Service Provider based in the UK.  Cloud, ISP, Managed Print Services, Service Desk, Hardware Support & Networking & IT consultancy.","288,734",,,,,,,,,,,,,,Active,1979-02-01,month,,101-250,,,,,,
Access Alto,https://www.crunchbase.com/organization/access-alto,"Access Alto is a leading Cloud Hosting provider offering Public, Private and Hybrid Cloud solutions on VMware and Openstack. We have award winning cloud infrastructure in the UK, US and APAC.","Business Development, Cloud Computing, Cloud Data Services, Enterprise Software, Finance, Private Cloud, Software",http://www.theaccessgroup.com/solutions/hosting/,"Brighton, East Sussex, United Kingdom","Leading cloud hosting provider offering Public, Private and Hybrid Cloud solutions on VMware and Openstack.","327,659",,,,,,,,,,,,,,Active,1989-01-01,year,,11-50,,,,,,
Solar Communications,https://www.crunchbase.com/organization/solar-communications,"Solar improve the speed of communication and the way organisations interact with customers, suppliers and employees, always in a secure and resilient manner, enhancing productivity, improving efficiencies and creating competitive advantage.   Solar designs, deploys and supports communications technology for more than 1,700 business customers of varying size across a variety of markets, helping to improve our clients'​ communication channels, increase operational effectiveness and reducing the cost of ownership, always with a dedicated focus on customer experience.","Cloud Computing, Information Technology, iOS, Mining, Solar, Telecommunications",http://www.solar.co.uk/,"Chippenham, Wiltshire, United Kingdom",Solar Communications is a cloud communication and computing specialist.,"384,144",,,,,,,,,,,,,,Closed,1988-01-01,year,,101-250,,,,8655042,USD,8655042
Talisman Tech,https://www.crunchbase.com/organization/talisman-tech,"Talisman is an integrated recruiting system. It streamlines your departments to increase profits. The products integrate together to offer recruitment agencies a platform that automates the recruitment process. Their services include Free Recruitment CRM, Pay and Bill, and many others.","Cloud Computing, Computer, CRM, Recruiting, Software",https://www.talisman.tech,"Dunstable, Bedfordshire, United Kingdom",Talisman provides integrated recruitment services.,"389,183",,,,,,,,,,,,,,Active,1982-01-01,year,1,11-50,David Hathiramani,,,,,
ACA IT-Solutions,https://www.crunchbase.com/organization/aca-it-solutions-bd70,,"Cloud Computing, Consulting, Information Technology",https://www.aca-it.nl,"Eindhoven, Noord-Brabant, The Netherlands","ACA IT-Solutions provides ICT on-premises, cloud computing solutions, cyber security, IT Consultation, and IT services.","403,438",,,,,,,,,,,,,European Union (EU),Active,1983-01-01,year,,101-250,,,,,,
Nobel,https://www.crunchbase.com/organization/nobel-da48,,"Cloud Computing, Hardware, Information Technology, Network Hardware",https://nobel.nl/,"Leiderdorp, Zuid-Holland, The Netherlands","Nobel is an information technology company that provides hardware products like servers & networks, IT management and cloud services.","447,550",,,,,,,,,,,,,European Union (EU),Active,1989-01-01,year,,11-50,,,,,,
DdD retail,https://www.crunchbase.com/organization/ddd-retail,"DdD Retail, provides a proprietary combined point of sale software/hardware solution, and primarily operates in the fashion retail industry across Denmark, Germany, Sweden and Norway.","Cloud Computing, Retail, Software",http://www.dddretail.com,"Køge, Sjelland, Denmark","DdD retail is a highly attractive, cloud-based software solution for retailers, particularly in the fashion sector.","449,017",,,,,,,,,,,,,"European Union (EU), Nordic Countries, Scandinavia",Active,1989-01-01,year,,11-50,,,,,,
EBS Sp. z o.o.,https://www.crunchbase.com/organization/ebs-sp-z-o-o,"EBS as a manufacturer and R&D company is present on the worldwide security market from 25 years. We specialized in production of devices based on GSM/GPRS/SMS, RFID and GPS technologies. The aim of EBS is to meet the market needs within the scope of security-related devices meant to protect people and property. Each of product is designed, manufactured and tested by EBS in our own factory in Poland. EBS is a company oriented to individual needs of our customers. Primary principle is the production of OEM/ODM systems and customize the equipment to the requirements of our customers. We have also great experience in M2M solutions. EBS products are offered on markets all over the world. Quality and competitiveness of the products are confirmed by fruitful collaboration with many partners in Europe, Asia, Africa, North and South America and Australia. We have established co-operational relations with the largest security agencies (G4S, Securitas or Prosegur), distributors of worldwide known brands of DSC, GE or Paradox and GSM providers (T-Mobile, Orange, Polkomtel).","Cloud Computing, Manufacturing",http://www.ebs.pl/,"Warsaw, Mazowieckie, Poland",EBS Sp. z o.o as a manufacturer and R&D company is present on the worldwide security market.,"471,298",,,,,,,,,,,,,European Union (EU),Active,1989-01-01,year,,101-250,,,,,,
IPSA,https://www.crunchbase.com/organization/ipsa-a205,,"Cloud Computing, Document Preparation",http://www.ipsa.es,"Madrid, Madrid, Spain","Ipsa designs cloud solutions. Ipsa solutions automate, safe and effective processing of related documents to ensure capture and validation.","502,469",,,,,,,,,,,,,European Union (EU),Active,1985-01-01,day,,51-100,,,,,,
Radix Technologies,https://www.crunchbase.com/organization/radix-technologies,"Radix Technologies began in 2006, with the vision to provide businesses with cost effective, user friendly, and robust on demand computing resources. Already a developer of a suite of on demand software application for the relocations and global logistics industries, we have extended our product offering with a new range of cloud infrastructure services. Radix is a company dedicated to the satisfaction of our clients through innovative technology and faultless service. We understand the value of time and productivity and we understand the significance when these elements are lost. We expect our name to be synonymous with quality and we expect our service and products to reflect this. We know that a clients trust must be earned and we strive, every step of the way and with every action, to gain it.","Cloud Computing, SaaS, Software, Web Hosting",http://www.radix-technologies.com,"Vevey, Vaud, Switzerland",Cloud services and SaaS provider,"529,733",,,,,,,,,,,,,,Closed,1990-01-01,year,1,11-50,John Eastman,,,,,
CoopSys,https://www.crunchbase.com/organization/coopsys,,"Cloud Computing, Information and Communications Technology (ICT), IT Infrastructure",https://www.coopsys.net,"London, England, United Kingdom",CoopSys helps charity and nonprofit organizations with a comprehensive range of ICT management and disaster recovery services.,"545,854",,,,,,,,,,,,,,Active,1987-01-01,year,,11-50,,,,3583610,USD,3583610
ACSSI,https://www.crunchbase.com/organization/acssi,,"Analytics, Cloud Computing, Information Technology",https://www.acssi.fr,"Villeneuve, Provence-Alpes-Cote d'Azur, France","ACSSI provides data analytics and integration, SAP, and cloud computing services.","561,433",,,,,,,,,,,,,European Union (EU),Active,1989-01-01,year,,51-100,,,,,,
QNP,https://www.crunchbase.com/organization/qnp,"QNP is specialized in the field of innovative IT and communication solutions. The company has been around for more than 30 years and has built up an impressive customer base of SMEs and healthcare institutions. In the region, QNP is often recognized by the modern building in which the company is housed.","Cloud Computing, Information Services, Information Technology",https://www.qnp.nl/,"Breda, Noord-Brabant, The Netherlands",QNP is specialized in the field of innovative IT and communication solutions.,"584,340",,,,,,,,,,,,,European Union (EU),Active,1990-01-01,year,,11-50,,,,,,
K3 Nordic,https://www.crunchbase.com/organization/k3-nordic,,"Cloud Computing, Information Services, Information Technology",https://k3nordic.com/,"Örebro, Orebro Lan, Sweden","K3 Nordic is a reseller of IT services such as software licenses, hardware support agreements, cloud services and IT consulting.","591,432",,,,,,,,,,,,,"European Union (EU), Nordic Countries, Scandinavia",Active,1989-01-01,day,1,11-50,"Håkan Svanberg,",,,,,
IT4Success,https://www.crunchbase.com/organization/it4success,IT4Success ensures that smart IT will contribute to the success of their company. They continue to build a team of people who want to innovate and develop. They believe in autonomy and freedom to think along with their customers in the growth of IT4Success.,"Cloud Computing, Information Technology, Network Security, Security, Software, Software Engineering",https://it4success.nl/,"Delft, Zuid-Holland, The Netherlands",IT4Success is a firm that specializes in information technology services.,"608,296",,,,,,,,,,,,,European Union (EU),Active,1987-01-01,year,1,11-50,Edo Bodt,,,,,
ANCO,https://www.crunchbase.com/organization/anco,,"Cloud Computing, Cyber Security, Information Technology",https://anco.es,"Barcelona, Catalonia, Spain","ANCO provides cybersecurity, cloud computing, and IT management services.","619,943",,,,,,,,,,,,,European Union (EU),Active,1978-01-01,year,,101-250,,,,4267541,USD,4267541
Selima,https://www.crunchbase.com/organization/selima,"Selima provides software solutions and managed services to public sector organizations and large businesses in the United Kingdom. It offers human resource, payroll, and expense management software solutions. The company provides EnvoyWorld, a human resource, payroll, and expenses solution that provides solutions to companies and public sector organizations.","Cloud Computing, Software",http://www.selima.co.uk,"Sheffield, Sheffield, United Kingdom","Selima offer modern, intuitive cloud based HR Software.","638,003",,,,,,,,,,,,,,Active,1983-01-01,year,,51-100,,,,,,
Lan Systems,https://www.crunchbase.com/organization/lan-systems,,"Cloud Computing, Cyber Security, Web Apps",http://www.lansystems.it,"Bologna, Emilia-Romagna, Italy","Lan Systems offers IT services such as cloud computing, developing web applications, system integration, and IT security.","658,700",,,,,,,,,,,,,European Union (EU),Active,1986-12-29,day,,1-10,,,,,,
Ashby Computer Services,https://www.crunchbase.com/organization/ashby-computer-services,,"Cloud Computing, Cyber Security, Technical Support",https://www.ashbycomputers.co.uk,"Blackmill, Bridgend, United Kingdom","Ashby Computer Services provides technical support, cloud services, and cyber securities services.","710,065",,,,,,,,,,,,,,Active,1987-01-01,year,,11-50,,,,,,
e-novinfo Sàrl,https://www.crunchbase.com/organization/e-novinfo-sàrl,,"Cloud Computing, Cloud Security, Software",http://www.e-novinfo.ch,"Neuchâtel, Neuchatel, Switzerland",E-novinfo Sàrl is an IT provider that offers cloud solutions and security for various companies.,"726,224",,,,,,,,,,,,,,Active,1961-01-01,day,,11-50,,,,22304822,USD,22304822
Onehouse,https://www.crunchbase.com/organization/onehouse-d945,"Onehouse designs and hosts IT infrastructure IT support, backups, and Microsoft Office 365, which is one of their main activities everything is connected, they also fix other problems with networks, WI-FI, PCs, tablets, and servers. They take responsibility for making IT work, provide advice for IT solutions and new IT hardware that works, and design new IT solutions that fit their company's technology and budget.","Cloud Computing, Consulting, Information Technology, Web Hosting",https://onehouse.dk,"Svendborg, Syddanmark, Denmark",Onehouse provides information technology and consulting services.,"758,018",,,,,,,,,,,,,"European Union (EU), Nordic Countries, Scandinavia",Active,1982-01-01,year,,11-50,,,,,,
RIN,https://www.crunchbase.com/organization/rin,,"Cloud Computing, Consulting, Information Technology",https://www.rin.nl,"Wijchen, Gelderland, The Netherlands","RIN B.V. is an ICT, Cloud, Telephony, Printing & Scanning, and Audiovisual services and solutions company.","769,515",,,,,,,,,,,,,European Union (EU),Active,1979-01-01,year,,11-50,,,,,,
Fujitsu UK,https://www.crunchbase.com/organization/fujitsu-uk,,"Cloud Computing, Information Services, Information Technology, Network Security, Software",https://www.fujitsu.com/uk/,"London, England, United Kingdom","Fujitsu UK provides IT products and services for the global marketplace including hardware, software and business solutions.","776,594",,,,,,,,,,,,,,Active,1935-01-01,day,,1001-5000,,,,,,
Atlas,https://www.crunchbase.com/organization/atlas-a606,,"Cloud Computing, Telecommunications",http://atlas-comms.com/,"Belfast, Belfast, United Kingdom","Atlas Specialising in telecommunications, network solutions, telephony solutions and Cloud solutions.","789,028",,,,,,,,,,,,,,Active,1972-01-01,day,,11-50,,,,,,
CMS Group,https://www.crunchbase.com/organization/cms-group-d254,,"Cloud Computing, Information Technology, IT Infrastructure",https://www.cms-group.net,"Blackburn, Lancashire, United Kingdom","CMS Group offers IT support services, projects, infrastructure, and cloud services.","795,892",,,,,,,,,,,,,,Active,1990-01-01,year,,11-50,,,,3482306,USD,3482306
Datef Spa,https://www.crunchbase.com/organization/datef-spa,,"Cloud Computing, Information Technology, Software",http://www.datef.it,"Bolzano, Friuli-Venezia Giulia, Italy",Datef expertise in IT services and cloud computing for the better operation of the IT.,"840,508",,,,,,,,,,,,,European Union (EU),Active,1988-06-24,day,,101-250,,,,3849907,USD,3849907
Softconstruct,https://www.crunchbase.com/organization/softconstruct-9a01,,"Cloud Computing, Hardware, Software",http://www.softconstruct.be,"Kontich, Antwerpen, Belgium","Softconstruct is an IT company that deals with software, hardware and IT services with online backup, cloud antivirus, digital dictation.","854,442",,,,,,,,,,,,,European Union (EU),Active,1987-06-29,day,,1-10,,,,,,
Icasa Group,https://www.crunchbase.com/organization/icasa-group,,"Cloud Computing, Information Technology, Logistics",http://www.icasa-group.com,"Diepenbeek, Limburg, Belgium","Icasa specializes in a cloud solution and provides services in the area of logistics, fuel, shop, finance cards and authorizations.","888,577",,,,,,,,,,,,,European Union (EU),Active,1990-01-01,day,,101-250,,,,,,
CSM MeinSystemhaus,https://www.crunchbase.com/organization/csm-meinsystemhaus,CSM MeinSystemhaus develops strategic IT solutions. They value long-term and trusting relationships with customers as a solution provider for medium-sized firms. They develop and implement individual solutions in conjunction with clients. They optimize and secure the processes of their business in the long term.,"Cloud Computing, Consulting, Information Technology, Software, Training",https://www.meinsystemhaus.de,"Warendorf, Nordrhein-Westfalen, Germany",CSM MeinSystemhaus provides software and information technology services.,"921,251",,,,,,,,,,,,,European Union (EU),Active,1977-01-01,year,,101-250,,,,,,
ITC ARIANE Services,https://www.crunchbase.com/organization/itc-ariane-services,,"Accounting, Cloud Computing, Outsourcing, Telecommunications",https://www.itc-ariane.com,"Montreuil, Ile-de-France, France","ITC ARIANE Services is an integration, services & outsourcing company in Cloud Accounting & telecommunications sectors.","923,468",,,,,,,,,,,,,European Union (EU),Active,1983-01-01,year,,51-100,,,,,,
