Organization Name,Organization Name URL,Full Description,Industries,Website,Headquarters Location,Description,CB Rank (Company),SEMrush - Monthly Visits,SEMrush - Average Visits (6 months),SEMrush - Monthly Visits Growth,SEMrush - Visit Duration Growth,SEMrush - Visit Duration,SEMrush - Page Views / Visit,SEMrush - Page Views / Visit Growth,SEMrush - Bounce Rate,SEMrush - Bounce Rate Growth,SEMrush - Global Traffic Rank,SEMrush - Monthly Rank Change (#),SEMrush - Monthly Rank Growth,Headquarters Regions,Operating Status,Founded Date,Founded Date Precision,Number of Founders,Number of Employees,Founders,Apptopia - Number of Apps,Apptopia - Downloads Last 30 Days,Aberdeen - IT Spend,Aberdeen - IT Spend Currency,Aberdeen - IT Spend Currency (in USD)
Ex Libris,https://www.crunchbase.com/organization/ex-libris,"Ex Libris Group is a leading provider of library automation solutions, offering the only comprehensive product suite for the discovery, management, and distribution of all materialsâprint, electronic, and digital. Dedicated to developing the market's most inventive and creative solutions, Ex Libris leads the way in defining and designing efficient, user-friendly products that serve the needs of academic, research, and national libraries today, enabling them to transition into the future.","Apps, Cloud Computing, Enterprise Software, Information Technology, Software, Web Design",http://www.exlibrisgroup.com,"Ballerup, Hovedstaden, Denmark","Ex Libris Group is a leading provider of library automation solutions, offering the only comprehensive product suite for the discovery,","165,720","13,961,244","14,073,988.5",54.13%,-40.67%,"1,278",2.44,-6.68%,53.17%,-8.56%,"12,435","-4,343",-25.89%,"European Union (EU), Nordic Countries, Scandinavia",Active,1986-01-01,year,2,501-1000,"Azriel Morag, Evgeniy Larionov",19,"3,443",,,
Exact,https://www.crunchbase.com/organization/exact,"Exact is a global supplier of cloud business software. Since the beginning in 1984, its focus has developed from supporting financial processes to developing a complete ERP offering for small and medium enterprises. It provides innovative solutions like Exact Globe, Exact Synergy, and Exact Online support over 400,000+ customers – local and international companies – with the daily management of their business. Exact develops industry-specific on-premise and SaaS solutions for manufacturing, wholesale & distribution, professional services, small business, and accountancy. Exact was founded in 1984 and is headquartered in Delft, the Netherlands.","Accounting, Cloud Computing, CRM, Enterprise Resource Planning (ERP), Enterprise Software, Finance, SaaS, Software",http://www.exact.com,"Delft, Zuid-Holland, The Netherlands",Exact is a company that provides cloud based business software for entrepreneurs and their accountants.,"229,780","622,387","672,910.5",71.27%,-14.53%,447,2.52,-18.63%,41.98%,-9.99%,"155,471","-63,803",-29.1%,European Union (EU),Active,1984-07-23,day,3,1001-5000,"Arco Van Nieuwland, Eduard Hagens, Irfan Verdia",32,"11,294",,,
Xperience,https://www.crunchbase.com/organization/xperience-b97c,"Xperience provides software solutions within ERP, CRM, managed IT and cloud service that helps the digital transformation of the business.","Cloud Computing, Consulting, CRM, Enterprise Resource Planning (ERP), Software",https://www.xperience-group.com/,"Antrim, Antrim, United Kingdom","Xperience provides software solutions within ERP, CRM, managed IT and cloud service that helps the digital transformation of the business.","187,002","402,949","198,967.83",897.05%,80.24%,"7,060",15.51,111.56%,12.66%,-67.72%,"203,920","-702,770",-77.51%,,Active,1969-01-01,year,,101-250,,,,6256711,USD,6256711
Sage,https://www.crunchbase.com/organization/sage-c1e4,"Sage DPW-Software is now implementing over 1000 kunden, which is the most widely used multinational untenermen, in branchen versions. Sage GmbH is with the Sage DPW-Product the latest personal management software.","Cloud Computing, Computer, Private Cloud, Security, Software",https://www.sagedpw.at/,"Vienna, Wien, Austria",Sage provides software for HR services.,"362,734","319,471","219,712.33",164.66%,-32.23%,82,3.52,10.78%,50.03%,-4.9%,"249,001","-217,670",-46.64%,European Union (EU),Active,1972-01-01,year,,101-250,,,,,,
Novahé,https://www.crunchbase.com/organization/novahé,,"Cloud Computing, Information Technology, IT Infrastructure",https://www.novahe.fr/,"Orléans, Centre, France","Novahé is an information technology company specialized in IT infrastructure, computer data security and cloud computing services.","930,723","288,214",,24.61%,65.53%,"1,705",25.43,179.25%,5.66%,-65.1%,"267,322","-32,645",-10.88%,European Union (EU),Active,1986-06-30,day,,51-100,,,,,,
Eurodata,https://www.crunchbase.com/organization/eurodata-911a,,"Cloud Computing, Service Industry, Software",https://eurodata.de,"Saarbrücken, Saarland, Germany",Eurodata is an IT company that provides solutions for cross company software service with cloud based solutions.,"501,885","287,354","190,185.33",12.1%,12.81%,"1,550",6.88,17.97%,14.97%,-14.6%,"267,804","-11,703",-4.19%,European Union (EU),Active,1965-01-01,year,,251-500,,7,"6,964",4047485,USD,4047485
Hatteland,https://www.crunchbase.com/organization/jakob-hatteland-computers,,"Cloud Computing, Information Technology, Software",https://www.hatteland.com/,"Stavanger, Rogaland, Norway","Hatteland offers services in cloud computing, system development, data center, helpdesk and IT consulting to overcome business issues.","402,919","211,804","60,906.67",560.55%,600.96%,729,1.25,5.21%,78.81%,-10.21%,"318,620","-729,645",-69.61%,"Nordic Countries, Scandinavia",Active,1971-01-01,day,,251-500,,,,,,
Norteam,https://www.crunchbase.com/organization/norteam,,"Cloud Computing, Information Technology, Software",https://www.norteam.se/,"Bromma, Sodermanlands Lan, Sweden","Norteam offers a wide range of IT solutions such as IT security, telephony, Microsoft Azure, cloud computing and intranet services.","967,402","180,493",,859.15%,-7.14%,"2,303",3.14,-19.54%,49.88%,66.16%,"368,114","-1,172,643",-76.11%,"European Union (EU), Nordic Countries, Scandinavia",Active,1989-01-01,year,,11-50,,,,,,
CRS4,https://www.crunchbase.com/organization/crs4,"Established in 1990, CRS4 (Center for Advanced Studies, Research and Development in Sardinia) is located within Science and Technology Park (Polaris), a point of attraction for high-tech research 40 km from Cagliari. CRS4 is an interdisciplinary research center promoting the study, development and application of innovative solutions to problems stemming from natural, social and industrial environments. Information Society and Technology and High Performance Computing are the supporting foundations. The main objective is innovation. The mission is to help Sardinia to build and support a layer of modern high tech industries considered essential to its economic and cultural development.","Business Development, Cloud Computing, Education, Information Technology",http://www.crs4.it/,"Pula, Sardegna, Italy","CRS4 is an interdisciplinary research center promoting the study, development and application of innovative solutions to problems stemming","764,573","103,411","58,347.33",-50.51%,-75.6%,152,2.02,-9.5%,28.03%,-27.19%,"536,742","215,217",66.94%,European Union (EU),Active,1990-01-01,year,,51-100,,,,,,
CWS Digital Solutions,https://www.crunchbase.com/organization/cws-digital-solutions,,"Artificial Intelligence, Cloud Computing, Service Industry",https://www.cws.it,"Turin, Piemonte, Italy","CWS Digital Solutions is a data, cloud, internet of thing and artificial intelligence and CWS support service company.","729,523","68,006","30,590.67",541.63%,55.11%,"1,486",7.6,109.9%,24.13%,-49.89%,"706,707","-1,413,061",-66.66%,European Union (EU),Active,1987-01-01,year,,101-250,,,,3821280,USD,3821280
Actuelburo,https://www.crunchbase.com/organization/actuelburo,,"Cloud Computing, Information Technology, Software, Software Engineering, Telecommunications",https://actuelburo.fr,"Orthez, Aquitaine, France","Actuelburo provides services such as IT, cloud services, telephony, office automation, software, and commercial management.","826,834","67,560","39,998.17",111.88%,-28.1%,"2,006",11.86,295.37%,41.67%,-37.5%,"709,847","-407,304",-36.46%,European Union (EU),Closed,1976-01-01,year,,101-250,,,,,,
Kin and Carta,https://www.crunchbase.com/organization/kin-and-carta,"Kin + Carta is a global digital transformation business that advises, creates, and connects marketing and customer experience. Kin + Carta is a professional services company, born out of the United Kingdom in 2018.","Cloud Computing, Cloud Data Services, Digital Marketing, Finance, Internet, Marketing",http://www.kinandcarta.com,"London, England, United Kingdom","Kin + Carta is a global digital transformation business that advises, creates, and connects marketing and customer experience.","10,693","58,451","54,108",80.56%,37.61%,300,1.71,0.75%,67.32%,-14.88%,"756,313","-285,698",-27.42%,,Active,1964-01-01,year,1,5001-10000,J Schwan,,,,,
Valore BF,https://www.crunchbase.com/organization/valore-bf,"Valore BF is a printing and innovation technology sector firm providing them with customized, vertical, and modular technological solutions tailored to their business and their needs. It is specialized in printing and document archiving, telecommunications, telephone systems, web Services, and more.","Cloud Computing, Cyber Security, Information Technology",https://www.valorebf.it,"Gallarate, Lombardia, Italy","Valore BF is a printing and innovation technology sector firm providing them with customized, vertical, and modular technological solutions.","1,161,981","56,018","48,894.17","1,262.97%",74.86%,"2,574",19.25,35.53%,7.02%,-33.89%,"805,730","-2,907,185",-78.3%,European Union (EU),Active,1985-01-01,year,,51-100,,,,3914461,USD,3914461
Siav,https://www.crunchbase.com/organization/siav,,"Cloud Computing, Information Technology, Software",https://www.siav.com,"Rubano, Veneto, Italy","Siav provides digital storage, document management, software development, document portals, and cloud services.","524,480","40,997","17,044.83",9.17%,-98.57%,14,1.07,-20.8%,98.35%,21.8%,"979,745","-27,021",-2.68%,European Union (EU),Active,1990-01-01,year,,251-500,,,,3849039,USD,3849039
Exor,https://www.crunchbase.com/organization/exor-eb7d,,"Cloud Computing, Industrial Automation, Information Technology, Internet of Things, Software",https://www.exorint.com,"San Giovanni Lupatoto, Veneto, Italy",Exor develops software for industrial edge management as well as offers connectivity management and IoT platform building solutions.,"239,452","32,968","16,910.5",201.27%,360.71%,258,2.31,11.67%,38.34%,21.18%,"1,121,410","-949,996",-45.86%,European Union (EU),Active,1971-01-01,year,,101-250,,,,,,
SLTN,https://www.crunchbase.com/organization/sltn,,"Business Intelligence, Cloud Computing, Information Technology",https://www.sltn.nl/,"Hilversum, Noord-Holland, The Netherlands","SLTN is one of the larger ICT companies in the Netherlands that focuses on data centers, Cloud, infrastructure and application services.","197,297","24,106","23,549.5",127.24%,-60.22%,438,2.03,38.68%,66.78%,-3.54%,"1,370,258","-748,285",-35.32%,European Union (EU),Active,1980-01-01,year,1,251-500,Eugene Tuijnman,,,,,
MPY Yrityspalvelut,https://www.crunchbase.com/organization/mpy-yrityspalvelut,,"Cloud Computing, Information Technology",https://www.mpy.fi/,"Mikkeli, Eastern Finland, Finland",MPY Yrityspalvelut provides information management audits to management and IT technology services.,"627,719","21,272","18,460.17",-54.73%,-40.24%,395,3.29,141.4%,27.95%,-62.1%,"1,443,494","622,265",75.77%,"European Union (EU), Nordic Countries, Scandinavia",Active,1988-01-01,day,,101-250,,,,4787758,USD,4787758
Olivetti,https://www.crunchbase.com/organization/olivetti,"Olivetti provides information technology products and services. It provides bank and post office terminals, cash registers, cordless and corded phones, retail printers, interactive boards, internet keys, multiservice terminals, POS touchscreen systems, office automation systems, self-service systems, tablets, fax machines, and validators; and multiservice terminals and specialized peripherals for banking, postal services, gaming and lottery, and transport sectors. It also provides software solutions, including Document Hub, a SaaS model document management solution that offers services for the document life cycle; Olitouch, a solution for corporate document dematerialization; Application Warehouse, a virtual store of business applications, including groups of bundled application solutions for small and medium enterprises, large corporate clients, and local and central government agencies. It also offers Olischool, which is a vertical hardware and software for schools. Olivetti also provides cloud computing and related services. Its products are primarily offered for SMEs, large corporate customers, and the retail sector in Europe and in the world. Olivetti was established in 1908 and is based in Ivrea, Italy. Olivetti operates as a subsidiary of Telecom Italia S.p.A.","Cloud Computing, Cloud Data Services, Computer, Enterprise Software, Information Technology, Software",http://www.olivetti.com/,"Ivrea, Piemonte, Italy",Olivetti provides information technology products and services.,"265,011","17,219","36,368.67",1.86%,-59.54%,53,1.36,-57.93%,79.11%,80.78%,"1,647,512","14,770",0.9%,European Union (EU),Active,1908-01-01,year,1,251-500,Marcello Pellacani,,,,,
DATADEC,https://www.crunchbase.com/organization/datadec,DATADEC is specialized for more than 30 years in developing and implementing management software on ORACLE technology. DATADEC is a pioneer in Cloud ERP.,"Cloud Computing, Computer, Enterprise Resource Planning (ERP), Information Technology, Software, Telecommunications",https://www.datadec.es/,"Valencia, Comunidad Valenciana, Spain",DATADEC develops and implements management software on ORACLE technology.,"1,415,800","15,556","22,613.67",-49.3%,120.93%,0,1.01,-14.19%,98.94%,20.34%,"1,706,231","493,028",40.64%,European Union (EU),Active,1987-01-01,year,,101-250,,,,12795814,USD,12795814
Ashgoal,https://www.crunchbase.com/organization/ashgoal,,"Cloud Computing, Consulting, IT Management, Software Engineering, Telecommunications",http://www.ashgoal.com,"Barnet, Barnet, United Kingdom","Ashgoal is an IT firm that specializes in cloud computing, IT security and infrastructure, hardware, telecom and communication.","877,024","14,707","5,148.83",443.5%,508.49%,0,1,0%,100%,0%,"1,802,382","-2,618,495",-59.23%,,Active,1979-01-01,year,,11-50,,,,,USD,
Simac,https://www.crunchbase.com/organization/simac,"Simac aims to promote high-quality technology as a publicly traded company in several European countries in Europe for large and medium-sized companies  of the business processes. Simac wants to work professionally, integerly, reliably, flexibly and result-oriented to the client and all other stakeholders .  Simac supplies medium and large companies and organizations. By investing in product and service development and implementing innovative projects for advanced clients , Simac acquires practical knowledge and skills, which are then deployed throughout the market. Simac works closely with its clients, mainly based on projects  and management contracts. The technology is an indispensable element in the business management of the customers and should be available continuously. Simac is aware of this responsibility, has the right knowledge and procedures at home and constantly innovates . Simac wants to take a leading position in the markets where it is active. That's why Simac targets a limited number of countries in Europe. Opportunities to expand the geographical area will be examined carefully and step by step. ","Cloud Computing, Information Technology",https://www.simac.com/,"Veldhoven, Noord-Brabant, The Netherlands",Simac aims to promote high-quality technology as a publicly traded company in several European countries.,"253,053","14,257","24,272.83",60.68%,1.45%,350,3.07,31.89%,63.01%,11.27%,"1,783,294","-420,744",-19.09%,European Union (EU),Active,1971-01-01,year,1,501-1000,Mac van Schagen,6,,,,
Grey Matter,https://www.crunchbase.com/organization/grey-matter-652e,,"Cloud Computing, Information Technology, Software",https://greymatter.com,"Ashburton, Devon, United Kingdom",Grey Matter is a software company that offers managed IT and cloud infrastructure management services.,"232,465","13,700","11,014",-9.56%,-72.32%,31,1.74,-1.05%,74.2%,12.73%,"1,875,818","146,436",8.47%,,Active,1983-01-01,year,,51-100,,,,,,
Concat AG,https://www.crunchbase.com/organization/concat-ag,"Concat provides customized IT infrastructures and cloud solutions. As an IT service provider, Concat AG offers a broad portfolio of managed services to efficiently support IT organizations in their transformation to a digital service provider. This ranges from the realization of tailor-made IT infrastructures via cloud services to the takeover of IT operations by the company's own ISO 9001 certified service and support organization (24 × 7). Concat also operates its own infrastructures in highly secure data centers in Germany that are ISO 9001 and 27001 certified. The head office is in Bensheim; In addition there are 12 branches and sales offices nationwide as well as the Munich subsidiary Concat GmbH. In the 2017/2018 financial year, 250 employees generated sales of 127 million euros.","Cloud Computing, Information Services, Information Technology, IT Infrastructure",https://www.concat.de,"Bensheim, Hessen, Germany",Concat provides customized IT infrastructures and cloud solutions.,"258,649","11,922",,,,75,1.54,,45.78%,,"2,041,003",,,European Union (EU),Active,1990-01-01,year,1,251-500,Dexter McGinnis,,,,,
Lanaco,https://www.crunchbase.com/organization/lanaco,,"Cloud Computing, Infrastructure, Professional Services, Software, Web Hosting",https://www.lanaco.com/,"Banja Luka, Republika Srpska, Bosnia and Herzegovina","Lanaco specializes in offering IT solutions that include software solutions, data infrastructure, hosting and cloud computing services.","643,682","11,901","14,702.17",75.14%,0.09%,"2,108",5.71,-27.44%,43.69%,96.8%,"1,972,073","-607,607",-23.55%,,Active,1990-01-01,year,,251-500,,,,,,
UMB,https://www.crunchbase.com/organization/umb-ag,"We believe that time is one of the most valuable resources in the world. We create time for our customers - for innovations and bold business ideas. With our leading edge know-how, we are the market leader for business & technology transformation. As the best employer we inspire generations. We develop digitization software and, as a swiss cloud native visionary, accelerate business progress. With our leading edge expertise in the areas consulting, cloud, digital transformation, modern work, security and infrastructure, we serve our customers in an inspiring, simple, and inspiring way.","Cloud Computing, Cloud Management, Cloud Security, Consulting, Information Services, Information Technology, Software",https://www.umb.ch/,"Cham, Zug, Switzerland","UMB provides a 360-degree service for your digital transformation with Consulting, Cloud, Modern Work, Security, and Infrastructure.","148,514","10,783","7,686.67",167.04%,-69.1%,72,3.13,53.32%,22.58%,10.25%,"2,101,245","-1,477,587",-41.29%,,Active,1978-01-01,year,,501-1000,,,,3683867,USD,3683867
SVL,https://www.crunchbase.com/organization/svl,,"Cloud Computing, Compliance, Consulting, Data Center Automation, Telecommunications",https://www.svlbusinesssolutions.com/,"Glasgow, Glasgow City, United Kingdom","SVL provides multimedia interaction recording, contact center applications, PCI security and automation along with consulting services.","560,164","10,490",,-99.52%,-51.01%,483,3.98,78.19%,32.79%,-52.55%,"2,130,929","2,076,246","3,796.88%",,Active,1967-01-01,year,,11-50,,,,,,
UWM Accountants,https://www.crunchbase.com/organization/uwm-accountants,,"Accounting, Cloud Computing",https://uwm.co.uk/,"Leeds, Leeds, United Kingdom","UWM Accountants offers cloud accountants services in Leeds, Yorkshire.","1,262,663","7,448","3,455.83",384.27%,78.97%,545,2.95,194.55%,78.38%,-21.62%,"2,541,979","-2,988,364",-54.04%,,Active,1978-01-01,year,,11-50,,,,3417358,USD,3417358
HSI Grup,https://www.crunchbase.com/organization/hsi-grup,,"Cloud Computing, Consulting, Information Technology",https://www.hsi.es/,"Barcelona, Catalonia, Spain",HSI Grup is a provider of IT and consulting services.,"516,616","7,127","2,114","1,283.88%",,0,1,0%,100%,0%,"2,633,764","-4,749,385",-64.33%,European Union (EU),Active,1988-01-01,day,,11-50,,,,14120006,USD,14120006
Acora Ltd,https://www.crunchbase.com/organization/acora-ltd,,"Cloud Computing, Cloud Infrastructure, Cloud Management, IT Infrastructure, IT Management, Outsourcing, Technical Support",https://www.acora.com/,"Burgess Hill, West Sussex, United Kingdom","Delivering outsourced IT services and IT managed services to mid-market businesses requiring agility, performance and profitability.","149,539","5,955","4,069.17",55%,"1,663.64%",194,3.14,173.66%,31.04%,-67.76%,"2,934,277","-730,764",-19.94%,,Active,1989-01-01,year,1,101-250,David Rabson,,,,,
Inforolot,https://www.crunchbase.com/organization/inforolot,,"Cloud Computing, Enterprise Resource Planning (ERP), Software",http://www.inforolot.com,"Olot, Catalonia, Spain",Inforolot provides IT services to companies. They are specialized in ERP Software Network and Communications.,"1,463,948","4,461",,,,0,1,,100%,,"3,581,882",,,European Union (EU),Active,1984-01-01,day,,11-50,,,,5028726,USD,5028726
Transputec,https://www.crunchbase.com/organization/transputec,"Founded in 1984, Transputec combines  excellence in insights, relationships and innovations to drive businesses forward. We manage IT services, develop tailor-made solutions, and supply hardware and software to international clients in a diverse range of sectors. These include commerce, finance, communications, construction, logistics and government. Our Goal: To help businesses reap the benefits of integrated IT solutions","Cloud Computing, Document Management, Enterprise Software, Information Technology, Software, Web Hosting",http://www.transputec.com,"London, England, United Kingdom","Transputec provides tailor-made IT solutions to its clients in the commerce, finance, communications, construction, and government sectors.","199,268","2,865","3,205.33",-38.08%,-87.14%,9,1.27,-47.72%,72.77%,256.02%,"4,383,945","866,239",24.63%,,Active,1984-01-01,year,1,51-100,Sonny Seghal,6,16,,,
WSB Solutions LLC,https://www.crunchbase.com/organization/wsb-solutions-llc,,"Cloud Computing, Consulting, Cyber Security, Information and Communications Technology (ICT), Information Technology, Software, Telecommunications",https://wsb-solutions.nl,"Hardinxveld, Zuid-Holland, The Netherlands","WSB Solutions provides software, ICT, telecom, cloud, office 365, dynamics 365, IT security, & Microsoft azure services.","1,015,725","2,848","6,721.33",-37.52%,,0,1,0%,100%,0%,"4,416,504","873,864",24.67%,European Union (EU),Active,1987-01-01,year,,51-100,,,,,,
EBC Group,https://www.crunchbase.com/organization/ebc-group,,"Cloud Computing, Information Technology",http://www.ebcgroup.co.uk,"Halesowen, Dudley, United Kingdom","EBC Group is providing managed services for over 25 years including IT, telephony, connectivity and print.","326,731","2,828",,-37.49%,"7,800%",0,1,-41.35%,100%,16.41%,"4,431,184","868,526",24.38%,,Active,1989-01-01,day,1,,Richard Lane,,,,,
Opin Kerfi,https://www.crunchbase.com/organization/opin-kerfi,,"Cloud Computing, Consulting, Information Technology, Internet",https://opinkerfi.is,"Reykjavík, Gullbringusysla, Iceland","Opin Kerfi specializes in IT services that offer cloud hosting and internet solutions, software licenses and security advisory services.","1,105,133","2,807","5,254",-85.2%,-88.59%,34,1.54,-83.03%,80.78%,205.41%,"4,447,195","2,912,641",189.8%,"Nordic Countries, Scandinavia",Active,1985-01-01,year,,101-250,,,,,,
Global-e ICT Solutions,https://www.crunchbase.com/organization/global-e-ict-solutions,,"Cloud Computing, Cloud Infrastructure, Cloud Management, Information and Communications Technology (ICT)",https://www.global-e.nl/,"Eindhoven, Noord-Brabant, The Netherlands","Global-e ICT Solutions offers innovative integrated services that help organizations perform better through cloud, voice and infrastructure.","1,604,493","2,180",,440.94%,,977,2,100%,42.75%,-57.25%,"4,833,207","-3,120,692",-39.23%,European Union (EU),Active,1988-01-01,year,,11-50,,,,,,
Sodvin,https://www.crunchbase.com/organization/sodvin,,"Cloud Computing, Energy, Software, Telecommunications",https://www.sodvin.no,"Kyrksæterøra, Sor-Trondelag, Norway","Sodvin provides software development, cloud computing, infrastructure, IT, real estate, telecommunication, and energy distribution services.","915,356","1,987","1,331.67",232.27%,144.4%,"1,701",3.16,-41.81%,20.55%,-61.07%,"4,973,694","-2,113,275",-29.82%,"Nordic Countries, Scandinavia",Active,1951-01-01,year,,101-250,,,,6008728,USD,6008728
Ozitem,https://www.crunchbase.com/organization/ozitem,,"Cloud Computing, Information Technology",https://groupeozitem.com/,"Levallois-perret, Ile-de-France, France","Ozitem provides tailor-made, innovative and scalable solutions.","424,938","1,707","4,056.33",116.35%,,0,1,0%,100%,0%,"5,248,451","-1,540,676",-22.69%,European Union (EU),Active,1990-01-01,day,1,101-250,Laurent Soulié,,,,,
