Organization Name,Organization Name URL,Full Description,Industries,Website,Headquarters Location,Description,CB Rank (Company),SEMrush - Monthly Visits,SEMrush - Average Visits (6 months),SEMrush - Monthly Visits Growth,SEMrush - Visit Duration Growth,SEMrush - Visit Duration,SEMrush - Page Views / Visit,SEMrush - Page Views / Visit Growth,SEMrush - Bounce Rate,SEMrush - Bounce Rate Growth,SEMrush - Global Traffic Rank,SEMrush - Monthly Rank Change (#),SEMrush - Monthly Rank Growth,Headquarters Regions,Operating Status,Founded Date,Founded Date Precision,Number of Founders,Number of Employees,Founders,Apptopia - Number of Apps,Apptopia - Downloads Last 30 Days,Aberdeen - IT Spend,Aberdeen - IT Spend Currency,Aberdeen - IT Spend Currency (in USD)
Shibumi,https://www.crunchbase.com/organization/shibumi,"Shibumi is a cloud-based enterprise application that provides the work management, collaboration, and performance measurement necessary to deliver successful business initiatives and optimize results. The company is focused on what customers need to execute business activity ranging from a single key initiative to an enterprise business improvement program. It reduces the need for time-consuming manual effort compiling status, impact, and results and helps get teams back to their most important job executing. Shibumi helps teams stop spending the majority of their week in meetings and accelerate their actions with a focus on measurable results.  The application is easy to use, intuitive interface, that requires little or no training means that any user can focus on getting work done rather than endless stakeholder reporting. It was founded in 2011 and is headquartered in Norwalk, Connecticut, United States.","B2B, Cloud Computing, Collaboration, Enterprise Software, Mobile, Social Media, Software, Web Development",http://www.shibumi.com,"Norwalk, Connecticut, United States","Shibumi is a cloud-based enterprise app providing work management, collaboration and performance measurement services for businesses.","14,979","2,479","3,607.83",-31.27%,-93.88%,0,1,-9.62%,100%,11.92%,"4,698,349","808,296",20.78%,"East Coast, New England, Northeastern US",Active,2011-01-01,year,4,51-100,"Jason Bobby, Ken Pellegrino, Mark DiGirolamo, Robert Nahmias",,,152454,USD,152454
OneView Commerce,https://www.crunchbase.com/organization/oneview-commerce,"OneView Digital Store is the retail-as-a-service platform that gives retailers a robust transaction engine and headless architecture to build and own their unique customer experiences for any touchpoint. Unlike legacy store systems, OneView puts customers and innovation at the center of the retailer universe instead of lanes or hardware. With a dynamic platform ecosystem including platform consumers and contributors, OneView has empowered leading innovators to build loyalty and mindshare with customers.  OneView Commerce's feature-as-a-service commerce engine includes store operations management with a function-rich point of sale services to enable efficient, relevant engagement, everywhere. It also provides a cloud-native Digital Store Platform to replace current in-store software and enable a modern and engaging shopping experience.","Cloud Computing, E-Commerce, PaaS, Point of Sale, Retail Technology, SaaS, Software",http://www.oneviewcommerce.com,"Boston, Massachusetts, United States",OneView Commerce is a retail-as-a-service platform that offers point of sale and store system suites solutions.,"48,376","2,370",,,,0,1,,100%,,"4,704,502",,,"Greater Boston Area, East Coast, New England",Active,2010-01-01,day,2,51-100,"Linda Palanza, Stuart Mitchell",,,,,
PushMon,https://www.crunchbase.com/organization/pushmon,"Cloud-based monitoring service for scripts, jobs, apps and batches. PushMon is a new kind of cloud-based monitoring system. Instead of checking public facing servers on a regular basis, PushMon will wait for pings from the objects being monitored. These objects are usually batch jobs, scheduled/cron scripts, backups, or test scripts, but really are anything that has access to the internet and can call a URL on a regular basis. If PushMon does not receive the URL ""ping"" by the specified schedule (like every hour, or every day or even by 5:00 PM every Fri), it will send an alert (email, IM, SMS, Twitter and/or phone call). It can monitor your database backups, your cron scripts, your background tests, your internet connectivity, your batch jobs, and a lot more. It also has an advanced but easy to use scheduling feature to alert you of problems as soon as possible.","Cloud Computing, Information Technology, Mobile Apps, Software",http://www.pushmon.com,"Seymour, Connecticut, United States",PushMon provides cloud-based software monitoring services for business customers.,"1,360,756","2,330",707.33,700.69%,,371,7.5,650%,50%,-50%,"4,830,551","-4,342,891",-47.34%,"East Coast, New England, Northeastern US",Active,2011-01-01,year,,11-50,,,,,,
Principle InfoTech,https://www.crunchbase.com/organization/principle-infotech,,"Big Data, Cloud Computing, Cyber Security, Enterprise Resource Planning (ERP), Information Technology, Project Management",https://principleinfotech.com/,"Houston, Texas, United States",Principle InfoTech offers services in implementing out-of-box BI packages such as Oracle Business Intelligence Applications (OBIA).,"493,520","2,284",,928.83%,,0,1.01,1.27%,98.73%,-1.27%,"4,863,988","-4,683,142",-49.05%,"Greater Houston Area, Southern US",Active,2009-01-01,day,,11-50,,,,135805,USD,135805
Cloudwalks,https://www.crunchbase.com/organization/cloudwalk-hosting-solution,"Cloudwalks is a leading QuickBooks Hosting provider in more than 10 countries. We have gained very rich experience in Hosted Tax and Accounting applications in a cloud environment. Cloudwalks hosts all popular accounting software, such as QuickBooks, Peachtree, Sage accounting software, etc. We at Cloudwalks host all versions of QuickBooks accounting software including Pro, Premier, Enterprise, QuickBooks Canada, and all industry-specific versions from the year 2010 onwards in a multi-user environment.","Cloud Computing, Cloud Infrastructure, Cloud Storage, Private Cloud, Web Hosting",https://www.cloudwalks.com,"New York, New York, United States",Cloudwalks is a QuickBooks hosting provider offering customized virtual office solutions.,"363,063","2,184",,,,171,1.25,,74.91%,,"4,929,231",,,"Greater New York Area, East Coast, Northeastern US",Active,2010-09-18,day,1,11-50,Michael Goldfine,,,,,
Azuqua,https://www.crunchbase.com/organization/azuqua,"Azuqua helps the world’s leading companies integrate their SaaS applications and automate time-consuming, repetitive work so they can deliver better employee and customer experiences and redefine productivity across the organization. Azuqua's platform is intuitive, powerful, and resilient. The visual drag and drop interface without the need for code makes this platform usable for business and IT. Azuqua solves even the toughest problems with hundreds of comprehensive connectors and a rich library of business logic and data processing functions. Azuqua is resilient and will give the user ease-of-mind. You can trust your automations will run on-time, every time and that your data will be secured.","Cloud Computing, Cloud Management, Data Integration, Enterprise Software, Marketing Automation, SaaS, Software",http://www.azuqua.com,"Seattle, Washington, United States",Azuqua helps people integrate their SaaS applications and build powerful automations to save time and eliminate manual work.,"34,711","2,182","2,436.33",223.74%,-22.22%,0,1,0%,100%,0%,"4,930,667","-2,731,583",-35.65%,"Greater Seattle Area, West Coast, Western US",Active,2011-01-01,year,2,51-100,"Craig Unger, Nikhil Hasija",,,,,
Illuminate Ventures,https://www.crunchbase.com/organization/illuminate-ventures,"Illuminate’s focus is on finding, funding and accelerating great founders in the B2B/Enterprise cloud and mobile computing space. They focus on companies building SaaS applications as well as solutions that leverage data and mobility to improve business results. They seek innovative ideas led by talented teams – frequently bringing together diverse perspectives that marry “creative destruction” with new technologies to solve old problems in new ways. Illuminate is typically a startup’s first institutional investor, but can also be a fit for an established company seeking its first equity financing. Their sweet spot is Series Seed rounds – filling the gap between angel capital and larger funding rounds of traditional VCs. When the timing is right, they collaborate with the best large-scale firms for the next round of financing, but they love lean start-ups that preserve flexibility in their early years. With three funds under management, Illuminate has been an early investor and board member in deep technology platforms like BrightEdge Technologies (SEO market leader), SaaS applications like Xactly Corporation (NYSE: XTLY) and early market innovators like Influitive (customer advocacy).","Big Data, Cloud Computing, Enterprise Software, Mobile, SaaS",http://www.illuminate.com,"Oakland, California, United States",Illuminate Ventures invests in early-stage high-tech companies delivering B2B/enterprise cloud and mobile solutions,"76,765","2,178","14,320.67",-23.04%,-20%,4,1.19,-20.93%,81.4%,62.8%,"4,932,732","595,964",13.74%,"San Francisco Bay Area, West Coast, Western US",Active,2010-01-01,year,1,1-10,Cindy Padnos,,,,,
Futran Solutions,https://www.crunchbase.com/organization/futran-solutions,"Futran Solutions is a Digital Technology organization focused on Data Analytics, Cloud, Automation, and New Age App Development.","Analytics, Apps, Cloud Computing, Cloud Data Services, Data Integration, Data Visualization, Developer APIs, Robotics",https://www.futransolutions.com/,"Edison, New Jersey, United States","Futran Solutions is a Digital Technology organization focused on Data Analytics, Cloud, Automation and New Age App Development.","184,627","2,137","2,143.83",162.53%,,0,1,-28.41%,100%,42.88%,"4,964,640","-2,330,294",-31.94%,"Greater New York Area, East Coast, Northeastern US",Active,2010-01-01,year,1,251-500,Jyoti Vazirani,,,2623369,USD,2623369
JNT TEK,https://www.crunchbase.com/organization/jnt-tek,,"Cloud Computing, Cloud Management, IT Infrastructure, IT Management, Web Development",https://www.jnttek.com/,"Los Angeles, California, United States","JNT TEK is an IT services consultancy that offers cloud computing, DevOps and infrastructure automation, system monitoring, and web design.","1,464,618","2,107",797,986.08%,-85.52%,54,1.85,-38.29%,71.62%,,"4,991,120","-4,666,608",-48.32%,"Greater Los Angeles Area, West Coast, Western US",Active,2010-01-01,year,,11-50,,,,,,
Commio,https://www.crunchbase.com/organization/commio,Commio is a cloud-based communication provider with direct access to the US Public Phone Network; with interconnection in 75+ LATAs.,"Cloud Computing, Software, Telecommunications",https://www.commio.com/,"Austin, Texas, United States",Commio provides professional and affordable services to clients.,"121,082","2,050","2,820.17",-49.77%,200%,21,1.78,22.26%,60.76%,-5.59%,"4,922,178","1,363,512",38.32%,Southern US,Active,2010-01-01,year,2,1-10,"Aaron Leon, Michael Tindall",,,,,
Librato,https://www.crunchbase.com/organization/librato,"Librato is a Software as a Service company offering a platform for Real-time Operations Analytics that accepts metrics from any source for real-time aggregation and transformation, anomaly detection, alerting, visual analysis and storage. We're dedicated to delivering beautiful, easy to use tools that make managing your operations more fun and efficient. The service is designed so that users can leverage it for any and all type of metrics, making it possible to see website sign-ups alongside infrastructure and business metrics. Users can aggregate, transform and correlate the data that is important to their business regardless of its origin.  Data sources can be custom, commercial or open source Data Collectors or applications instrumented using one of the language bindings available for our API. There is an active user community building connectors for existing open source data collectors such as statsd, collectd or nagios, as well as other integrations and applications.","Analytics, Cloud Computing, SaaS, Software",http://www.librato.com,"San Francisco, California, United States",Real time operations analytics for metrics from any source,"57,781","1,969","14,173",30.22%,-98.27%,0,1,0%,100%,0%,"4,985,755","-616,321",-11%,"San Francisco Bay Area, West Coast, Western US",Active,2011-01-01,year,5,11-50,"Daniel Stondin, Fred van den Bosch, Joseph Ruscio, Mike Heffner, Nik Wekwerth",,,,,
Mercatus,https://www.crunchbase.com/organization/mercatus,"Mercatus is an investment data management platform for private market fund managers and asset owners that need to solve the complexity of their private investment data. We offer a single platform for business users to manage the entire investment lifecycle: from deal to divestment, asset to fund, debt to equity. Mercatus is a platform that solves investment data challenges in portfolio monitoring, deal management, valuation management, and ESG. It is the only platform that enables scenario analysis and valuations at scale at the asset and fund level. With Mercatus, you will trust your data, scale your team, and make better investment decisions.","Cloud Computing, Financial Services, FinTech, Information Technology, Software",http://gomercatus.com,"San Mateo, California, United States",Mercatus is the modern investment data management platform for private markets.,"16,796","1,942","4,888",7.71%,-14.29%,36,1.39,11.09%,60.84%,-30.35%,"5,120,875","-27,168",-0.53%,"San Francisco Bay Area, Silicon Valley, West Coast",Active,2009-01-01,year,2,11-50,"Haresh Patel, Tim Buchner",,,,,
Stratasan,https://www.crunchbase.com/organization/healthdatasource,"Stratasan’s software and services provide market intelligence to hospitals and healthcare systems, equipping them to make better decisions and maximize strategic growth. Their proprietary software platform and reality-driven data analysis provide a foundation for strategic growth including: strategic planning, marketing, physician relations, and mergers and acquisitions. This intelligence is delivered via their proprietary platform and their team of seasoned healthcare strategic growth professionals, they call Spark Services.","Analytics, Big Data, Cloud Computing, Data Visualization, Software",http://www.stratasan.com,"Nashville, Tennessee, United States","Stratasan provides software suites and related services to healthcare systems, helping the users make decisions maximizing their growth.","20,479","1,926","8,540.17",-63.06%,828.57%,65,3.97,187.51%,57.5%,-34.1%,"5,017,891","1,931,198",62.57%,Southern US,Active,2010-09-01,day,3,51-100,"Brian Dailey, J Tod Fetherling, Jason Moore",,,447071,USD,447071
CopperEgg Corporation,https://www.crunchbase.com/organization/copperegg-corporation,"Server Monitoring and Website Monitoring for your cloud infrastructure by CopperEgg.  CopperEgg provides simple, unified, smart, and fast insight into your AWS cloud servers (EC2), websites, web applications, and services to optimize performance and troubleshoot issues in a single pane of glass. The CopperEgg unified dashboard updates every few seconds (not minutes) and reveals details that help uncover previously hidden information, like CPU Steal, and resolve problems before they arise.   SaaS-based service with mobile applications Real-time monitoring: 5 seconds for servers, 15 seconds for websites Custom alerting and notifications Installs in less than 10 seconds Easily understand server health, load, performance and capacity Measure web application response time and monitor website uptime Correlate server issues with web performance problems Supports Linux, Windows, MacOS, and FreeBSD, physical, virtual and cloud Use CopperEgg in every phase of your operations and application development cycles, from initial design to testing to production. CopperEgg gives you the insight you need to understand what is happening from inside your cloud instances and from outside customer experience.","Cloud Computing, Enterprise Applications, Enterprise Software, SaaS, Software",http://www.copperegg.com,"Austin, Texas, United States","CopperEgg offers server and website monitoring tools to administer, troubleshoot and optimize servers, websites and apps in cloud.","302,451","1,890","3,137.17",-14.09%,353.57%,0,1,0%,100%,0%,"5,168,528","347,559",7.21%,Southern US,Active,2010-06-01,day,2,11-50,"Eric Anderson, Scott Johnson",1,,,,
Phantom Technology Solutions,https://www.crunchbase.com/organization/phantom-technology-solutions,"Phantom Technology Solutions creates a multitude of technology-related services and products for the customer. It provides IT Support such as technical helpdesk support, computer support, and consulting to small and medium-sized businesses.","Cloud Computing, Cyber Security, Electronics, Information Technology, IT Infrastructure, IT Management, Network Security, Technical Support",https://www.phantomts.com,"Rolling Prairie, Indiana, United States",Phantom Technology Solutions creates a multitude of technology-related services and products for the customer.,"750,665","1,818",,,,0,1,,100%,,"5,348,420",,,"Great Lakes, Midwestern US",Active,2010-01-30,day,1,1-10,Henry Timm,,,,,
Geo Semiconductor,https://www.crunchbase.com/organization/geo-semiconductor,"Geo Semiconductor is a fabless semiconductor company, provides video and geometry processing solutions. Its products include Geo IC, a system-on-chip geometry processor for capture and projection light engines; Realta IC, an integrated system-on-chip image processor that enables a benchmark standard of video excellence; Tahoe, an evaluation board that enables evaluation and design of video systems with geometry processor; and Niobe Evaluation Board, a reference platform for image processor. The company's products are used in projectors, DVD players, medical and military displays, and video walls, as well as in signage, home theater, and education systems and AVRs. It serves consumer, automotive, and security markets. The company was incorporated in 2009 and is based in Santa Clara, California.","Cloud Computing, Enterprise Software, Semiconductor",http://www.geosemi.com,"Santa Clara, California, United States",Geo Semiconductor is a fabless semiconductor company that designs video and geometry processing integrated circuits (ICs).,"20,976","1,755","5,108",-16.51%,-97.96%,31,2.97,44.27%,0%,1.23%,"5,455,184","569,545",11.66%,"San Francisco Bay Area, Silicon Valley, West Coast",Active,2009-01-01,year,1,51-100,Paul M. Russo,,,854077,USD,854077
Exablox,https://www.crunchbase.com/organization/exablox,"Exablox is the company re-imagining storage to solve businesses’ runaway storage costs and data management nightmares. OneBlox combines the advantages of a scale-out distributed object store solution, the performance of all-flash, the ease of use of network attached storage, and OneSystem, an elegant multi-tenant cloud-based management service. Founded in 2010, Exablox is headquartered in Mountain View and backed by leading Silicon Valley venture firms.","Analytics, Cloud Computing, Electronics, Enterprise Software, Flash Storage, Hardware, Information Technology, Location Based Services, Software",http://www.exablox.com,"Mountain View, California, United States","Exablox provides a scale-out, cloud-based storage and data management solution.","40,933","1,742",,30.19%,421.25%,834,6.07,51.78%,27.55%,-58.49%,"5,211,080","-861,654",-14.19%,"San Francisco Bay Area, Silicon Valley, West Coast",Active,2010-01-01,year,1,51-100,Tad Hunt,,,,,
Fierce Software,https://www.crunchbase.com/organization/fierce-software,,"Analytics, Cloud Computing, Data Integration, Software",http://www.fiercesw.com,"Herndon, Virginia, United States","Fierce Software is a company that provides application development, data analytics, managed IT and cloud management solutions.","279,372","1,718","2,017.17",0.23%,,0,1,0%,100%,0%,"5,492,955","251,790",4.8%,"Washington DC Metro Area, East Coast, Southern US",Active,2011-01-01,year,1,11-50,Selena Fernandes,,,243970,USD,243970
Lingows,https://www.crunchbase.com/organization/lingows,,"Advertising, Cloud Computing, Information Services, Information Technology, SEM, SEO",https://www.lingows.com,"Denver, Colorado, United States","Lingows offers SEO, SEM, web development, cloud computing, cybersecurity, digital marketing, and IT support services.","1,304,131","1,669",,348.66%,,0,1,0%,100%,0%,"5,554,438","-3,227,492",-36.75%,"Greater Denver Area, Western US",Active,2011-01-01,year,,11-50,,,,,,
Obihai Technology,https://www.crunchbase.com/organization/obihai-technology,"Obihai is a Silicon Valley-based, California corporation that designs, develops, manufactures and markets VoIP analog phone adapters, smart phone VoIP apps and hybrid cloud + premise based phone systems for consumers and small business. Obihai is rooted in the following technologies: Voice over IP, consumer and business-grade electronics and communication systems, semiconductor and integrated circuit design, audio and video DSP algorithm design, high-yield + low-cost manufacturing, global telecommunications compliance and mass-scale network deployment. The cloud-based OBiTALK device management and peer-to-peer communication network provides the Obihai support team, end users and service providers with the ability to remotely configure and manage VoIP devices as well as troubleshoot network and application problems that are typical when using an over-the-top communications service / application.","Cloud Computing, Public Relations, Video Streaming, VoIP",http://www.obihai.com,"Campbell, California, United States","Obihai develops VoIP analog phone adapters, smart phone VoIP apps, and phone systems for consumers and small businesses.","361,897","1,640","5,032.17",-89.19%,530%,126,2,71.7%,0%,22.35%,"5,452,899","3,808,465",231.6%,"San Francisco Bay Area, Silicon Valley, West Coast",Active,2010-01-01,year,2,11-50,"Jan Fandrianto, Sam Sin",2,,,,
Fracsys,https://www.crunchbase.com/organization/fracsys,,"Analytics, Apps, Cloud Computing, Data Integration, Software",http://fracsys.com/,"Leesburg, Virginia, United States","Fracsys deals with data management, business analytics, application development, big data, cloud computing and enterprise modernization.","642,470","1,640",,,,62,13,,0%,,"5,426,685",,,"Washington DC Metro Area, East Coast, Southern US",Active,2010-01-01,year,,11-50,,,,,,
Resolution Development Services,https://www.crunchbase.com/organization/resolution-development-services,"Resolution Development Services is a Product Development Company servicing clients. Resolution employs senior-level engineers and program managers who are experts in bringing to market Medical Device and Life Science products. Resolution’s staff consists of hardware, software, machine vision, and systems engineers allowing them to service their client's wide range of product development needs. A resolution has designed ablation devices, custom imaging sensors, handheld medical devices, and clinical analyzers for the Medical Device, Life Science, and Hospital markets.","Cloud Computing, Consumer, Medical, Mobile Apps, Product Design, Software, Web Development",https://www.resolutiondev.com/,"Woburn, Massachusetts, United States",Resolution Development Services is a Product Development Company.,"882,377","1,640",,,,0,1,,100%,,"5,667,198",,,"Greater Boston Area, East Coast, New England",Active,2009-01-01,year,,11-50,,,,32921,USD,32921
JH Computech,https://www.crunchbase.com/organization/jh-computech,,"Cloud Computing, Consulting, Information Technology",https://www.jhcomputech.com/,"Englewood Cliffs, New Jersey, United States",JH Computech is a provider of IT support and services.,"1,168,369","1,640",,,,0,1,,100%,,"5,573,189",,,"Greater New York Area, East Coast, Northeastern US",Active,2009-01-01,day,,1-10,,,,,,
CloudCar,https://www.crunchbase.com/organization/cloudcar,"CloudCar™ provides the most powerful platform for building next generation connected vehicle experiences. Our cloud based services and content is constantly evolving, ensuring an ever-green experience to your customers.  The CloudCar™ platform is distinct in that it offers the OEM: a driver-centric intuitive experience, control of data, rapid deployment of services, and expansion to new geographic regions without requiring firmware updates.","Automotive, Cloud Computing, Enterprise Software, Mobile, Natural Language Processing",http://cloudcar.com,"Santa Clara, California, United States",CloudCar has built a comprehensive platform delivering cloud-based solutions to OEMS.,"30,047","1,638",,,,0,1,,100%,,"5,674,551",,,"San Francisco Bay Area, Silicon Valley, West Coast",Closed,2011-01-01,year,2,51-100,"Albert Jordan, Bruce Leak",,,635892,USD,635892
