Organization Name,Organization Name URL,Full Description,Industries,Website,Headquarters Location,Description,CB Rank (Company),SEMrush - Monthly Visits,SEMrush - Average Visits (6 months),SEMrush - Monthly Visits Growth,SEMrush - Visit Duration Growth,SEMrush - Visit Duration,SEMrush - Page Views / Visit,SEMrush - Page Views / Visit Growth,SEMrush - Bounce Rate,SEMrush - Bounce Rate Growth,SEMrush - Global Traffic Rank,SEMrush - Monthly Rank Change (#),SEMrush - Monthly Rank Growth,Headquarters Regions,Operating Status,Founded Date,Founded Date Precision,Number of Founders,Number of Employees,Founders,Apptopia - Number of Apps,Apptopia - Downloads Last 30 Days,Aberdeen - IT Spend,Aberdeen - IT Spend Currency,Aberdeen - IT Spend Currency (in USD)
Server At Work,https://www.crunchbase.com/organization/server-work,"Server At Work is a premier provider of IT managed services which cooperates with clients to help them achieve greatness through technology. Empowering clients to exceed goals, Server At Work delivers support and services including technology management, cybersecurity management, support desk, project management, and IT consulting to the industries of construction, education, local government, healthcare, and professional services.","Cloud Computing, Consulting, Cyber Security, Information Technology, IT Infrastructure, Network Security, Risk Management, VoIP",https://www.saw.it,"Lake Charles, Louisiana, United States","IT Managed Services Provider, Technology Management, Cybersecurity Management, Support Desk, Project Management, and IT Consulting.","965,483",,,,,,,,,,,,,Southern US,Active,2009-01-01,year,,11-50,,,,,,
Merit Technology Consultants,https://www.crunchbase.com/organization/merit-technology-consultants,,"Cloud Computing, Information Technology, Network Security, VoIP",https://www.merittc.com/,"The Woodlands, Texas, United States","Merit Technology Consultants is an IT service provider of managed services, network security, VoIP, cloud computing and help desk services.","966,011",,,,,,,,,,,,,"Greater Houston Area, Southern US",Active,2010-01-01,year,,1-10,,,,,,
Cilver Technologies,https://www.crunchbase.com/organization/cilver-technologies,,"Cloud Computing, Consulting, Information Technology, Outsourcing, Staffing Agency",https://www.cilvertechnologies.com/,"Seattle, Washington, United States","Cilver Technologies renders IT staffing, outsourcing, information lifecycle management, cloud, data warehousing and consulting services.","970,809",,,,,,,,,,,,,"Greater Seattle Area, West Coast, Western US",Active,2009-01-01,year,,251-500,,,,,,
KYM Advisors,https://www.crunchbase.com/organization/kym-advisors,"KYM Advisors provide information technology management capabilities with specialization in data sciences, information sharing and safeguarding, cyber security, and agile program delivery. They help with information sharing and safe guarding, cyber security, data governance, IT modernization and refresh, enterprise architecture, governance, risk, compliance, data sciences, government cloud, financial management of technology, program and project management, agile, IT strategy and modernization, systems engineering, NIEM, NIEM UML, application development, business continuity planning, program management, solutions architecture, SBA 8A, woman-owned small business, and TS facilities clearance.","Cloud Computing, Consulting, Cyber Security, Information Technology",https://kymadvisors.com,"Reston, Virginia, United States","KYM Advisors offers cybersecurity, business process reengineering, data sciences, program automation and cloud migration services.","971,300",,,,,,,,,,,,,"Washington DC Metro Area, East Coast, Southern US",Active,2010-01-01,year,,11-50,,,,,,
FST Servers,https://www.crunchbase.com/organization/fst-servers,"FST Servers is a cloud computing company based in Chicago, IL that strives to provide technical users innovative, yet affordable, virtualization solutions for personal or business users. Their in-house software provides easy creation and management of their virtual hosting options.","Cloud Computing, Web Hosting",http://fstservers.com,"Chicago, Illinois, United States",FST Servers is a professional virtual private server (VPS) hosting company.,"970,265",,,,,,,,,,,,,"Greater Chicago Area, Great Lakes, Midwestern US",Active,2009-07-01,day,,1-10,,,,,,
Cloud Nyc,https://www.crunchbase.com/organization/cloud-nyc,,"Cloud Computing, Information Technology, Security, Software",https://www.cloudnyc.com,"New York, New York, United States",Cloud Nyc helps organizations to improve productivity and secure work environment with cloud computing and hosting services.,"977,853",,,,,,,,,,,,,"Greater New York Area, East Coast, Northeastern US",Active,2011-01-01,year,,1-10,,,,,,
Austex Technology,https://www.crunchbase.com/organization/austex-technology,,"Cloud Computing, CRM, Information Technology, Software",https://www.austextechnology.com/,"Austin, Texas, United States","Austex Technology is an IT firm that provides cloud computing, CRM solutions, IT support and technical tools for sales enablement.","988,441",,,,,,,,,,,,,Southern US,Active,2009-01-01,year,,1-10,,,,,,
Cloubrain,https://www.crunchbase.com/organization/cloubrain,"Cloubrain automates server efficiency. We predict your cloud infrastructure based on your application needs. This enables engineers to focus on building their business, and not on managing their cloud infrastructure.","Cloud Computing, Cloud Management, Data Center Automation",http://cloubrain.com/,"Fremont, California, United States","Cloubrain defragments your datacenter whether you are running VMs, Containers, or a hybrid deployment.","988,782",,,,,,,,,,,,,"San Francisco Bay Area, Silicon Valley, West Coast",Active,2011-01-01,year,1,1-10,Pete Perlegos,,,,,
Bayon Technologies Group,https://www.crunchbase.com/organization/bayon-technologies-group,,"Cloud Computing, IT Management, Network Security",http://www.bayontechgroup.com,"Fort Lauderdale, Florida, United States","Bayon Technologies Group offers managed IT, network management, cybersecurity, cloud computing services to the private & public sectors.","989,729",,,,,,,,,,,,,"Greater Miami Area, East Coast, Southern US",Active,2011-01-01,year,,1-10,,,,,,
Raccoon Technologies,https://www.crunchbase.com/organization/raccoon-technologies,,"Cloud Computing, Consulting, Professional Networking, Software, Telecommunications",https://www.raccoontech.com,"Ada, Oklahoma, United States","Raccoon Technologies offers software development, heavy machines, computer service, cloud-based configurations, and network solutions.","990,468",,,,,,,,,,,,,Southern US,Active,2009-01-01,year,,1-10,,,,,,
NovaONE Networks,https://www.crunchbase.com/organization/novaone-networks,"NovaONE Networks provides telecommunication services. They provide cloud computing, cloud phone systems, internet connectivity, expense reduction, business continuity, multi-tenant, and cyber security services. They address inquiries through phone calls.","Cloud Computing, Cyber Security, Internet, Telecommunications",https://novaonenetworks.com/multi-tenant,"Madison, Wisconsin, United States",NovaONE Networks is a cloud and connectivity company that provides business communication and telecom procurement consulting services.,"991,431",,,,,,,,,,,,,"Great Lakes, Midwestern US",Active,2010-01-01,year,,1-10,,,,,,
itBeans,https://www.crunchbase.com/organization/itbeans,,"Cloud Computing, Mobile Apps, Staffing Agency",http://www.itbeans.com,"Pittsburgh, Pennsylvania, United States","itBeans expertise in mobile app development solutions, cloud and staffing services.","994,569",,,,,,,,,,,,,"Great Lakes, Northeastern US",Active,2010-01-01,year,,1-10,,,,,,
Cyfluent,https://www.crunchbase.com/organization/cyfluent,"Cyfluent’s leadership has over 30 years of medical PM, EHR, and health  information technology experience bolstered by its partners, Planned Systems International (PSI) and Protomed. Today, Cyfluent is truly the physician’s advocate and offers the nation’s only guaranteed real-time support. Cyfluent’s robust functionality and support can be yours for one affordable monthly service fee – no change to your existing network or workflow – no nickel and diming you afterwards – low risks and high rewards -TRUE SECOND GENERATION CHOICES.","Cloud Computing, Health Care, Hospital",https://www.cyfluent.com/,"Alexandria, Virginia, United States","Cyfluent is a provider of easy-to-use electronic health record,practice management,and personal health record solutions.","997,902",,,,,,,,,,,,,"Washington DC Metro Area, East Coast, Southern US",Active,2009-01-01,year,,11-50,,,,,,
KCD Tech,https://www.crunchbase.com/organization/kcd-tech,"KCD Tech is a virtualization and cloud computing consulting firm that was originally conceived in 1987. Starting off as a provider of computer programming skills and services, KCD Tech has morphed into a leader in the provision of information technology consulting services and specialize in the delivery of efficient and value-optimized business solutions.","Cloud Computing, Consulting, Software, Virtualization",http://www.kcdtech.com,"Oswego, Illinois, United States",Virtualization services provider,"1,000,404",,,,,,,,,,,,,"Greater Chicago Area, Great Lakes, Midwestern US",Active,2009-07-19,day,,1-10,,,,,,
Facility IT Group,https://www.crunchbase.com/organization/facility-it-group,,"Cloud Computing, Cyber Security, Information Technology, IT Infrastructure, VoIP",https://www.facilityitgroup.com/,"Rolling Meadows, Illinois, United States","Facility IT Group specializes in infrastructure design, cloud, colocation, VoIP, security, monitoring and onsite maintenance services.","1,002,279",,,,,,,,,,,,,"Greater Chicago Area, Great Lakes, Midwestern US",Active,2009-01-01,year,,1-10,,,,,,
Itechizen,https://www.crunchbase.com/organization/itechizen,"Itechizen offers custom solutions for their business. They have a trailblazing development strategy that caters to mobile, web, and blockchain technologies. Among their services are PHP development, Laravel development, digital marketing, iPhone app development, Android app development, and SEO.","Cloud Computing, Digital Marketing, Software, Software Engineering, Web Development",https://itechizen.com/,"Colonia, New Jersey, United States",Itechizen provides information technologies and software services.,"1,004,022",,,,,,,,,,,,,"Greater New York Area, East Coast, Northeastern US",Active,2011-01-01,year,,11-50,,,,,,
Hybros,https://www.crunchbase.com/organization/hybros,,"Cloud Computing, Consulting, Information Technology, Project Management",https://www.hybros.com/,"Bensalem, Pennsylvania, United States",Hybros is a full-service team of IT professionals partnering with organizations to develop and support their technological vision.,"1,005,058",,,,,,,,,,,,,"Greater Philadelphia Area, Great Lakes, Northeastern US",Active,2009-01-01,year,,11-50,,,,109870,USD,109870
P4 Technologies,https://www.crunchbase.com/organization/p4-technologies,,"Cloud Computing, Supply Chain Management",http://www.p4tech.com,"Wilmington, North Carolina, United States",P4 Technologies is a cloud-based supply chain solutions company.,"1,005,841",,,,,,,,,,,,,"East Coast, Southern US",Active,2011-01-01,day,,1-10,,,,,,
The Shattuck Group,https://www.crunchbase.com/organization/the-shattuck-group,,"Aerospace, Cloud Computing, Cyber Security",http://www.shattuckgroup.net/,"Mclean, Virginia, United States",The Shattuck Group is a cyber security engineering firm.,"1,009,060",,,,,,,,,,,,,"Washington DC Metro Area, East Coast, Southern US",Active,2010-01-01,day,,1-10,,,,78539,USD,78539
Dastor,https://www.crunchbase.com/organization/dastor,,"Cloud Computing, Compliance, Data Center, Security",https://www.peer9.net,"King Of Prussia, Pennsylvania, United States","Dastor specializes in colocation, cloud hosting, public cloud access, security, compliance, disaster recovery and network services.","1,009,153",,,,,,,,,,,,,"Greater Philadelphia Area, Great Lakes, Northeastern US",Active,2010-01-01,year,,,,,,,,
NuSpective Solutions,https://www.crunchbase.com/organization/nuspective-solutions,"NuSpective Solutions, a new breed IT Solutions Provider, is bringing a fresh perspective to data center infrastructure and next generation networking and security solutions. With NuSpective Solutions you will get practical business people, highly trained engineers, and high-level service and responsiveness. Their team is motivated to earn your trust and business! Their solutions portfolio includes:  Private Cloud infrastructure utilizing the FlexPod reference design from Cisco, NetApp & VMware; high performance Data Management and Tiered Storage designs using Flash-Cache and Solid State (SSD) technologies; Managed Hosted and Public Cloud services from a lineup of top tier and specialized service provider partners; Hybrid Data Center Designs that federate Private and Public cloud with orchestration and security; next generation firewall security and WAN Optimization solutions; and the professional services to successfully integrate your particular solution.","Cloud Computing, Information Services, Information Technology",https://nuspective.com,"Pleasanton, California, United States","NuSpective Solutions, a new breed IT Solutions Provider.","1,019,925",,,,,,,,,,,,,"San Francisco Bay Area, West Coast, Western US",Active,2010-01-01,year,2,,"Bob Murtagh, David McMorrow",,,89531,USD,89531
Skyen.,https://www.crunchbase.com/organization/skyen,,"Cloud Computing, Cyber Security, IT Management",https://skyen.com/,"San Francisco, California, United States","Skyen deals with managed IT services, IT support, cloud computing, equipment procurement, VoIP and cybersecurity.","1,025,833",,,,,,,,,,,,,"San Francisco Bay Area, West Coast, Western US",Active,2010-01-01,year,,1-10,,,,,,
Cloud Guru,https://www.crunchbase.com/organization/cloud-guru,"Cloud Guru Inc helps small & medium businesses on their journey to the Cloud. The Cloud Guru Difference is our suite of services from the best players in the Cloud market, including Google, Amazon, Salesforce and Rackspace; plus, our 20+ years in the industry. So if you’re looking to offload expensive, short-life infrastructure to save money and become more efficient by making services and processes more available from anywhere, Cloud Guru has the process, the tools and the experience to get it done right.","Apps, Cloud Computing, Consulting, CRM, Mobile, Search Engine, Virtualization, Wireless",http://www.CloudGuruInc.com,"Boston, Massachusetts, United States",Cloud Architecture Consulting & Services,"1,026,770",,,,,,,,,,,,,"Greater Boston Area, East Coast, New England",Closed,2011-01-01,year,,1-10,,,,,,
Briskco,https://www.crunchbase.com/organization/briskco,,"Cloud Computing, IT Management, Network Security, Software",https://www.briskco.com/,"Miami, Florida, United States","Briskco is an IT firm that offers security, software, networking, cloud computing and managed IT services to its clients.","1,028,918",,,,,,,,,,,,,"Greater Miami Area, East Coast, Southern US",Active,2010-01-01,year,,1-10,,,,,,
ANRE Technologies,https://www.crunchbase.com/organization/anre-technologies,"Anre Technologies' proven track record includes assisting clients' organizations to define, implement, and optimize their Information Technology (IT) and data center operations through the application of proven system engineering practices and upholding industry standards and best practices. A requirement to standardize IT delivery, Anre Tech incorporates the time-tested, success-oriented disciplines of Project Management, International Project Management, Software Development, Data Flow, and Networking into a holistic approach. NASA's Jet Propulsion Laboratory (JPL) and the California Institute of Technology (Caltech) require cutting-edge solutions. The teams' staff members are very familiar with critical government operations, including those at the Jet Propulsion Laboratory and the California Institute of Technology.","Cloud Computing, Information Services, Information Technology, Project Management, Software, Web Development",http://anretech.com/,"Altadena, California, United States",Anre Technologies offers comprehensive IT management and support for several large academic institutions on a time-and-materials basis.,"1,034,473",,,,,,,,,,,,,"Greater Los Angeles Area, West Coast, Western US",Active,2010-01-01,year,,11-50,,,,767418,USD,767418
Accelera IT Solutions,https://www.crunchbase.com/organization/accelera-it-solutions,,"Cloud Computing, IT Management, Software, Web Hosting",https://accelera.tech/,"Phoenix, Arizona, United States","Accelera IT Solutions focuses on cloud computing, backup, disaster recovery, hardware, vendor, project and IT management solutions.","1,037,427",,,,,,,,,,,,,"Greater Phoenix Area, Western US",Active,2009-01-01,year,,11-50,,,,,,
Fivetwelve,https://www.crunchbase.com/organization/fivetwelve,,"Analytics, Cloud Computing, Consulting, Software, Software Engineering",http://www.fivetwelvellc.com,"Clarksville, Tennessee, United States","Fivetwelve is an IT firm that provides software engineering, cloud computing, analytics, and system engineering solutions to its clients.","1,041,737",,,,,,,,,,,,,Southern US,Active,2011-01-01,year,,11-50,,,,,,
Vigilant Cyber Systems,https://www.crunchbase.com/organization/vigilant-cyber-systems,"Vigilant Cyber Systems offers cutting-edge solutions that assess the efficacy of offensive and defensive cyber resources to protect the integrity and safety of infrastructure and other assets vulnerable to cyber threats, regardless of their complexity or origin. Their engineers have decades of experience solving the most difficult cyber-threat issues.","Cloud Computing, Cyber Security, Software",https://vigilantsys.com,"Carolina, Rhode Island, United States",Vigilant Cyber Systems provides testing solutions to the defense community.,"1,042,445",,,,,,,,,,,,,"East Coast, New England, Northeastern US",Active,2010-01-01,year,,11-50,,,,,,
NorthBay Solutions Pakistan,https://www.crunchbase.com/organization/northbay-solutions-pakistan,"NorthBay Solutions is a USA-based, business solutions organization. NorthBay has over a decade of development and solution delivery experience, which has enabled us to create real-world DevOps methodologies and best practices that share with the clients to help improve their processes and accelerate their success beyond the initial engagement.","Architecture, Cloud Computing, Consulting, Software",https://northbaysolutions.net,"Andover, Massachusetts, United States",NorthBay Solutions (NBS) is the leading supplier of software outsourcing services to enterprise & emerging Companies.,"1,044,271",,,,,,,,,,,,,"Greater Boston Area, East Coast, New England",Active,2010-01-01,year,,11-50,,,,,,
Big Dog Computing,https://www.crunchbase.com/organization/big-dog-computing,,"Cloud Computing, Consulting, IT Management, Training",https://www.bigdogcomputing.com/,"Concord, California, United States","Big Dog Computing is an IT consulting firm that provides help desk support, network management, cloud computing and training services.","1,049,204",,,,,,,,,,,,,"San Francisco Bay Area, West Coast, Western US",Active,2010-01-01,year,1,1-10,Jeremy Rector,,,,,
Polar IT Services,https://www.crunchbase.com/organization/polar-it-services-inc,Polar IT Services offers software solutions to businesses of all sizes. Their comprehensive suite of information technology solutions bridges the gap between their personnel needs and technology. That includes Staff Augmentation and Strategic Solutions.,"Big Data, Business Intelligence, Cloud Computing, Information Technology, Software",https://www.polarits.com,"Elkridge, Maryland, United States",Polar IT Services provides data science and cloud computing services.,"1,051,784",,,,,,,,,,,,,"Greater Baltimore-Maryland Area, East Coast, Southern US",Active,2011-01-01,year,,11-50,,,,,,
Semantic Press,https://www.crunchbase.com/organization/semantic-press,"Semantic Press believes that data science and mobilization will enable organizations to add new dimensions to their offerings and could potentially new product categories. The company develops applications that enables organizations to understand data, derive value and build services on top of data-centric mobile middleware solutions. Semantic Press is the creator of Meta Modeler, a tool for acquiring, cleaning up, enhancing, analyzing and publishing data for machine-to-machine or mobile devices.  Meta Modeler lowers the threshold for people to work with data significantly and enables a new class of products to emerge.","Artificial Intelligence, Big Data, Cloud Computing, Machine Learning, Mobile, Software",http://semanticpress.com,"Mountain View, California, United States",Middleware Solutions for Mobilizing Data,"1,056,661",,,,,,,,,,,,,"San Francisco Bay Area, Silicon Valley, West Coast",Active,2009-09-06,day,1,1-10,Terry Martin,,,,,
Wicked Code,https://www.crunchbase.com/organization/wicked-code,,"Cloud Computing, Computer, Internet, Marketing, Mobile Apps, Web Apps, Web Hosting",https://www.wickedcode.com/,"San Francisco, California, United States","Wicked Code is a web design and development firm that specializes in web design, web applications, internet marketing, and web hosting.","1,058,868",,,,,,,,,,,,,"San Francisco Bay Area, West Coast, Western US",Active,2010-01-01,year,,1-10,,,,,,
Neovise,https://www.crunchbase.com/organization/neovise,"Neovise is an IT industry analyst firm focused on cloud computing.  Based on independent research and analysis, Neovise delivers essential knowledge and guidance to cloud-related technology vendors, service providers, systems integrators and investors, as well as business organizations seeking to purchase cloud-related services and technology. Services include research, advisory and collateral development that help customers—and their customers—make optimal decisions and formulate winning strategies. Research. Analyze. Neovise.","Analytics, Cloud Computing, Consulting, IaaS, Infrastructure, PaaS, Video Streaming",http://www.neovise.com,"Fort Collins, Colorado, United States",Neovise is an IT research firm focused on cloud computing delivers essential knowledge and guidance to cloud-related technology vendors.,"1,062,458",,,,,,,,,,,,,Western US,Active,2009-05-01,day,,11-50,,,,,,
Reliable Information Technology,https://www.crunchbase.com/organization/reliable-information-technology,,"Cloud Computing, Consulting, Cyber Security, Information Technology, Network Security",https://www.ritcompany.com,"Addison, Texas, United States",RIT is a provider of information technology support for organizations.,"1,062,778",,,,,,,,,,,,,"Dallas/Fort Worth Metroplex, Southern US",Active,2011-01-01,year,1,1-10,Sid Rothenberg,,,,,
SharpEntity,https://www.crunchbase.com/organization/sharpentity,"SharpEntity provides application rationalization, cloud architecture assessment, cloud-native architecture, cost optimization, program management, and devops solutions. They also offer software development lifecycle, lifecycle methodology, early testing, using code metrics,  service oriented architecture, disparate systems and services.","Cloud Computing, Consulting, Information Services, Management Consulting",http://www.sharpentity.com,"Pingree, Idaho, United States","SharpEntity provides cloud computing services, as well as IT implementation, architecture, and design.","1,069,716",,,,,,,,,,,,,Western US,Active,2010-01-01,year,,1-10,,,,,,
GCS Americas,https://www.crunchbase.com/organization/gcs-americas,,"Cloud Computing, Consulting, Information Technology",https://gcsamericas.com,"Lewisville, Texas, United States","GCS Americas is a consulting agency that provides cloud computing, system integration, and application development services.","1,071,721",,,,,,,,,,,,,"Dallas/Fort Worth Metroplex, Southern US",Active,2010-01-01,year,,11-50,,,,,,
C&B Solutions,https://www.crunchbase.com/organization/c-b-solutions,"C&B Solutions offers services that include personnel data systems, rich user interfaces, secure web services, cloud computing, systems architecture, and software management.","Cloud Computing, Cyber Security, Software",http://www.cnb-solutions.com ,"Schertz, Texas, United States",C&B Solutions provides complete web solutions.,"1,072,679",,,,,,,,,,,,,Southern US,Active,2010-03-08,day,,,,,,,,
Greenmark IT,https://www.crunchbase.com/organization/greenmark-it,,"Cloud Computing, IT Management, Network Security, Service Industry, Software",https://www.greenmarkit.com,"Presque Isle, Maine, United States","Greenmark IT is a company that renders managed IT, server installations, network security and cloud computing solutions.","1,079,544",,,,,,,,,,,,,"East Coast, New England, Northeastern US",Active,2010-01-01,year,,1-10,,,,,,
Audacious Software,https://www.crunchbase.com/organization/audacious-software,"Audacious Software is a Chicago company focusing on creating digital experiences for web, mobile, desktop. Develop and deploy full-stack systems that include apps on users' devices and data on the server backend.","Cloud Computing, Information Technology, Software",https://audacious-software.com,"Chicago, Illinois, United States",Audacious Software is a mobile development firm focusing on native solutions across platforms and devices.,"1,080,360",,,,,,,,,,,,,"Greater Chicago Area, Great Lakes, Midwestern US",Active,2010-01-01,year,,1-10,,,,,,
CloudWeaver,https://www.crunchbase.com/organization/cloudweaver,,"Analytics, Cloud Computing, Information Technology, SaaS, Software",http://www.cloudweaver.com,"Mountain View, California, United States","CloudWeaver is a SaaS based automated Cloud Monitoring, Analytics and Optimization offering for AWS and other Clouds.","1,083,401",,,,,,,,,,,,,"San Francisco Bay Area, Silicon Valley, West Coast",Active,2010-01-01,day,,11-50,,,,,,
