Organization Name,Organization Name URL,Full Description,Industries,Website,Headquarters Location,Description,CB Rank (Company),SEMrush - Monthly Visits,SEMrush - Average Visits (6 months),SEMrush - Monthly Visits Growth,SEMrush - Visit Duration Growth,SEMrush - Visit Duration,SEMrush - Page Views / Visit,SEMrush - Page Views / Visit Growth,SEMrush - Bounce Rate,SEMrush - Bounce Rate Growth,SEMrush - Global Traffic Rank,SEMrush - Monthly Rank Change (#),SEMrush - Monthly Rank Growth,Headquarters Regions,Operating Status,Founded Date,Founded Date Precision,Number of Founders,Number of Employees,Founders,Apptopia - Number of Apps,Apptopia - Downloads Last 30 Days,Aberdeen - IT Spend,Aberdeen - IT Spend Currency,Aberdeen - IT Spend Currency (in USD)
"MondayCall, LLC",https://www.crunchbase.com/organization/mondaycall-solutions,"MondayCall Solutions is an official Salesforce.com partner specializing in providing best-practices consulting, training and implementation services. The MondayCall Solution's team of certified experts focuses on strong upfront planning/needs assessment and strong follow-through execution.  MondayCall Solutions has a wide range of package and custom services including Quickstarts that help new Salesforce.com customers to advanced services that help mature customers gain the full value from their Salesforce.com sales and service cloud investment.","Cloud Computing, Consulting, CRM, Professional Services",http://www.mondaycall.com,"San Francisco, California, United States",Trusted Salesforce.com Consulting Partner,"234,885",,,,,,,,,,,,,"San Francisco Bay Area, West Coast, Western US",Active,2009-01-01,year,2,11-50,"Andrew Yang, Chris Zak",,,126649,USD,126649
Infinetics Technologies,https://www.crunchbase.com/organization/infinetics,"Infinetics has designed and implemented Long Hop™, a high performance network connection architecture that provides significantly better tradeoffs between bandwidth, latency, fault tolerance and cost than previously known approaches. Long Hop networks are more cost efficient than a fat-tree, supporting at least 50% more servers using the same network hardware while providing equivalent bandwidth and improved latency of at least 25%. Oversubscription and fault tolerance can also be smoothly varied to meet cost and performance goals. Long Hop’s regular wiring patterns maximize the number of short connections and minimize the number of long distance connections between server rows or containers, thereby reducing cabling costs and simplifying expansion by reducing or eliminating rewiring. Long Hop networks well serve the needs of modern data centers by providing consistent bandwidth under varying load conditions via extensive multi-path support and automatic load balancing, allowing mobile workloads to be placed without regard to available bandwidth, and allowing services to be isolated in a multi-tenant environment to match the business needs of customers.  Long Hop achieves this by combining patent-pending wiring methods with a simple high-performance, TCAM-efficient forwarding method well suited to the current generation of network switch hardware and SDN controllers supporting OpenFlow or proprietary southbound APIs. The wiring method starts with a highly symmetrical framework well suited to economical, fault tolerant switching, and overlays another symmetrical network of short cuts that simultaneously amplify available bandwidth as well as reduce latency. The end result gives the ability to design and construct networks that precisely meet implementation-specific business needs.","Cloud Computing, Developer Platform, Enterprise Software",http://www.infinetics.com,"Boston, Massachusetts, United States","Infinetics develops network architecture and software products such as the Long Hop, a high performance network connection architecture.","239,567",,,,,,,,,,,,,"Greater Boston Area, East Coast, New England",Active,2009-01-01,year,1,11-50,Anthony Antonuccio,,,,,
CipherGraph Networks,https://www.crunchbase.com/organization/ciphergraph-networks,CipherGraph Networks provides secure cloud based VPN services. CipherGraph Cloud VPN enables companies to allow employees and external contractors to work from anywhere. The CIO/IT department writes access rules to control access to their network services based on user's identity or group.,"Cloud Computing, Enterprise Software, Meeting Software, Network Security, Security",http://www.ciphergraph.com,"Pleasanton, California, United States",CipherGraph Networks provides cloud-based VPN services enabling companies to allow employees and external contractors to work from anywhere.,"243,214",,,,,,,,,,,,,"San Francisco Bay Area, West Coast, Western US",Closed,2011-01-01,year,1,11-50,Jitender Sharan,,,,,
TJFACT Corporation,https://www.crunchbase.com/organization/tjfact-corporation,,"Cloud Computing, Cyber Security, Government, Information Technology, Management Consulting",https://tjfact.com/,"Atlanta, Georgia, United States",TJFACT is specializes in delivering high quality consulting services and solutions to the Federal Government.,"253,556",,,,,,,,,,,,,"Greater Atlanta Area, East Coast, Southern US",Active,2009-01-01,day,1,101-250,Terrence Evans,,,162032,USD,162032
Virtual-Q,https://www.crunchbase.com/organization/virtual-q,"Virtual-Q, a Houston-based startup, has developed breakthrough technology for enterprise cloudtop computing. ""Cloudtops"" provide the capabilities of desktops and laptops, but with the all of the processing performed, and all of the data resident, in a secure datacenter. Virtual-Q's cloudtops help organizations improve worker productivity, reduce their total cost of ownership, assure business continuity, safeguard sensitive data, improve compliance, and leverage their existing IT investments. The company's proprietary virtualization technology represents a new paradigm for Computing-as-a-Service (CaaS), delivering a complete, cloud-based IT environment (cloudtop) accessible from virtually any Internet-connected device, including iPads and iPhones. The Q Cloudtop includes the latest Microsoft Windows operating system and Office Suite technologies. It delivers unparalleled performance while extending the useful life of existing desktop and laptop devices. Virtual-Q is a Microsoft Gold Certified Partner and works closely with other leading technology vendors.","Cloud Computing, Information Technology, Internet, SaaS, Security, Software, Virtualization",http://www.virtual-q.com,"Houston, Texas, United States","Virtual-Q, a Houston-based startup, has developed breakthrough technology for enterprise cloudtop computing.","258,848",,,,,,,,,,,,,"Greater Houston Area, Southern US",Active,2009-01-01,year,1,11-50,Victor J. Quinones Jr,,,243225,USD,243225
Futuralis,https://www.crunchbase.com/organization/futuralis,"Futuralis is a technology consulting firm that specializes in AWS cloud services and modern application development. As an Advanced tier partner, its obsession is to help deploy the power of Amazon Web Services. In the process of understanding what is important. The company implements a cloud strategy to reduce costs, improve security, and increase business efficiency. The company was founded in 2011 and is headquartered in Bethesda, Maryland.","Business Intelligence, Cloud Computing, Cloud Data Services, Cloud Management",https://futuralis.com/,"Bethesda, Maryland, United States",Futuralis is a technology consulting firm that specializes in AWS cloud services and modern application development.,"264,054",,,,,,,,,,,,,"Washington DC Metro Area, East Coast, Southern US",Active,2011-01-01,year,1,11-50,Aravind Pamula,,,,,
Closeloop Technologies,https://www.crunchbase.com/organization/closeloop-technologies,"Closeloop Technologies is your one-stop solution for software development needs. Having an industry experience of more than two decades, Closeloop ticks all the right boxes to satisfy your organization’s digital urges. We connect software development service seekers to skilled and certified professionals who can suggest, recommend, and build just the right product you need to upscale and grow your business. We cater to businesses of all sizes, including start-ups, small- and medium-scale organizations, and extensive industry giants with multiple skill sets in our adroit professionals. For some clients, we offer software consulting services; for others, we ideate, design, and develop feature-rich and scalable mobile and web applications.  Whereas for some, we build and manage CRM/ERP solutions. We help you build your business online from scratch, from consulting to brainstorming ideas to creating a plan of action, its implementation, prototype designing, product development, and quality assurance. Depending on the needs and requirements of your business, our forward-thinking business analysts draft an executable plan to achieve periodic objectives. Moreover, we provide annual maintenance plans that help keep your software or app aligned with the latest market standards. Services we presently offer include the following: - Software development services - Native and hybrid mobile app development - Customized web design and development - Software business consulting services - CRM & ERP development, implementation and management - Cloud app development and customization - Ecommerce portal development - Industry-specific app development (Finance, Healthcare, Transportation & Logistics, Sports, Lifestyle, Retail and many more) - AI application development - AR/VR & Wearable app development - Chatbot development - Custom Food delivery apps, dating apps etc. Your search for an experienced and skilled software development company ends right here! Get in touch with us today for a free consultation, business development ideas, growth avenues, and C-level expertise and recommendations.","Artificial Intelligence, Cloud Computing, Food and Beverage, Information Technology, Mobile Apps, Software, Web Design, Web Development",https://www.closeloop.com,"Mountain View, California, United States","Closeloop Technologies is a software solutions firm that offers website development, chatbots, data analytics and mobile applications.","270,954",,,,,,,,,,,,,"San Francisco Bay Area, Silicon Valley, West Coast",Active,2011-01-01,year,1,51-100,Assim Gupta,,,,,
Evoz,https://www.crunchbase.com/organization/evoz,"Evoz is an app that enables parents to monitor their babies by using their iOS devices from anywhere in the world while providing a parenting toolbox. It is a WiFi enabled baby monitor for a connected home via mobile devices. It uses an end-to-end encryption and locks down unnecessary program to keep family's privacy secure. Evoz was founded in 2010 and is based in Los Altos, California.","Android, Apps, Big Data, Cloud Computing, iOS, Product Design, Software, Wellness",http://www.myevoz.com,"Los Altos, California, United States",Evoz is an app that enables parents to monitor their babies by using their iOS devices from anywhere in the world.,"274,324",,,,,,,,,,,,,"San Francisco Bay Area, Silicon Valley, West Coast",Active,2010-03-01,day,1,11-50,Avishai Shoham,6,,,,
IntelliBee,https://www.crunchbase.com/organization/intellibee,,"Big Data, Cloud Computing, Internet of Things, Mobile Apps, Software, Wearables",https://intellibee.com ,"Detroit, Michigan, United States",IntelliBee is an information technology services company that provides solutions to business IT problems across the globe.,"287,069",,,,,,,,,,,,,"Greater Detroit Area, Great Lakes, Midwestern US",Active,2010-01-01,day,,11-50,,,,,,
CloudStrategies,https://www.crunchbase.com/organization/cloudstrategies,"CloudStrategies is a provider of technology-based business solutions that deliver breakaway competitive advantage. Our proven expertise in the practical application of Microsoft On-line Services, offers clients new, creative and innovative ways to utilize information to boost productivity, increase effectiveness and transform their operations. We are dedicated to guiding, designing and implementing customized cloud computing solutions for clients that create lasting value.","Cloud Computing, Consulting, Enterprise Software, Information Technology, Security, Software",http://cloudstrategies.net,"Cedar Knolls, New Jersey, United States",CloudStrategies is engaged in developing cloud-based business solutions to enable businesses to better understand their target audience.,"286,850",,,,,,,,,,,,,"Greater New York Area, East Coast, Northeastern US",Active,2009-01-01,year,1,11-50,Pete Zarras,,,,,
Unified Networking Solutions,https://www.crunchbase.com/organization/unified-networking-solutions,"Unified Networking Solutions design, implement and fully manage IT systems for small to medium-sized businesses.","Cloud Computing, Consulting, Information Technology, IT Management",https://www.unifieditsupport.com,"Raynham, Massachusetts, United States","Unified Networking Solutions is an IT firm that renders data security, cloud computing, software, managed IT and consulting service.","291,008",,,,,,,,,,,,,"East Coast, New England, Northeastern US",Active,2010-01-01,year,,11-50,,,,,,
PurpleRain,https://www.crunchbase.com/organization/purplerain,,"Big Data, Cloud Computing",http://purplerain.in,"Walnut, California, United States","PurpleRain is a product company specializes in enabling value on sales automation, cloud communication, and big data.","298,201",,,,,,,,,,,,,"Greater Los Angeles Area, West Coast, Western US",Active,2011-01-01,day,,1-10,,,,,,
CronSights,https://www.crunchbase.com/organization/cronsights,"CronSights is the premier provider of handle time metrics and insights that help customer support leaders understand agent and contact center performance in Service Cloud environments. Leveraging deep Salesforce and Force.com experience across hundreds of successful deployments, CronSights solutions deliver accurate real-time measurements, reporting, and dashboards that organizations use to gain deep understandings into their support operations. Customers using CronSights are able to improve support responsiveness, balance agent resources, manage teams across shifts and locations, and objectively evaluate their support workflows and procedures.  Founded in 2007, CronSights solutions are in use by hundreds of Service Cloud customers worldwide ranging from global software companies to smaller manufacturers and service organizations. Whether using the metrics to monitor agent behavior, identify bottlenecks in support workflows, manage service levels, or establish benchmarks for KPI’s, CronSights solutions are key to matching world-class support with operational excellence.","Analytics, Cloud Computing, Customer Service, Enterprise Software, Software",http://www.cronsights.com/,"New York, New York, United States",CronSights plugs into the Service Cloud and automates the collection and generation of Handle Time and SLA metrics.,"300,352",,,,,,,,,,,,,"Greater New York Area, East Coast, Northeastern US",Active,2009-07-14,day,2,1-10,"Leonid Zaents, Shahaf Galil",,,,,
Comparex,https://www.crunchbase.com/organization/comparex,"COMPAREX is a global IT provider specializing in cloud managed services, software license management and sourcing, technical product consulting and professional services. COMPAREX develops innovative services that support management and leverage software products, leading to an overall improvement of workforce productivity. COMPAREX serves corporate customers spanning from small businesses to large international corporations as well as the public institutions supporting every customer during their digital journey towards productivity optimization. The portfolio has a solid foundation in license management, software procurement and cloud services. Substantial professional and managed services complete the portfolio to support customers with services tailored to their business demands.","Cloud Computing, Consulting, Enterprise Software, Information Technology, Software",https://comparexusa.com/,"Raleigh, North Carolina, United States","Comparex is a market-leading cloud migration, licensing and technology solutions provider.","301,712",,,,,,,,,,,,,"Research Triangle, East Coast, Southern US",Active,2011-01-01,year,1,251-500,Peter Jung,,,,,
K-Tech Solutions,https://www.crunchbase.com/organization/k-tech-solutions-832d,"K-Tech provides IT and cybersecurity solutions to a number of industries, including veterinary, health care, law firms, insurance, and accounting, according to its website.","Cloud Computing, IT Management, Management Consulting, Network Security",http://www.ktechsolutionsllc.com,"Hilliard, Ohio, United States","K-Tech Solutions delivers managed IT services, computer support, network security and cloud computing solutions.","304,160",,,,,,,,,,,,,"Great Lakes, Midwestern US",Active,2011-01-01,year,,1-10,,,,,,
Heroic Technologies,https://www.crunchbase.com/organization/heroic-technologies,,"Cloud Computing, Cyber Security, Information Technology, VoIP",https://www.heroictec.com/,"Campbell, California, United States","Heroic Technologies is an IT company that provides managed IT services, cloud computing, cybersecurity and VoIP phone services.","304,610",,,,,,,,,,,,,"San Francisco Bay Area, Silicon Valley, West Coast",Active,2011-01-01,day,,1-10,,,,,,
SilverSky,https://www.crunchbase.com/organization/advanced-computer-solutions-group-a60e,"Advanced Computer Solutions Group has been at the forefront of deploying leading technology and cybersecurity solutions to educational institutions, including both K-12 and higher education, as well as government municipalities, private industry organizations, and small businesses for more than twelve years.","Cloud Computing, Information Services, Information Technology, Security",http://www.silversky.com,"Mount Laurel, New Jersey, United States",Advanced Computer Solutions Group has been at the forefront of deploying leading technology and cybersecurity solutions.,"311,339",,,,,,,,,,,,,"Greater Philadelphia Area, East Coast, Northeastern US",Active,2009-01-01,year,,11-50,,,,,,
StackMob,https://www.crunchbase.com/organization/stackmob,"StackMob’s mobile platform helps developers create a mobile business by letting them easily build, deploy and grow full-featured applications from the very first version. StackMob cuts backend development time from months to minutes, letting developers focus on creating powerful apps with quality user experiences. StackMob also provides a front-end development environment that developers can use to create a single, feature-rich application that runs seamlessly on multiple mobile operating systems.","Cloud Computing, Developer APIs, Mobile, PaaS, SaaS",http://www.stackmob.com,"San Francisco, California, United States","StackMob is a mobile platform helping developers create a mobile business by letting them build, deploy and grow mobile applications.","311,499",,,,,,,,,,,,,"San Francisco Bay Area, West Coast, Western US",Active,2010-01-01,year,3,11-50,"Pouyan Salehi, Ty Amell, Will Palmeri",,,,,
Data Cloud Solutions,https://www.crunchbase.com/organization/data-cloud-solutions,"Data Cloud Solutions provides cloud computing solutions and consulting services for collecting, reviewing, and managing large amounts of data. The CAMACloud platform, including MobileAssessor, is a fully integrated suite of tools for enhancing the way users collect, verify, analyze, and improve data. The platform includes modules for mobile data collection, desktop review (remote verification), multiple regression analysis, sketch validation, and comparable property reports. CAMACloud's workflow is 100% configurable and works with any database. MobileAssessor is the most widely used mobile application in the mass appraisal industry with 5,000 users across 200+ counties, 28 states, and two countries.","Cloud Computing, Data Integration, Information Technology, Software",https://www.datacloudsolutions.net/,"Springfield, Ohio, United States","Data Cloud Solutions is an internationally recognized systems integrator, cloud solutions provider and consulting services firm.","323,097",,,,,,,,,,,,,"Great Lakes, Midwestern US",Active,2010-01-01,year,,11-50,,,,,,
Assemble,https://www.crunchbase.com/organization/inkstone,"Assemble, formerly Inkstone, provides software services that deliver delightful customer experiences. Founded in 2010, the company is headquartered in Seattle, Washington, United States.","Cloud Computing, Cloud Infrastructure, Cloud Management, Consumer Electronics, Internet of Things, iOS, Product Design, Software, Wearables, Web Apps",https://weassemble.com,"Seattle, Washington, United States",Assemble provides software services that deliver delightful customer experiences.,"330,020",,,,,,,,,,,,,"Greater Seattle Area, West Coast, Western US",Active,2010-06-01,day,5,11-50,"Claes Nygren, Frances Cairns, Jay Jones, Jeremy Norberg, Ryan Bruels",3,,,,
Surya Technologies,https://www.crunchbase.com/organization/surya-technologies,,"Cloud Computing, Information Technology, Security",https://suryatechnologies.com,"Cary, North Carolina, United States","Surya Technologies is an IT company that provides cloud, recovery, and security services.","334,410",,,,,,,,,,,,,"Research Triangle, East Coast, Southern US",Active,2009-01-01,year,,11-50,,,,,,
Polkast,https://www.crunchbase.com/organization/polkast,"Everyone is talking about cloud services. Instead of sending your content up to the cloud, Polkast brings the cloud to you. Polkast creates your own personal cloud dynamically, letting your mobile devices directly access your home base computers. Polkast automatically detects your proximity to the PC and choose the fastest route: Wi-Fi or over the internet. Polkast then opens a secure connection and encrypts all transmissions. So you can securely access all of your content directly. By maximizing Wi-Fi bandwidth, Polkast allows users to retrieve any of their data files up to 10x faster than the traditional cloud. This peer-to-peer approach also means privacy and security are 100% under your control. And removing cloud storage limitations means access to 100% of your files. Using Polkast is as easy as downloading the free app and logging in. Get access to 500 GB of content instead of 2-5 GB. Fetch a video file from across the room takes a few minutes not hours. Share without file size limits.","Android, Cloud Computing, Consumer Electronics, iOS, Meeting Software, Mobile, Photography, Security, Software",http://www.polkast.com,"Laguna Beach, California, United States",Polkast develops cloud-based apps that enable users to access files on their PCs via iOS and Android devices.,"336,151",,,,,,,,,,,,,"Greater Los Angeles Area, West Coast, Western US",Active,2010-12-15,day,1,1-10,Hong Bui,1,,,,
Nitro Mobile Solutions,https://www.crunchbase.com/organization/crash-bang-studios,"Nitro Mobile Solutions provides mobile solutions for businesses ranging from Fortune 50 companies to community banks and credit unions. The company began in 2009 with a focus on delivering mobile applications for businesses and continues to provide mission critical, custom mobile applications for enterprises such as The Home Depot. By combining business experience, mobile expertise and an innovative mobile technology platform, Nitro helps organizations craft and execute strategies that optimize business for a mobile world.  In addition to custom mobile application development, Nitro Mobile Solutions specializes in providing mobile banking solutions for regional and community banks and credit unions. Nitro Mobile Solutions has the advanced technology and industry expertise to get an affordable, turnkey mobile banking app to customers and members in less than 30-60 days. Equally important, Nitro provides each bank or credit union with complete control over mobile app branding, customization and personalized communication – all with no expertise or coding required.","Android, Cloud Computing, Internet, iOS, Mobile, Social Media Marketing, Software",https://www.nitrosolutions.com/,"Tampa, Florida, United States","We develop custom mobile solutions for enterprises and financial services, driving business optimization and productivity.","347,369",,,,,,,,,,,,,"Tampa Bay Area, East Coast, Southern US",Active,2009-01-01,year,1,11-50,Molly Slade,100,,,,
EachScape,https://www.crunchbase.com/organization/eachscape,"EachScape is the only platform that lets you build and manage high quality custom apps across iOS, Android and HTML5, for phones and tablets, using drag & drop--which means producers, not developers, can do the building.   EachScape doesn’t use templates: that's very important! Instead, EachScape provides a powerful building-block approach. This allows for endless design opportunities. Your app will be unique.  Our clients include NBC, CBS, Scripps, Kellogg's, Nivea and other top brands, companies, and agencies.","Android, Cloud Computing, iOS, Mobile, Software, Web Development",http://www.eachscape.com,"New York, New York, United States","EachScape is a platform that enables users to build and manage custom apps across iOS, Android and HTML5 devices.","349,250",,,,,,,,,,,,,"Greater New York Area, East Coast, Northeastern US",Active,2009-01-01,year,2,11-50,"Bob Fitterman, Ludovic Collin",10,,121350,USD,121350
SynapOne,https://www.crunchbase.com/organization/synapone,,"Analytics, Big Data, Cloud Computing, Information Technology, Internet of Things, Software, Text Analytics",https://synapteinsolutions.com/,"Mclean, Virginia, United States","SynapOne develops software applications for analytics, agility, cloud, eDiscovery, IoT, big data and digital solutions.","354,408",,,,,,,,,,,,,"Washington DC Metro Area, East Coast, Southern US",Active,2011-01-01,year,1,11-50,Sharad Dayma,,,139739,USD,139739
